url,book_id,title,award_count,author,avg_rating,num_reviews,num_ratings,num_pages,original_publish_year,series,genres,awards,place
https://www.goodreads.com/book/show/238968.DragonQuest,238968,DragonQuest,0,Donita K. Paul,4.15,7614.0,7614.0,355.0,2005.0,True,"Fantasy, Fantasy, Dragons, Young Adult, Christian, Christian Fiction, Fiction, Adventure, Christian Fiction, Christian Fantasy, Fantasy, Magic, Fantasy, High Fantasy",,Amara
https://www.goodreads.com/book/show/266346.Every_Breath_You_Take,266346,"Every Breath You Take: A True Story of Obsession, Revenge, and Murder",0,Ann Rule,4.02,6825.0,6825.0,681.0,2000.0,False,"Crime, True Crime, Nonfiction, Mystery, Crime, Mystery, Audiobook, Adult, Biography, True Story, Thriller, Mystery Thriller, Dark",,
https://www.goodreads.com/book/show/68099.Death_at_La_Fenice,68099,Death at La Fenice,0,Donna Leon,3.87,26768.0,26768.0,270.0,1992.0,True,"Mystery, Fiction, Cultural, Italy, Mystery, Crime, Thriller, Mystery Thriller, Mystery, Detective, Thriller, Mystery, Murder Mystery, Music, Suspense",,Venice
https://www.goodreads.com/book/show/16789.The_Good_Fairies_of_New_York,16789,The Good Fairies of New York,0,Martin Millar,3.51,5228.0,5228.0,242.0,1992.0,False,"Fantasy, Fiction, Fantasy, Urban Fantasy, Humor, Paranormal, Fairies, Science Fiction Fantasy, New York, Contemporary, Adult, Fantasy, Paranormal",,
https://www.goodreads.com/book/show/6216670-so-not-happening,6216670,So Not Happening,0,Jenny B. Jones,4.12,3923.0,3923.0,330.0,2009.0,True,"Young Adult, Christian Fiction, Christian, Romance, Mystery, Contemporary, Fiction, Womens Fiction, Chick Lit, Humor, Realistic Fiction",,"Truman, Oklahoma"
https://www.goodreads.com/book/show/18901.The_Book_of_Nightmares,18901,The Book of Nightmares,0,Galway Kinnell,4.22,2299.0,2299.0,88.0,1971.0,False,"Poetry, Literature, Contemporary, Nonfiction, Literature, American, Dark, Literature, 20th Century",,
https://www.goodreads.com/book/show/3827274,3827274,الفوائد,0,Ibn Qayyim al-Jawziyya,4.5,4019.0,4019.0,304.0,1979.0,False,"Religion, Religion, Islam, Nonfiction, Audiobook",,
https://www.goodreads.com/book/show/18884.Polgara_the_Sorceress,18884,Polgara the Sorceress,1,David Eddings,4.1,27607.0,27607.0,754.0,1997.0,False,"Fantasy, Fiction, Fantasy, Epic Fantasy, Science Fiction Fantasy, Fantasy, High Fantasy, Fantasy, Magic, Young Adult, Adventure, Adult, Science Fiction",British Fantasy Award Nominee for Best Novel (1998),
https://www.goodreads.com/book/show/32812.Paradiso,32812,Paradiso,0,Dante Alighieri,3.95,16448.0,16448.0,400.0,1320.0,True,"Classics, Poetry, Fiction, Literature, Religion, European Literature, Italian Literature, Historical, Medieval, Fantasy, Philosophy, Cultural, Italy",,
https://www.goodreads.com/book/show/21337.Prodigal_Son,21337,Prodigal Son,0,Dean Koontz,4.02,33865.0,33865.0,,2005.0,True,"Horror, Fiction, Thriller, Fantasy, Mystery, Science Fiction, Suspense, Fantasy, Paranormal, Horror, Victor Frankenstein, Audiobook",,"New Orleans, Louisiana"
https://www.goodreads.com/book/show/2177563.Madness,2177563,Madness: A Bipolar Life,0,Marya Hornbacher,4.01,12714.0,12714.0,299.0,2008.0,False,"Autobiography, Memoir, Nonfiction, Psychology, Health, Mental Health, Mental Health, Mental Illness, Biography, Biography Memoir, Biography, Autobiography, Health, Self Help",,
https://www.goodreads.com/book/show/27719.The_Night_of_Wishes,27719,The Night of Wishes,1,Michael Ende,4.12,6598.0,6598.0,216.0,1989.0,False,"Fantasy, Childrens, European Literature, German Literature, Fiction, Classics, Young Adult, Audiobook, Childrens, Middle Grade, Humor, Fantasy, Magic",Preis der Leseratten des ZDF (1989),
https://www.goodreads.com/book/show/1891296.The_Fire_Eternal,1891296,The Fire Eternal,0,Chris d'Lacey,3.99,13290.0,13290.0,432.0,2007.0,True,"Fantasy, Fantasy, Dragons, Young Adult, Fiction, Childrens, Middle Grade, Childrens, Fantasy, Magic, Adventure, Fantasy, Urban Fantasy, Science Fiction",,
https://www.goodreads.com/book/show/60932.Parable_of_the_Talents,60932,Parable of the Talents,1,Octavia E. Butler,4.28,29509.0,29509.0,448.0,1998.0,True,"Science Fiction, Fiction, Science Fiction, Dystopia, Fantasy, Speculative Fiction, Apocalyptic, Post Apocalyptic, Science Fiction Fantasy, Cultural, African American, Novels, Religion",Nebula Award for Best Novel (1999),United States of America
https://www.goodreads.com/book/show/316496.Oscar_and_Lucinda,316496,Oscar and Lucinda,5,Peter Carey,3.73,19790.0,19790.0,515.0,1988.0,False,"Fiction, Historical, Historical Fiction, Cultural, Australia, Romance, Historical, Classics, Literary Fiction, Literature, Novels, Contemporary","Booker Prize (1988), Miles Franklin Literary Award (1989), National Book Council Banjo Award for Fiction (1989), Colin Roderick Award (1988), The Best of the Booker Nominee (2008)","Sydney, New South Wales, England"
https://www.goodreads.com/book/show/156198.The_Public_Burning,156198,The Public Burning,1,Robert Coover,4.03,1211.0,1211.0,544.0,1977.0,False,"Fiction, Historical, Historical Fiction, Novels, Literature, The United States Of America, Politics, Literature, American, Literature, 20th Century, Literary Fiction, United States",National Book Award Finalist for Fiction (1978),
https://www.goodreads.com/book/show/60080.Groundwork_of_the_Metaphysics_of_Morals,60080,Groundwork of the Metaphysics of Morals,0,Immanuel Kant,3.84,17199.0,17199.0,120.0,1785.0,False,"Philosophy, Nonfiction, Classics, European Literature, German Literature, Academic, School, Academic, College, Academic, Literature, 18th Century, Philosophy, Metaphysics, Academic, Read For School",,
https://www.goodreads.com/book/show/60215.The_Urth_of_the_New_Sun,60215,The Urth of the New Sun,3,Gene Wolfe,4.01,5781.0,5781.0,372.0,1987.0,True,"Fantasy, Science Fiction, Fiction, Science Fiction Fantasy, Speculative Fiction, Literature, Science Fiction, Time Travel, Apocalyptic, Post Apocalyptic, Audiobook, Science Fiction, Dying Earth","Hugo Award Nominee for Best Novel (1988), Nebula Award Nominee for Best Novel (1988), Seiun Award 星雲賞 Nominee for Best Translated Long Form (2009)",
https://www.goodreads.com/book/show/1681964.Timeless_Love,1681964,Timeless Love,0,Judith O'Brien,3.65,485.0,485.0,231.0,2002.0,False,"Historical, Historical Fiction, Romance, Young Adult, Science Fiction, Time Travel, Fantasy, Historical, Fiction, Womens Fiction, Chick Lit, European Literature, British Literature, Young Adult, Teen",,
https://www.goodreads.com/book/show/2067912.A_Batalha_do_Apocalipse,2067912,A Batalha do Apocalipse,0,Eduardo Spohr,4.14,3109.0,3109.0,569.0,2007.0,False,"Fantasy, Fiction, Adventure, Fantasy, Mythology, Adult, Fantasy, Supernatural, Paranormal, Angels, Fantasy, Epic Fantasy, Thriller, European Literature, Portuguese Literature",,
https://www.goodreads.com/book/show/14889.Joy_in_the_Morning,14889,Joy in the Morning,0,Betty  Smith,3.91,6697.0,6697.0,296.0,1963.0,False,"Fiction, Classics, Historical, Historical Fiction, Romance, Historical, Young Adult, Adult, Novels, Adult Fiction, Young Adult, Coming Of Age",,"Brooklyn, New York City, New York, Midwest"
https://www.goodreads.com/book/show/16117368-the-saint,16117368,The Saint,2,Tiffany Reisz,4.58,6800.0,6800.0,442.0,2014.0,True,"Erotica, BDSM, Adult Fiction, Erotica, Romance, Dark, Contemporary, Adult, Romance, Erotic Romance, Romance, Contemporary Romance, Fiction, Romance, M F Romance","RITA Award by Romance Writers of America for Best Erotic Romance (2015), Romantic Times Reviewers' Choice Award (RT Award) Nominee for Erotic Romance (2014)",
https://www.goodreads.com/book/show/6058.The_Road_Back,6058,The Road Back,0,Erich Maria Remarque,4.33,5206.0,5206.0,352.0,1931.0,True,"Classics, Fiction, War, Historical, Historical Fiction, European Literature, German Literature, War, World War I, Cultural, Germany, Historical, Literature, Novels",,
https://www.goodreads.com/book/show/894154.Red_Sorghum,894154,Red Sorghum,0,Mo Yan,3.77,5938.0,5938.0,359.0,1987.0,False,"Cultural, China, Fiction, Historical, Historical Fiction, Cultural, Asia, Nobel Prize, Asian Literature, Chinese Literature, Novels, Literature, Historical, Literature, Asian Literature",,China
https://www.goodreads.com/book/show/7417780-the-piper-s-son,7417780,The Piper's Son,5,Melina Marchetta,4.05,11289.0,11289.0,336.0,2010.0,False,"Young Adult, Contemporary, Romance, Fiction, Realistic Fiction, New Adult, Music, Family, Cultural, Australia, Young Adult, Young Adult Contemporary","New South Wales Premier's Literary Award Nominee for Ethel Turner Prize for Young People's Literature (2011), Miles Franklin Literary Award Nominee for Longlist (2011), Children's Book Council of Australia Award Nominee for Older Readers Book of the Year (2011), Prime Minister's Literary Awards Nominee for Young Adult Fiction (2011), Queensland Premier's Literary Awards Nominee for Young Adult Book Award (2010)","Sydney, New South Wales"
https://www.goodreads.com/book/show/426825.QB_VII,426825,QB VII,0,Leon Uris,4.19,28782.0,28782.0,432.0,1970.0,False,"Historical, Historical Fiction, Fiction, World War II, Holocaust, Historical, War, War, World War II, Mystery, Literature, Literature, Jewish, Novels",,
https://www.goodreads.com/book/show/17325147-left-drowning,17325147,Left Drowning,0,Jessica Park,4.12,24318.0,24318.0,399.0,2013.0,True,"New Adult, Romance, Contemporary, Academic, College, Romance, Contemporary Romance, Sociology, Abuse, Young Adult, Fiction, Audiobook, Womens Fiction, Chick Lit",,"Wisconsin, Maine, Massachusetts, Madison, Wisconsin, Newburyport, Massachusetts, Ellsworth, Maine, Bar Harbor, Maine"
https://www.goodreads.com/book/show/20877885-nothing-left-to-lose,20877885,Nothing Left to Lose,0,Kirsty Moseley,4.27,15007.0,15007.0,525.0,2013.0,True,"Romance, New Adult, Sociology, Abuse, Academic, College, Romance, Contemporary Romance, Contemporary, Young Adult, Suspense, Dark, Drama",,
https://www.goodreads.com/book/show/12290008-antologi-rasa,12290008,Antologi Rasa,0,Ika Natassa,3.75,6618.0,6618.0,328.0,2011.0,False,"Romance, Fiction, Asian Literature, Indonesian Literature, Novels, Adult, Womens Fiction, Chick Lit, Contemporary, Romance, Contemporary Romance, Young Adult, Drama",,
https://www.goodreads.com/book/show/5974527,5974527,بيت من لحم,0,Yusuf Idris,3.9,1769.0,1769.0,137.0,1971.0,False,"Short Stories, Novels, Fiction, Literature",,
https://www.goodreads.com/book/show/12022079-home-front,12022079,Home Front,1,Kristin Hannah,4.13,64880.0,64880.0,390.0,2012.0,False,"Fiction, Womens Fiction, Chick Lit, Romance, Contemporary, Audiobook, War, Adult, Adult Fiction, Womens Fiction, Drama",Goodreads Choice Award Nominee for Fiction (2012),
https://www.goodreads.com/book/show/186837.How_I_Became_Stupid,186837,How I Became Stupid,0,Martin Page,3.39,9794.0,9794.0,160.0,2000.0,False,"Fiction, Humor, Cultural, France, Novels, Contemporary, European Literature, French Literature, Literature, Literary Fiction, Philosophy, Humor, Comedy",,
https://www.goodreads.com/book/show/918645.Mygale,918645,Mygale,0,Thierry Jonquet,3.78,2929.0,2929.0,129.0,1984.0,False,"Horror, Thriller, Fiction, Cultural, France, Mystery, Crime, Mystery, European Literature, French Literature, Drama, Suspense, Dark",,Livry-Gargan
https://www.goodreads.com/book/show/13188615-breaking-point,13188615,Breaking Point,0,Kristen Simmons,3.99,10845.0,10845.0,400.0,2013.0,True,"Science Fiction, Dystopia, Young Adult, Romance, Science Fiction, Apocalyptic, Post Apocalyptic, Fantasy, Adventure, Fiction, Young Adult, Teen, Science Fiction, Apocalyptic",,
https://www.goodreads.com/book/show/309780.Framed,309780,Framed,2,Frank Cottrell Boyce,3.87,1774.0,1774.0,320.0,2006.0,False,"Art, Childrens, Fiction, Childrens, Middle Grade, Humor, Young Adult, Childrens, Juvenile, Realistic Fiction, Audiobook, Mystery, Crime","Manchester Book Award  Nominee for Longlist (2007), Deutscher Jugendliteraturpreis Nominee for Jugendbuch (2007)",
https://www.goodreads.com/book/show/13576494-buenos-d-as-princesa,13576494,"¡Buenos días, princesa!",0,Blue Jeans,3.78,12300.0,12300.0,535.0,2012.0,True,"Romance, Young Adult, Contemporary, Love, European Literature, Spanish Literature, LGBT, Romance, Erotic Romance, Young Adult, High School",,
https://www.goodreads.com/book/show/248309.The_Cry_of_the_Icemark,248309,The Cry of the Icemark,1,Stuart Hill,4.11,10538.0,10538.0,496.0,2005.0,True,"Fantasy, Young Adult, Adventure, Fantasy, Magic, Fiction, Fantasy, High Fantasy, Paranormal, Vampires, Romance, Young Adult, Young Adult Fantasy, War",Waterstones Children's Book Prize (2005),
https://www.goodreads.com/book/show/22667507-almost-broken,22667507,Almost Broken,0,Portia Moore,4.42,6687.0,6687.0,248.0,2014.0,True,"Romance, New Adult, Contemporary, Romance, Contemporary Romance, Dark, Suspense, Drama, Mental Health, Mental Illness, Mystery, Fiction",,
https://www.goodreads.com/book/show/782982.The_Lonely_Passion_of_Judith_Hearne,782982,The Lonely Passion of Judith Hearne,1,Brian Moore,3.99,2503.0,2503.0,223.0,1955.0,False,"Fiction, Cultural, Ireland, Classics, European Literature, Irish Literature, Literature, Novels, Literature, 20th Century, Literary Fiction, Cultural, Canada, Religion",Authors' Club Best First Novel Award (1955),Ireland
https://www.goodreads.com/book/show/20451634-oyasumi-punpun,20451634,Oyasumi Punpun,0,Inio Asano,4.7,3136.0,3136.0,2956.0,2007.0,True,"Sequential Art, Manga, Sequential Art, Comics, Sequential Art, Graphic Novels, Fiction, Comics Manga, Realistic Fiction, Slice Of Life, Drama, Young Adult, Coming Of Age, Contemporary, Manga, Seinen",,
https://www.goodreads.com/book/show/23129923-fifteen-dogs,23129923,Fifteen Dogs,4,André Alexis,3.79,20565.0,20565.0,171.0,2015.0,True,"Fiction, Cultural, Canada, Fantasy, Animals, Philosophy, Animals, Dogs, Contemporary, Literary Fiction, Audiobook, Novels","Scotiabank Giller Prize (2015), CBC Canada Reads (2017), Toronto Book Award Nominee (2015), Rogers Writers' Trust Fiction Prize (2015)","Toronto, Ontario"
https://www.goodreads.com/book/show/881508.Pan_Tadeusz,881508,Pan Tadeusz,0,Adam Mickiewicz,3.32,8615.0,8615.0,598.0,1834.0,False,"Classics, European Literature, Polish Literature, Poetry, Academic, School, Fiction, Cultural, Poland, Historical, Historical Fiction, Literature, 19th Century, Academic, Read For School, Literature",,Nowogródek
https://www.goodreads.com/book/show/6597855-kiklop,6597855,Kiklop,2,Ranko Marinković,4.07,1096.0,1096.0,565.0,1965.0,False,"Classics, Fiction, Academic, Read For School, Literary Fiction, Unfinished, Novels, Academic, School","BTBA Best Translated Book Award Nominee for Fiction longlist (2011), NIN Prize (1965)",Zagreb
https://www.goodreads.com/book/show/35228012-paralysis,35228012,Paralysis: Beating the Odds,0,Addison D'marko,4.16,228.0,228.0,157.0,2017.0,False,"True Story, Autobiography, Memoir, Inspirational, New Adult, Nonfiction, Self Help, Biography, Self Help, Personal Development, Literature, 21st Century",,
https://www.goodreads.com/book/show/34610437-the-diary-of-a-canadian-nobody,34610437,THE DIARY OF A CANADIAN NOBODY: The diary of a Mr. Nobody and how the war on terror affects his modern family,0,Arthur Paul James,4.22,64.0,64.0,273.0,2016.0,False,"Young Adult, Fiction, Drama, Adult, Modern, Novels, Young Adult, Teen, Suspense",,
https://www.goodreads.com/book/show/29875363-the-fireman,29875363,The Fireman,2,Joe Hill,3.9,53554.0,53554.0,768.0,2016.0,False,"Horror, Fiction, Science Fiction, Fantasy, Thriller, Science Fiction, Dystopia, Apocalyptic, Post Apocalyptic, Audiobook, Science Fiction, Apocalyptic, Adult","Locus Award for Best Horror Novel (2017), Goodreads Choice Award for Horror (2016)",
https://www.goodreads.com/book/show/30152013-le-poin-on-pilot-edition,30152013,Le Poinçon « Pilot Edition »,0,Lucio Agustine Rosenkreutz Crăciunescu,5.0,8.0,8.0,129.0,2012.0,False,,,
https://www.goodreads.com/book/show/71549.The_Family_of_Pascual_Duarte,,,0,,,,,,,False,,,
https://www.goodreads.com/book/show/28233096-the-silver-eyes,28233096,The Silver Eyes,0,Scott Cawthon,4.2,10253.0,10253.0,330.0,2015.0,True,"Horror, Young Adult, Mystery, Fiction, Fantasy, Paranormal, Thriller, Games, Video Games, Fantasy, Supernatural, Fantasy, Science Fiction",,
https://www.goodreads.com/book/show/43884993-the-19th-christmas,43884993,The 19th Christmas,0,James Patterson,3.91,24393.0,24393.0,344.0,2019.0,True,"Mystery, Fiction, Thriller, Holiday, Christmas, Mystery, Crime, Audiobook, Thriller, Mystery Thriller, Suspense, Mystery, Murder Mystery, Mystery, Detective",,
https://www.goodreads.com/book/show/42184334-here-to-stay,42184334,Here To Stay,0,Mark Edwards,3.98,36702.0,36702.0,,2019.0,False,"Thriller, Fiction, Mystery, Thriller, Mystery Thriller, Thriller, Psychological Thriller, Suspense, Mystery, Crime, Drama, Audiobook, Horror",,
https://www.goodreads.com/book/show/34521785-murdertrending,34521785,#Murdertrending,0,Gretchen McNeil,3.77,4804.0,4804.0,352.0,2018.0,True,"Young Adult, Mystery, Horror, Thriller, Science Fiction, Dystopia, Thriller, Mystery Thriller, Fiction, Science Fiction, Suspense, Young Adult, Teen",,
https://www.goodreads.com/book/show/20767918-the-escape,20767918,The Escape,1,David Baldacci,4.17,48746.0,48746.0,470.0,2014.0,True,"Thriller, Fiction, Mystery, Suspense, Audiobook, Mystery, Crime, Thriller, Mystery Thriller, Spy Thriller, Espionage, War, Military Fiction, Action",Goodreads Choice Award Nominee for Mystery & Thriller (2015),
https://www.goodreads.com/book/show/2274992.Tessa_in_Love,2274992,Tessa in Love,0,Kate le Vann,3.89,549.0,549.0,160.0,2005.0,False,"Romance, Young Adult, Young Adult, Teen, Contemporary",,
https://www.goodreads.com/book/show/230200.Paroles,230200,Paroles,0,Jacques Prévert,4.26,6564.0,6564.0,254.0,1949.0,False,"Poetry, Cultural, France, European Literature, French Literature, Classics, Literature, 20th Century, Literature, Fiction, Contemporary, Academic, School, Academic, Read For School",,
https://www.goodreads.com/book/show/372713.Doctored_Evidence,372713,Doctored Evidence,1,Donna Leon,3.89,6801.0,6801.0,245.0,2004.0,True,"Mystery, Fiction, Mystery, Crime, Cultural, Italy, Thriller, Mystery Thriller, Mystery, Detective, Thriller, Audiobook, Emergency Services, Police, Contemporary",Gumshoe Award Nominee for Best European Crime Novel (2005),Venice
https://www.goodreads.com/book/show/13067.Flush,13067,Flush,2,Carl Hiaasen,3.88,27769.0,27769.0,263.0,2005.0,False,"Young Adult, Fiction, Realistic Fiction, Mystery, Childrens, Middle Grade, Humor, Childrens, Adventure, Audiobook, Contemporary","Agatha Award for Best Childrens Young Adult (2005), Dorothy Canfield Fisher Children's Book Award (2007)",Florida
https://www.goodreads.com/book/show/817791.The_Blind_Side,817791,The Blind Side,2,Michael   Lewis,4.15,87641.0,87641.0,339.0,2006.0,False,"Sports, Sports, Nonfiction, Biography, Football, Adult, Biography Memoir, Business, Media Tie In, Autobiography, Memoir, History","ALA Alex Award (2007), Iowa High School Book Award Nominee (2011)","Memphis, Tennessee"
https://www.goodreads.com/book/show/697251.Martian_Time_Slip,697251,Martian Time-Slip,0,Philip K. Dick,3.76,11072.0,11072.0,262.0,1964.0,False,"Science Fiction, Fiction, Novels, Speculative Fiction, Science Fiction, Time Travel, Science Fiction Fantasy, Literature, American, Classics, Fantasy, Science Fiction, Dystopia",,Mars
https://www.goodreads.com/book/show/39000.Six_Frigates,39000,Six Frigates: The Epic History of the Founding of the U. S. Navy,0,Ian W. Toll,4.34,5489.0,5489.0,560.0,2006.0,False,"History, Nonfiction, North American Hi..., American History, War, Military Fiction, Military, Military History, War, Military History, Naval History, Military History, American Revolution, Adventure, Maritime, Audiobook",,
https://www.goodreads.com/book/show/623976.Alcatraz_Versus_the_Evil_Librarians,623976,Alcatraz Versus the Evil Librarians,1,Brandon Sanderson,3.9,22635.0,22635.0,308.0,2007.0,True,"Fantasy, Young Adult, Fiction, Childrens, Middle Grade, Humor, Childrens, Adventure, Audiobook, Fantasy, Urban Fantasy, Childrens, Juvenile",Premio El Templo de las Mil Puertas Nominee for Mejor novela extranjera perteneciente a saga (2016),United States of America
https://www.goodreads.com/book/show/759945.The_Magic_of_Thinking_Big,759945,The Magic of Thinking Big,0,David J. Schwartz,4.24,73676.0,73676.0,320.0,1959.0,False,"Self Help, Business, Nonfiction, Self Help, Personal Development, Psychology, Leadership, Productivity, Business, Entrepreneurship, Inspirational, Audiobook",,
https://www.goodreads.com/book/show/1422250.Vampires_are_Forever,1422250,Vampires are Forever,0,Lynsay Sands,4.26,18407.0,18407.0,371.0,2008.0,True,"Romance, Paranormal Romance, Fantasy, Paranormal, Romance, Paranormal, Vampires, Fantasy, Adult, Fiction, Fantasy, Urban Fantasy, Humor, Fantasy, Supernatural",,"England, Amsterdam"
https://www.goodreads.com/book/show/170619.All_Around_the_Town,170619,All Around the Town,0,Mary Higgins Clark,3.96,25122.0,25122.0,352.0,1989.0,False,"Mystery, Fiction, Suspense, Thriller, Thriller, Mystery Thriller, Mystery, Crime, Adult, Adult Fiction, Romance, Contemporary",,
https://www.goodreads.com/book/show/39937.Blue_Angel,39937,Blue Angel,1,Francine Prose,3.35,3408.0,3408.0,314.0,2000.0,False,"Fiction, Literary Fiction, Novels, Contemporary, Academic, Academia, Literature, American, Literature, Sexuality, Adult, Womens",National Book Award Finalist for Fiction (2000),Pennsylvania
https://www.goodreads.com/book/show/3417.Caesar_s_Women,3417,Caesar's Women,0,Colleen McCullough,4.26,6361.0,6361.0,943.0,1996.0,True,"Historical, Historical Fiction, Fiction, Historical, Roman, Cultural, Italy, History, Ancient History, Literature, Ancient, Politics, Novels, Literature",,
https://www.goodreads.com/book/show/96471.Earth,96471,Earth,2,David Brin,3.92,6975.0,6975.0,704.0,1990.0,False,"Science Fiction, Fiction, Science Fiction Fantasy, Speculative Fiction, Science Fiction, Near Future, Environment, Science Fiction, Hard Science Fiction, Biology, Ecology, Fantasy, Novels","Hugo Award Nominee for Best Novel (1991), Locus Award Nominee for Best Science Fiction Novel (1991)",
https://www.goodreads.com/book/show/339218.Riders,339218,Riders,0,Jilly Cooper,3.98,8118.0,8118.0,919.0,1985.0,True,"Romance, Fiction, Womens Fiction, Chick Lit, Contemporary, Animals, Horses, Sports, Sports, European Literature, British Literature, Humor, Romance, Contemporary Romance, Modern",,United Kingdom
https://www.goodreads.com/book/show/1373381.The_Ship_of_Brides,1373381,The Ship of Brides,0,Jojo Moyes,3.81,30445.0,30445.0,482.0,2005.0,False,"Historical, Historical Fiction, Fiction, Romance, Historical, Womens Fiction, Chick Lit, Cultural, Australia, War, World War II, Audiobook, Adult, Adult Fiction",,
https://www.goodreads.com/book/show/7095049-vampire-mistress,7095049,Vampire Mistress,0,Joey W. Hill,4.29,1475.0,1475.0,389.0,2010.0,True,"Paranormal, Vampires, Erotica, BDSM, Fantasy, Paranormal, Adult Fiction, Erotica, Romance, Paranormal Romance, Romance, Erotica, Menage, Fantasy, Romance, Erotic Romance, Adult",,
https://www.goodreads.com/book/show/7874158-vampire-trinity,7874158,Vampire Trinity,0,Joey W. Hill,4.4,1356.0,1356.0,406.0,2010.0,True,"Paranormal, Vampires, Erotica, BDSM, Adult Fiction, Erotica, Fantasy, Paranormal, Romance, Paranormal Romance, Romance, Erotica, Menage, Fantasy, Romance, Erotic Romance, Menage, M M F",,
https://www.goodreads.com/book/show/3438058,3438058,لماذا من حولك أغبياء؟,0,Sherif Arafa,3.79,7514.0,7514.0,271.0,2007.0,False,"Self Help, Psychology, Nonfiction, Self Help, Personal Development, International Dev..., Human Development, Northern Africa, Egypt, Language, Communication, Romance, Historical Romance",,
https://www.goodreads.com/book/show/2685469-buntschatten-und-flederm-use-mein-leben-in-einer-anderen-welt,2685469,Buntschatten und Fledermäuse. Mein Leben in einer anderen Welt,0,Axel Brauns,4.36,329.0,329.0,380.0,2002.0,False,"Nonfiction, Biography, Health, Mental Health, Psychology",,
https://www.goodreads.com/book/show/8419647-never-eighteen,8419647,Never Eighteen,1,Megan Bostic,3.79,2084.0,2084.0,200.0,2012.0,False,"Young Adult, Contemporary, Realistic Fiction, Romance, Death, Fiction, Young Adult, Teen, Travel, Road Trip, Young Adult, Young Adult Contemporary, Womens Fiction, Chick Lit",Charlotte Award Nominee (2014),"Tacoma, Washington, Seattle, Washington"
https://www.goodreads.com/book/show/8599748-trust-in-advertising,8599748,Trust in Advertising,0,Victoria Michaels,3.89,11865.0,11865.0,452.0,2010.0,False,"Romance, Romance, Contemporary Romance, Contemporary, Womens Fiction, Chick Lit, Adult, Humor, New Adult, Adult Fiction, Erotica, Fan Fiction, Love",,"San Francisco, California"
https://www.goodreads.com/book/show/6013687-waking-rose,6013687,Waking Rose,0,Regina Doman,4.37,1139.0,1139.0,354.0,2007.0,True,"Young Adult, Fantasy, Fairy Tales, Fiction, Fantasy, Romance, Christian Fiction, Retellings, Christianity, Catholic, Fairy Tales, Fairy Tale Retellings, Christian",,United States of America
https://www.goodreads.com/book/show/10433900-variant,10433900,Variant,0,Robison Wells,3.93,21687.0,21687.0,373.0,2011.0,True,"Young Adult, Science Fiction, Science Fiction, Dystopia, Mystery, Fiction, Thriller, Young Adult, Teen, Fantasy, Adventure, School Stories, Boarding School",,
https://www.goodreads.com/book/show/14828781-fallout,14828781,Fallout: Equestria,0,kkat,4.65,559.0,559.0,1600.0,2011.0,False,"Fan Fiction, Fantasy, Apocalyptic, Post Apocalyptic, Science Fiction, Fiction, Fantasy, Dragons, Unfinished, Science Fiction Fantasy, Fantasy, Magic",,
