url,book_id,title,award_count,author,avg_rating,num_reviews,num_ratings,num_pages,original_publish_year,series,genres,awards,place
https://www.goodreads.com/book/show/15722934-immortal-ever-after,15722934,Immortal Ever After,0,Lynsay Sands,4.26,9911.0,9911.0,358.0,2013.0,True,"Fantasy, Paranormal, Romance, Paranormal Romance, Romance, Paranormal, Vampires, Fantasy, Adult, Fantasy, Urban Fantasy, Fiction, Contemporary, Fantasy, Supernatural",,"Cambridge, Ontario, Toronto, Ontario"
https://www.goodreads.com/book/show/93007.The_Merry_Adventures_of_Robin_Hood,93007,The Merry Adventures of Robin Hood,0,Howard Pyle,4.07,60384.0,60384.0,400.0,1883.0,False,"Classics, Fiction, Historical, Historical Fiction, Adventure, Fantasy, Childrens, Literature, Young Adult, Historical, Audiobook",,"Sherwood Forest, Nottinghamshire, England"
https://www.goodreads.com/book/show/30189.Cast_in_Courtlight,30189,Cast in Courtlight,0,Michelle Sagara,4.11,10227.0,10227.0,488.0,2006.0,True,"Fantasy, Fantasy, Magic, Fantasy, Dragons, Fantasy, Urban Fantasy, Fantasy, Paranormal, Fiction, Science Fiction Fantasy, Mystery, Fantasy, High Fantasy, Romance",,
https://www.goodreads.com/book/show/1470282.Les_Enfants_de_la_libert_,1470282,Les Enfants de la liberté,0,Marc Levy,3.97,2919.0,2919.0,433.0,2007.0,False,"Cultural, France, Historical, Historical Fiction, Fiction, Roman, Romance, Historical, War, War, World War II, Contemporary, European Literature, French Literature",,
https://www.goodreads.com/book/show/7920450-comfort-food,7920450,Comfort Food,0,Kitty Thomas,3.7,15711.0,15711.0,192.0,2010.0,False,"Erotica, BDSM, Dark, Adult Fiction, Erotica, Romance, Contemporary, Adult, Sociology, Abuse, Romance, Erotic Romance, Fiction, Romance, Contemporary Romance",,
https://www.goodreads.com/book/show/3522419-nemesis,3522419,Nemesis,2,Jo Nesbø,3.98,66583.0,66583.0,480.0,2002.0,True,"Mystery, Crime, Mystery, Fiction, Thriller, European Literature, Scandinavian Literature, Mystery, Detective, Thriller, Mystery Thriller, Scandinavian Lite..., Nordic Noir, Suspense, Audiobook","Macavity Award Nominee for Best Mystery Novel (2010), Edgar Award Nominee for Best Novel (2010)",Oslo
https://www.goodreads.com/book/show/90420.Copper_Sun,90420,Copper Sun,5,Sharon M. Draper,4.34,13487.0,13487.0,302.0,2006.0,False,"Historical, Historical Fiction, Young Adult, Historical, Fiction, Cultural, African American, Young Adult, Teen, Academic, School, Adventure, Survival, Cultural, Africa, Young Adult, Young Adult Historical Fiction","South Carolina Book Award Nominee for Young Adult (2009), Coretta Scott King Book Award for Author (2007), Society of Midland Authors Award Nominee for Children's Fiction (2007), Missouri Gateway Readers Award Nominee (2009), Margaret A. Edwards Award (2015)","Ghana, United States of America, Florida, South Carolina"
https://www.goodreads.com/book/show/50696.The_Ghost_Writer,50696,The Ghost Writer,3,Philip Roth,3.82,10532.0,10532.0,179.0,1979.0,True,"Fiction, Novels, Literary Fiction, Literature, American, Literature, Literature, Jewish, Classics, Contemporary, Literature, 20th Century, American, Americana","Pulitzer Prize Nominee for Fiction (1980), National Book Critics Circle Award Nominee for Fiction (1979), National Book Award Finalist for Fiction (Hardcover) (1980)",Massachusetts
https://www.goodreads.com/book/show/44905.Writing_Down_the_Bones,44905,Writing Down the Bones: Freeing the Writer Within,0,Natalie Goldberg,4.19,26474.0,26474.0,312.0,1986.0,False,"Language, Writing, Nonfiction, Reference, Self Help, Autobiography, Memoir, Poetry, Art, Art, Crafts, How To, Spirituality",,
https://www.goodreads.com/book/show/13573400-two-brothers,13573400,Two Brothers,0,Ben Elton,4.35,10349.0,10349.0,424.0,2012.0,False,"Historical, Historical Fiction, Fiction, War, Historical, War, World War II, World War II, Holocaust, Cultural, Germany, Audiobook, Book Club, Novels",,"Berlin, Germany"
https://www.goodreads.com/book/show/13505141-grasping-at-eternity,13505141,Grasping at Eternity,0,Karen Amanda Hooper,4.06,2458.0,2458.0,328.0,2012.0,True,"Young Adult, Fantasy, Fantasy, Paranormal, Romance, Romance, Paranormal Romance, Fantasy, Magic, Fantasy, Supernatural, Fantasy, Urban Fantasy, Fiction, Contemporary",,
https://www.goodreads.com/book/show/71705.Zig_Zag,71705,Zig Zag,0,José Carlos Somoza,3.74,1599.0,1599.0,512.0,2006.0,False,"Science Fiction, Thriller, Fiction, Horror, Mystery, Cultural, Spain, Roman, Novels, Science Fiction Fantasy, Fantasy",,
https://www.goodreads.com/book/show/13380221-house-of-secrets,13380221,House of Secrets,0,Chris Columbus,3.81,11406.0,11406.0,490.0,2013.0,True,"Fantasy, Childrens, Middle Grade, Adventure, Young Adult, Fiction, Childrens, Mystery, Fantasy, Magic, Childrens, Juvenile, Young Adult, Young Adult Fantasy",,
https://www.goodreads.com/book/show/16466436-unravel,16466436,Unravel,0,Calia Read,3.95,11009.0,11009.0,324.0,2014.0,True,"New Adult, Romance, Contemporary, Mystery, Dark, Sociology, Abuse, Thriller, Thriller, Mystery Thriller, Romance, Contemporary Romance, Fiction",,
https://www.goodreads.com/book/show/8639945-life-without-limits,8639945,Life Without Limits,1,Nick Vujicic,4.13,7621.0,7621.0,272.0,2007.0,False,"Nonfiction, Biography, Christian, Self Help, Inspirational, Autobiography, Memoir, Biography, Autobiography, Self Help, Personal Development, Religion, Christianity, Spirituality",Australian Book Industry Award (ABIA) Nominee for Biography and for Newcomer (2012),
https://www.goodreads.com/book/show/6528980-1,6528980,ソードアート・オンライン 1: アインクラッド [Sōdo āto onrain 1: Ainkuraddo],0,Reki Kawahara,4.31,7758.0,7758.0,352.0,2009.0,True,"Novels, Light Novel, Fantasy, Sequential Art, Manga, Science Fiction, Young Adult, Romance, Fiction, Asian Literature, Japanese Literature, Cultural, Japan, Media Tie In, Anime",,
https://www.goodreads.com/book/show/23309634-before-we-were-strangers,23309634,Before We Were Strangers,0,Renee Carlino,4.24,29770.0,29770.0,320.0,2015.0,False,"Romance, Contemporary, New Adult, Romance, Contemporary Romance, Fiction, Adult, Academic, College, Womens Fiction, Chick Lit, Young Adult, Love",,"New York City, New York"
https://www.goodreads.com/book/show/417065.On_the_Road,417065,On the Road: the Original Scroll,0,Jack Kerouac,4.13,10834.0,10834.0,416.0,1957.0,False,"Fiction, Classics, Travel, Literature, Literature, American, Novels, Adventure, Classics, Modern Classics, Literary Fiction, Roman",,
https://www.goodreads.com/book/show/29430620-children-of-eden,29430620,Children of Eden,0,Joey Graceffa,3.88,8772.0,8772.0,278.0,2016.0,True,"Young Adult, Science Fiction, Dystopia, Science Fiction, Fantasy, Fiction, Audiobook, LGBT, Romance, Apocalyptic, Post Apocalyptic, Mystery",,
https://www.goodreads.com/book/show/25689056-the-inquisition,25689056,The Inquisition,0,Taran Matharu,4.33,16130.0,16130.0,368.0,2016.0,True,"Fantasy, Young Adult, Fantasy, Magic, Adventure, Young Adult, Young Adult Fantasy, Fiction, Paranormal, Demons, Fantasy, High Fantasy, Fantasy, Paranormal, Romance",,
https://www.goodreads.com/book/show/34813838-that-which-clouds-the-soul,34813838,"That, Which Clouds the Soul",0,Nicolas Ryan Moore,4.5,28.0,28.0,120.0,2017.0,False,,,
https://www.goodreads.com/book/show/17838528-the-unexpected-everything,17838528,The Unexpected Everything,1,Morgan Matson,4.02,35992.0,35992.0,519.0,2016.0,False,"Contemporary, Young Adult, Romance, Young Adult, Young Adult Contemporary, Fiction, Realistic Fiction, Womens Fiction, Chick Lit, Young Adult, Young Adult Romance, Romance, Contemporary Romance, Audiobook",Goodreads Choice Award Nominee for Young Adult Fiction (2016),Connecticut
https://www.goodreads.com/book/show/50273.Song_of_the_Silent_Snow,50273,Song of the Silent Snow,0,Hubert Selby Jr.,3.57,1578.0,1578.0,216.0,1986.0,False,"Short Stories, Fiction, Literature, Literature, 20th Century, American, Americana, The United States Of America, Classics, Literature, American, Drama, Modern",,
https://www.goodreads.com/book/show/20174424-city-of-stairs,20174424,City of Stairs,4,Robert Jackson Bennett,4.05,31932.0,31932.0,452.0,2014.0,True,"Fantasy, Fiction, Mystery, Fantasy, Urban Fantasy, Science Fiction, Adult, Young Adult, Childrens, Fantasy, High Fantasy, Science Fiction Fantasy","Locus Award Nominee for Best Fantasy Novel (2015), World Fantasy Award Nominee for Best Novel (2015), British Fantasy Award Nominee for Robert Holdstock Award (best fantasy novel) (2015), Goodreads Choice Award Nominee for Fantasy (2014)",
https://www.goodreads.com/book/show/25868918-jane-steele,25868918,Jane Steele,1,Lyndsay Faye,3.89,14254.0,14254.0,432.0,2016.0,False,"Historical, Historical Fiction, Fiction, Mystery, Retellings, Romance, Historical, Gothic, Adult, Audiobook, Adult Fiction",Edgar Award Nominee for Best Novel (2017),England
https://www.goodreads.com/book/show/29233804-wolfsong,29233804,Wolfsong,0,T.J. Klune,4.35,22713.0,22713.0,495.0,2016.0,True,"Fantasy, Romance, Romance, M M Romance, Fantasy, Paranormal, LGBT, Paranormal, Shapeshifters, Shapeshifters, Werewolves, Romance, Paranormal Romance, Fantasy, Urban Fantasy, Adult",,"Oregon, Green Creek, OR"
https://www.goodreads.com/book/show/2930763,2930763,الشيخ زعرب وآخرون,0,يوسف السباعي,3.64,153.0,153.0,,1952.0,False,"Short Stories, Fiction",,
https://www.goodreads.com/book/show/5342.The_Life_of_Our_Lord,5342,The Life of Our Lord: Written for His Children During the Years 1846 to 1849,0,Charles Dickens,4.0,2119.0,2119.0,128.0,1934.0,False,"Classics, Holiday, Christmas, Religion, Nonfiction, Christian, Childrens, Inspirational, Biography, Spirituality, Religion, Christianity",,
https://www.goodreads.com/book/show/449573.The_Theory_of_Everything,449573,The Theory of Everything: The Origin and Fate of the Universe,0,Stephen Hawking,4.18,17336.0,17336.0,176.0,2002.0,False,"Science, Nonfiction, Science, Physics, Science, Astronomy, Audiobook, Philosophy, Science, Popular Science, Space, History, Classics",,
https://www.goodreads.com/book/show/777211.Executive_Power,777211,Executive Power,0,Vince Flynn,4.29,43365.0,43365.0,512.0,2003.0,True,"Fiction, Thriller, Action, Spy Thriller, Espionage, Mystery, Suspense, Thriller, Spy Thriller, Thriller, Mystery Thriller, Audiobook, Adventure",,
https://www.goodreads.com/book/show/43888.The_Sword_of_Truth_Boxed_Set_I,43888,"The Sword of Truth, Boxed Set I: Wizard's First Rule, Blood of the Fold, Stone of Tears",0,Terry Goodkind,4.29,4387.0,4387.0,2480.0,1998.0,True,"Fantasy, Fiction, Fantasy, Magic, Adult, Fantasy, Epic Fantasy, Science Fiction Fantasy, Epic, Fantasy, Paranormal, Novels, Science Fiction",,
https://www.goodreads.com/book/show/94039.Drop_Dead_Beautiful,94039,Drop Dead Beautiful,0,Jackie Collins,4.04,4997.0,4997.0,512.0,2007.0,True,"Fiction, Romance, Womens Fiction, Chick Lit, Contemporary, Adult, Audiobook, Romance, Contemporary Romance, Drama, Suspense, Adult Fiction",,
https://www.goodreads.com/book/show/58801.De_la_part_de_la_princesse_morte,58801,De la part de la princesse morte,1,Kenizé Mourad,4.16,3171.0,3171.0,607.0,1987.0,False,"Historical, Historical Fiction, Fiction, Historical, Cultural, India, Romance, Cultural, France, Roman, Contemporary, Novels, Literature",Grand Prix des lectrices de Elle for roman (1988),
https://www.goodreads.com/book/show/702051.Gideon,702051,Gideon,0,Jacquelyn Frank,4.14,14483.0,14483.0,337.0,2007.0,True,"Romance, Paranormal Romance, Fantasy, Paranormal, Romance, Paranormal, Demons, Fantasy, Paranormal, Vampires, Fantasy, Urban Fantasy, Adult, Fiction, Fantasy, Magic",,United Kingdom
https://www.goodreads.com/book/show/13978.One_Good_Knight,13978,One Good Knight,0,Mercedes Lackey,3.86,10391.0,10391.0,393.0,2006.0,True,"Fantasy, Romance, Fantasy, Fairy Tales, Fiction, Fantasy, Dragons, Fantasy, Magic, Science Fiction Fantasy, Adult, Romance, Fantasy Romance, Adventure",,"Acadia, Five Hundred Kingdoms"
https://www.goodreads.com/book/show/10780042-j-r-ward-collection,10780042,"J. R. Ward Collection: Black Dagger #1,3,5,6 & Fallen Angels #1",0,J.R. Ward,4.73,2408.0,2408.0,2403.0,2010.0,False,"Fantasy, Paranormal, Paranormal, Vampires, Romance, Romance, Paranormal Romance, Fantasy, Adult, Love, Horror",,
https://www.goodreads.com/book/show/6439641-luv-ya-bunches,6439641,Luv Ya Bunches,0,Lauren Myracle,4.05,4874.0,4874.0,338.0,2009.0,True,"Childrens, Middle Grade, Realistic Fiction, Childrens, Fiction, Contemporary, Young Adult, Academic, School, Young Adult, Teen, Womens Fiction, Chick Lit, Childrens, Juvenile",,
https://www.goodreads.com/book/show/592167.The_Conquest_of_Gaul,592167,The Conquest of Gaul,0,Gaius Julius Caesar,4.0,9408.0,9408.0,269.0,1982.0,False,"History, Classics, Nonfiction, History, Ancient History, War, Biography, Military, Military History, War, Military Fiction, Roman, Literature, Ancient",,"Gaul, Roman Empire"
https://www.goodreads.com/book/show/2544.The_Madman,2544,The Madman,0,Kahlil Gibran,4.06,8244.0,8244.0,80.0,1918.0,False,"Poetry, Philosophy, Fiction, Classics, Short Stories, Literature, Spirituality, Novels, Religion, Cultural, Lebanon",,
https://www.goodreads.com/book/show/53834.The_Jesus_I_Never_Knew,53834,The Jesus I Never Knew,1,Philip Yancey,4.16,19542.0,19542.0,304.0,1995.0,False,"Christian, Nonfiction, Religion, Christianity, Religion, Religion, Theology, Religion, Faith, Spirituality, Christian, Christian Living, Christian, Christian Non Fiction, Inspirational",ECPA Christian Book Award for Christian Book of the Year (1996),
https://www.goodreads.com/book/show/16689.Citizen_of_the_Galaxy,16689,Citizen of the Galaxy,0,Robert A. Heinlein,4.0,15485.0,15485.0,288.0,1957.0,False,"Science Fiction, Fiction, Young Adult, Science Fiction Fantasy, Classics, Audiobook, Space, Space Opera, Fantasy, Adventure, Speculative Fiction",,
https://www.goodreads.com/book/show/20522640-mortal-heart,20522640,Mortal Heart,1,Robin LaFevers,4.11,22471.0,22471.0,444.0,2014.0,True,"Fantasy, Young Adult, Romance, Historical, Fiction, Historical, Historical Fiction, Young Adult, Young Adult Fantasy, Adventure, Fantasy, Mythology, Fantasy, Paranormal",Mythopoeic Fantasy Award Nominee for Children's Literature (2015),Brittany
https://www.goodreads.com/book/show/1876.The_History_of_Sexuality_Volume_3,1876,"The History of Sexuality, Volume 3: The Care of the Self",0,Michel Foucault,4.05,2238.0,2238.0,288.0,1984.0,True,"Philosophy, Nonfiction, History, Sexuality, Philosophy, Theory, Sociology, Psychology, Cultural, France, GLBT, Queer, Gender",,
https://www.goodreads.com/book/show/3040004-procession-of-the-dead,3040004,Procession of the Dead,0,D.B. Shan,3.93,2597.0,2597.0,312.0,1999.0,True,"Fantasy, Horror, Fiction, Mystery, Fantasy, Urban Fantasy, Mystery, Crime, Fantasy, Paranormal, Thriller, Adult, Science Fiction",,
https://www.goodreads.com/book/show/572626.Separate_Beds,572626,Separate Beds,1,LaVyrle Spencer,3.94,6095.0,6095.0,464.0,1985.0,False,"Romance, Romance, Contemporary Romance, Contemporary, Fiction, Romance, Historical Romance, Adult, Womens Fiction, Chick Lit, Marriage, Historical, Historical Fiction, Historical",Golden Medallion by Romance Writers of America Nominee for Single Title Release (1986),"Minneapolis, Minnesota"
https://www.goodreads.com/book/show/10393675-until-tuesday,10393675,Until Tuesday: A Wounded Warrior and the Golden Retriever Who Saved Him,3,Luis Carlos Montalván,4.19,8341.0,8341.0,252.0,2011.0,False,"Nonfiction, Animals, Autobiography, Memoir, Animals, Dogs, Biography, War, Military Fiction, Biography Memoir, War, Biography, Autobiography, Disability","Audie Award Nominee for Auto-biographies/Memoirs (2012), USA Best Book Award for Audiobook: Autobiography/Biography/Memoirs and Autobiography/Memoirs  (2012), International Latino Book Awards Nominee (2012)",
https://www.goodreads.com/book/show/13112869-not-a-drop-to-drink,13112869,Not a Drop to Drink,0,Mindy McGinnis,3.82,12473.0,12473.0,309.0,2013.0,True,"Young Adult, Science Fiction, Dystopia, Apocalyptic, Post Apocalyptic, Science Fiction, Fiction, Adventure, Survival, Romance, Science Fiction, Apocalyptic, Fantasy, Audiobook",,
https://www.goodreads.com/book/show/18081717,18081717,ترنيمة سلام,1,أحمد عبد المجيد,3.91,10173.0,10173.0,366.0,2013.0,False,"Novels, Fiction, Literature, Spirituality, Contemporary, African Literature, Egyptian Literature, International Dev..., Human Development",جائزة الشيخ زايد للكتاب Nominee (0),
https://www.goodreads.com/book/show/13380915-zom-b,13380915,Zom-B,0,Darren Shan,3.58,7590.0,7590.0,217.0,2012.0,True,"Horror, Horror, Zombies, Young Adult, Fiction, Fantasy, Young Adult, Teen, Fantasy, Paranormal, Science Fiction, Apocalyptic, Audiobook, Science Fiction",,"London, England"
https://www.goodreads.com/book/show/108925._J_rusalem,108925,Ô Jérusalem,0,Larry Collins,4.31,3429.0,3429.0,924.0,1972.0,False,"History, Nonfiction, Cultural, Israel, Literature, Jewish, War, Historical, Politics, Religion, Judaism, Religion, Roman",,Israel
https://www.goodreads.com/book/show/20821371-the-sense-of-style,20821371,The Sense of Style: The Thinking Person's Guide to Writing in the 21st Century,0,Steven Pinker,4.06,7124.0,7124.0,368.0,2014.0,False,"Language, Writing, Nonfiction, Humanities, Language, Humanities, Linguistics, Reference, Psychology, Science, Self Help, Business, Language, Communication",,
https://www.goodreads.com/book/show/18505784-the-pearl-that-broke-its-shell,18505784,The Pearl That Broke Its Shell,1,Nadia Hashimi,4.15,36915.0,36915.0,452.0,2014.0,False,"Fiction, Historical, Historical Fiction, Contemporary, Historical, Adult Fiction, Adult, Book Club, Literary Fiction, Cultural, Cultural, Asia",Goodreads Choice Award Nominee for Fiction & for Debut Goodreads Author (2014),Kabul
https://www.goodreads.com/book/show/6539716,6539716,الحب من الوريد إلى الوريد,0,غادة السمان,3.78,2018.0,2018.0,212.0,1980.0,False,"Poetry, Romance, Literature, Love",,
https://www.goodreads.com/book/show/18339630-all-my-puny-sorrows,18339630,All My Puny Sorrows,6,Miriam Toews,3.97,21087.0,21087.0,321.0,2014.0,False,"Fiction, Cultural, Canada, Contemporary, Literary Fiction, Novels, Health, Mental Health, Adult Fiction, Book Club, Family, Mental Health, Mental Illness","Scotiabank Giller Prize Nominee (2014), Wellcome Book Prize Nominee (2015), Canadian Authors Association Award for Fiction (2015), Rogers Writers' Trust Fiction Prize (2014), Andrew Carnegie Medal Nominee for Fiction (2015), Rathbones Folio Prize Nominee (2015)",
https://www.goodreads.com/book/show/220754.Dream_Boy,220754,Dream Boy,2,Jim Grimsley,3.92,4293.0,4293.0,195.0,1995.0,False,"LGBT, Fiction, LGBT, Gay, Romance, Young Adult, GLBT, Queer, Romance, M M Romance, Young Adult, Coming Of Age, Gay, Gay Fiction, Contemporary","Stonewall Book Award for Literature (1996), Lambda Literary Award Nominee for Gay Men's Fiction (1996)",North Carolina
https://www.goodreads.com/book/show/20977124-sea-of-stars,20977124,Sea of Stars,0,Amy A. Bartol,4.25,12139.0,12139.0,320.0,2015.0,True,"Fantasy, Romance, Young Adult, Science Fiction, Fantasy, Paranormal, New Adult, Science Fiction, Aliens, Fiction, Fantasy, Supernatural, Science Fiction, Dystopia",,
https://www.goodreads.com/book/show/6345999-death-note,6345999,"Death Note: Black Edition, Vol. 1",0,Tsugumi Ohba,4.47,12718.0,12718.0,385.0,2003.0,True,"Sequential Art, Manga, Sequential Art, Graphic Novels, Fantasy, Sequential Art, Comics, Horror, Fiction, Young Adult, Mystery, Thriller, Graphic Novels Manga",,
https://www.goodreads.com/book/show/1830571.A_Lua_de_Joana,1830571,A Lua de Joana,0,Maria Teresa Maia Gonzalez,3.71,5880.0,5880.0,156.0,1995.0,False,"European Literature, Portuguese Literature, Young Adult, Childrens, Fiction, Contemporary, Cultural, Portugal, Classics, Romance, Drama, Academic, School",,
https://www.goodreads.com/book/show/23208344-the-deal,23208344,The Deal: A Prequel of Marriage by Law,0,N.K. Pockett,4.44,94.0,94.0,24.0,2014.0,False,,,
https://www.goodreads.com/book/show/18602406-yellow-brick-war,18602406,Yellow Brick War,0,Danielle  Paige,3.82,17189.0,17189.0,270.0,2016.0,True,"Fantasy, Young Adult, Retellings, Fiction, Fantasy, Magic, Romance, Adventure, Fantasy, Fairy Tales, Young Adult, Young Adult Fantasy, Audiobook",,
https://www.goodreads.com/book/show/16065004-shadows-of-self,16065004,Shadows of Self,2,Brandon Sanderson,4.27,92489.0,92489.0,383.0,2015.0,True,"Fantasy, Fiction, Science Fiction, Steampunk, Fantasy, Epic Fantasy, Fantasy, High Fantasy, Audiobook, Adult, Young Adult, Adventure, Fantasy, Magic","Goodreads Choice Award Nominee for Fantasy (2015), Reddit r/fantasy Stabby Award for Best Novel (2015)",
https://www.goodreads.com/book/show/334227.Vidas_Secas,334227,Vidas Secas,0,Graciliano Ramos,4.17,11326.0,11326.0,176.0,1938.0,False,"Classics, Fiction, Cultural, Brazil, Literature, Romance, European Literature, Portuguese Literature, Drama, Novels, Academic, School, Literature, 20th Century",,
https://www.goodreads.com/book/show/30614118-fed-up-a-relatable-memoir,30614118,Fed Up! a Relatable Memoir,0,C.P. Henderson,4.12,241.0,241.0,222.0,2016.0,False,"Autobiography, Memoir, True Story, Nonfiction, New Adult, Inspirational, Humor, Biography, Self Help, Personal Development",,
https://www.goodreads.com/book/show/101869.The_Atrocity_Archives,101869,The Atrocity Archives,0,Charles Stross,3.91,22855.0,22855.0,345.0,2004.0,True,"Science Fiction, Fantasy, Horror, Fiction, Fantasy, Urban Fantasy, Humor, Horror, Lovecraftian, Thriller, Science Fiction Fantasy, Fantasy, Paranormal",,"London, England"
https://www.goodreads.com/book/show/265987.Malina,265987,Malina,0,Ingeborg Bachmann,4.06,2600.0,2600.0,244.0,1971.0,False,"Fiction, European Literature, German Literature, Novels, Cultural, Germany, Literature, Classics, Literature, 20th Century, Literary Fiction, Womens, Female Authors",,
https://www.goodreads.com/book/show/42379032-the-last-time-i-saw-you,42379032,The Last Time I Saw You,0,Liv Constantine,3.52,16408.0,16408.0,320.0,2019.0,False,"Mystery, Thriller, Fiction, Thriller, Mystery Thriller, Suspense, Audiobook, Thriller, Psychological Thriller, Mystery, Crime, Drama, Contemporary",,
https://www.goodreads.com/book/show/32889533-the-marsh-king-s-daughter,32889533,The Marsh King's Daughter,1,Karen Dionne,3.87,25675.0,25675.0,320.0,2017.0,False,"Thriller, Fiction, Mystery, Suspense, Thriller, Mystery Thriller, Mystery, Crime, Audiobook, Adult, Thriller, Psychological Thriller, Contemporary",Barry Award for Best Novel (2018),"Michigan, Upper Peninsula, Michigan"
https://www.goodreads.com/book/show/843433.Philosophy,843433,Philosophy: Who Needs It,0,Ayn Rand,3.88,2807.0,2807.0,308.0,1982.0,True,"Philosophy, Nonfiction, Politics, Classics, History, Economics, Writing, Essays, Cultural, Modern, Culture, Society",,
https://www.goodreads.com/book/show/24929.Lost,24929,Lost,0,Gregory Maguire,2.82,13932.0,13932.0,340.0,2001.0,False,"Fantasy, Fiction, Mystery, Horror, Fantasy, Fairy Tales, Adult, Retellings, Science Fiction Fantasy, Fantasy, Supernatural, Adult Fiction",,
https://www.goodreads.com/book/show/4758093-l-a-candy,,,0,,,,,,,False,,,
https://www.goodreads.com/book/show/1002520.Coming_Home,1002520,Coming Home,0,Lauren Brooke,4.12,6533.0,6533.0,144.0,2000.0,True,"Animals, Horses, Young Adult, Animals, Childrens, Fiction, Contemporary, Childrens, Middle Grade, Realistic Fiction, Family, Childrens, Juvenile",,Virginia
https://www.goodreads.com/book/show/7968.Red_Prophet,7968,Red Prophet,4,Orson Scott Card,3.8,19917.0,19917.0,311.0,1988.0,True,"Fantasy, Fiction, Science Fiction, Alternate History, Historical, Historical Fiction, Science Fiction Fantasy, Science Fiction, Historical, Fantasy, Magic, Young Adult, Speculative Fiction","Hugo Award Nominee for Best Novel (1989), Nebula Award Nominee for Best Novel (1988), Locus Award for Best Fantasy Novel (1989), Mythopoeic Fantasy Award Nominee (1989)",United States of America
https://www.goodreads.com/book/show/227274.The_Memory_of_Old_Jack,227274,The Memory of Old Jack,0,Wendell Berry,4.31,2590.0,2590.0,170.0,1974.0,False,"Fiction, Novels, Historical, Historical Fiction, Literature, Literary Fiction, American, Southern, Environment, Nature, Classics, Literature, American, Audiobook",,
https://www.goodreads.com/book/show/8752457-first-step-2-forever,8752457,First Step 2 Forever,0,Justin Bieber,4.25,4907.0,4907.0,240.0,2010.0,False,"Nonfiction, Biography, Biography, Autobiography, Music, Autobiography, Memoir, Young Adult, Teen, Childrens, Music, Musicians, Biography Memoir",,
https://www.goodreads.com/book/show/293583.Ophelia,293583,Ophelia,0,Lisa M. Klein,3.72,10887.0,10887.0,328.0,2006.0,False,"Historical, Historical Fiction, Young Adult, Fiction, Romance, Retellings, Historical, Fantasy, Young Adult, Teen, Classics, Romance, Historical Romance",,Denmark
https://www.goodreads.com/book/show/319403.Pigtopia,319403,Pigtopia,0,Kitty Fitzgerald,3.69,750.0,750.0,247.0,2005.0,False,"Fiction, Young Adult, European Literature, Irish Literature, Own, Novels, Book Club, Contemporary",,
https://www.goodreads.com/book/show/7831742-the-lost-saint,7831742,The Lost Saint,0,Bree Despain,4.03,16596.0,16596.0,404.0,2010.0,True,"Young Adult, Fantasy, Paranormal, Fantasy, Shapeshifters, Werewolves, Romance, Romance, Paranormal Romance, Fantasy, Supernatural, Fantasy, Urban Fantasy, Fiction, Animals, Wolves",,
https://www.goodreads.com/book/show/19674.The_Teeth_of_the_Tiger,19674,The Teeth of the Tiger,0,Tom Clancy,3.7,24385.0,24385.0,625.0,2003.0,True,"Fiction, Thriller, Action, Spy Thriller, Espionage, War, Military Fiction, Adventure, Suspense, Mystery, Thriller, Mystery Thriller, Thriller, Spy Thriller",,
