url,book_id,title,award_count,author,avg_rating,num_reviews,num_ratings,num_pages,original_publish_year,series,genres,awards,place
https://www.goodreads.com/book/show/5439.Interpreter_of_Maladies,5439,Interpreter of Maladies,3,Jhumpa Lahiri,4.16,164821.0,164821.0,198.0,1999.0,False,"Short Stories, Fiction, Cultural, India, Contemporary, Literary Fiction, Literature, Asian Literature, Indian Literature, Cultural, Asia, Adult Fiction, Adult","Pulitzer Prize for Fiction (2000), PEN/Hemingway Foundation Award (2000), Puddly Award for Short Stories (2001)","Boston, Massachusetts, Kolkata, Odisha, Connecticut"
https://www.goodreads.com/book/show/902.The_Westing_Game,902,The Westing Game,7,Ellen Raskin,4.01,177164.0,177164.0,182.0,1978.0,False,"Mystery, Young Adult, Fiction, Childrens, Middle Grade, Childrens, Classics, Thriller, Mystery Thriller, Academic, School, Childrens, Juvenile, Realistic Fiction","Newbery Medal (1979), Banta Award, Dorothy Canfield Fisher Children's Book Award Nominee (1980), Boston Globe-Horn Book Award for Fiction (1978), National Book Award Finalist for Children's Book, Fiction (Paperback) (1981), Virginia Reader's Choice","Westingtown, Milwaukee, Wisconsin"
https://www.goodreads.com/book/show/77390.Anne_of_Avonlea,77390,Anne of Avonlea,0,L.M. Montgomery,4.19,155660.0,155660.0,304.0,1909.0,True,"Classics, Fiction, Young Adult, Historical, Historical Fiction, Childrens, Historical, Romance, Cultural, Canada, Audiobook, Childrens, Middle Grade",,Prince Edward Island
https://www.goodreads.com/book/show/7723542-a-dog-s-purpose,7723542,A Dog's Purpose,2,W. Bruce Cameron,4.34,117924.0,117924.0,319.0,2010.0,True,"Fiction, Animals, Animals, Dogs, Contemporary, Adult, Fantasy, Audiobook, Adult Fiction, Humor, Young Adult","Goodreads Choice Award Nominee for Fiction (2010), Missouri Gateway Readers Award Nominee (2013)",
https://www.goodreads.com/book/show/35729.Lover_Eternal,35729,Lover Eternal,0,J.R. Ward,4.33,177254.0,177254.0,441.0,2006.0,True,"Romance, Fantasy, Paranormal, Romance, Paranormal Romance, Paranormal, Vampires, Fantasy, Fantasy, Urban Fantasy, Adult, Fiction, Adult Fiction, Erotica, Fantasy, Supernatural",,"Caldwell, New York"
https://www.goodreads.com/book/show/227571.Peace_Like_a_River,227571,Peace Like a River,4,Leif Enger,3.98,84410.0,84410.0,312.0,2001.0,False,"Fiction, Historical, Historical Fiction, Book Club, Adult Fiction, Novels, Literary Fiction, Adult, Contemporary, Young Adult, Coming Of Age, Family","Book Sense Book of the Year Award for Adult Fiction (2002), Independent Publisher Book Award (IPPY) for Fiction - General (2002), ALA Alex Award (2002), International Dublin Literary Award Nominee (2003)","United States of America, North Dakota"
https://www.goodreads.com/book/show/15241.The_Two_Towers,15241,The Two Towers,0,J.R.R. Tolkien,4.45,757295.0,757295.0,322.0,1954.0,True,"Fantasy, Fiction, Classics, Adventure, Science Fiction Fantasy, Fantasy, High Fantasy, Fantasy, Epic Fantasy, Novels, Literature, Young Adult",,Middle-earth
https://www.goodreads.com/book/show/5527.All_the_King_s_Men,5527,All the King's Men,3,Robert Penn Warren,4.06,60312.0,60312.0,439.0,1946.0,False,"Fiction, Classics, Historical, Historical Fiction, Politics, Literature, Novels, Literature, American, Literary Fiction, American, Southern, Historical","Pulitzer Prize for Fiction (1947), Prix du Meilleur Livre Étranger for Roman (1953), Mikael Agricola -palkinto (1977)",Southern Region
https://www.goodreads.com/book/show/25480342-a-monster-calls,25480342,A Monster Calls,22,Patrick Ness,4.33,223254.0,223254.0,237.0,2011.0,False,"Fantasy, Young Adult, Fiction, Horror, Childrens, Middle Grade, Contemporary, Magical Realism, Childrens, Fantasy, Paranormal, Death","Bram Stoker Award Nominee for Best Young Adult Novel (2011), Kate Greenaway Medal (2012), Galaxy British Book Awards for Children's Book of the Year (2011), Grand Prix de l'Imaginaire for Jeunesse (2013), Los Angeles Times Book Prize Nominee for Young Adult Literature (2011), Red House Children's Book Award (2012), Rhode Island Teen Book Award Nominee (2014), Deutscher Jugendliteraturpreis for Preis der Jugendjury & Nominierung Kategorie Kinderbuch (2012), Tähtifantasia Award Nominee (2017), The Inky Awards Nominee for Silver Inky (2012), Gouden Lijst for vertaald boek (2014), Lincoln Award Nominee (2015), Galaxy National Book Award for Children’s Book of the Year (2011), Grampian Children’s Book Award Nominee (2013), The Kitschies for Red Tentacle (Novel) (2011), Goodreads Choice Award Nominee for Middle Grade & Children's (2011), Carnegie Medal (2012), The Inky Awards Shortlist for Silver Inky (2012), Prix Elbakin.net for Meilleur roman fantasy traduit Jeunesse (2012), Europese Literatuurprijs Nominee (2014), Rebecca Caudill Young Readers' Book Award Nominee (2016), Premi Protagonista Jove for Categoria 13-14 anys (2017)","England, United Kingdom"
https://www.goodreads.com/book/show/65641.The_Silver_Chair,65641,The Silver Chair,0,C.S. Lewis,3.95,252499.0,252499.0,243.0,1953.0,True,"Fantasy, Fiction, Classics, Young Adult, Childrens, Christian, Adventure, Childrens, Middle Grade, Christian Fiction, Science Fiction Fantasy",,
https://www.goodreads.com/book/show/14935.Sense_and_Sensibility,14935,Sense and Sensibility,0,Jane Austen,4.08,986248.0,986248.0,409.0,1811.0,False,"Classics, Fiction, Romance, Historical, Historical Fiction, Literature, Historical, Classics, Classic Literature, Literature, 19th Century, Novels, European Literature, British Literature",,"England, United Kingdom, Devonshire, England"
https://www.goodreads.com/book/show/567678.The_Wasp_Factory,567678,The Wasp Factory,1,Iain Banks,3.81,87978.0,87978.0,192.0,1984.0,False,"Fiction, Horror, Thriller, Mystery, Contemporary, Dark, Drama, Suspense, Novels, Classics",Kurd-Laßwitz-Preis for Foreign Novel (1992),Scotland
https://www.goodreads.com/book/show/40593473-finding-hope-in-the-darkness-of-grief,40593473,"Finding Hope in the Darkness of Grief: Spiritual Insights Expressed Through Art, Poetry and Prose",1,Diamante Lavendar,4.33,5252.0,5252.0,74.0,2018.0,False,"Contemporary, Fiction, Novels, Drama, Book Club, Epic, Adult, Poetry, New Adult, Young Adult",Feathered Quill Book Award for Religious/Spiritual (1st) and for Inspirational (2nd) (2019),
https://www.goodreads.com/book/show/80660.We_Need_to_Talk_About_Kevin,80660,We Need to Talk About Kevin,1,Lionel Shriver,4.05,176217.0,176217.0,400.0,2003.0,False,"Fiction, Contemporary, Thriller, Horror, Mystery, Crime, Drama, Psychology, Adult, Literary Fiction, Book Club",Orange Prize for Fiction (2005),
https://www.goodreads.com/book/show/43758.The_Queen_of_the_Damned,43758,The Queen of the Damned,2,Anne Rice,3.88,141339.0,141339.0,448.0,1988.0,True,"Horror, Fantasy, Paranormal, Vampires, Fiction, Fantasy, Paranormal, Fantasy, Supernatural, Fantasy, Urban Fantasy, Gothic, Adult, Science Fiction Fantasy","Bram Stoker Award Nominee for Best Novel (1988), Locus Award Nominee for Best Horror Novel (1989)",
https://www.goodreads.com/book/show/10534.The_Art_of_War,10534,The Art of War,1,Sun Tzu,3.97,355790.0,355790.0,273.0,-500.0,False,"Nonfiction, Classics, Philosophy, History, War, Business, Politics, War, Military Fiction, Cultural, China, Leadership",Independent Publisher Book Award (IPPY) for Multicultural Non-Fiction (2003),
https://www.goodreads.com/book/show/7631105-the-scorch-trials,7631105,The Scorch Trials,0,James Dashner,3.91,472719.0,472719.0,362.0,2010.0,True,"Young Adult, Science Fiction, Dystopia, Science Fiction, Fiction, Fantasy, Adventure, Apocalyptic, Post Apocalyptic, Young Adult, Teen, Audiobook, Mystery",,
https://www.goodreads.com/book/show/60510.Poison_Study,60510,Poison Study,3,Maria V. Snyder,4.09,152905.0,152905.0,427.0,2005.0,True,"Fantasy, Young Adult, Romance, Fantasy, Magic, Fiction, Fantasy, Paranormal, Fantasy, High Fantasy, Young Adult, Young Adult Fantasy, Adventure, New Adult","Locus Award Nominee for Best First Novel (2006), RITA Award by Romance Writers of America Nominee for First Book (2006), Compton Crook Award (2006)",Ixia
https://www.goodreads.com/book/show/52529.The_Secret,52529,The Secret,0,Rhonda Byrne,3.69,372577.0,372577.0,199.0,2006.0,True,"Self Help, Nonfiction, Spirituality, Psychology, Philosophy, Self Help, Personal Development, Inspirational, Audiobook, Spirituality, New Age, Business",,
https://www.goodreads.com/book/show/23522.Mythology,23522,Mythology,0,Edith Hamilton,4.01,46555.0,46555.0,497.0,1942.0,False,"Fantasy, Mythology, Classics, Nonfiction, History, Reference, Religion, Academic, School, Mythology, Greek Mythology, Literature, Short Stories",,
https://www.goodreads.com/book/show/6482837-before-i-fall,6482837,Before I Fall,11,Lauren Oliver,3.9,306373.0,306373.0,470.0,2010.0,False,"Young Adult, Contemporary, Fiction, Romance, Fantasy, Realistic Fiction, Young Adult, Teen, Fantasy, Paranormal, Death, Audiobook","Romantic Times Reviewers' Choice Award (RT Award) Nominee for Best Young Adult Paranormal/Fantasy Novel (2010), Rhode Island Teen Book Award Nominee (2012), Milwaukee County Teen Book Award Nominee (2011), Deutscher Jugendliteraturpreis Nominee for Preis der Jugendjury (2011), Literaturpreis der Jury der jungen Leser for Cover (2011), Goodreads Choice Award for Young Adult Fiction, Debut Author, Nominee for Goodreads Author, Favorite Heroine (2010), Missouri Gateway Readers Award Nominee (2013), Premio El Templo de las Mil Puertas Nominee for Mejor novela extranjera independiente (2010)",Connecticut
https://www.goodreads.com/book/show/27523.Left_Behind,27523,Left Behind,0,Tim LaHaye,3.84,209736.0,209736.0,342.0,1995.0,True,"Fiction, Christian, Christian Fiction, Religion, Fantasy, Thriller, Religion, Christianity, Science Fiction, Science Fiction, Apocalyptic, Spirituality",,"Illinois, New York City, New York, Mount Prospect, Illinois, Chicago, Illinois"
https://www.goodreads.com/book/show/7664041-inheritance,7664041,Inheritance,1,Christopher Paolini,4.09,229916.0,229916.0,849.0,2011.0,True,"Fiction, Young Adult, Adventure, Fantasy, Fantasy, Epic Fantasy, Young Adult, Young Adult Fantasy, Science Fiction Fantasy, Audiobook, Young Adult, Teen, Childrens",Premio El Templo de las Mil Puertas Nominee for Mejor novela extranjera perteneciente a saga (2011),Alagaësia
https://www.goodreads.com/book/show/20758104-the-knife-of-never-letting-go,20758104,The Knife of Never Letting Go,8,Patrick Ness,3.97,167046.0,167046.0,512.0,2008.0,True,"Young Adult, Science Fiction, Dystopia, Science Fiction, Fantasy, Fiction, Adventure, Young Adult, Teen, Audiobook, Thriller, Apocalyptic, Post Apocalyptic","Guardian Children's Fiction Prize (2008), Manchester Book Award  Nominee for Longlist (2009), Odyssey Award Nominee (2011), James Tiptree Jr. Award (2008), Milwaukee County Teen Book Award Nominee (2010), Dioraphte Jongerenliteratuurprijs Nominee (2014), Carnegie Medal Nominee (2009), Green Mountain Book Award (2012)",New World
https://www.goodreads.com/book/show/27003.The_Eyre_Affair,27003,The Eyre Affair,5,Jasper Fforde,3.87,127749.0,127749.0,374.0,2001.0,True,"Fantasy, Fiction, Mystery, Humor, Science Fiction, Writing, Books About Books, Science Fiction, Time Travel, Science Fiction, Alternate History, Science Fiction Fantasy, Adult","Locus Award Nominee for Best Science Fiction Novel (2002), IAFA William L. Crawford Fantasy Award (2002), Dilys Award Nominee (2003), ALA Alex Award (2003), Lincoln Award Nominee (2006)","England, Wales, Swindon, England"
https://www.goodreads.com/book/show/17125.One_Day_in_the_Life_of_Ivan_Denisovich,17125,One Day in the Life of Ivan Denisovich,0,Aleksandr Solzhenitsyn,3.96,96122.0,96122.0,182.0,1962.0,False,"Fiction, Classics, Cultural, Russia, Historical, Historical Fiction, Literature, Russian Literature, Literature, Novels, Historical, Literature, 20th Century, Academic, School",,"Russian Federation, Soviet Union"
https://www.goodreads.com/book/show/1617.Night,1617,Night,0,Elie Wiesel,4.34,1015273.0,1015273.0,115.0,1956.0,True,"Nonfiction, Classics, History, Autobiography, Memoir, World War II, Holocaust, Biography, Academic, School, Historical, War, War, World War II",,
https://www.goodreads.com/book/show/59219.The_Talisman,59219,The Talisman,4,Stephen King,4.13,110505.0,110505.0,656.0,1984.0,True,"Horror, Fantasy, Fiction, Thriller, Adventure, Mystery, Fantasy, Supernatural, Audiobook, Fantasy, Paranormal, Science Fiction","Locus Award Nominee for Best Fantasy Novel (1985), World Fantasy Award Nominee for Best Novel (1985), Audie Award for Fiction, Unabridged (2002)",
https://www.goodreads.com/book/show/10441.The_Memory_Keeper_s_Daughter,10441,The Memory Keeper's Daughter,0,Kim Edwards,3.68,570122.0,570122.0,401.0,2005.0,False,"Fiction, Contemporary, Adult Fiction, Adult, Historical, Historical Fiction, Book Club, Drama, Womens Fiction, Chick Lit, Novels, Family",,"Pittsburgh, Pennsylvania, Lexington, Kentucky, Paris"
https://www.goodreads.com/book/show/8492825-where-she-went,8492825,Where She Went,4,Gayle Forman,4.01,264980.0,264980.0,297.0,2011.0,True,"Young Adult, Romance, Contemporary, Fiction, Realistic Fiction, Music, New Adult, Young Adult, Teen, Audiobook, Young Adult, Young Adult Contemporary","Milwaukee County Teen Book Award Nominee (2012), The Inky Awards Nominee for Silver Inky (2011), Goodreads Choice Award for Young Adult Fiction (2011), The Inky Awards Shortlist for Silver Inky (2011)","New York City, New York, Oregon"
https://www.goodreads.com/book/show/17332218-words-of-radiance,17332218,Words of Radiance,5,Brandon Sanderson,4.74,228506.0,228506.0,1087.0,2014.0,True,"Fantasy, Fiction, Fantasy, Epic Fantasy, Fantasy, High Fantasy, Audiobook, Fantasy, Magic, Science Fiction Fantasy, Adult, Epic, Adventure","Locus Award Nominee for Best Fantasy Novel (2015), David Gemmell Legend Award for Best Fantasy Novel (2015), David Gemmell Ravenheart Award for Best Fantasy Cover Art (2015), Goodreads Choice Award Nominee for Fantasy (2014), Reddit r/fantasy Stabby Award for Best Novel (2014)",Roshar
https://www.goodreads.com/book/show/121749.Prince_Caspian,121749,Prince Caspian,0,C.S. Lewis,3.97,367160.0,367160.0,240.0,1951.0,True,"Fantasy, Fiction, Classics, Young Adult, Childrens, Adventure, Christian, Childrens, Middle Grade, Christian Fiction, Science Fiction Fantasy",,
https://www.goodreads.com/book/show/112750.Darkfever,112750,Darkfever,0,Karen Marie Moning,4.06,166486.0,166486.0,309.0,2006.0,True,"Fantasy, Fantasy, Urban Fantasy, Fantasy, Paranormal, Romance, Romance, Paranormal Romance, Fairies, Fae, Adult, Fiction, Fantasy, Supernatural, Paranormal, Vampires",,"Ashford, Georgia, Dublin"
https://www.goodreads.com/book/show/7304203-shadowfever,7304203,Shadowfever,3,Karen Marie Moning,4.4,100921.0,100921.0,608.0,2011.0,True,"Fantasy, Urban Fantasy, Fantasy, Fantasy, Paranormal, Romance, Romance, Paranormal Romance, Fairies, Fae, Adult, Fiction, Fantasy, Magic, Fantasy, Supernatural","Romantic Times Reviewers' Choice Award (RT Award) for Best Urban Fantasy Protagonist (2011), DABWAHA Romance Tournament for Best Romance of the Year & Best Novel with Romantic Elements/Crossover (2012), Goodreads Choice Award for Paranormal Fantasy and Nominee for Favorite Book (2011)",Dublin
https://www.goodreads.com/book/show/13206760-scarlet,13206760,Scarlet,2,Marissa Meyer,4.26,334152.0,334152.0,454.0,2013.0,True,"Young Adult, Fantasy, Science Fiction, Romance, Science Fiction, Dystopia, Retellings, Fiction, Fantasy, Fairy Tales, Audiobook, Adventure","Goodreads Choice Award Nominee for Best Young Adult Fantasy & Science Fiction (2013), Premio El Templo de las Mil Puertas Nominee for Mejor novela extranjera perteneciente a saga (2013)","Toulouse, Paris, Rieux, New Beijing, Eastern Commonwealth"
https://www.goodreads.com/book/show/110737.Seabiscuit,110737,Seabiscuit: An American Legend,4,Laura Hillenbrand,4.2,152200.0,152200.0,457.0,1999.0,False,"Nonfiction, History, Biography, Sports, Sports, Animals, Animals, Horses, Historical, Biography Memoir, North American Hi..., American History, Sports, Horse Racing","Book Sense Book of the Year Award for Adult Nonfiction (2002), William Hill Sports Book of the Year (2001), Puddly Award for Nonfiction (2004), National Book Critics Circle Award Nominee for General Nonfiction (2001)",United States of America
https://www.goodreads.com/book/show/374233.If_on_a_Winter_s_Night_a_Traveler,374233,If on a Winter's Night a Traveler,2,Italo Calvino,4.04,78316.0,78316.0,260.0,1979.0,False,"Fiction, Classics, European Literature, Italian Literature, Literature, Magical Realism, Cultural, Italy, Novels, Writing, Books About Books, Literary Fiction, Literature, 20th Century","Ars Translationis (2010), Ein Buch für die Stadt (2004)",
https://www.goodreads.com/book/show/20820994-i-ll-give-you-the-sun,20820994,I'll Give You the Sun,10,Jandy Nelson,4.14,270197.0,270197.0,371.0,2014.0,False,"Young Adult, Contemporary, LGBT, Romance, Fiction, Realistic Fiction, GLBT, Queer, Young Adult, Coming Of Age, Young Adult, Young Adult Contemporary, Family","Stonewall Book Award Nominee for Children’s and Young Adult Literature (2015), Georgia Peach Book Award Nominee for Honor book (2015), Josette Frank Award for Younger Readers (2015), Michael L. Printz Award (2015), Pennsylvania Young Readers' Choice Award Nominee for Young Adults (2016), Milwaukee County Teen Book Award Nominee (2016), The Inky Awards for Silver Inky (2016), Lincoln Award Nominee (2016), Goodreads Choice Award Nominee for Young Adult Fiction (2014), Premio El Templo de las Mil Puertas Nominee for Mejor novela extranjera independiente (2015)",California
https://www.goodreads.com/book/show/17841.Foucault_s_Pendulum,17841,Foucault's Pendulum,3,Umberto Eco,3.9,61426.0,61426.0,623.0,1988.0,False,"Fiction, Mystery, Historical, Historical Fiction, Literature, Classics, European Literature, Italian Literature, Thriller, Novels, Philosophy, Cultural, Italy","PEN Translation Prize for William Weaver (1990), Premio Bancarella (1989), Ars Translationis (1998)","Italy, Milan"
https://www.goodreads.com/book/show/15622.Native_Son,15622,Native Son,1,Richard Wright,3.99,92981.0,92981.0,504.0,1940.0,False,"Fiction, Classics, Historical, Historical Fiction, Cultural, African American, Race, Literature, Novels, Academic, School, Literature, American, Literature, Banned Books",New York Drama Critics' Circle Award Nominee for Best American Play,"Chicago, Illinois, Illinois"
https://www.goodreads.com/book/show/13206828-cress,13206828,Cress,2,Marissa Meyer,4.42,295234.0,295234.0,552.0,2014.0,True,"Young Adult, Fantasy, Science Fiction, Romance, Retellings, Science Fiction, Dystopia, Fiction, Fantasy, Fairy Tales, Audiobook, Adventure","Geffen Award Nominee for Best Translated YA Book (2019), Goodreads Choice Award Nominee for Young Adult Fantasy & Science Fiction (2014)","Luna, New Beijing, Eastern Commonwealth, Sahara"
https://www.goodreads.com/book/show/682804.The_Killer_Angels,682804,The Killer Angels,1,Michael Shaara,4.31,77036.0,77036.0,345.0,1974.0,True,"Historical, Historical Fiction, Fiction, Military History, Civil War, War, Historical, War, Military Fiction, Classics, North American Hi..., American History, American History, American Civil War, Academic, School",Pulitzer Prize for Fiction (1975),"Gettysburg, Pennsylvania, Pennsylvania"
https://www.goodreads.com/book/show/3867.The_History_of_Love,3867,The History of Love,6,Nicole Krauss,3.91,125940.0,125940.0,255.0,2005.0,False,"Fiction, Historical, Historical Fiction, Romance, Contemporary, Novels, Literary Fiction, Book Club, Adult Fiction, Adult, Love","Orange Prize Nominee for Fiction Shortlist (2006), Edward Lewis Wallant Award (2005), Borders Original Voices Award for Fiction (2005), William Saroyan International Prize for Writing for Fiction (2008), Prix du Meilleur Livre Étranger for Roman (2006), Premi Llibreter de narrativa Nominee (2006)","New York City, New York, Slonim"
https://www.goodreads.com/book/show/2767.A_People_s_History_of_the_United_States,2767,A People's History of the United States,1,Howard Zinn,4.06,205475.0,205475.0,729.0,1980.0,False,"History, Nonfiction, Politics, North American Hi..., American History, Historical, Social Movements, Social Justice, Classics, Audiobook, Literature, American, Unfinished",National Book Award Finalist for History (Paperback) (1981),United States of America
https://www.goodreads.com/book/show/2536134.Gone,2536134,Gone,1,Michael  Grant,3.86,185244.0,185244.0,560.0,2008.0,True,"Young Adult, Science Fiction, Dystopia, Science Fiction, Fantasy, Fiction, Fantasy, Paranormal, Romance, Adventure, Fantasy, Supernatural, Young Adult, Teen",Missouri Truman Readers Award Nominee (2011),"Perdido Beach, California"
https://www.goodreads.com/book/show/547094.I_Am_Legend_and_Other_Stories,547094,I Am Legend and Other Stories,0,Richard Matheson,4.0,121612.0,121612.0,317.0,1954.0,False,"Horror, Fiction, Science Fiction, Paranormal, Vampires, Short Stories, Fantasy, Apocalyptic, Post Apocalyptic, Classics, Science Fiction, Dystopia, Horror, Zombies",,"Los Angeles, California"
https://www.goodreads.com/book/show/41219.Possession,41219,Possession,3,A.S. Byatt,3.87,75429.0,75429.0,555.0,1990.0,False,"Fiction, Historical, Historical Fiction, Romance, Classics, Mystery, Historical, Literary Fiction, Literature, European Literature, British Literature, Poetry","Booker Prize (1990), Irish Times International Fiction Prize (1990), Commonwealth Writers' Prize for Best Book in South Asia and Europe (1991)","London, England, Lincoln, England, England, United Kingdom"
https://www.goodreads.com/book/show/415.Gravity_s_Rainbow,415,Gravity's Rainbow,5,Thomas Pynchon,3.96,40526.0,40526.0,776.0,1973.0,False,"Fiction, Classics, Science Fiction, Literature, Historical, Historical Fiction, Novels, Literature, American, War, Unfinished, Literature, 20th Century","Nebula Award Nominee for Novel (1973), National Book Award for Fiction (1974), William Dean Howells Medal (1975), Tähtivaeltaja Award Nominee (2015), Mikael Agricola -palkinto (2015)",
https://www.goodreads.com/book/show/78433.The_Blind_Assassin,78433,The Blind Assassin,5,Margaret Atwood,3.95,139790.0,139790.0,637.0,2000.0,False,"Fiction, Historical, Historical Fiction, Mystery, Cultural, Canada, Literary Fiction, Classics, Contemporary, Literature, Science Fiction, Historical","Booker Prize (2000), Orange Prize Nominee for Fiction Shortlist (2001), Hammett Prize (2000), Puddly Award for New Novel (2001), International Dublin Literary Award Nominee for Shortlist (2002)","Canada, Toronto, Ontario, Southwest Ontario"
https://www.goodreads.com/book/show/7869.The_Bourne_Identity,7869,The Bourne Identity,1,Robert Ludlum,4.03,408905.0,408905.0,566.0,1980.0,True,"Fiction, Thriller, Mystery, Suspense, Spy Thriller, Espionage, Adventure, Action, Thriller, Mystery Thriller, Mystery, Crime, Novels",Japan Adventure Fiction Association Prize 日本冒険小説協会大賞特別賞 for Best Translated Novel (1984),"Marseille (Marseilles), Paris, Zurich, New York City, New York"
https://www.goodreads.com/book/show/10357575-1q84,10357575,1Q84,4,Haruki Murakami,3.92,215017.0,215017.0,925.0,2009.0,True,"Fiction, Fantasy, Magical Realism, Cultural, Japan, Science Fiction, Asian Literature, Japanese Literature, Contemporary, Literature, Novels, Science Fiction, Dystopia","Andrew Carnegie Medal Nominee for Fiction (2012), Premi Ictineu for Millor novel·la traduïda (2012), Goodreads Choice Award for Fiction (2011), International Dublin Literary Award Nominee for Shortlist (2013)",Tokyo
https://www.goodreads.com/book/show/38311414-house-of-sand-and-fog,38311414,House of Sand and Fog,2,Andre Dubus III,3.85,128024.0,128024.0,368.0,1999.0,False,"Fiction, Contemporary, Literary Fiction, Novels, Adult Fiction, Literature, Book Club, Drama, Adult, Suspense","Los Angeles Times Book Prize Nominee for Fiction (1999), National Book Award Finalist for Fiction (1999)",California
https://www.goodreads.com/book/show/1554.Oedipus_Rex,1554,Oedipus Rex,0,Sophocles,3.71,177115.0,177115.0,75.0,-429.0,True,"Classics, Plays, Fiction, Drama, Academic, School, Fantasy, Mythology, Academic, Read For School, Plays, Theatre, Literature, Young Adult, High School",,Greece
https://www.goodreads.com/book/show/13831.Alanna,13831,Alanna: The First Adventure,3,Tamora Pierce,4.23,122983.0,122983.0,274.0,1983.0,True,"Fantasy, Young Adult, Fiction, Adventure, Fantasy, Magic, Young Adult, Young Adult Fantasy, Childrens, Middle Grade, Fantasy, High Fantasy, Childrens, Young Adult, Teen","Preis der Leseratten des ZDF, NSK Neustadt Prize for Children's Literature Nominee (2013), Margaret A. Edwards Award (2013)",Tortall
https://www.goodreads.com/book/show/89717.The_Haunting_of_Hill_House,89717,The Haunting of Hill House,1,Shirley Jackson,3.83,181238.0,181238.0,182.0,1959.0,False,"Horror, Classics, Fiction, Gothic, Mystery, Fantasy, Paranormal, Audiobook, Thriller, Paranormal, Ghosts, Fantasy",National Book Award Finalist for Fiction (1960),United States of America
https://www.goodreads.com/book/show/13642.A_Wizard_of_Earthsea,13642,A Wizard of Earthsea,4,Ursula K. Le Guin,3.99,256134.0,256134.0,183.0,1968.0,True,"Fantasy, Fiction, Young Adult, Classics, Science Fiction Fantasy, Fantasy, Magic, Science Fiction, Fantasy, High Fantasy, Adventure, Fantasy, Dragons","Lewis Carroll Shelf Award (1979), Boston Globe-Horn Book Award for Fiction (1969), Złota Sepulka for Książka autora zagranicznego (1984), Margaret A. Edwards Award (2004)",Earthsea Realm
https://www.goodreads.com/book/show/24768.Pretties,24768,Pretties,0,Scott Westerfeld,3.84,239741.0,239741.0,370.0,2005.0,True,"Young Adult, Science Fiction, Dystopia, Science Fiction, Fiction, Fantasy, Romance, Young Adult, Teen, Adventure, Apocalyptic, Post Apocalyptic, Science Fiction Fantasy",,
