url,book_id,title,award_count,author,avg_rating,num_reviews,num_ratings,num_pages,original_publish_year,series,genres,awards,place
https://www.goodreads.com/book/show/3869.A_Brief_History_of_Time,3869,A Brief History of Time,1,Stephen Hawking,4.18,325203.0,325203.0,212.0,1988.0,False,"Science, Nonfiction, Science, Physics, History, Philosophy, Science, Astronomy, Classics, Science, Popular Science, Space, Audiobook",Royal Society Science Book Prize Nominee for General Prize (1989),
https://www.goodreads.com/book/show/196970.The_Night_Before_Christmas,196970,The Night Before Christmas,0,Clement C. Moore,4.37,113126.0,113126.0,32.0,1823.0,False,"Holiday, Christmas, Childrens, Childrens, Picture Books, Classics, Poetry, Fiction, Holiday, Fantasy, Kids, Short Stories",,
https://www.goodreads.com/book/show/18423.The_Left_Hand_of_Darkness,18423,The Left Hand of Darkness,4,Ursula K. Le Guin,4.08,128815.0,128815.0,304.0,1969.0,True,"Science Fiction, Fiction, Fantasy, Classics, Science Fiction Fantasy, Feminism, Speculative Fiction, Novels, LGBT, Gender","Hugo Award for Best Novel (1970), Nebula Award for Best Novel (1969), James Tiptree Jr. Award for Retrospective (1995), Margaret A. Edwards Award (2004)",
https://www.goodreads.com/book/show/2203.John_Adams,2203,John Adams,6,David McCullough,4.04,328504.0,328504.0,751.0,2001.0,False,"History, Biography, Nonfiction, North American Hi..., American History, Politics, Presidents, Politics, Historical, Biography Memoir, Military History, American Revolution, Audiobook","Pulitzer Prize for Biography or Autobiography (2002), Ambassador Book Award for Biography (2002), Audie Award for Nonfiction (2002), Puddly Award for Nonfiction (2002), American Revolution Round Table Award (2001), Fraunces Tavern Museum Book Award (2002)","Boston, Massachusetts, Philadelphia, Pennsylvania"
https://www.goodreads.com/book/show/18545.Rosencrantz_and_Guildenstern_Are_Dead,18545,Rosencrantz and Guildenstern Are Dead,1,Tom Stoppard,4.06,80880.0,80880.0,126.0,1966.0,False,"Plays, Drama, Fiction, Classics, Plays, Theatre, Humor, Academic, School, Literature, Academic, Read For School, Young Adult, High School",New York Drama Critics' Circle Award for Best Play (1968),
https://www.goodreads.com/book/show/304027.Lover_Unbound,304027,Lover Unbound,2,J.R. Ward,4.32,123636.0,123636.0,502.0,2007.0,True,"Fantasy, Paranormal, Romance, Romance, Paranormal Romance, Paranormal, Vampires, Fantasy, Fantasy, Urban Fantasy, Adult, Fiction, Adult Fiction, Erotica, Fantasy, Supernatural","All About Romance (AAR) Annual Reader Poll for Most Tortured Hero & Honorable Mention for Guiltiest Pleasure Romance (2008), Romantic Times Reviewers' Choice Award (RT Award) for Vampire Romance (2007)","Caldwell, New York"
https://www.goodreads.com/book/show/6853.One_for_the_Money,6853,One for the Money,6,Janet Evanovich,4.03,498420.0,498420.0,320.0,1994.0,True,"Mystery, Fiction, Humor, Womens Fiction, Chick Lit, Romance, Mystery, Crime, Thriller, Mystery Thriller, Contemporary, Adult, Audiobook","Anthony Award Nominee for Best Novel (1995), Shamus Award Nominee for Best First PI Novel (1995), Dilys Award (1995), CWA New Blood Dagger (1995), Agatha Award Nominee for Best First Novel (1994), Edgar Award Nominee for Best First Novel (1995)","Trenton, New Jersey"
https://www.goodreads.com/book/show/32423.Watchers,32423,Watchers,2,Dean Koontz,4.18,156760.0,156760.0,624.0,1987.0,False,"Horror, Fiction, Thriller, Mystery, Suspense, Science Fiction, Drama, Fantasy, Novels, Mystery, Crime","Audie Award for Best Male Narrator (2019), Japan Adventure Fiction Association Prize 日本冒険小説協会大賞特別賞 for Best Translated Novel (1993)",
https://www.goodreads.com/book/show/14290364-champion,14290364,Champion,0,Marie Lu,4.33,177373.0,177373.0,369.0,2013.0,True,"Science Fiction, Dystopia, Young Adult, Romance, Science Fiction, Fantasy, Fiction, Adventure, Action, Audiobook, Young Adult, Teen",,
https://www.goodreads.com/book/show/99300.The_Yellow_Wallpaper_and_Other_Stories,99300,The Yellow Wallpaper and Other Stories,0,Charlotte Perkins Gilman,4.04,81710.0,81710.0,70.0,1892.0,False,"Classics, Short Stories, Fiction, Feminism, Horror, Literature, Academic, School, Gothic, Health, Mental Health, Literature, 19th Century",,
https://www.goodreads.com/book/show/77197.Assassin_s_Apprentice,77197,Assassin's Apprentice,3,Robin Hobb,4.15,248944.0,248944.0,435.0,1995.0,True,"Fantasy, Fiction, Fantasy, Epic Fantasy, Fantasy, High Fantasy, Adventure, Science Fiction Fantasy, Fantasy, Magic, Adult, Young Adult, Audiobook","Locus Award Nominee for Fantasy (1996), British Fantasy Award Nominee for Best Novel (1997), Compton Crook Award (1996)) Nominee (1996)","Buckkeep, Moonseye, Neatbay, Forge, Jhaampe (Mountain Kingdom)"
https://www.goodreads.com/book/show/10965.A_Breath_of_Snow_and_Ashes,10965,A Breath of Snow and Ashes,3,Diana Gabaldon,4.42,147161.0,147161.0,993.0,2005.0,True,"Historical, Historical Fiction, Romance, Fiction, Fantasy, Science Fiction, Time Travel, Historical, Romance, Historical Romance, Audiobook, Adult, Adventure","All About Romance (AAR) Annual Reader Poll for Most-Hanky Read (tie) & Best American Historical/Frontier Romance (2006), The Quill Award for Science fiction/fantasy/horror (2006), Corine Internationaler Buchpreis for Weltbild Leserpreis (2006)","United States of America, North Carolina, North Carolina, North Carolina, North Carolina"
https://www.goodreads.com/book/show/10967.The_Fiery_Cross,,,0,,,,,,,False,,,
https://www.goodreads.com/book/show/17212231-inferno,17212231,Inferno,1,Dan Brown,3.86,488748.0,488748.0,463.0,2013.0,True,"Fiction, Thriller, Mystery, Thriller, Mystery Thriller, Suspense, Historical, Historical Fiction, Adventure, Novels, Mystery, Crime, Adult",Goodreads Choice Award for Mystery & Thriller (2013),"Istanbul, Florence, Venice"
https://www.goodreads.com/book/show/46756.Oryx_and_Crake,46756,Oryx and Crake,5,Margaret Atwood,4.01,231322.0,231322.0,389.0,2003.0,True,"Fiction, Science Fiction, Science Fiction, Dystopia, Apocalyptic, Post Apocalyptic, Fantasy, Cultural, Canada, Speculative Fiction, Science Fiction Fantasy, Audiobook, Novels","Booker Prize Nominee (2003), Orange Prize Nominee for Fiction Shortlist (2004), Sunburst Award Nominee for Canadian Novel (2004), Scotiabank Giller Prize Nominee (2003), Grand Prix de l'Imaginaire Nominee for Roman étranger (2006)",
https://www.goodreads.com/book/show/21853621-the-nightingale,21853621,The Nightingale,3,Kristin Hannah,4.57,778449.0,778449.0,440.0,2015.0,False,"Historical, Historical Fiction, Fiction, Historical, War, World War II, War, Audiobook, Adult, Cultural, France, Romance, Adult Fiction","Audie Award for Fiction (2016), Goodreads Choice Award for Historical Fiction (2015) and Nominee for Best of the Best  (2018), International Dublin Literary Award Nominee (2017)","Paris, Loire Valley, Pyrenees, Oregon Coast, Carriveau, Portland, Oregon, Ravensbrück, Paris"
https://www.goodreads.com/book/show/16286.The_Magus,16286,The Magus,0,John Fowles,4.06,49414.0,49414.0,656.0,1965.0,False,"Fiction, Classics, Fantasy, Mystery, Literature, Novels, Literary Fiction, Cultural, Greece, European Literature, British Literature, Contemporary",,"Greece, London, England"
https://www.goodreads.com/book/show/32075671-the-hate-u-give,32075671,The Hate U Give,19,Angie Thomas,4.51,570419.0,570419.0,444.0,2017.0,True,"Young Adult, Fiction, Contemporary, Audiobook, Realistic Fiction, Race, Social Movements, Social Justice, Young Adult, Teen, Young Adult, Young Adult Contemporary, Cultural, African American","National Book Award Nominee for Young People's Literature (2017), Odyssey Award (2018), William C. Morris YA Debut Award (2018), Los Angeles Times Book Prize Nominee for Young Adult Literature (2017), Edgar Award Nominee for Best Young Adult (2018), Michael L. Printz Award Nominee (2018), Rhode Island Teen Book Award (2019), Evergreen Teen Book Award Nominee for High School (2020), Coretta Scott King Book Award Nominee for Author Honor (2018), Deutscher Jugendliteraturpreis for Preis der Jugendjury (2018), Amelia Elizabeth Walden Award (2018), Boston Globe-Horn Book Award for Fiction (2017), Lincoln Award (2019), Waterstones Children's Book Prize for Overall and Older Fiction (2018), Kirkus Prize Nominee for Young Readers' Literature (2017), Goodreads Choice Award for Young Adult Fiction & for Debut Goodreads Author (2017) and for Best of the Best  (2018), Carnegie Medal Nominee (2018), NAACP Image Award Nominee for Youth/Teens (2018), Blogistanian Kuopus (2017)","United States of America, Garden Heights"
https://www.goodreads.com/book/show/6262365-tempted,6262365,Tempted,1,P.C. Cast,3.94,156797.0,156797.0,319.0,2009.0,True,"Young Adult, Paranormal, Vampires, Fantasy, Fantasy, Paranormal, Romance, Fantasy, Supernatural, Fiction, Romance, Paranormal Romance, Fantasy, Urban Fantasy, Fantasy, Magic",Romantic Times Reviewers' Choice Award (RT Award) Nominee for Best Young Adult Paranormal/Fantasy Novel (2009),"United States of America, Tulsa, Oklahoma"
https://www.goodreads.com/book/show/3980.From_the_Mixed_Up_Files_of_Mrs_Basil_E_Frankweiler,3980,From the Mixed-Up Files of Mrs. Basil E. Frankweiler,4,E.L. Konigsburg,4.14,195142.0,195142.0,178.0,1967.0,False,"Fiction, Childrens, Young Adult, Childrens, Middle Grade, Mystery, Classics, Realistic Fiction, Adventure, Childrens, Juvenile, Academic, School","Newbery Medal (1968), Lewis Carroll Shelf Award (1968), Dorothy Canfield Fisher Children's Book Award Nominee (1969), William Allen White Children's Book Award (1970)","New York City, New York, Connecticut"
https://www.goodreads.com/book/show/47989.Night_Watch,47989,Night Watch,3,Terry Pratchett,4.47,99225.0,99225.0,480.0,2002.0,True,"Fantasy, Fiction, Humor, Humor, Comedy, Science Fiction, Time Travel, Science Fiction Fantasy, Audiobook, Science Fiction, Novels, Fantasy, High Fantasy","Locus Award Nominee for Best Fantasy Novel (2003), Prometheus Award for Best Novel (2003), Tähtifantasia Award Nominee (2011)","Ankh-Morpork, Discworld"
https://www.goodreads.com/book/show/1431.Veronika_Decides_to_Die,1431,Veronika Decides to Die,0,Paulo Coelho,3.71,182852.0,182852.0,210.0,1998.0,True,"Fiction, Contemporary, Philosophy, Novels, Psychology, Romance, Drama, Health, Mental Health, Literature, Spirituality",,Ljubljana
https://www.goodreads.com/book/show/29588376-the-lies-of-locke-lamora,29588376,The Lies of Locke Lamora,6,Scott Lynch,4.26,240845.0,240845.0,752.0,2006.0,True,"Fantasy, Fiction, Adventure, Adult, Fantasy, High Fantasy, Fantasy, Epic Fantasy, Audiobook, Science Fiction Fantasy, Mystery, Mystery, Crime","Locus Award Nominee for Best Fantasy Novel and Best First Novel (2007), World Fantasy Award Nominee for Best Novel (2007), Compton Crook Award Nominee (2007), Grand Prix de l'Imaginaire Nominee for Roman étranger (2008), Tähtifantasia Award Nominee (2008), British Fantasy Award Nominee for Best Novel (2007)",Camorr
https://www.goodreads.com/book/show/1582996.City_of_Ashes,1582996,City of Ashes,2,Cassandra Clare,4.15,789671.0,789671.0,453.0,2008.0,True,"Fantasy, Young Adult, Fantasy, Paranormal, Romance, Fantasy, Urban Fantasy, Paranormal, Vampires, Fiction, Fantasy, Supernatural, Paranormal, Angels, Fantasy, Magic","Gaylactic Spectrum Award Nominee for Best Novel (2009), Premio El Templo de las Mil Puertas Nominee for Mejor novela extranjera perteneciente a saga (2009)","New York City, New York"
https://www.goodreads.com/book/show/852470.I_d_Tell_You_I_Love_You_But_Then_I_d_Have_to_Kill_You,852470,"I'd Tell You I Love You, But Then I'd Have to Kill You",2,Ally Carter,3.82,180441.0,180441.0,284.0,2006.0,True,"Young Adult, Romance, Mystery, Contemporary, Fiction, Spy Thriller, Espionage, Womens Fiction, Chick Lit, Adventure, Young Adult, Teen, Realistic Fiction","Georgia Peach Book Award Nominee for Honor book (2007), Lincoln Award Nominee (2010)","Roseville, Virginia"
https://www.goodreads.com/book/show/4953.A_Heartbreaking_Work_of_Staggering_Genius,4953,A Heartbreaking Work of Staggering Genius,4,Dave Eggers,3.68,176393.0,176393.0,485.0,2000.0,False,"Fiction, Contemporary, Literature, Novels, Humor, Biography Memoir, Literature, American, Unfinished, Adult, Literary Fiction","Pulitzer Prize Nominee for General Nonfiction (2001), Guardian First Book Award Nominee (2000), Borders Original Voices Award for Nonfiction (2000), Puddly Award for Memoir (2001)",
https://www.goodreads.com/book/show/2052.The_Big_Sleep,2052,The Big Sleep,2,Raymond Chandler,3.96,135454.0,135454.0,231.0,1939.0,True,"Mystery, Fiction, Classics, Mystery, Crime, Mystery, Noir, Mystery, Detective, Thriller, Mystery Thriller, Thriller, Novels, Literature, American","Anthony Award Nominee for Best Novel of the Century (2000), CWA Best Ever Nominee for Crime Novel (2013)","Los Angeles, California, California"
https://www.goodreads.com/book/show/452306.The_Sisterhood_of_the_Traveling_Pants,452306,The Sisterhood of the Traveling Pants,12,Ann Brashares,3.8,641939.0,641939.0,294.0,2001.0,True,"Young Adult, Fiction, Womens Fiction, Chick Lit, Contemporary, Romance, Young Adult, Teen, Realistic Fiction, Childrens, Young Adult, Coming Of Age, Young Adult, Young Adult Contemporary","Book Sense Book of the Year Award for Children's Literature (2002), South Carolina Book Award Nominee for Young Adult Book Award (2004), Maryland Black-Eyed Susan Book Award for High School (2003), Rhode Island Teen Book Award (2002), Evergreen Teen Book Award (2004), Pacific Northwest Library Association Young Reader's Choice Award for Senior (2004), Deutscher Jugendliteraturpreis Nominee for Preis der Jugendjury (2003), Iowa Teen Award (2004), Eliot Rosewater Indiana High School Book Award (2004), Lincoln Award Nominee (2007), Missouri Gateway Readers Award (2004), Oklahoma Sequoyah Award for YA (2004)","Santorini, South Carolina, Bethesda, Maryland, Loreto, Baja California Sur"
https://www.goodreads.com/book/show/8682.Jitterbug_Perfume,8682,Jitterbug Perfume,0,Tom Robbins,4.21,71659.0,71659.0,342.0,1984.0,False,"Fiction, Fantasy, Humor, Magical Realism, Literature, Novels, Contemporary, Literature, American, Classics, Literary Fiction",,
https://www.goodreads.com/book/show/14249.Prodigal_Summer,14249,Prodigal Summer,0,Barbara Kingsolver,4.0,101536.0,101536.0,444.0,2000.0,False,"Fiction, Contemporary, Environment, Nature, Novels, Literary Fiction, Adult Fiction, Adult, Literature, Environment, Audiobook",,"Egg Fork, Zebulon County, Kentucky, Kentucky, Appalachia"
https://www.goodreads.com/book/show/3388.Corelli_s_Mandolin,3388,Corelli's Mandolin,1,Louis de Bernières,3.99,78807.0,78807.0,437.0,1994.0,False,"Fiction, Historical, Historical Fiction, Romance, Classics, War, Historical, Cultural, Greece, War, World War II, Novels, Literature",Commonwealth Writers' Prize for Best Book Overall (1995),"Cephallonia, Greece"
https://www.goodreads.com/book/show/30346601-brainwalker,30346601,Brainwalker,0,Robyn Mundell,4.36,21695.0,21695.0,,2016.0,False,"Fantasy, Young Adult, Childrens, Childrens, Middle Grade, Adventure, Science Fiction Fantasy, Young Adult, Young Adult Fantasy, Fiction, Drama, New Adult",,
https://www.goodreads.com/book/show/6882.Papillon,6882,Papillon,0,Henri Charrière,4.21,59953.0,59953.0,544.0,1969.0,True,"Nonfiction, Biography, Classics, Adventure, Autobiography, Memoir, Biography, Autobiography, Cultural, France, History, Mystery, Crime, Biography Memoir",,"Devil's Island, French Guiana, Paris"
https://www.goodreads.com/book/show/88077.The_Magic_Mountain,88077,The Magic Mountain,1,Thomas Mann,4.09,40710.0,40710.0,706.0,1924.0,False,"Fiction, Classics, European Literature, German Literature, Literature, Philosophy, Novels, Cultural, Germany, Literature, 20th Century, Literary Fiction, Nobel Prize",Helen and Kurt Wolff Translator's Prize for John E. Woods (1996),"Switzerland, Italy, Davos, Hamburg"
https://www.goodreads.com/book/show/323355.The_Book_of_Mormon,323355,The Book of Mormon: Another Testament of Jesus Christ,0,Anonymous,4.32,77521.0,77521.0,531.0,1830.0,False,"Religion, Nonfiction, Christianity, Lds, Religion, Church, Spirituality, History, Classics, Inspirational, Reference, Christian",,
https://www.goodreads.com/book/show/6295.Howl_and_Other_Poems,6295,Howl and Other Poems,0,Allen Ginsberg,4.12,97260.0,97260.0,56.0,1956.0,False,"Poetry, Classics, Fiction, Literature, American, Literature, LGBT, Literature, 20th Century, GLBT, Queer, Literature, Banned Books, Academic, School",,United States of America
https://www.goodreads.com/book/show/32768522-carry-on,32768522,Carry On,3,Rainbow Rowell,4.21,230357.0,230357.0,522.0,2015.0,True,"Fantasy, Young Adult, LGBT, Romance, Fiction, Fantasy, Magic, GLBT, Queer, Paranormal, Vampires, Audiobook, Young Adult, Young Adult Fantasy","Milwaukee County Teen Book Award Nominee (2017), Goodreads Choice Award Nominee for Young Adult Fantasy & Science Fiction (2015), Premio El Templo de las Mil Puertas Nominee for Mejor novela extranjera independiente (2016)",
https://www.goodreads.com/book/show/6969.Emma,6969,Emma,0,Jane Austen,4.02,687353.0,687353.0,474.0,1815.0,False,"Classics, Fiction, Romance, Historical, Historical Fiction, Literature, Historical, Literature, 19th Century, Audiobook, Classics, Classic Literature, Novels",,"Surrey, England"
https://www.goodreads.com/book/show/2967752-the-elegance-of-the-hedgehog,2967752,The Elegance of the Hedgehog,6,Muriel Barbery,3.78,157023.0,157023.0,325.0,2006.0,False,"Fiction, Cultural, France, Contemporary, Philosophy, Book Club, Literary Fiction, Novels, Literature, Adult Fiction, Adult","BTBA Best Translated Book Award Nominee for Fiction Longlist (2009), Prix des Libraires (2007), Brive-La-Gaillarde Readers Prize (2007), French-American Foundation Translation Prize Nominee for Fiction (2008), Prix Georges Brassens (2006), International Dublin Literary Award Nominee for Shortlist (2010)",France
https://www.goodreads.com/book/show/15749186-to-all-the-boys-i-ve-loved-before,15749186,To All the Boys I've Loved Before,3,Jenny Han,4.14,552597.0,552597.0,355.0,2014.0,True,"Young Adult, Romance, Contemporary, Fiction, Audiobook, Womens Fiction, Chick Lit, Realistic Fiction, Young Adult, Young Adult Contemporary, Young Adult, Young Adult Romance, Young Adult, High School","Pennsylvania Young Readers' Choice Award Nominee for Young Adults (2016), Lincoln Award Nominee (2018), Goodreads Choice Award Nominee for Young Adult Fiction (2014)","Charlottesville, Virginia"
https://www.goodreads.com/book/show/4982.The_Sirens_of_Titan,4982,The Sirens of Titan,2,Kurt Vonnegut Jr.,4.14,120742.0,120742.0,224.0,1959.0,False,"Science Fiction, Fiction, Classics, Humor, Novels, Literature, Fantasy, Science Fiction Fantasy, Literature, American, Literature, 20th Century","Hugo Award Nominee for Best Novel (1960), Seiun Award 星雲賞 for Best Foreign Novel (1973)","Indianapolis, Indiana, Newport, Rhode Island"
https://www.goodreads.com/book/show/76401.Bury_My_Heart_at_Wounded_Knee,76401,Bury My Heart at Wounded Knee: An Indian History of the American West,0,Dee Brown,4.19,73218.0,73218.0,509.0,1970.0,False,"History, Nonfiction, North American Hi..., American History, Classics, Historical, War, Politics, Race, Native Americans, Westerns",,
https://www.goodreads.com/book/show/33507.Twenty_Thousand_Leagues_Under_the_Sea,33507,Twenty Thousand Leagues Under the Sea,0,Jules Verne,3.89,208689.0,208689.0,394.0,1869.0,True,"Classics, Science Fiction, Fiction, Adventure, Fantasy, Cultural, France, Literature, Science Fiction, Steampunk, Novels, European Literature, French Literature",,"Antarctica, Bahamas, Indian Ocean, Pacific Ocean, Atlantis, Red Sea, Mediterranean Sea"
