url,book_id,title,award_count,author,avg_rating,num_reviews,num_ratings,num_pages,original_publish_year,series,genres,awards,place
https://www.goodreads.com/book/show/14241.The_Liars_Club,14241,The Liars' Club,2,Mary Karr,3.93,61125.0,61125.0,320.0,1995.0,False,"Autobiography, Memoir, Nonfiction, Biography, Biography Memoir, Biography, Autobiography, Young Adult, Coming Of Age, Book Club, Womens, American, Southern, Adult","PEN/Martha Albrand Award for First Nonfiction Writers (1996), National Book Critics Circle Award Nominee for Biography/Autobiography (1995)",
https://www.goodreads.com/book/show/7770715-by-midnight,7770715,By Midnight,0,Mia James,3.59,2233.0,2233.0,436.0,2010.0,True,"Young Adult, Fantasy, Paranormal, Fantasy, Romance, Mystery, Paranormal, Vampires, Romance, Paranormal Romance, Fantasy, Urban Fantasy, Fiction, Fantasy, Supernatural",,"Highgate, London, England"
https://www.goodreads.com/book/show/10114.Helen_of_Troy,10114,Helen of Troy,0,Margaret George,3.93,10224.0,10224.0,611.0,2006.0,False,"Historical, Historical Fiction, Fiction, Fantasy, Mythology, Historical, Romance, Mythology, Greek Mythology, Fantasy, Cultural, Greece, War, Adult",,Greece
https://www.goodreads.com/book/show/7124475-endless-summer,7124475,Endless Summer,0,Jennifer Echols,4.01,19811.0,19811.0,587.0,2010.0,True,"Young Adult, Romance, Contemporary, Womens Fiction, Chick Lit, Young Adult, Young Adult Romance, Young Adult, High School, Realistic Fiction, Fiction, Romance, Contemporary Romance, Young Adult, Young Adult Contemporary",,
https://www.goodreads.com/book/show/51985.Existentialism_is_a_Humanism,51985,Existentialism is a Humanism,0,Jean-Paul Sartre,3.98,25780.0,25780.0,108.0,1946.0,False,"Philosophy, Nonfiction, Cultural, France, Classics, Writing, Essays, European Literature, French Literature, Philosophy, Theory, Literature, 20th Century, Academic, School, Nobel Prize",,
https://www.goodreads.com/book/show/65397.Plantation,65397,Plantation,0,Dorothea Benton Frank,4.18,11462.0,11462.0,449.0,2001.0,True,"Fiction, Womens Fiction, Chick Lit, American, Southern, Romance, Contemporary, Adult, Womens Fiction, Drama, Family, Relationships",,"Tall Plains, South Carolina"
https://www.goodreads.com/book/show/624641.The_Dreamers,624641,The Dreamers,1,Gilbert Adair,3.56,2513.0,2513.0,208.0,1988.0,False,"Fiction, Historical, Historical Fiction, LGBT, Contemporary, Cultural, France, Literature, 20th Century, European Literature, British Literature, Literature, Novels, Historical",Authors' Club Best First Novel Award (1988),Paris
https://www.goodreads.com/book/show/17316075-second-chance-boyfriend,17316075,Second Chance Boyfriend,0,Monica  Murphy,4.05,35113.0,35113.0,210.0,2013.0,True,"New Adult, Romance, Contemporary, Romance, Contemporary Romance, Academic, College, Sports, Sports, Young Adult, Sociology, Abuse, Adult, Adult Fiction, Erotica",,California
https://www.goodreads.com/book/show/69413.La_Regenta,69413,La Regenta,0,Leopoldo Alas,4.0,3361.0,3361.0,1024.0,1884.0,False,"Classics, European Literature, Spanish Literature, Fiction, Cultural, Spain, Literature, 19th Century, Novels, Drama, Literature, Historical, Historical Fiction, Romance",,Vetusta
https://www.goodreads.com/book/show/4601396-pygmy,4601396,Pygmy,1,Chuck Palahniuk,2.97,27388.0,27388.0,255.0,2009.0,False,"Fiction, Contemporary, Humor, Novels, Literature, Literature, American, Unfinished, Suspense, Humor, Comedy, Adult Fiction",Goodreads Choice Award Nominee for Fiction (2009),
https://www.goodreads.com/book/show/8928054-shine,8928054,Shine,5,Lauren Myracle,3.83,12711.0,12711.0,350.0,2011.0,False,"Young Adult, Mystery, Fiction, Realistic Fiction, LGBT, Contemporary, Young Adult, Teen, Young Adult, Coming Of Age, Mystery, Crime, Sociology, Abuse","Milwaukee County Teen Book Award (2012), Amelia Elizabeth Walden Award (2012), James Cook Book Award Nominee (2013), Goodreads Choice Award Nominee for Young Adult Fiction (2011), Missouri Gateway Readers Award Nominee (2014)",North Carolina
https://www.goodreads.com/book/show/18149630-peter,18149630,Peter: The Untold True Story,0,Christopher Daniel Mechling,3.77,379.0,379.0,220.0,2013.0,False,"Historical, Historical Fiction, Fantasy, Young Adult, Fiction, Historical, Retellings, Fantasy, Fairy Tales, Adventure, Adult, Historical Fiction, Historical Fantasy",,"London, England, Hamelin, Hanover, Berkhamsted, England, Norfolk, England, St. James Palace, London, England, Kensington Palace, London, England, Herrenhausen Palace, Hanover, Leicester House, England, Whitehall, England, Richmond Park, Kensington Gardens"
https://www.goodreads.com/book/show/6646071-flowers-from-the-storm,6646071,Flowers from the Storm,1,Laura Kinsale,4.09,13807.0,13807.0,565.0,1992.0,False,"Romance, Historical Romance, Romance, Historical, Historical, Historical Fiction, Historical, Regency, Fiction, Adult, Audiobook, Disability, Historical Romance, Regency Romance",Romance Readers Anonymous (RRA) Award (1996),"London, England, Wales"
https://www.goodreads.com/book/show/40192811-where-one-goes,40192811,Where One Goes,0,B.N. Toler,4.42,8664.0,8664.0,269.0,2015.0,True,"Romance, Fantasy, Paranormal, New Adult, Contemporary, Romance, Contemporary Romance, Romance, Paranormal Romance, Fantasy, Paranormal, Ghosts, War, Military Fiction, Humor",,
https://www.goodreads.com/book/show/25852870-eligible,25852870,Eligible: A Modern Retelling of Pride & Prejudice,1,Curtis Sittenfeld,3.61,80353.0,80353.0,492.0,2016.0,True,"Fiction, Romance, Womens Fiction, Chick Lit, Contemporary, Retellings, Audiobook, Adult, Adult Fiction, Humor, Romance, Contemporary Romance",Goodreads Choice Award Nominee for Fiction (2016),"Cincinnati, Ohio, New York City, New York"
https://www.goodreads.com/book/show/400723.Archy_and_Mehitabel,400723,Archy and Mehitabel,0,Don Marquis,4.26,1457.0,1457.0,192.0,1927.0,False,"Poetry, Humor, Fiction, Classics, Humor, Comedy, Literature, Animals, Childrens, Philosophy, Animals, Cats",,United States of America
https://www.goodreads.com/book/show/326911.Warriors,326911,Warriors: Secrets of the Clans,0,Erin Hunter,4.18,9136.0,9136.0,168.0,2007.0,True,"Fantasy, Animals, Fiction, Childrens, Childrens, Middle Grade, Animals, Cats, Young Adult, Animals, Animal Fiction, Reference, Guides, Adventure",,
https://www.goodreads.com/book/show/6768411-mistwood,6768411,Mistwood,0,Leah Cypess,3.52,6606.0,6606.0,304.0,2009.0,True,"Fantasy, Young Adult, Fantasy, Magic, Fantasy, Paranormal, Romance, Young Adult, Young Adult Fantasy, Paranormal, Shapeshifters, Young Adult, Teen, Fantasy, High Fantasy, Mystery",,
https://www.goodreads.com/book/show/568454.D_Gray_man_Vol_1,568454,"D.Gray-man, Vol. 1",0,Katsura Hoshino,4.2,27913.0,27913.0,196.0,2004.0,True,"Sequential Art, Manga, Fantasy, Sequential Art, Graphic Novels, Sequential Art, Comics, Manga, Shonen, Horror, Young Adult, Fantasy, Supernatural, Action, Comics Manga",,
https://www.goodreads.com/book/show/6641799-the-long-way-home,6641799,The Long Way Home,0,Andrew Klavan,4.26,3169.0,3169.0,345.0,2009.0,True,"Young Adult, Mystery, Thriller, Fiction, Adventure, Christian, Christian Fiction, Action, Suspense, Contemporary",,
https://www.goodreads.com/book/show/11746513-explosive-eighteen,11746513,Explosive Eighteen,0,Janet Evanovich,3.95,71201.0,71201.0,305.0,2011.0,True,"Mystery, Fiction, Humor, Womens Fiction, Chick Lit, Romance, Mystery, Crime, Audiobook, Humor, Comedy, Adult, Thriller, Mystery Thriller",,"Trenton, New Jersey"
https://www.goodreads.com/book/show/189802.Belgarath_the_Sorcerer,189802,Belgarath the Sorcerer,0,David Eddings,4.07,75587.0,75587.0,736.0,1995.0,False,"Fantasy, Fiction, Young Adult, Fantasy, Epic Fantasy, Science Fiction Fantasy, Fantasy, High Fantasy, Childrens, Adventure, Childrens, Middle Grade, Fantasy, Magic",,
https://www.goodreads.com/book/show/112292.Dauntless,112292,Dauntless,0,Jack Campbell,3.96,28239.0,28239.0,293.0,2006.0,True,"Science Fiction, Space, Space Opera, Fiction, War, Military Fiction, Science Fiction, Military Science Fiction, Space, War, Audiobook, Science Fiction Fantasy, Fantasy",,Space
https://www.goodreads.com/book/show/99152.Life_on_the_Mississippi,99152,Life on the Mississippi,0,Mark Twain,3.87,13194.0,13194.0,384.0,1883.0,False,"Classics, Nonfiction, History, Travel, Biography, Autobiography, Memoir, Literature, Humor, Literature, American, Biography, Autobiography",,"United States of America, Mississippi River"
https://www.goodreads.com/book/show/289787.Danzig_Passage,289787,Danzig Passage,0,Bodie Thoene,4.41,4541.0,4541.0,464.0,1991.0,True,"Historical, Historical Fiction, Christian Fiction, Fiction, Christian, Historical, War, World War II, Romance, World War II, Holocaust, Adult Fiction, Religion",,
https://www.goodreads.com/book/show/16119044-the-maleficent-seven,16119044,The Maleficent Seven: From the World of Skulduggery Pleasant,0,Derek Landy,4.35,5629.0,5629.0,288.0,2013.0,True,"Fantasy, Young Adult, Fantasy, Urban Fantasy, Fiction, Fantasy, Magic, Adventure, Action, Fantasy, Paranormal, Mystery, Short Stories",,
https://www.goodreads.com/book/show/1319.The_War_of_Art,1319,The War of Art: Winning the Inner Creative Battle,0,Steven Pressfield,4.0,78864.0,78864.0,168.0,2002.0,False,"Nonfiction, Language, Writing, Self Help, Art, Business, Self Help, Personal Development, Psychology, Productivity, Philosophy, Design",,
https://www.goodreads.com/book/show/16279856-the-eye-of-minds,16279856,The Eye of Minds,0,James Dashner,3.85,36284.0,36284.0,308.0,2013.0,True,"Young Adult, Science Fiction, Science Fiction, Dystopia, Fantasy, Fiction, Adventure, Young Adult, Teen, Mystery, Action, Thriller",,
https://www.goodreads.com/book/show/20649134-chase-the-darkness,20649134,Chase the Darkness,0,J.D. Tyler,4.09,1169.0,1169.0,257.0,2015.0,True,"Fantasy, Paranormal, Romance, Paranormal Romance, Paranormal, Shapeshifters, Romance, War, Military Fiction, Fantasy, Urban Fantasy, Paranormal, Vampires, Fantasy, Audiobook, Fantasy, Magic",,
https://www.goodreads.com/book/show/920330.Blackbird,920330,Blackbird: A Childhood Lost and Found,0,Jennifer Lauck,4.05,8359.0,8359.0,432.0,2000.0,False,"Autobiography, Memoir, Nonfiction, Biography, Biography Memoir, Biography, Autobiography, Childrens, Young Adult, Coming Of Age, Family, Womens, True Story",,
https://www.goodreads.com/book/show/34037113-the-rules-of-magic,34037113,The Rules of Magic,1,Alice Hoffman,3.97,76687.0,76687.0,369.0,2017.0,True,"Fantasy, Fiction, Historical, Historical Fiction, Magical Realism, Paranormal, Witches, Fantasy, Magic, Audiobook, Fantasy, Paranormal, Romance, Adult",Mythopoeic Fantasy Award Nominee for Adult Literature (2018),"Massachusetts, New York City, New York, Paris"
https://www.goodreads.com/book/show/25614994-fight-club-2,25614994,Fight Club 2,1,Chuck Palahniuk,3.06,7533.0,7533.0,256.0,2015.0,True,"Sequential Art, Graphic Novels, Sequential Art, Comics, Fiction, Graphic Novels Comics, Comics, Comic Book, Thriller, Mystery, Crime, Fantasy, Humor, Comics Manga",Will Eisner Comic Industry Awards Nominee for Best Cover Artist (for multiple covers) (for David Mack) (2017),
https://www.goodreads.com/book/show/225383.Everything_She_Ever_Wanted,225383,Everything She Ever Wanted,2,Ann Rule,4.02,6873.0,6873.0,560.0,1992.0,False,"Crime, True Crime, Nonfiction, Mystery, Crime, Mystery, True Story, History, Biography, Audiobook, Thriller, Adult","Anthony Award Nominee for Best True Crime (1993), Edgar Award Nominee for Best Fact Crime (1993)",
https://www.goodreads.com/book/show/56829.Hackers,56829,Hackers: Heroes of the Computer Revolution,0,Steven Levy,4.15,7291.0,7291.0,464.0,1984.0,False,"Nonfiction, History, Science, Technology, Computer Science, Computers, Science, Computer Science, Science, Computer Science, Programming, Biography, Computers, Hackers, Business",,
https://www.goodreads.com/book/show/431221.Skallagrigg,431221,Skallagrigg,0,William Horwood,4.52,769.0,769.0,728.0,1987.0,False,"Fiction, Fantasy, Disability, Young Adult, Adult Fiction, Science Fiction, European Literature, British Literature, Contemporary, Historical, Historical Fiction",,
https://www.goodreads.com/book/show/31426.The_Collected_Poems,31426,The Collected Poems,1,Sylvia Plath,4.19,35691.0,35691.0,349.0,1981.0,False,"Poetry, Classics, Fiction, Literature, Literature, American, Feminism, Literature, 20th Century, Health, Mental Health, Mental Health, Mental Illness, Female Authors",Pulitzer Prize for Poetry (1982),
https://www.goodreads.com/book/show/3224378-frozen-fire,3224378,Frozen Fire,7,Tim Bowler,3.63,3443.0,3443.0,328.0,2006.0,False,"Young Adult, Mystery, Fantasy, Fantasy, Paranormal, Fiction, Thriller, Fantasy, Supernatural, Horror, Suspense, Contemporary","Stockport Schools' Book Award, North East Teenage Book Award Nominee (2007), Highland Children's Book Award, Hull Children's Book Award, Redbridge Children's Book Award for Teenage Book (2007), South Lanarkshire Children's Book Award, Carnegie Medal Nominee (2008)",
https://www.goodreads.com/book/show/8719.Julian,8719,Julian,0,Gore Vidal,4.2,6297.0,6297.0,528.0,1964.0,False,"Historical, Historical Fiction, Fiction, Historical, Literature, Religion, Novels, Cultural, Italy, Roman, Literature, American, Classics",,Roman Empire
https://www.goodreads.com/book/show/2795053-the-umbrella-academy-vol-1,2795053,"The Umbrella Academy, Vol. 1: The Apocalypse Suite",2,Gerard Way,3.85,45971.0,45971.0,184.0,2007.0,True,"Sequential Art, Graphic Novels, Sequential Art, Comics, Fantasy, Fiction, Graphic Novels Comics, Science Fiction, Comics, Superheroes, Comics, Comic Book, Adult, Science Fiction, Time Travel","Harvey Awards for Best New Series (2008), Will Eisner Comic Industry Awards for Best  Limited Series (2008)",
https://www.goodreads.com/book/show/8315340-twilight-s-dawn,8315340,Twilight's Dawn,1,Anne Bishop,4.28,9091.0,9091.0,435.0,2011.0,True,"Fantasy, Romance, Fiction, Fantasy, Dark Fantasy, Fantasy, Magic, Paranormal, Witches, Science Fiction Fantasy, Fantasy, High Fantasy, Short Stories, Fantasy, Paranormal",Goodreads Choice Award Nominee for Fantasy (2011),
https://www.goodreads.com/book/show/793003.Broken,793003,Broken,0,Megan Hart,3.92,9589.0,9589.0,384.0,2007.0,False,"Romance, Adult Fiction, Erotica, Contemporary, Romance, Contemporary Romance, Romance, Erotic Romance, Adult, Fiction, Womens Fiction, Chick Lit, Romance, M F Romance, Dark",,
https://www.goodreads.com/book/show/16121427-elfin,16121427,Elfin,0,Quinn Loftis,4.1,8430.0,8430.0,389.0,2012.0,True,"Fantasy, Young Adult, Romance, Fantasy, Paranormal, Fairies, Fae, Romance, Paranormal Romance, Fantasy, Magic, Fantasy, Elves, Fantasy, Supernatural, Paranormal, Fairies",,
https://www.goodreads.com/book/show/4652.In_Our_Time,4652,In Our Time,0,Ernest Hemingway,3.78,19822.0,19822.0,156.0,1925.0,False,"Fiction, Classics, Short Stories, Literature, Literature, American, Academic, School, Literature, 20th Century, Academic, Read For School, Academic, College, Literary Fiction",,
https://www.goodreads.com/book/show/16043804-the-crown-tower,16043804,The Crown Tower,1,Michael J. Sullivan,4.33,31623.0,31623.0,384.0,2013.0,True,"Fantasy, Fiction, Fantasy, Epic Fantasy, Adventure, Fantasy, High Fantasy, Audiobook, Adult, Science Fiction Fantasy, Epic, Action",Goodreads Choice Award Nominee for Fantasy (2013),
https://www.goodreads.com/book/show/23711387-the-bad-girl-and-the-good-boy,23711387,The Bad Girl and the Good Boy,0,Karla Luna,4.17,606.0,606.0,,2014.0,False,"Young Adult, New Adult, Romance, Romance, Contemporary Romance, Humor",,
https://www.goodreads.com/book/show/18392495-the-boy-most-likely-to,18392495,The Boy Most Likely To,0,Huntley Fitzpatrick,3.78,14392.0,14392.0,,2015.0,False,"Young Adult, Contemporary, Romance, Realistic Fiction, Young Adult, Young Adult Contemporary, Fiction, Romance, Contemporary Romance, New Adult, Young Adult, Young Adult Romance, Audiobook",,
https://www.goodreads.com/book/show/38926487-all-your-perfects,38926487,All Your Perfects,1,Colleen Hoover,4.29,70913.0,70913.0,305.0,2018.0,False,"Romance, Contemporary, New Adult, Fiction, Romance, Contemporary Romance, Adult, Audiobook, Womens Fiction, Chick Lit, Adult Fiction, Drama",Goodreads Choice Award Nominee for Romance (2018),
https://www.goodreads.com/book/show/18373.Flowers_for_Algernon,18373,Flowers for Algernon,3,Daniel Keyes,4.15,505722.0,505722.0,311.0,1959.0,False,"Fiction, Classics, Science Fiction, Young Adult, Literature, Psychology, Academic, School, Novels, Adult, Academic, Read For School","Hugo Award Nominee for Best Novel (1967), Nebula Award for Best Novel (tie) (1966), Locus Award Nominee for All-Time Best Novel (36th in poll) (1975)","New York City, New York, New York State, United States of America"
https://www.goodreads.com/book/show/16180.The_Boleyn_Inheritance,16180,The Boleyn Inheritance,1,Philippa Gregory,3.88,84412.0,84412.0,518.0,2006.0,True,"Historical, Historical Fiction, Fiction, Historical, Romance, English History, Tudor Period, European Literature, British Literature, Adult, Romance, Historical Romance, Adult Fiction, Womens Fiction, Chick Lit",Romantic Times Reviewers' Choice Award (RT Award) for Best Historical Fiction (2006),England
https://www.goodreads.com/book/show/493123.Silver_Is_for_Secrets,493123,Silver Is for Secrets,0,Laurie Faria Stolarz,4.08,9884.0,9884.0,277.0,2005.0,True,"Young Adult, Fantasy, Fantasy, Paranormal, Fantasy, Magic, Paranormal, Witches, Mystery, Fiction, Romance, Young Adult, Teen, Fantasy, Supernatural",,
https://www.goodreads.com/book/show/216408.The_True_Story_of_Hansel_and_Gretel,216408,The True Story of Hansel and Gretel,0,Louise Murphy,4.04,12017.0,12017.0,320.0,2003.0,False,"Historical, Historical Fiction, Fiction, World War II, Holocaust, War, World War II, Historical, War, Fantasy, Fairy Tales, Cultural, Poland, Young Adult, Retellings",,
https://www.goodreads.com/book/show/176711.Wraeththu,176711,Wraeththu,0,Storm Constantine,3.94,2581.0,2581.0,800.0,1993.0,True,"Fantasy, Science Fiction, Fiction, LGBT, GLBT, Queer, Romance, M M Romance, Science Fiction Fantasy, LGBT, Gay, Science Fiction, Dystopia, Romance",,
https://www.goodreads.com/book/show/1812595.Narrenturm,1812595,Narrenturm,1,Andrzej Sapkowski,4.07,8021.0,8021.0,593.0,2002.0,True,"Fantasy, Historical, Historical Fiction, European Literature, Polish Literature, Fiction, Historical, Audiobook, Adventure, Historical Fiction, Historical Fantasy, Novels, Science Fiction Fantasy",Janusz A. Zajdel Award for Novel (2003),Silesia
https://www.goodreads.com/book/show/7875439-a-perfect-day-for-bananafish,7875439,A Perfect Day for Bananafish,0,J.D. Salinger,4.32,8924.0,8924.0,18.0,1948.0,False,"Short Stories, Classics, Fiction, Literature, American, Academic, School, Literature, Literature, 20th Century, Historical, Historical Fiction, Young Adult, High School, The United States Of America",,
https://www.goodreads.com/book/show/533465.Balzac_and_the_Little_Chinese_Seamstress,533465,Balzac and the Little Chinese Seamstress,7,Dai Sijie,3.64,58842.0,58842.0,184.0,2000.0,False,"Fiction, Historical, Historical Fiction, Cultural, China, Cultural, Asia, Historical, Writing, Books About Books, Novels, Literature, Asian Literature, Literature, Academic, School","Independent Foreign Fiction Prize Nominee for Shortlist (2002), Premio letterario Giuseppe Acerbi (2015), Prix des libraires du Québec for Lauréats hors Québec (2001), Prix Relay du Roman d'Evasion (2000), Scott Moncrieff Prize for Ina Rilke (2002), Premi Llibreter de narrativa Nominee (2001), International Dublin Literary Award Nominee (2003)",China
https://www.goodreads.com/book/show/8112318-the-candymakers,8112318,The Candymakers,3,Wendy Mass,4.31,23611.0,23611.0,453.0,2010.0,True,"Childrens, Middle Grade, Mystery, Fiction, Realistic Fiction, Childrens, Fantasy, Young Adult, Adventure, Childrens, Juvenile, Contemporary","Pennsylvania Young Readers' Choice Award Nominee for Grades 6-8 (2013), Iowa Children's Choice Award Nominee (2013), North Carolina Children's Book Award (2013)",
https://www.goodreads.com/book/show/9598.Deadeye_Dick,9598,Deadeye Dick,1,Kurt Vonnegut Jr.,3.82,25189.0,25189.0,271.0,1982.0,False,"Fiction, Humor, Classics, Literature, Science Fiction, Novels, Literature, American, Contemporary, Horror, Literary Fiction",Premio Grinzane Cavour Nominee for Narrativa Straniera (1985),
https://www.goodreads.com/book/show/8113512-poison,8113512,Poison,1,Bridget Zinn,3.93,10178.0,10178.0,280.0,2013.0,False,"Fantasy, Young Adult, Romance, Fantasy, Magic, Adventure, Fantasy, High Fantasy, Young Adult, Young Adult Fantasy, Fiction, Young Adult, Teen, Fantasy, Fairy Tales",Oregon Spirit Book Award Nominee for Young Adult (2013),
https://www.goodreads.com/book/show/17831619-beautiful-beginning,17831619,Beautiful Beginning,0,Christina Lauren,4.2,27700.0,27700.0,208.0,2013.0,True,"Romance, Romance, Contemporary Romance, Contemporary, Adult Fiction, Erotica, Adult, New Adult, Novella, Humor, Romance, Erotic Romance, Womens Fiction, Chick Lit",,
https://www.goodreads.com/book/show/169756.Feed,169756,Feed,5,M.T. Anderson,3.55,59586.0,59586.0,308.0,2002.0,False,"Young Adult, Science Fiction, Science Fiction, Dystopia, Fiction, Young Adult, Teen, Fantasy, Audiobook, Romance, Science Fiction Fantasy, Academic, School","Golden Duck Award for Young Adult (Hal Clement Award) (2003), Los Angeles Times Book Prize for Young Adult Literature (2002), Boston Globe-Horn Book Award Nominee for Fiction (2003), National Book Award Finalist for Young People's Literature (2002), Margaret A. Edwards Award (2019)",
https://www.goodreads.com/book/show/85459.Northern_Lights,85459,Northern Lights,0,Nora Roberts,4.01,40933.0,40933.0,637.0,2004.0,False,"Romance, Romance, Romantic Suspense, Mystery, Fiction, Romance, Contemporary Romance, Contemporary, Suspense, Womens Fiction, Chick Lit, Thriller, Mystery, Crime",,"Lunacy, Alaska"
https://www.goodreads.com/book/show/90413.The_Queen_of_the_South,90413,The Queen of the South,0,Arturo Pérez-Reverte,3.94,12217.0,12217.0,528.0,2002.0,False,"Fiction, Thriller, Historical, Historical Fiction, European Literature, Spanish Literature, Cultural, Spain, Mystery, Mystery, Crime, Contemporary, Adventure, Literature",,
https://www.goodreads.com/book/show/18602341-the-wicked-will-rise,18602341,The Wicked Will Rise,0,Danielle  Paige,3.8,28680.0,28680.0,293.0,2015.0,True,"Fantasy, Young Adult, Retellings, Fiction, Fantasy, Magic, Fantasy, Fairy Tales, Adventure, Audiobook, Paranormal, Witches, Young Adult, Young Adult Fantasy",,
https://www.goodreads.com/book/show/38198027-whisper-me-this,38198027,Whisper Me This,0,Kerry Anne King,3.95,31345.0,31345.0,362.0,2018.0,False,"Fiction, Mystery, Contemporary, Thriller, Business, Amazon, Thriller, Mystery Thriller, Drama, Suspense, Audiobook, Family",,
https://www.goodreads.com/book/show/611298.I_Am_America,611298,I Am America (And So Can You!),2,Stephen Colbert,3.89,80994.0,80994.0,230.0,2007.0,False,"Nonfiction, Humor, Humor, Comedy, Politics, Audiobook, Biography, Writing, Essays, Literature, American, Adult, Culture, Pop Culture","Audie Award for Humor (2008), Grammy Award Nominee for Best Spoken Word Album (2009)",
https://www.goodreads.com/book/show/28417.La_B_te_humaine,28417,La Bête humaine,1,Émile Zola,4.07,8788.0,8788.0,462.0,1890.0,True,"Classics, Fiction, Cultural, France, European Literature, French Literature, Literature, 19th Century, Novels, Roman, Literature, Historical, Historical Fiction, Mystery, Crime",French-American Foundation Translation Prize Nominee for Fiction (2008),France
https://www.goodreads.com/book/show/115130.A_Stranger_in_the_Mirror,115130,A Stranger in the Mirror,0,Sidney Sheldon,3.64,19700.0,19700.0,352.0,1976.0,False,"Fiction, Thriller, Mystery, Romance, Suspense, Thriller, Mystery Thriller, Contemporary, Mystery, Crime, Novels, Drama",,
https://www.goodreads.com/book/show/10853.In_Search_of_Captain_Zero,10853,In Search of Captain Zero: A Surfer's Road Trip Beyond the End of the Road,0,Allan C. Weisbecker,3.91,2534.0,2534.0,352.0,2001.0,False,"Nonfiction, Travel, Autobiography, Memoir, Adventure, Biography, Biography Memoir, Sports, Sports",,
https://www.goodreads.com/book/show/15704485-the-prince,15704485,The Prince,0,Tiffany Reisz,4.46,12562.0,12562.0,407.0,2012.0,True,"Erotica, BDSM, Adult Fiction, Erotica, Romance, Dark, Contemporary, Romance, M M Romance, Adult, Romance, Contemporary Romance, Romance, Erotic Romance, Fiction",,
https://www.goodreads.com/book/show/8471815-you-don-t-have-to-say-you-love-me,8471815,You Don't Have to Say You Love Me,0,Sarra Manning,3.96,16583.0,16583.0,560.0,2011.0,False,"Romance, Womens Fiction, Chick Lit, Contemporary, Romance, Contemporary Romance, Adult, New Adult, Humor, Fiction, European Literature, British Literature, Realistic Fiction",,"London Bridge, London, England"
https://www.goodreads.com/book/show/129618.Until_You,129618,Until You,0,Judith McNaught,4.12,19612.0,19612.0,430.0,1994.0,True,"Romance, Historical Romance, Romance, Historical, Historical, Historical Fiction, Historical, Regency, Fiction, Adult, Historical Romance, Regency Romance, Womens Fiction, Chick Lit, European Literature, British Literature",,"The Colonies, London, England"
https://www.goodreads.com/book/show/10002296-wildflower-hill,10002296,Wildflower Hill,0,Kimberley Freeman,4.09,12353.0,12353.0,524.0,2010.0,False,"Historical, Historical Fiction, Fiction, Romance, Cultural, Australia, Historical, Womens Fiction, Chick Lit, Contemporary, Adult, Adult Fiction, Audiobook",,"London, England, Australia"
https://www.goodreads.com/book/show/16070521-come-away-with-me,16070521,Come Away with Me,0,Kristen Proby,3.91,60118.0,60118.0,324.0,2012.0,True,"Romance, Romance, Contemporary Romance, Contemporary, New Adult, Adult Fiction, Erotica, Adult, Womens Fiction, Chick Lit, Romance, Erotic Romance, Fiction, Adult Fiction",,"Seattle, Washington"
