url,book_id,title,award_count,author,avg_rating,num_reviews,num_ratings,num_pages,original_publish_year,series,genres,awards,place
https://www.goodreads.com/book/show/6585201-changes,6585201,Changes,1,Jim Butcher,4.49,102232.0,102232.0,438.0,2010.0,True,"Fantasy, Fantasy, Urban Fantasy, Fiction, Mystery, Fantasy, Paranormal, Fantasy, Magic, Paranormal, Vampires, Audiobook, Fantasy, Supernatural, Science Fiction Fantasy",Goodreads Choice Award Nominee for Paranormal Fantasy (2010),"Chicago, Illinois, Chichen Itza"
https://www.goodreads.com/book/show/20706320-a-grimm-warning,20706320,A Grimm Warning,1,Chris Colfer,4.51,35828.0,35828.0,448.0,2014.0,True,"Fantasy, Childrens, Middle Grade, Fantasy, Fairy Tales, Fiction, Childrens, Young Adult, Adventure, Fantasy, Magic, Retellings, Audiobook",Goodreads Choice Award Nominee for Middle Grade & Children's (2014),
https://www.goodreads.com/book/show/43230472-syrian-brides,43230472,Syrian Brides,0,Anna Halabi,4.17,209.0,209.0,134.0,2018.0,False,"Short Stories, Fiction, Contemporary, Cultural, Literary Fiction, Cultural, Asia, Womens Fiction, Chick Lit, Feminism, Historical, Anthologies",,
https://www.goodreads.com/book/show/5548850-the-day-jesus-rode-into-croydon,5548850,The Day Jesus Rode Into Croydon,0,Kirk St Moritz,3.47,248.0,248.0,440.0,2008.0,False,"Fiction, Humor, Mystery",,
https://www.goodreads.com/book/show/780581.Bel_Ami,780581,Bel-Ami,0,Guy de Maupassant,3.86,31086.0,31086.0,416.0,1885.0,False,"Classics, Fiction, Cultural, France, European Literature, French Literature, Literature, 19th Century, Romance, Literature, Novels, Historical, Historical Fiction, Academic, School",,Paris
https://www.goodreads.com/book/show/12020927-blood-in-the-skies,12020927,Blood in the Skies,0,G.D. Falksen,3.68,233.0,233.0,266.0,2011.0,True,"Science Fiction, Steampunk, Fantasy, Science Fiction, Adventure, Fiction, Apocalyptic, Post Apocalyptic, Young Adult, Horror, Zombies, Science Fiction, Dystopia",,
https://www.goodreads.com/book/show/16081961,16081961,الأسود يليق بك,0,أحلام مستغانمي,3.65,60744.0,60744.0,331.0,2012.0,False,"Novels, Romance, Fiction, Romantic, Literature, Love, Drama, Northern Africa, Algeria",,
https://www.goodreads.com/book/show/100365.The_Mote_in_God_s_Eye,100365,The Mote in God's Eye,3,Larry Niven,4.08,64657.0,64657.0,596.0,1974.0,True,"Science Fiction, Fiction, Science Fiction Fantasy, Space, Space Opera, Science Fiction, Aliens, Fantasy, Audiobook, Classics, Space, Speculative Fiction","Hugo Award Nominee for Best Novel (1975), Nebula Award Nominee for Novel (1975), Locus Award Nominee for Best Novel (1975)",
https://www.goodreads.com/book/show/3238153-north-of-beautiful,3238153,North of Beautiful,6,Justina Chen,3.92,35191.0,35191.0,373.0,2009.0,False,"Young Adult, Romance, Contemporary, Realistic Fiction, Fiction, Young Adult, Teen, Womens Fiction, Chick Lit, Young Adult, High School, Young Adult, Coming Of Age, Young Adult, Young Adult Contemporary","Florida Teens Read Nominee (2010), Amelia Elizabeth Walden Award Nominee (2010), Lincoln Award Nominee (2013), James Cook Book Award Nominee (2011), CYBILS Award Nominee for Young Adult Fiction (2009), Goodreads Choice Award Nominee for Young Adult Fiction (2009)",
https://www.goodreads.com/book/show/6539.The_Body_Farm,,,0,,,,,,,False,,,
https://www.goodreads.com/book/show/24817626-go-set-a-watchman,24817626,Go Set a Watchman,2,Harper Lee,3.32,240762.0,240762.0,278.0,2015.0,False,"Fiction, Historical, Historical Fiction, Classics, Audiobook, Historical, Adult, Adult Fiction, Literature, Literary Fiction, Novels","Goodreads Choice Award for Fiction (2015), Waterstones Book of the Year Nominee (2015)","Maycomb, Alabama"
https://www.goodreads.com/book/show/34492.Wintersmith,34492,Wintersmith,3,Terry Pratchett,4.2,58005.0,58005.0,325.0,2006.0,True,"Fantasy, Young Adult, Fiction, Humor, Childrens, Fantasy, Magic, Adventure, Humor, Comedy, Science Fiction Fantasy, Childrens, Middle Grade","Locus Award for Best Young Adult Novel (2007), Mythopoeic Fantasy Award Nominee for Children's Literature (2007) (2016), Carnegie Medal Nominee (2008)",
https://www.goodreads.com/book/show/12331767-high-rise,12331767,High-Rise,0,J.G. Ballard,3.61,26472.0,26472.0,208.0,1975.0,False,"Fiction, Science Fiction, Science Fiction, Dystopia, Thriller, Classics, Audiobook, Horror, Novels, Literature, European Literature, British Literature",,"London, England"
https://www.goodreads.com/book/show/16234584-the-drowned-world,16234584,The Drowned World,0,J.G. Ballard,3.54,23261.0,23261.0,198.0,1962.0,False,"Science Fiction, Fiction, Apocalyptic, Post Apocalyptic, Science Fiction, Dystopia, Fantasy, Science Fiction, Apocalyptic, Novels, Speculative Fiction, Thriller, Classics",,"London, England"
https://www.goodreads.com/book/show/18404957-the-rise-of-mallory,18404957,The Rise of Mallory,0,Roy Huff,4.34,127.0,127.0,242.0,2014.0,True,"Fantasy, Young Adult, Fiction, Science Fiction, New Adult, Business, Amazon, Science Fiction, Time Travel, Fantasy, Paranormal, Adventure",,
https://www.goodreads.com/book/show/26119570-mack,26119570,Mack,0,Mimi Jean Pamfiloff,4.2,1700.0,1700.0,,2016.0,True,"Fantasy, Paranormal, Romance, Paranormal Romance, Romance, Dark, Fantasy, Mystery, Suspense, Fantasy, Supernatural, Contemporary, Romance, Contemporary Romance",,
https://www.goodreads.com/book/show/37903770-norse-mythology,37903770,Norse Mythology,1,Neil Gaiman,4.08,238721.0,238721.0,301.0,2017.0,False,"Fantasy, Fantasy, Mythology, Fiction, Audiobook, Short Stories, Classics, Historical, Historical Fiction, Adult, Retellings, Religion",Goodreads Choice Award Nominee for Fantasy (2017),
https://www.goodreads.com/book/show/11346.Sula,11346,Sula,2,Toni Morrison,3.95,71499.0,71499.0,174.0,1973.0,False,"Fiction, Classics, Historical, Historical Fiction, Cultural, African American, Literature, Novels, Literary Fiction, Race, Academic, School, Feminism","Audie Award for Narration by the Author or Authors (1998), National Book Award Finalist for Fiction (1975)",
https://www.goodreads.com/book/show/16031620,16031620,الفيل الأزرق,2,أحمد مراد,3.79,61486.0,61486.0,385.0,2012.0,False,"Novels, Fiction, Horror, Mystery, Literature, Fantasy, Psychology, Mystery, Crime, Thriller, Suspense","الجائزة العالمية للرواية العربية (أي باف) / International Prize for Arabic Fiction (IPAF) Nominee (2014), القائمة الطويلة لجائزة العالمية للرواية العربية للعام for القائمة الطويلة للجائزة العالمية للرواية العربية (البوكر) Winners  (2014)",Cairo
https://www.goodreads.com/book/show/36430011-you,36430011,You,0,Caroline Kepnes,3.91,166920.0,166920.0,422.0,2014.0,True,"Thriller, Fiction, Mystery, Contemporary, Thriller, Mystery Thriller, Adult, Audiobook, Suspense, Horror, Mystery, Crime",,"New York City, New York, New York State"
https://www.goodreads.com/book/show/298663.The_Killer_Inside_Me,298663,The Killer Inside Me,0,Jim Thompson,3.82,22110.0,22110.0,244.0,1952.0,False,"Fiction, Mystery, Crime, Mystery, Mystery, Noir, Thriller, Horror, Classics, Thriller, Mystery Thriller, Novels, Suspense",,Central City
https://www.goodreads.com/book/show/12527.Pilgrim_at_Tinker_Creek,12527,Pilgrim at Tinker Creek,1,Annie Dillard,4.09,23089.0,23089.0,288.0,1974.0,False,"Nonfiction, Environment, Nature, Autobiography, Memoir, Writing, Essays, Classics, Philosophy, Science, Environment, Spirituality, Biography",Pulitzer Prize for General Nonfiction (1975),
https://www.goodreads.com/book/show/1833852.A_Fraction_of_the_Whole,1833852,A Fraction of the Whole,5,Steve Toltz,4.14,17672.0,17672.0,530.0,2008.0,False,"Fiction, Cultural, Australia, Novels, Contemporary, Humor, Literature, Literary Fiction, Philosophy, Family, Unfinished","Booker Prize Nominee (2008), Guardian First Book Award Nominee (2008), New South Wales Premier's Literary Award for People's Choice Award (2009), Bollinger Everyman Wodehouse Prize Nominee for comic fiction (2009), Australian Book Industry Award (ABIA) for Literary  Fiction and Nominee for Newcomer (2008)","Australia, Paris, Thailand"
https://www.goodreads.com/book/show/163716.The_Complete_Fairy_Tales,163716,The Complete Fairy Tales,0,Oscar Wilde,4.33,11057.0,11057.0,144.0,1891.0,False,"Classics, Fantasy, Short Stories, Fiction, Fantasy, Fairy Tales, Childrens, Literature, Literature, 19th Century, Classics, Classic Literature, European Literature, Irish Literature",,
https://www.goodreads.com/book/show/160251.Ordinary_People,160251,Ordinary People,1,Judith Guest,3.91,19098.0,19098.0,263.0,1976.0,False,"Fiction, Classics, Contemporary, Psychology, Young Adult, Literature, Novels, Academic, School, Family, Academic, Read For School",Janet Heidinger Kafka Prize (1976),"Lake Forest, Illinois"
https://www.goodreads.com/book/show/9646.Homage_to_Catalonia,9646,Homage to Catalonia,0,George Orwell,4.09,47126.0,47126.0,232.0,1938.0,False,"History, Nonfiction, Politics, Classics, War, Autobiography, Memoir, Biography, Cultural, Spain, Literature, Biography, Autobiography",,Catalonia (Cataluña; Catalunya)
https://www.goodreads.com/book/show/208631.Ocean_Sea,208631,Ocean Sea,1,Alessandro Baricco,4.11,17655.0,17655.0,256.0,1993.0,False,"Fiction, European Literature, Italian Literature, Contemporary, Cultural, Italy, Novels, Magical Realism, Literature, Literary Fiction, Romance, Drama",Premio Viareggio (1993),Almayer Inn
https://www.goodreads.com/book/show/38495676-notice-me,38495676,Notice Me,0,Emem Uko,4.26,588.0,588.0,266.0,2018.0,False,"Contemporary, Young Adult, Fiction, New Adult, Adult, Novels, Childrens, Middle Grade, Romance, Love Story, Young Adult, Teen, Music",,
https://www.goodreads.com/book/show/15888.An_Instance_of_the_Fingerpost,15888,An Instance of the Fingerpost,1,Iain Pears,3.94,21916.0,21916.0,691.0,1997.0,False,"Historical, Historical Fiction, Fiction, Mystery, Historical, Mystery, Crime, Mystery, Historical Mystery, Thriller, Mystery Thriller, European Literature, British Literature, Thriller, Novels",Martin Beck Award (1999),"Oxford, England"
https://www.goodreads.com/book/show/77727.Calvin_and_Hobbes,77727,Calvin and Hobbes,0,Bill Watterson,4.6,141830.0,141830.0,128.0,1987.0,True,"Sequential Art, Comics, Humor, Sequential Art, Graphic Novels, Fiction, Childrens, Humor, Comedy, Graphic Novels Comics, Comics, Comic Book, Classics, Sequential Art, Comic Strips",,
https://www.goodreads.com/book/show/13835.In_the_Hand_of_the_Goddess,13835,In the Hand of the Goddess,1,Tamora Pierce,4.2,94809.0,94809.0,264.0,1984.0,True,"Fantasy, Young Adult, Fiction, Fantasy, Magic, Adventure, Young Adult, Young Adult Fantasy, Romance, Fantasy, High Fantasy, Childrens, Childrens, Middle Grade",Margaret A. Edwards Award (2013),Tortall
https://www.goodreads.com/book/show/9914.The_Informers,9914,The Informers,0,Bret Easton Ellis,3.37,19318.0,19318.0,240.0,1994.0,False,"Fiction, Short Stories, Thriller, Mystery, Dark, Contemporary, Literature, American, Mystery, Crime, Literature, Novels",,"United States of America, Los Angeles, California"
https://www.goodreads.com/book/show/54984.La_catedral_del_mar,54984,La catedral del mar,4,Ildefonso Falcones,4.12,42195.0,42195.0,672.0,2006.0,True,"Historical, Historical Fiction, Fiction, Historical, Cultural, Spain, European Literature, Spanish Literature, Historical, Medieval, Roman, Novels, Romance, Audiobook","Euskadi de Plata for Best Spanish Novel (2006), Qué leer for Best Spanish Book (2006), Premio Fundación José Manuel Lara for novela más vendida (2006), Prix Fulbert de Chartres (2009)","Barcelona, Catalonia"
https://www.goodreads.com/book/show/156534.Y,156534,"Y: The Last Man, Vol. 1: Unmanned",0,Brian K. Vaughan,4.08,106291.0,106291.0,130.0,2003.0,True,"Sequential Art, Graphic Novels, Sequential Art, Comics, Science Fiction, Fiction, Graphic Novels Comics, Comics, Comic Book, Science Fiction, Dystopia, Apocalyptic, Post Apocalyptic, Fantasy, Adult",,United States of America
https://www.goodreads.com/book/show/1108124._,1108124,பொன்னியின் செல்வன்,0,Kalki,4.7,7733.0,7733.0,1452.0,1954.0,False,"Fiction, Historical, Historical Fiction, Classics, Asian Literature, Indian Literature, Historical, Novels, Cultural, India, Adventure, Thriller, Fantasy",,"Thanjavur, Kancheepuram, Anuradhapura, Nagapattinam"
https://www.goodreads.com/book/show/10345937-shades-of-earth,10345937,Shades of Earth,0,Beth Revis,4.08,32312.0,32312.0,369.0,2013.0,True,"Young Adult, Science Fiction, Science Fiction, Dystopia, Romance, Fantasy, Fiction, Space, Mystery, Science Fiction, Aliens, Adventure",,
https://www.goodreads.com/book/show/13580951-united-we-spy,13580951,United We Spy,1,Ally Carter,4.44,31066.0,31066.0,296.0,2013.0,True,"Young Adult, Mystery, Romance, Contemporary, Spy Thriller, Espionage, Fiction, Adventure, Action, Young Adult, Teen, Womens Fiction, Chick Lit",Goodreads Choice Award Nominee for Young Adult Fiction (2013),
https://www.goodreads.com/book/show/35066358-the-first-fifteen-lives-of-harry-august,35066358,The First Fifteen Lives of Harry August,5,Claire North,4.02,72881.0,72881.0,417.0,2014.0,False,"Science Fiction, Fiction, Fantasy, Science Fiction, Time Travel, Historical, Historical Fiction, Audiobook, Adult, Historical, Science Fiction Fantasy, Thriller","Arthur C. Clarke Award Nominee (2015), British Science Fiction Association Award Nominee for Best Novel (2014), John W. Campbell Memorial Award for Best Science Fiction Novel (2015), Goodreads Choice Award Nominee for Science Fiction (2014), Seiun Award 星雲賞 Nominee for Best Translated Novel (2017)",
https://www.goodreads.com/book/show/7060582-twice-bitten,7060582,Twice Bitten,1,Chloe Neill,4.19,49064.0,49064.0,355.0,2010.0,True,"Fantasy, Urban Fantasy, Paranormal, Vampires, Fantasy, Paranormal, Fantasy, Romance, Romance, Paranormal Romance, Adult, Fantasy, Magic, Fantasy, Supernatural, Paranormal, Shapeshifters",Goodreads Choice Award Nominee for Paranormal Fantasy (2010),"Chicago, Illinois"
https://www.goodreads.com/book/show/1337448.Wir_Kinder_vom_Bahnhof_Zoo,1337448,Wir Kinder vom Bahnhof Zoo,0,Christiane F.,4.23,32679.0,32679.0,367.0,1978.0,False,"Nonfiction, Biography, European Literature, German Literature, Classics, Autobiography, Memoir, Cultural, Germany, Contemporary, Biography, Autobiography, Biography Memoir, Drama",,Berlin
https://www.goodreads.com/book/show/16006.Paradise,16006,Paradise,0,Judith McNaught,4.31,31292.0,31292.0,709.0,1991.0,True,"Romance, Romance, Contemporary Romance, Contemporary, Fiction, Romance, Historical Romance, Womens Fiction, Chick Lit, Adult, Historical, Romance, Romantic Suspense, Historical, Historical Fiction",,"Chicago, Illinois"
https://www.goodreads.com/book/show/2213324.Airhead,2213324,Airhead,0,Meg Cabot,3.77,37113.0,37113.0,337.0,2008.0,True,"Young Adult, Romance, Womens Fiction, Chick Lit, Contemporary, Fiction, Science Fiction, Young Adult, Teen, Fantasy, Realistic Fiction, Mystery",,"New York City, New York"
https://www.goodreads.com/book/show/10950924-the-dovekeepers,10950924,The Dovekeepers,1,Alice Hoffman,4.05,69209.0,69209.0,504.0,2011.0,False,"Historical, Historical Fiction, Fiction, Historical, Magical Realism, Book Club, Literature, Jewish, Adult Fiction, Adult, Cultural, Israel, Audiobook",Goodreads Choice Award Nominee for Historical Fiction (2011),Masada
https://www.goodreads.com/book/show/13662.The_Tombs_of_Atuan,13662,The Tombs of Atuan,4,Ursula K. Le Guin,4.08,96840.0,96840.0,180.0,1970.0,True,"Fantasy, Fiction, Young Adult, Science Fiction Fantasy, Classics, Fantasy, Magic, Fantasy, High Fantasy, Adventure, Childrens, Science Fiction","Newbery Medal Nominee (1972), National Book Award Nominee for Children's Books (1972), Mythopoeic Fantasy Award Nominee (1972), Margaret A. Edwards Award (2004)",Earthsea Realm
https://www.goodreads.com/book/show/40948565-the-secret-of-the-nagas,40948565,The Secret of the Nagas,0,Amish Tripathi,4.07,79042.0,79042.0,398.0,2011.0,True,"Fiction, Fantasy, Mythology, Fantasy, Asian Literature, Indian Literature, Historical, Historical Fiction, Cultural, India, Amish, Novels, Adventure, Thriller",,
https://www.goodreads.com/book/show/480570.The_First_Man_in_Rome,480570,The First Man in Rome,0,Colleen McCullough,4.09,20795.0,20795.0,1076.0,1990.0,True,"Historical, Historical Fiction, Fiction, Historical, Cultural, Italy, Roman, History, Ancient History, Novels, War, Literature, Ancient, Audiobook",,Rome
https://www.goodreads.com/book/show/35297265-unwifeable,35297265,Unwifeable: A Memoir,0,Mandy Stadtmiller,3.55,2348.0,2348.0,321.0,2018.0,False,"Autobiography, Memoir, Nonfiction, Humor, Biography Memoir, Biography, Autobiography, Womens, Biography, Feminism, Relationships, New York",,
https://www.goodreads.com/book/show/7766027-i-hunt-killers,7766027,I Hunt Killers,4,Barry Lyga,4.02,38866.0,38866.0,359.0,2012.0,True,"Young Adult, Mystery, Thriller, Horror, Mystery, Crime, Fiction, Contemporary, Thriller, Mystery Thriller, Suspense, Young Adult, Teen","Bram Stoker Award Nominee for Best Young Adult Novel (2012), Georgia Peach Book Award Nominee for Honor book (2013), Lincoln Award Nominee (2014), Goodreads Choice Award Nominee for Young Adult Fiction (2012)",Lobo's Nod
https://www.goodreads.com/book/show/1316617.Succubus_on_Top,1316617,Succubus on Top,0,Richelle Mead,4.04,31557.0,31557.0,314.0,2008.0,True,"Fantasy, Urban Fantasy, Fantasy, Paranormal, Fantasy, Romance, Romance, Paranormal Romance, Paranormal, Vampires, Paranormal, Demons, Adult, Paranormal, Angels, Fantasy, Supernatural",,"Seattle, Washington"
https://www.goodreads.com/book/show/87264.Mem_rias_P_stumas_de_Br_s_Cubas,87264,Memórias Póstumas de Brás Cubas,0,Machado de Assis,4.26,20717.0,20717.0,176.0,1881.0,False,"Fiction, Classics, Cultural, Brazil, Literature, Novels, Romance, European Literature, Portuguese Literature, Cultural, Latin American, Literature, 19th Century, Literary Fiction",,Rio de Janeiro
https://www.goodreads.com/book/show/1809465.Rodrick_Rules,1809465,Rodrick Rules,0,Jeff Kinney,4.14,145857.0,145857.0,226.0,2008.0,True,"Fiction, Humor, Childrens, Realistic Fiction, Childrens, Middle Grade, Sequential Art, Graphic Novels, Young Adult, Humor, Comedy, Sequential Art, Comics, Contemporary",,
https://www.goodreads.com/book/show/342049.Growth_of_the_Soil,342049,Growth of the Soil,0,Knut Hamsun,4.13,8829.0,8829.0,435.0,1917.0,False,"Fiction, Classics, Literature, Novels, Nobel Prize, European Literature, Scandinavian Literature, Literature, 20th Century, Mystery, Drama, Thriller",,Norway
https://www.goodreads.com/book/show/27774596-after-you,27774596,After You,3,Jojo Moyes,3.73,313894.0,313894.0,352.0,2015.0,True,"Fiction, Romance, Contemporary, Womens Fiction, Chick Lit, Audiobook, Adult, Adult Fiction, Drama, Realistic Fiction, Novels","Goodreads Choice Award Nominee for Fiction (2015), Woman & Home Reader's Choice Award for Book That Made Me Cry (2016), Βραβείο Βιβλίου Public for Μεταφρασμένο Μυθιστόρημα (Translator: Χρύσα Μπανιά) (2017)","London, England"
https://www.goodreads.com/book/show/36349731-adjustment-day,36349731,Adjustment Day,0,Chuck Palahniuk,3.14,7868.0,7868.0,316.0,2018.0,False,"Fiction, Contemporary, Science Fiction, Science Fiction, Dystopia, Adult, Adult Fiction, Dark, Thriller, Classics, Cult Classics, Drama",,
https://www.goodreads.com/book/show/42641.Resurrection,42641,Resurrection,0,Leo Tolstoy,4.15,18512.0,18512.0,562.0,1899.0,False,"Classics, Fiction, Literature, Russian Literature, Cultural, Russia, Literature, Novels, Literature, 19th Century, Philosophy, Religion, Literary Fiction",,
https://www.goodreads.com/book/show/8428069-the-lying-game,8428069,The Lying Game,0,Sara Shepard,3.93,39142.0,39142.0,307.0,2010.0,True,"Young Adult, Mystery, Contemporary, Fiction, Romance, Womens Fiction, Chick Lit, Thriller, Young Adult, Teen, Thriller, Mystery Thriller, Realistic Fiction",,"Arizona, Las Vegas, Nevada"
https://www.goodreads.com/book/show/16109563-undeniable,16109563,Undeniable,0,Madeline Sheehan,4.04,48250.0,48250.0,219.0,2012.0,True,"Romance, Dark, Contemporary, Adult Fiction, Erotica, Romance, Contemporary Romance, Adult, Sociology, Abuse, New Adult, Romance, Erotic Romance, Drama",,"New York City, New York"
https://www.goodreads.com/book/show/3684856-fool,3684856,Fool,1,Christopher Moore,3.97,51892.0,51892.0,311.0,2009.0,True,"Humor, Fiction, Fantasy, Humor, Comedy, Historical, Historical Fiction, Audiobook, Historical, Adult, Adult Fiction, Retellings",Goodreads Choice Award Nominee for Fiction (2009),United Kingdom
https://www.goodreads.com/book/show/93269.Earth_Abides,93269,Earth Abides,1,George R. Stewart,3.96,26068.0,26068.0,345.0,1949.0,False,"Science Fiction, Fiction, Apocalyptic, Post Apocalyptic, Science Fiction, Apocalyptic, Science Fiction, Dystopia, Classics, Science Fiction Fantasy, Speculative Fiction, Fantasy, Adventure, Survival",International Fantasy Award for Fiction (1951),United States of America
https://www.goodreads.com/book/show/12274389-the-dark-tower-series-collection,12274389,"The Dark Tower Series Collection: The Gunslinger, The Drawing of the Three, The Waste Lands, Wizard and Glass, Wolves of the Calla, Song of Susannah, The Dark Tower",0,Stephen King,4.61,10244.0,10244.0,3914.0,2005.0,True,"Fantasy, Fiction, Horror, Science Fiction, Thriller, Apocalyptic, Post Apocalyptic, Science Fiction Fantasy, Westerns, Adventure, Novels",,
https://www.goodreads.com/book/show/6665847-daemon,6665847,Daemon,0,Daniel Suarez,4.15,43802.0,43802.0,632.0,2006.0,True,"Science Fiction, Fiction, Thriller, Science Fiction, Cyberpunk, Mystery, Audiobook, Science, Technology, Mystery, Crime, Science Fiction Fantasy, Fantasy",,
https://www.goodreads.com/book/show/822.The_Confusion,822,The Confusion,0,Neal Stephenson,4.26,22511.0,22511.0,815.0,2004.0,True,"Fiction, Historical, Historical Fiction, Science Fiction, Fantasy, Historical, Adventure, Literature, Science Fiction Fantasy, Speculative Fiction, Science Fiction, Alternate History",,
https://www.goodreads.com/book/show/40425.Tarzan_of_the_Apes,40425,Tarzan of the Apes,0,Edgar Rice Burroughs,3.9,40066.0,40066.0,324.0,1912.0,True,"Classics, Fiction, Adventure, Fantasy, Cultural, Africa, Pulp, Science Fiction, Romance, Novels, Action",,"Africa, Paris"
https://www.goodreads.com/book/show/16150831-in-the-afterlight,16150831,In The Afterlight,0,Alexandra Bracken,4.29,50449.0,50449.0,535.0,2014.0,True,"Young Adult, Science Fiction, Dystopia, Fantasy, Science Fiction, Romance, Fantasy, Paranormal, Fiction, Audiobook, Fantasy, Supernatural, Adventure",,
https://www.goodreads.com/book/show/30259.For_a_Few_Demons_More,30259,For a Few Demons More,0,Kim Harrison,4.31,55903.0,55903.0,456.0,2007.0,True,"Fantasy, Urban Fantasy, Fantasy, Fantasy, Paranormal, Paranormal, Vampires, Paranormal, Witches, Fantasy, Magic, Fiction, Paranormal, Demons, Romance, Fantasy, Supernatural",,"Cincinnati, Ohio, Ohio"
https://www.goodreads.com/book/show/32762917-nightfall,32762917,Nightfall,0,Shannon Messenger,4.62,14055.0,14055.0,576.0,2017.0,True,"Fantasy, Childrens, Middle Grade, Young Adult, Fiction, Adventure, Young Adult, Young Adult Fantasy, Childrens, Romance, Fantasy, Magic, Contemporary",,
https://www.goodreads.com/book/show/14758.In_Her_Shoes,14758,In Her Shoes,0,Jennifer Weiner,3.8,200980.0,200980.0,537.0,2002.0,False,"Womens Fiction, Chick Lit, Fiction, Romance, Contemporary, Adult Fiction, Adult, Humor, Womens Fiction, Family, Novels",,
https://www.goodreads.com/book/show/5517.A_Raisin_in_the_Sun,5517,A Raisin in the Sun,2,Lorraine Hansberry,3.83,71136.0,71136.0,162.0,1959.0,False,"Plays, Classics, Fiction, Drama, Academic, School, Academic, Read For School, Cultural, African American, Plays, Theatre, Historical, Historical Fiction, Young Adult, High School","New York Drama Critics' Circle Award for Best American Play (1959), Audie Award for Multi-Voiced Performance (2012)","Chicago, Illinois, Illinois"
https://www.goodreads.com/book/show/30123368-my-blood-approves,30123368,My Blood Approves,0,Amanda Hocking,3.82,28840.0,28840.0,278.0,2010.0,True,"Paranormal, Vampires, Young Adult, Fantasy, Paranormal, Fantasy, Romance, Romance, Paranormal Romance, Fantasy, Supernatural, Fiction, Fantasy, Urban Fantasy, Young Adult, Teen",,Minnesota
https://www.goodreads.com/book/show/23305614-finding-audrey,23305614,Finding Audrey,2,Sophie Kinsella,3.77,71972.0,71972.0,286.0,2015.0,False,"Young Adult, Contemporary, Romance, Fiction, Health, Mental Health, Womens Fiction, Chick Lit, Mental Health, Mental Illness, Audiobook, Realistic Fiction, Young Adult, Teen","Rhode Island Teen Book Award Nominee (2017), Goodreads Choice Award Nominee for Young Adult Fiction (2015)",
https://www.goodreads.com/book/show/116296.Making_Money,116296,Making Money,2,Terry Pratchett,4.21,64711.0,64711.0,394.0,2007.0,True,"Fantasy, Fiction, Humor, Humor, Comedy, Science Fiction Fantasy, Young Adult, Audiobook, Childrens, Adventure, Childrens, Middle Grade","Nebula Award Nominee for Best Novel (2008), Locus Award for Best Fantasy Novel (2008)",Ankh-Morpork
https://www.goodreads.com/book/show/8239301,8239301,الطنطورية,0,رضوى عاشور,4.33,22406.0,22406.0,463.0,2010.0,False,"Novels, Fiction, Historical, Historical Fiction, Literature, Northern Africa, Egypt, War, Politics, Unfinished, Historical, African Literature, Egyptian Literature",,
https://www.goodreads.com/book/show/5346.The_Last_Juror,5346,The Last Juror,0,John Grisham,3.9,88844.0,88844.0,278.0,2004.0,False,"Fiction, Thriller, Mystery, Mystery, Crime, Suspense, Drama, Thriller, Legal Thriller, Novels, Thriller, Mystery Thriller, Adult Fiction",,"Ford County, Mississippi"
