,index,Unnamed: 0,url,book_id,title,author,good_read_score,good_read_votes,avg_rating,num_reviews,num_ratings,num_pages,original_publish_year,series,genres,awards,award_count,place,Fiction,Fantasy,Classics,Young Adult,Novels,Literature,Romance,Historical,Historical Fiction,Audiobook,Adult,Adventure,Contemporary,Science Fiction,Childrens,Mystery,Cultural,Academic,Paranormal,School,Science Fiction Fantasy,Adult Fiction,Magic,European Literature,Literary Fiction,Urban Fantasy,Drama,Middle Grade,American,Thriller,Supernatural,Dystopia,Horror,Philosophy,Classic Literature,Humor,Teen,Paranormal Romance,Nonfiction,Vampires,Crime,Realistic Fiction,Chick Lit,Womens Fiction,20th Century,British Literature,Young Adult Fantasy,War,Poetry,High Fantasy,MINMAX/norm Average Rating,MEAN/norm Average Rating
661,662,662,https://www.goodreads.com/book/show/304027.Lover_Unbound,304027.0,Lover Unbound,J.R. Ward,12306,161,4.32,4994,123966,502,2007.0,True,"Fantasy, Paranormal, Romance, Romance, Paranormal Romance, Paranormal, Vampires, Fantasy, Fantasy, Urban Fantasy, Adult, Fiction, Adult Fiction, Erotica, Fantasy, Supernatural","All About Romance (AAR) Annual Reader Poll for Most Tortured Hero & Honorable Mention for Guiltiest Pleasure Romance (2008), Romantic Times Reviewers' Choice Award (RT Award) for Vampire Romance (2007)",2,"Caldwell, New York",True,True,False,False,False,False,True,False,False,False,True,False,False,False,False,False,False,False,True,False,False,True,False,False,False,True,False,False,False,False,True,False,False,False,False,False,False,True,False,True,False,False,False,False,False,False,False,False,False,False,8.434782608695652,6.28478987930784
662,663,663,https://www.goodreads.com/book/show/6853.One_for_the_Money,6853.0,One for the Money,Janet Evanovich,12241,166,4.03,15120,499086,320,1994.0,True,"Mystery, Fiction, Humor, Womens Fiction, Chick Lit, Romance, Mystery, Crime, Thriller, Mystery Thriller, Contemporary, Adult, Audiobook","Anthony Award Nominee for Best Novel (1995), Shamus Award Nominee for Best First PI Novel (1995), Dilys Award (1995), CWA New Blood Dagger (1995), Agatha Award Nominee for Best First Novel (1994), Edgar Award Nominee for Best First Novel (1995)",6,"Trenton, New Jersey",True,False,False,False,False,False,True,False,False,True,True,False,True,False,False,True,False,False,False,False,False,False,False,False,False,False,False,False,False,True,False,False,False,False,False,True,False,False,False,False,True,False,True,True,False,False,False,False,False,False,7.489130434782609,5.339137705394797
663,664,664,https://www.goodreads.com/book/show/32423.Watchers,32423.0,Watchers,Dean Koontz,12219,152,4.18,4160,157472,624,1987.0,False,"Horror, Fiction, Thriller, Mystery, Suspense, Science Fiction, Drama, Fantasy, Novels, Mystery, Crime","Audie Award for Best Male Narrator (2019), Japan Adventure Fiction Association Prize 日本冒険小説協会大賞特別賞 for Best Translated Novel (1993)",2,nan,True,True,False,False,True,False,False,False,False,False,False,False,False,True,False,True,False,False,False,False,False,False,False,False,False,False,True,False,False,True,False,False,True,False,False,False,False,False,False,False,True,False,False,False,False,False,False,False,False,False,7.978260869565217,5.8282681401774035
664,665,665,https://www.goodreads.com/book/show/77197.Assassin_s_Apprentice,77197.0,Assassin's Apprentice,Robin Hobb,12190,147,4.15,10795,249645,435,1995.0,True,"Fantasy, Fiction, Fantasy, Epic Fantasy, Fantasy, High Fantasy, Adventure, Science Fiction Fantasy, Fantasy, Magic, Adult, Young Adult, Audiobook","Locus Award Nominee for Fantasy (1996), British Fantasy Award Nominee for Best Novel (1997), Compton Crook Award (1996)) Nominee (1996)",3,"Buckkeep, Moonseye, Neatbay, Forge, Jhaampe (Mountain Kingdom)",True,True,False,True,False,False,False,False,False,True,True,True,False,True,False,False,False,False,False,False,True,False,True,False,False,False,False,False,False,False,False,False,False,False,False,False,False,False,False,False,False,False,False,False,False,False,False,False,False,True,7.880434782608697,5.730442053220884
665,666,666,https://www.goodreads.com/book/show/14290364-champion,14290364.0,Champion,Marie Lu,12110,145,4.33,15908,178164,369,2013.0,True,"Science Fiction, Dystopia, Young Adult, Romance, Science Fiction, Fantasy, Fiction, Adventure, Action, Audiobook, Young Adult, Teen",nan,0,nan,True,True,False,True,False,False,True,False,False,True,True,True,False,True,False,False,False,False,False,False,False,False,False,False,False,False,False,False,False,False,False,True,False,False,False,False,True,False,False,False,False,False,False,False,False,False,False,False,False,False,8.467391304347828,6.317398574960013
666,667,667,https://www.goodreads.com/book/show/99300.The_Yellow_Wallpaper_and_Other_Stories,99300.0,The Yellow Wallpaper and Other Stories,Charlotte Perkins Gilman,12098,176,4.04,2293,81781,70,1892.0,False,"Classics, Short Stories, Fiction, Feminism, Horror, Literature, Academic, School, Gothic, Health, Mental Health, Literature, 19th Century",nan,0,nan,True,False,True,False,False,True,False,False,False,False,False,False,False,False,False,False,False,True,False,True,False,False,False,False,False,False,False,False,False,False,False,False,True,False,False,False,False,False,False,False,False,False,False,False,False,False,False,False,False,False,7.521739130434783,5.37174640104697
667,668,668,https://www.goodreads.com/book/show/17212231-inferno,17212231.0,Inferno,Dan Brown,12021,151,3.86,37462,490472,463,2013.0,True,"Fiction, Thriller, Mystery, Thriller, Mystery Thriller, Suspense, Historical, Historical Fiction, Adventure, Novels, Mystery, Crime, Adult",Goodreads Choice Award for Mystery & Thriller (2013),1,"Istanbul, Florence, Venice",True,False,False,False,True,False,False,True,True,False,True,True,False,False,False,True,False,False,False,False,False,False,False,False,False,False,False,False,False,True,False,False,False,False,False,False,False,False,False,False,True,False,False,False,False,False,False,False,False,False,6.934782608695652,4.784789879307839
668,669,669,https://www.goodreads.com/book/show/10965.A_Breath_of_Snow_and_Ashes,10965.0,A Breath of Snow and Ashes,Diana Gabaldon,11994,154,4.42,5678,147815,993,2005.0,True,"Historical, Historical Fiction, Romance, Fiction, Fantasy, Science Fiction, Time Travel, Historical, Romance, Historical Romance, Audiobook, Adult, Adventure","All About Romance (AAR) Annual Reader Poll for Most-Hanky Read (tie) & Best American Historical/Frontier Romance (2006), The Quill Award for Science fiction/fantasy/horror (2006), Corine Internationaler Buchpreis for Weltbild Leserpreis (2006)",3,"United States of America, North Carolina, North Carolina, North Carolina, North Carolina",True,True,False,False,False,False,True,True,True,True,True,True,False,True,False,False,False,False,False,False,False,False,False,False,False,False,False,False,False,False,False,False,False,False,False,False,False,False,False,False,False,False,False,False,False,False,False,False,False,False,8.76086956521739,6.610876835829579
669,670,670,https://www.goodreads.com/book/show/21853621-the-nightingale,21853621.0,The Nightingale,Kristin Hannah,11966,138,4.57,69520,782996,440,2015.0,False,"Historical, Historical Fiction, Fiction, Historical, War, World War II, War, Audiobook, Adult, Cultural, France, Romance, Adult Fiction","Audie Award for Fiction (2016), Goodreads Choice Award for Historical Fiction (2015) and Nominee for Best of the Best  (2018), International Dublin Literary Award Nominee (2017)",3,"Paris, Loire Valley, Pyrenees, Oregon Coast, Carriveau, Portland, Oregon, Ravensbrück, Paris",True,False,False,False,False,False,True,True,True,True,True,False,False,False,False,False,True,False,False,False,False,True,False,False,False,False,False,False,False,False,False,False,False,False,False,False,False,False,False,False,False,False,False,False,False,False,False,True,False,False,9.250000000000002,7.100007270612188
670,671,671,https://www.goodreads.com/book/show/10967.The_Fiery_Cross,10967.0,The Fiery Cross,Diana Gabaldon,11953,156,4.22,7507,182870,1443,2001.0,True,"Historical, Historical Fiction, Romance, Fiction, Fantasy, Science Fiction, Time Travel, Historical, Romance, Historical Romance, Audiobook, Adult, Adventure",nan,0,"North Carolina, North Carolina, North Carolina, Mount Holicon, The Royal Colony of North Carolina",True,True,False,False,False,False,True,True,True,True,True,True,False,True,False,False,False,False,False,False,False,False,False,False,False,False,False,False,False,False,False,False,False,False,False,False,False,False,False,False,False,False,False,False,False,False,False,False,False,False,8.108695652173912,5.9587029227861
671,672,672,https://www.goodreads.com/book/show/32075671-the-hate-u-give,32075671.0,The Hate U Give,Angie Thomas,11917,134,4.51,62989,574883,444,2017.0,True,"Young Adult, Fiction, Contemporary, Audiobook, Realistic Fiction, Race, Social Movements, Social Justice, Young Adult, Teen, Young Adult, Young Adult Contemporary, Cultural, African American","National Book Award Nominee for Young People's Literature (2017), Odyssey Award (2018), William C. Morris YA Debut Award (2018), Los Angeles Times Book Prize Nominee for Young Adult Literature (2017), Edgar Award Nominee for Best Young Adult (2018), Michael L. Printz Award Nominee (2018), Rhode Island Teen Book Award (2019), Evergreen Teen Book Award Nominee for High School (2020), Coretta Scott King Book Award Nominee for Author Honor (2018), Deutscher Jugendliteraturpreis for Preis der Jugendjury (2018), Amelia Elizabeth Walden Award (2018), Boston Globe-Horn Book Award for Fiction (2017), Lincoln Award (2019), Waterstones Children's Book Prize for Overall and Older Fiction (2018), Kirkus Prize Nominee for Young Readers' Literature (2017), Goodreads Choice Award for Young Adult Fiction & for Debut Goodreads Author (2017) and for Best of the Best  (2018), Carnegie Medal Nominee (2018), NAACP Image Award Nominee for Youth/Teens (2018), Blogistanian Kuopus (2017)",19,"United States of America, Garden Heights",True,False,False,True,False,False,False,False,False,True,True,False,True,False,False,False,True,False,False,False,False,False,False,False,False,False,False,False,True,False,False,False,False,False,False,False,True,False,False,False,False,True,False,False,False,False,False,False,False,False,9.054347826086957,6.904355096699144
672,673,673,https://www.goodreads.com/book/show/46756.Oryx_and_Crake,46756.0,Oryx and Crake,Margaret Atwood,11893,154,4.0,13978,232000,389,2003.0,True,"Fiction, Science Fiction, Science Fiction, Dystopia, Apocalyptic, Post Apocalyptic, Fantasy, Cultural, Canada, Speculative Fiction, Science Fiction Fantasy, Audiobook, Novels","Booker Prize Nominee (2003), Orange Prize Nominee for Fiction Shortlist (2004), Sunburst Award Nominee for Canadian Novel (2004), Scotiabank Giller Prize Nominee (2003), Grand Prix de l'Imaginaire Nominee for Roman étranger (2006)",5,nan,True,True,False,False,True,False,False,False,False,True,False,False,False,True,False,False,True,False,False,False,True,False,False,False,False,False,False,False,False,False,False,True,False,False,False,False,False,False,False,False,False,False,False,False,False,False,False,False,False,False,7.391304347826088,5.241311618438274
673,674,674,https://www.goodreads.com/book/show/16286.The_Magus,16286.0,The Magus,John Fowles,11821,153,4.06,3047,49704,656,1965.0,False,"Fiction, Classics, Fantasy, Mystery, Literature, Novels, Literary Fiction, Cultural, Greece, European Literature, British Literature, Contemporary",nan,0,"Greece, London, England",True,True,True,False,True,True,False,False,False,False,False,False,True,False,False,True,True,False,False,False,False,False,False,True,True,False,False,False,False,False,False,False,False,False,False,False,False,False,False,False,False,False,False,False,False,True,False,False,False,False,7.58695652173913,5.4369637923513165
674,675,675,https://www.goodreads.com/book/show/6262365-tempted,6262365.0,Tempted,P.C. Cast,11795,160,3.94,3432,157273,319,2009.0,True,"Young Adult, Paranormal, Vampires, Fantasy, Fantasy, Paranormal, Romance, Fantasy, Supernatural, Fiction, Romance, Paranormal Romance, Fantasy, Urban Fantasy, Fantasy, Magic",Romantic Times Reviewers' Choice Award (RT Award) Nominee for Best Young Adult Paranormal/Fantasy Novel (2009),1,"United States of America, Tulsa, Oklahoma",True,True,False,True,False,False,True,False,False,False,True,False,False,False,False,False,False,False,True,False,False,False,True,False,False,True,False,False,False,False,True,False,False,False,False,False,False,True,False,True,False,False,False,False,False,False,False,False,False,False,7.195652173913044,5.0456594445252305
675,676,676,https://www.goodreads.com/book/show/3980.From_the_Mixed_Up_Files_of_Mrs_Basil_E_Frankweiler,3980.0,From the Mixed-Up Files of Mrs. Basil E. Frankweiler,E.L. Konigsburg,11738,162,4.14,7427,195447,178,1967.0,False,"Fiction, Childrens, Young Adult, Childrens, Middle Grade, Mystery, Classics, Realistic Fiction, Adventure, Childrens, Juvenile, Academic, School","Newbery Medal (1968), Lewis Carroll Shelf Award (1968), Dorothy Canfield Fisher Children's Book Award Nominee (1969), William Allen White Children's Book Award (1970)",4,"New York City, New York, Connecticut",True,False,True,True,False,False,False,False,False,False,True,True,False,False,True,True,False,True,False,True,False,False,False,False,False,False,False,True,False,False,False,False,False,False,False,False,False,False,False,False,False,True,False,False,False,False,False,False,False,False,7.8478260869565215,5.697833357568708
676,677,677,https://www.goodreads.com/book/show/47989.Night_Watch,47989.0,Night Watch,Terry Pratchett,11683,146,4.46,2448,99758,480,2002.0,True,"Fantasy, Fiction, Humor, Humor, Comedy, Science Fiction, Time Travel, Science Fiction Fantasy, Audiobook, Science Fiction, Novels, Fantasy, High Fantasy","Locus Award Nominee for Best Fantasy Novel (2003), Prometheus Award for Best Novel (2003), Tähtifantasia Award Nominee (2011)",3,"Ankh-Morpork, Discworld",True,True,False,False,True,False,False,False,False,True,False,False,False,True,False,False,False,False,False,False,True,False,False,False,False,False,False,False,False,False,False,False,False,False,False,True,False,False,False,False,False,False,False,False,False,False,False,False,False,True,8.891304347826088,6.741311618438274
677,678,678,https://www.goodreads.com/book/show/1431.Veronika_Decides_to_Die,1431.0,Veronika Decides to Die,Paulo Coelho,11661,144,3.71,8484,183590,210,1998.0,True,"Fiction, Contemporary, Philosophy, Novels, Psychology, Romance, Drama, Health, Mental Health, Literature, Spirituality",nan,0,Ljubljana,True,False,False,False,True,True,True,False,False,False,False,False,True,False,False,False,False,False,False,False,False,False,False,False,False,False,True,False,False,False,False,False,False,True,False,False,False,False,False,False,False,False,False,False,False,False,False,False,False,False,6.445652173913044,4.2956594445252305
678,679,679,https://www.goodreads.com/book/show/29588376-the-lies-of-locke-lamora,29588376.0,The Lies of Locke Lamora,Scott Lynch,11538,131,4.26,15692,241887,752,2006.0,True,"Fantasy, Fiction, Adventure, Adult, Fantasy, High Fantasy, Fantasy, Epic Fantasy, Audiobook, Science Fiction Fantasy, Mystery, Mystery, Crime","Locus Award Nominee for Best Fantasy Novel and Best First Novel (2007), World Fantasy Award Nominee for Best Novel (2007), Compton Crook Award Nominee (2007), Grand Prix de l'Imaginaire Nominee for Roman étranger (2008), Tähtifantasia Award Nominee (2008), British Fantasy Award Nominee for Best Novel (2007)",6,Camorr,True,True,False,False,False,False,False,False,False,True,True,True,False,True,False,True,False,False,False,False,True,False,False,False,False,False,False,False,False,False,False,False,False,False,False,False,False,False,False,False,True,False,False,False,False,False,False,False,False,True,8.23913043478261,6.089137705394795
679,680,680,https://www.goodreads.com/book/show/1582996.City_of_Ashes,1582996.0,City of Ashes,Cassandra Clare,11528,164,4.15,30510,792215,453,2008.0,True,"Fantasy, Young Adult, Fantasy, Paranormal, Romance, Fantasy, Urban Fantasy, Paranormal, Vampires, Fiction, Fantasy, Supernatural, Paranormal, Angels, Fantasy, Magic","Gaylactic Spectrum Award Nominee for Best Novel (2009), Premio El Templo de las Mil Puertas Nominee for Mejor novela extranjera perteneciente a saga (2009)",2,"New York City, New York",True,True,False,True,False,False,True,False,False,False,True,False,False,False,False,False,False,False,True,False,False,False,True,False,False,True,False,False,False,False,True,False,False,False,False,False,False,False,False,True,False,False,False,False,False,False,False,False,False,False,7.880434782608697,5.730442053220884
680,681,681,https://www.goodreads.com/book/show/852470.I_d_Tell_You_I_Love_You_But_Then_I_d_Have_to_Kill_You,852470.0,"I'd Tell You I Love You, But Then I'd Have to Kill You",Ally Carter,11518,143,3.82,7610,181109,284,2006.0,True,"Young Adult, Romance, Mystery, Contemporary, Fiction, Spy Thriller, Espionage, Womens Fiction, Chick Lit, Adventure, Young Adult, Teen, Realistic Fiction","Georgia Peach Book Award Nominee for Honor book (2007), Lincoln Award Nominee (2010)",2,"Roseville, Virginia",True,False,False,True,False,False,True,False,False,False,True,True,True,False,False,True,False,False,False,False,False,False,False,False,False,False,False,False,False,True,False,False,False,False,False,False,True,False,False,False,False,True,True,True,False,False,False,False,False,False,6.804347826086956,4.654355096699144
681,682,682,https://www.goodreads.com/book/show/4953.A_Heartbreaking_Work_of_Staggering_Genius,4953.0,A Heartbreaking Work of Staggering Genius,Dave Eggers,11501,147,3.68,9286,176956,485,2000.0,False,"Fiction, Contemporary, Literature, Novels, Humor, Biography Memoir, Literature, American, Unfinished, Adult, Literary Fiction","Pulitzer Prize Nominee for General Nonfiction (2001), Guardian First Book Award Nominee (2000), Borders Original Voices Award for Nonfiction (2000), Puddly Award for Memoir (2001)",4,nan,True,False,False,False,True,True,False,False,False,False,True,False,True,False,False,False,False,False,False,False,False,False,False,False,True,False,False,False,True,False,False,False,False,False,False,True,False,False,False,False,False,False,False,False,False,False,False,False,False,False,6.347826086956522,4.19783335756871
682,683,683,https://www.goodreads.com/book/show/2052.The_Big_Sleep,2052.0,The Big Sleep,Raymond Chandler,11497,156,3.96,6016,136437,231,1939.0,True,"Mystery, Fiction, Classics, Mystery, Crime, Mystery, Noir, Mystery, Detective, Thriller, Mystery Thriller, Thriller, Novels, Literature, American","Anthony Award Nominee for Best Novel of the Century (2000), CWA Best Ever Nominee for Crime Novel (2013)",2,"Los Angeles, California, California",True,False,True,False,True,True,False,False,False,False,False,False,False,False,False,True,False,False,False,False,False,False,False,False,False,False,False,False,True,True,False,False,False,False,False,False,False,False,False,False,True,False,False,False,False,False,False,False,False,False,7.260869565217391,5.110876835829578
683,684,684,https://www.goodreads.com/book/show/452306.The_Sisterhood_of_the_Traveling_Pants,452306.0,The Sisterhood of the Traveling Pants,Ann Brashares,11492,165,3.8,7508,643105,294,2001.0,True,"Young Adult, Fiction, Womens Fiction, Chick Lit, Contemporary, Romance, Young Adult, Teen, Realistic Fiction, Childrens, Young Adult, Coming Of Age, Young Adult, Young Adult Contemporary","Book Sense Book of the Year Award for Children's Literature (2002), South Carolina Book Award Nominee for Young Adult Book Award (2004), Maryland Black-Eyed Susan Book Award for High School (2003), Rhode Island Teen Book Award (2002), Evergreen Teen Book Award (2004), Pacific Northwest Library Association Young Reader's Choice Award for Senior (2004), Deutscher Jugendliteraturpreis Nominee for Preis der Jugendjury (2003), Iowa Teen Award (2004), Eliot Rosewater Indiana High School Book Award (2004), Lincoln Award Nominee (2007), Missouri Gateway Readers Award (2004), Oklahoma Sequoyah Award for YA (2004)",12,"Santorini, South Carolina, Bethesda, Maryland, Loreto, Baja California Sur",True,False,False,True,False,False,True,False,False,False,True,False,True,False,True,False,False,False,False,False,False,False,False,False,False,False,False,False,False,False,False,False,False,False,False,False,True,False,False,False,False,True,True,True,False,False,False,False,False,False,6.739130434782608,4.589137705394795
684,685,685,https://www.goodreads.com/book/show/8682.Jitterbug_Perfume,8682.0,Jitterbug Perfume,Tom Robbins,11459,145,4.21,3702,71938,342,1984.0,False,"Fiction, Fantasy, Humor, Magical Realism, Literature, Novels, Contemporary, Literature, American, Classics, Literary Fiction",nan,0,nan,True,True,True,False,True,True,False,False,False,False,False,False,True,False,False,False,False,False,False,False,False,False,True,False,True,False,False,False,True,False,False,False,False,False,False,True,False,False,False,False,False,False,False,False,False,False,False,False,False,False,8.076086956521738,5.926094227133927
685,686,686,https://www.goodreads.com/book/show/14249.Prodigal_Summer,14249.0,Prodigal Summer,Barbara Kingsolver,11445,157,4.0,6366,101671,444,2000.0,False,"Fiction, Contemporary, Environment, Nature, Novels, Literary Fiction, Adult Fiction, Adult, Literature, Environment, Audiobook",nan,0,"Egg Fork, Zebulon County, Kentucky, Kentucky, Appalachia",True,False,False,False,True,True,False,False,False,True,True,False,True,False,False,False,False,False,False,False,False,True,False,False,True,False,False,False,False,False,False,False,False,False,False,False,False,False,False,False,False,False,False,False,False,False,False,False,False,False,7.391304347826088,5.241311618438274
686,687,687,https://www.goodreads.com/book/show/3388.Corelli_s_Mandolin,3388.0,Corelli's Mandolin,Louis de Bernières,11438,155,3.99,2869,79003,437,1994.0,False,"Fiction, Historical, Historical Fiction, Romance, Classics, War, Historical, Cultural, Greece, War, World War II, Novels, Literature",Commonwealth Writers' Prize for Best Book Overall (1995),1,"Cephallonia, Greece",True,False,True,False,True,True,True,True,True,False,False,False,False,False,False,False,True,False,False,False,False,False,False,False,False,False,False,False,False,False,False,False,False,False,False,False,False,False,False,False,False,False,False,False,False,False,False,True,False,False,7.358695652173914,5.208702922786101
687,689,689,https://www.goodreads.com/book/show/6882.Papillon,6882.0,Papillon,Henri Charrière,11388,159,4.21,2218,60256,544,1969.0,True,"Nonfiction, Biography, Classics, Adventure, Autobiography, Memoir, Biography, Autobiography, Cultural, France, History, Mystery, Crime, Biography Memoir",nan,0,"Devil's Island, French Guiana, Paris",False,False,True,False,False,False,False,False,False,False,False,True,False,False,False,True,True,False,False,False,False,False,False,False,False,False,False,False,False,False,False,False,False,False,False,False,False,False,True,False,True,False,False,False,False,False,False,False,False,False,8.076086956521738,5.926094227133927
688,690,690,https://www.goodreads.com/book/show/88077.The_Magic_Mountain,88077.0,The Magic Mountain,Thomas Mann,11305,141,4.09,2401,40846,706,1924.0,False,"Fiction, Classics, European Literature, German Literature, Literature, Philosophy, Novels, Cultural, Germany, Literature, 20th Century, Literary Fiction, Nobel Prize",Helen and Kurt Wolff Translator's Prize for John E. Woods (1996),1,"Switzerland, Italy, Davos, Hamburg",True,False,True,False,True,True,False,False,False,False,False,False,False,False,False,False,True,False,False,False,False,False,False,True,True,False,False,False,False,False,False,False,False,True,False,False,False,False,False,False,False,False,False,False,True,False,False,False,False,False,7.684782608695652,5.534789879307839
689,691,691,https://www.goodreads.com/book/show/323355.The_Book_of_Mormon,323355.0,The Book of Mormon: Another Testament of Jesus Christ,Anonymous,11303,124,4.32,6028,77709,531,1830.0,False,"Religion, Nonfiction, Christianity, Lds, Religion, Church, Spirituality, History, Classics, Inspirational, Reference, Christian",nan,0,nan,False,False,True,False,False,False,False,False,False,False,False,False,False,False,False,False,False,False,False,False,False,False,False,False,False,False,False,False,False,False,False,False,False,False,False,False,False,False,True,False,False,False,False,False,False,False,False,False,False,False,8.434782608695652,6.28478987930784
690,692,692,https://www.goodreads.com/book/show/6295.Howl_and_Other_Poems,6295.0,Howl and Other Poems,Allen Ginsberg,11240,159,4.12,1796,97456,56,1956.0,False,"Poetry, Classics, Fiction, Literature, American, Literature, LGBT, Literature, 20th Century, GLBT, Queer, Literature, Banned Books, Academic, School",nan,0,United States of America,True,False,True,False,False,True,False,False,False,False,False,False,False,False,False,False,False,True,False,True,False,False,False,False,False,False,False,False,True,False,False,False,False,False,False,False,False,False,False,False,False,False,False,False,True,False,False,False,True,False,7.782608695652174,5.632615966264361
