,index,Unnamed: 0,url,book_id,title,author,good_read_score,good_read_votes,avg_rating,num_reviews,num_ratings,num_pages,original_publish_year,series,genres,awards,award_count,place,Fiction,Fantasy,Classics,Young Adult,Novels,Literature,Romance,Historical,Historical Fiction,Audiobook,Adult,Adventure,Contemporary,Science Fiction,Childrens,Mystery,Cultural,Academic,Paranormal,School,Science Fiction Fantasy,Adult Fiction,Magic,European Literature,Literary Fiction,Urban Fantasy,Drama,Middle Grade,American,Thriller,Supernatural,Dystopia,Horror,Philosophy,Classic Literature,Humor,Teen,Paranormal Romance,Nonfiction,Vampires,Crime,Realistic Fiction,Chick Lit,Womens Fiction,20th Century,British Literature,Young Adult Fantasy,War,Poetry,High Fantasy,MINMAX/norm Average Rating,MEAN/norm Average Rating
0,0,0,https://www.goodreads.com/book/show/2767052-the-hunger-games,2767052.0,The Hunger Games,Suzanne Collins,3076236,31349,4.32,175755,6700182,374,2008.0,True,"Young Adult, Fiction, Science Fiction, Dystopia, Fantasy, Science Fiction, Romance, Adventure, Young Adult, Teen, Apocalyptic, Post Apocalyptic, Action","Locus Award Nominee for Best Young Adult Book (2009), Georgia Peach Book Award (2009), Buxtehuder Bulle (2009), Golden Duck Award for Young Adult (Hal Clement Award) (2009), Grand Prix de l'Imaginaire Nominee for Roman jeunesse étranger (2010), Books I Loved Best Yearly (BILBY) Awards for Older Readers (2012), West Australian Young Readers' Book Award (WAYRBA) for Older Readers (2010), Red House Children's Book Award for Older Readers & Overall (2010), South Carolina Book Award for Junior and Young Adult Book (2011), Charlotte Award (2010), Colorado Blue Spruce Young Adult Book Award (2010), Teen Buckeye Book Award (2009), Pennsylvania Young Readers' Choice Award for Young Adults (2010), Rhode Island Teen Book Award (2010), Dorothy Canfield Fisher Children's Book Award (2010), Evergreen Teen Book Award (2011), Soaring Eagle Book Award (2009), Milwaukee County Teen Book Award Nominee (2010), Sakura Medal for Middle School Book (2010), Michigan Library Association Thumbs Up! Award (2009), Florida Teens Read (2009), Deutscher Jugendliteraturpreis for Preis der Jugendjury (2010), Iowa High School Book Award (2011), New Mexico Land of Enchantment Award for Young Adult (2011), Eliot Rosewater Indiana High School Book Award (2010), The Inky Awards for Silver Inky (2009), California Young Readers Medal for Young Adult (2011), Lincoln Award (2011), Kinderboekwinkelprijs (2010), Missouri Truman Readers Award (2011), CYBILS Award for Young Adult Fantasy & Science Fiction (2008), Literaturpreis der Jury der jungen Leser for Jugendbuch (2010), The Inky Awards Shortlist for Silver Inky (2009), Prix Et-lisez-moi (2011), Missouri Gateway Readers Award (2011), Oklahoma Sequoyah Award for High School and Intermediate (2011), Premio El Templo de las Mil Puertas for Mejor novela extranjera perteneciente a saga (2009), Rebecca Caudill Young Readers' Book Award (2011), LovelyBooks Leserpreis for Fantasy (2009), LovelyBooks Leserpreis for Bestes Cover/Umschlag (2009), Premi Protagonista Jove for Categoria 13-14 anys (2010)",41,"District 12, Panem, Capitol, Panem, Panem",True,True,False,True,False,False,True,False,False,False,True,True,False,True,False,False,False,False,False,False,False,False,False,False,False,False,False,False,False,False,False,True,False,False,False,False,True,False,False,False,False,False,False,False,False,False,False,False,False,False,8.434782608695652,6.28478987930784
1,1,1,https://www.goodreads.com/book/show/2.Harry_Potter_and_the_Order_of_the_Phoenix,2.0,Harry Potter and the Order of the Phoenix,J.K. Rowling,2700287,27614,4.5,45541,2660090,870,2003.0,True,"Fantasy, Young Adult, Fiction, Fantasy, Magic, Childrens, Adventure, Audiobook, Childrens, Middle Grade, Classics, Science Fiction Fantasy","Bram Stoker Award for Works for Young Readers (2003), Anthony Award for Young Adult (2004), Mythopoeic Fantasy Award for Children's Literature (2008), Audie Award for Audiobook of the Year (2004), Books I Loved Best Yearly (BILBY) Awards for Older Readers (2004), Colorado Blue Spruce Young Adult Book Award (2006), Golden Archer Award for Middle/Junior High (2005), Deutscher Jugendliteraturpreis Nominee for Preis der Jugendjury (2004), Carnegie Medal Nominee (2003)",9,"Hogwarts School of Witchcraft and Wizardry, London, England",True,True,True,True,False,False,False,False,False,True,True,True,False,True,True,False,False,False,False,False,True,False,True,False,False,False,False,True,False,False,False,False,False,False,False,False,False,False,False,False,False,False,False,False,False,False,False,False,False,False,9.021739130434783,6.87174640104697
2,2,2,https://www.goodreads.com/book/show/2657.To_Kill_a_Mockingbird,2657.0,To Kill a Mockingbird,Harper Lee,2337619,24019,4.28,95315,4759651,324,1960.0,False,"Classics, Fiction, Historical, Historical Fiction, Academic, School, Literature, Young Adult, Historical, Novels, Academic, Read For School, Young Adult, High School","Pulitzer Prize for Fiction (1961), Audie Award for Classic (2007), National Book Award Finalist for Fiction (1961), Alabama Author Award for Fiction (1961)",4,"Maycomb, Alabama, Alabama",True,False,True,True,True,True,False,True,True,False,True,False,False,False,False,False,False,True,False,True,False,False,False,False,False,False,False,False,False,False,False,False,False,False,False,False,False,False,False,False,False,False,False,False,False,False,False,False,False,False,8.304347826086957,6.154355096699145
3,3,3,https://www.goodreads.com/book/show/1885.Pride_and_Prejudice,1885.0,Pride and Prejudice,Jane Austen,2075005,21381,4.27,73599,3195107,279,1813.0,False,"Classics, Fiction, Romance, Historical, Historical Fiction, Literature, Historical, Novels, Romance, Historical Romance, Adult, Classics, Classic Literature",nan,0,"United Kingdom, Derbyshire, England, England, Hertfordshire, England",True,False,True,False,True,True,True,True,True,False,True,False,False,False,False,False,False,False,False,False,False,False,False,False,False,False,False,False,False,False,False,False,False,False,True,False,False,False,False,False,False,False,False,False,False,False,False,False,False,False,8.271739130434781,6.121746401046969
4,4,4,https://www.goodreads.com/book/show/41865.Twilight,41865.0,Twilight,Stephenie Meyer,1483269,15119,3.61,107395,5217549,501,2005.0,True,"Young Adult, Fantasy, Romance, Fiction, Paranormal, Vampires, Fantasy, Paranormal, Romance, Paranormal Romance, Fantasy, Supernatural, Young Adult, Teen, Fantasy, Urban Fantasy","Georgia Peach Book Award (2007), Buxtehuder Bulle (2006), Kentucky Bluegrass Award for 9-12 (2007), Prijs van de Kinder- en Jeugdjury Vlaanderen (2008), Books I Loved Best Yearly (BILBY) Awards for Older Readers (2009), West Australian Young Readers' Book Award (WAYRBA) for Older Readers (2008), Garden State Book Award for Fiction (Grades 9-12) (2008), South Carolina Book Award for Young Adult Book Award (2008), Grand Canyon Reader Award for Teen Book (2008), Maryland Black-Eyed Susan Book Award for High School (2008), Golden Sower Award for Young Adult (2009), Nevada Young Readers' Award for Young Adult Category  (2007), The Flume: New Hampshire Teen Reader's Choice Award (2007), Pennsylvania Young Readers' Choice Award for Young Adult (2009), Rhode Island Teen Book Award (2007), Evergreen Teen Book Award (2008), Michigan Library Association Thumbs Up! Award Nominee (2006), Teen Read Award Nominee for Best All-Time-Fave (2010), Deutscher Jugendliteraturpreis Nominee for Preis der Jugendjury (2007), Iowa High School Book Award (2008), Eliot Rosewater Indiana High School Book Award (2008), Lincoln Award (2008), Literaturpreis der Jury der jungen Leser for Cover (2007), Prix Et-lisez-moi (2008), Missouri Gateway Readers Award (2008)",25,"Forks, Washington, Phoenix, Arizona, Washington (state)",True,True,False,True,False,False,True,False,False,False,True,False,False,False,False,False,False,False,True,False,False,False,False,False,False,True,False,False,False,False,True,False,False,False,False,False,True,True,False,True,False,False,False,False,False,False,False,False,False,False,6.119565217391304,3.9695724880034913
5,5,5,https://www.goodreads.com/book/show/19063.The_Book_Thief,19063.0,The Book Thief,Markus Zusak,1433461,14784,4.38,116994,1947564,552,2005.0,False,"Historical, Historical Fiction, Fiction, Young Adult, Historical, Classics, War, World War II, Holocaust, War, World War II, Writing, Books About Books, Audiobook","National Jewish Book Award for Children’s and Young Adult Literature (2006), Book Sense Book of the Year Award for Children's Literature (2007), Buxtehuder Bulle (2008), Sydney Taylor Book Award for Teen Readers (2007), Prijs van de Kinder- en Jeugdjury Vlaanderen (2009), Michael L. Printz Award Nominee (2007), Exclusive Books Boeke Prize (2007), Rhode Island Teen Book Award Nominee (2008), The Quill Award Nominee for Young Adult/Teen (2006), Zilveren Zoen (2008), Teen Read Award Nominee for Best All-Time-Fave (2010), Deutscher Jugendliteraturpreis for Preis der Jugendjury (2009), Association of Jewish Libraries for Teen Book Award (2006), Lincoln Award Nominee (2010), Australian Book Industry Award (ABIA) Nominee for Literary Fiction (2008), Kathleen Mitchell Award, Ena Noel Award (2008), Literaturpreis der Jury der jungen Leser for Jugendbuch (2009), LovelyBooks Leserpreis for Allgemeine Literatur (2009), Margaret A. Edwards Award (2014)",20,"Molching, Germany",True,False,True,True,False,False,False,True,True,True,True,False,False,False,False,False,False,False,False,False,False,False,False,False,False,False,False,False,False,False,False,False,False,False,False,False,False,False,False,False,False,False,False,False,False,False,False,True,False,False,8.630434782608695,6.480442053220883
6,6,6,https://www.goodreads.com/book/show/170448.Animal_Farm,170448.0,Animal Farm,George Orwell,1317112,13678,3.96,61260,2917365,141,1945.0,False,"Classics, Fiction, Science Fiction, Dystopia, Fantasy, Literature, Politics, Academic, School, Science Fiction, Novels, Academic, Read For School","Prometheus Hall of Fame Award (2011), Retro Hugo Award for Best Novella (1996)",2,"England, United Kingdom",True,True,True,False,True,True,False,False,False,False,False,False,False,True,False,False,False,True,False,True,False,False,False,False,False,False,False,False,False,False,False,True,False,False,False,False,False,False,False,False,False,False,False,False,False,False,False,False,False,False,7.260869565217391,5.110876835829578
7,7,7,https://www.goodreads.com/book/show/11127.The_Chronicles_of_Narnia,11127.0,The Chronicles of Narnia,C.S. Lewis,1269128,13261,4.26,10704,546845,767,1956.0,True,"Fantasy, Classics, Fiction, Young Adult, Childrens, Christian, Adventure, Childrens, Middle Grade, Science Fiction Fantasy, Christian Fiction",nan,0,"London, England",True,True,True,True,False,False,False,False,False,False,True,True,False,True,True,False,False,False,False,False,True,False,False,False,False,False,False,True,False,False,False,False,False,False,False,False,False,False,False,False,False,False,False,False,False,False,False,False,False,False,8.23913043478261,6.089137705394795
8,8,8,https://www.goodreads.com/book/show/30.J_R_R_Tolkien_4_Book_Boxed_Set,30.0,J.R.R. Tolkien 4-Book Boxed Set: The Hobbit and The Lord of the Rings,J.R.R. Tolkien,1203644,12555,4.6,1846,114804,1728,1955.0,True,"Fantasy, Fiction, Classics, Adventure, Science Fiction Fantasy, Fantasy, Epic Fantasy, Fantasy, High Fantasy, Young Adult, Literature, Fantasy, Magic",nan,0,Middle-earth,True,True,True,True,False,True,False,False,False,False,True,True,False,True,False,False,False,False,False,False,True,False,True,False,False,False,False,False,False,False,False,False,False,False,False,False,False,False,False,False,False,False,False,False,False,False,False,False,False,True,9.347826086956522,7.197833357568708
9,9,9,https://www.goodreads.com/book/show/11870085-the-fault-in-our-stars,11870085.0,The Fault in Our Stars,John Green,1120595,11631,4.19,158320,3790358,313,2012.0,False,"Young Adult, Romance, Fiction, Contemporary, Realistic Fiction, Young Adult, Teen, Young Adult, Coming Of Age, Novels, Drama, Love","Georgia Peach Book Award (2013), Buxtehuder Bulle (2012), Odyssey Award (2013), Audie Award for Teens (2013), West Australian Young Readers' Book Award (WAYRBA) for Older Readers (2013), Pennsylvania Young Readers' Choice Award for Young Adults (2013), Rhode Island Teen Book Award (2014), Evergreen Teen Book Award (2015), Soaring Eagle Book Award (2014), Milwaukee County Teen Book Award (2013), Indies Choice Book Award for Young Adult (2013), Deutscher Jugendliteraturpreis for Preis der Jugendjury (2013), Amelia Elizabeth Walden Award (2013), Dioraphte Jongerenliteratuurprijs for vertaald boek en publieksprijs (2013), The Inky Awards for Silver Inky (2012), California Young Readers Medal for Young Adult (2015), Lincoln Award (2014), Luisterboek Award (2015), Goodreads Choice Award for Young Adult Fiction (2012) and Nominee for Best of the Best  (2018), Green Mountain Book Award (2014), The Inky Awards Shortlist for Silver Inky (2012), Louisiana Teen Readers' Choice (2015), Missouri Gateway Readers Award (2015), Oklahoma Sequoyah Award for High School (2015), Alabama Author Award for Young Adult (2013), Premio El Templo de las Mil Puertas for Mejor novela extranjera independiente (2012), FAB Award Nominee (2014), Premi Protagonista Jove for Categoria 15-16 anys (2013)",28,"Indianapolis, Indiana, Amsterdam",True,False,False,True,True,False,True,False,False,False,True,False,True,False,False,False,False,False,False,False,False,False,False,False,False,False,True,False,False,False,False,False,False,False,False,False,True,False,False,False,False,True,False,False,False,False,False,False,False,False,8.010869565217392,5.860876835829579
10,10,10,https://www.goodreads.com/book/show/18405.Gone_with_the_Wind,18405.0,Gone with the Wind,Margaret Mitchell,1099157,11329,4.3,20530,1104716,1037,1936.0,False,"Classics, Historical, Historical Fiction, Fiction, Romance, Historical, War, Literature, Military History, Civil War, Romance, Historical Romance, Novels","Pulitzer Prize for Novel (1937), National Book Award for Novel (1936)",2,"Atlanta, Georgia",True,False,True,False,True,True,True,True,True,False,False,False,False,False,False,False,False,False,False,False,False,False,False,False,False,False,False,False,False,False,False,False,False,False,False,False,False,False,False,False,False,False,False,False,False,False,False,True,False,False,8.369565217391305,6.219572488003491
11,11,11,https://www.goodreads.com/book/show/370493.The_Giving_Tree,370493.0,The Giving Tree,Shel Silverstein,1039948,10784,4.37,18595,950571,64,1964.0,False,"Childrens, Childrens, Picture Books, Classics, Fiction, Poetry, Young Adult, Fantasy, Childrens, Juvenile, Kids, Short Stories",nan,0,nan,True,True,True,True,False,False,False,False,False,False,True,False,False,False,True,False,False,False,False,False,False,False,False,False,False,False,False,False,False,False,False,False,False,False,False,False,False,False,False,False,False,False,False,False,False,False,False,False,True,False,8.597826086956523,6.44783335756871
12,12,12,https://www.goodreads.com/book/show/6185.Wuthering_Heights,6185.0,Wuthering Heights,Emily Brontë,1002306,10488,3.87,40354,1412272,464,1847.0,False,"Classics, Fiction, Romance, Gothic, Literature, Historical, Historical Fiction, Literature, 19th Century, Novels, Classics, Classic Literature, Historical",nan,0,"Yorkshire Dales, England",True,False,True,False,True,True,True,True,True,False,False,False,False,False,False,False,False,False,False,False,False,False,False,False,False,False,False,False,False,False,False,False,False,False,True,False,False,False,False,False,False,False,False,False,False,False,False,False,False,False,6.967391304347826,4.817398574960014
13,13,13,https://www.goodreads.com/book/show/5297.The_Picture_of_Dorian_Gray,5297.0,The Picture of Dorian Gray,Oscar Wilde,898108,9466,4.09,34383,1038052,272,1890.0,False,"Classics, Fiction, Horror, Fantasy, Literature, Gothic, Novels, Literature, 19th Century, LGBT, Classics, Classic Literature",nan,0,England,True,True,True,False,True,True,False,False,False,False,False,False,False,False,False,False,False,False,False,False,False,False,False,False,False,False,False,False,False,False,False,False,True,False,True,False,False,False,False,False,False,False,False,False,False,False,False,False,False,False,7.684782608695652,5.534789879307839
14,14,14,https://www.goodreads.com/book/show/968.The_Da_Vinci_Code,968.0,The Da Vinci Code,Dan Brown,893962,9408,3.87,48380,2015066,489,2003.0,True,"Fiction, Mystery, Thriller, Suspense, Thriller, Mystery Thriller, Historical, Historical Fiction, Adventure, Novels, Mystery, Crime, Adult","British Book Award for Book of the Year (2005), Book Sense Book of the Year Award for Adult Fiction (2004), Humo's Gouden Bladwijzer (2004), Zilveren Vingerafdruk (2004), The Flume: New Hampshire Teen Reader's Choice Award (2006), Teen Buckeye Book Award (2005), Iowa High School Book Award (2006), Puddly Award for Fiction (2007), Missouri Gateway Readers Award for Adult (2006)",9,"Paris, London, England, France, England, United Kingdom",True,False,False,False,True,False,False,True,True,False,True,True,False,False,False,True,False,False,False,False,False,False,False,False,False,False,False,False,False,True,False,False,False,False,False,False,False,False,False,False,True,False,False,False,False,False,False,False,False,False,6.967391304347826,4.817398574960014
15,15,15,https://www.goodreads.com/book/show/929.Memoirs_of_a_Geisha,929.0,Memoirs of a Geisha,Arthur Golden,874419,9113,4.12,31049,1771831,503,1997.0,False,"Fiction, Historical, Historical Fiction, Romance, Historical, Classics, Cultural, Japan, Adult, Novels, Cultural, Asia, Adult Fiction",nan,0,"Kyoto, Japan",True,False,True,False,True,False,True,True,True,False,True,False,False,False,False,False,True,False,False,False,False,True,False,False,False,False,False,False,False,False,False,False,False,False,False,False,False,False,False,False,False,False,False,False,False,False,False,False,False,False,7.782608695652174,5.632615966264361
16,16,16,https://www.goodreads.com/book/show/386162.The_Hitchhiker_s_Guide_to_the_Galaxy,386162.0,The Hitchhiker's Guide to the Galaxy,Douglas Adams,866468,8939,4.22,32134,1514840,193,1979.0,True,"Science Fiction, Fiction, Humor, Fantasy, Classics, Humor, Comedy, Science Fiction Fantasy, Audiobook, Adventure, Novels",nan,0,nan,True,True,True,False,True,False,False,False,False,True,False,True,False,True,False,False,False,False,False,False,True,False,False,False,False,False,False,False,False,False,False,False,False,False,False,True,False,False,False,False,False,False,False,False,False,False,False,False,False,False,8.108695652173912,5.9587029227861
17,17,17,https://www.goodreads.com/book/show/10210.Jane_Eyre,10210.0,Jane Eyre,Charlotte Brontë,860460,9086,4.13,45272,1702825,532,1847.0,False,"Classics, Fiction, Romance, Historical, Historical Fiction, Gothic, Literature, Historical, Literature, 19th Century, Academic, School, Classics, Classic Literature",nan,0,"Thornfield Hall, England, United Kingdom",True,False,True,False,False,True,True,True,True,False,False,False,False,False,False,False,False,True,False,True,False,False,False,False,False,False,False,False,False,False,False,False,False,False,True,False,False,False,False,False,False,False,False,False,False,False,False,False,False,False,7.815217391304348,5.665224661916535
18,18,18,https://www.goodreads.com/book/show/24213.Alice_s_Adventures_in_Wonderland_Through_the_Looking_Glass,24213.0,Alice's Adventures in Wonderland / Through the Looking-Glass,Lewis Carroll,852804,9008,4.06,11250,480135,239,1871.0,True,"Classics, Fantasy, Fiction, Childrens, Young Adult, Literature, Adventure, Childrens, Middle Grade, Novels, Literature, 19th Century",nan,0,"United Kingdom, England, Wonderland",True,True,True,True,True,True,False,False,False,False,True,True,False,False,True,False,False,False,False,False,False,False,False,False,False,False,False,True,False,False,False,False,False,False,False,False,False,False,False,False,False,False,False,False,False,False,False,False,False,False,7.58695652173913,5.4369637923513165
19,19,19,https://www.goodreads.com/book/show/24280.Les_Mis_rables,24280.0,Les Misérables,Victor Hugo,829701,8720,4.18,18308,704096,1463,1862.0,False,"Classics, Fiction, Historical, Historical Fiction, Literature, Cultural, France, Historical, Novels, European Literature, French Literature, Romance, Classics, Classic Literature",nan,0,"Paris, France",True,False,True,False,True,True,True,True,True,False,False,False,False,False,False,False,True,False,False,False,False,False,False,True,False,False,False,False,False,False,False,False,False,False,True,False,False,False,False,False,False,False,False,False,False,False,False,False,False,False,7.978260869565217,5.8282681401774035
20,20,20,https://www.goodreads.com/book/show/13079982-fahrenheit-451,13079982.0,Fahrenheit 451,Ray Bradbury,817434,8782,3.99,51369,1790373,194,1953.0,False,"Classics, Fiction, Science Fiction, Science Fiction, Dystopia, Academic, School, Literature, Novels, Fantasy, Adult, Science Fiction Fantasy","Prometheus Hall of Fame Award (1984), Geffen Award for Best Translated SF Book (2002), California Book Award for Fiction (Silver) (1953), Retro Hugo Award for Best Novel (2004)",4,nan,True,True,True,False,True,True,False,False,False,False,True,False,False,True,False,False,False,True,False,True,True,False,False,False,False,False,False,False,False,False,False,True,False,False,False,False,False,False,False,False,False,False,False,False,False,False,False,False,False,False,7.358695652173914,5.208702922786101
21,21,21,https://www.goodreads.com/book/show/13335037-divergent,13335037.0,Divergent,Veronica Roth,816671,8581,4.18,109822,3077890,487,2011.0,True,"Young Adult, Science Fiction, Dystopia, Fiction, Fantasy, Science Fiction, Romance, Adventure, Young Adult, Teen, Apocalyptic, Post Apocalyptic, Action","Georgia Peach Book Award (2012), South Carolina Book Award for Young Adult (2014), Rhode Island Teen Book Award (2013), Evergreen Teen Book Award (2014), Soaring Eagle Book Award (2012), Milwaukee County Teen Book Award Nominee (2012), Children's Choice Book Award Nominee for Teen Choice Book of the Year (2012), Sakura Medal, New Mexico Land of Enchantment Award for Young Adult (2014), Eliot Rosewater Indiana High School Book Award (2014), California Young Readers Medal for Young Adult (2014), Lincoln Award Nominee (2014), DABWAHA Romance Tournament for Best Young Adult Romance (2012), Goodreads Choice Award for Favorite Book and for Young Adult Fantasy & Science Fiction and Nominee for Goodreads Author (2011), Green Mountain Book Award (2013), The Magnolia Award for 6-8 (2014), Louisiana Teen Readers' Choice (2014), Missouri Gateway Readers Award (2014), Oklahoma Sequoyah Award for High Schol (2014), Premio El Templo de las Mil Puertas Nominee for Mejor novela extranjera perteneciente a saga (2011)",20,"Chicago, Illinois",True,True,False,True,False,False,True,False,False,False,True,True,False,True,False,False,False,False,False,False,False,False,False,False,False,False,False,False,False,False,False,True,False,False,False,False,True,False,False,False,False,False,False,False,False,False,False,False,False,False,7.978260869565217,5.8282681401774035
22,22,22,https://www.goodreads.com/book/show/22628.The_Perks_of_Being_a_Wallflower,22628.0,The Perks of Being a Wallflower,Stephen Chbosky,791794,8321,4.2,60694,1320875,213,1999.0,False,"Young Adult, Fiction, Contemporary, Young Adult, Coming Of Age, Romance, Realistic Fiction, Classics, LGBT, Health, Mental Health, Young Adult, Teen",nan,0,"Pittsburgh, Pennsylvania",True,False,True,True,False,False,True,False,False,False,True,False,True,False,False,False,False,False,False,False,False,False,False,False,False,False,False,False,False,False,False,False,False,False,False,False,True,False,False,False,False,True,False,False,False,False,False,False,False,False,8.043478260869566,5.893485531481754
23,23,23,https://www.goodreads.com/book/show/7624.Lord_of_the_Flies,7624.0,Lord of the Flies,William Golding,789348,8396,3.69,39987,2366862,182,1954.0,False,"Classics, Fiction, Young Adult, Academic, School, Literature, Science Fiction, Dystopia, Novels, Academic, Read For School, Young Adult, High School, Adventure",nan,0,nan,True,False,True,True,True,True,False,False,False,False,True,True,False,True,False,False,False,True,False,True,False,False,False,False,False,False,False,False,False,False,False,True,False,False,False,False,False,False,False,False,False,False,False,False,False,False,False,False,False,False,6.380434782608695,4.230442053220882
24,24,24,https://www.goodreads.com/book/show/4671.The_Great_Gatsby,4671.0,The Great Gatsby,F. Scott Fitzgerald,789113,8493,3.93,71800,3987371,200,1925.0,False,"Classics, Fiction, Academic, School, Historical, Historical Fiction, Literature, Romance, Novels, Academic, Read For School, Young Adult, High School, Literature, American","Grammy Award Nominee for Best Spoken Word Album (2003), Long Island Reads (2002)",2,"New York City, New York, New York State, Long Island, New York",True,False,True,True,True,True,True,True,True,False,True,False,False,False,False,False,False,True,False,True,False,False,False,False,False,False,False,False,True,False,False,False,False,False,False,False,False,False,False,False,False,False,False,False,False,False,False,False,False,False,7.163043478260871,5.013050748873058
