,index,Unnamed: 0,url,book_id,title,author,good_read_score,good_read_votes,avg_rating,num_reviews,num_ratings,num_pages,original_publish_year,series,genres,awards,award_count,place,Fiction,Fantasy,Classics,Young Adult,Novels,Literature,Romance,Historical,Historical Fiction,Audiobook,Adult,Adventure,Contemporary,Science Fiction,Childrens,Mystery,Cultural,Academic,Paranormal,School,Science Fiction Fantasy,Adult Fiction,Magic,European Literature,Literary Fiction,Urban Fantasy,Drama,Middle Grade,American,Thriller,Supernatural,Dystopia,Horror,Philosophy,Classic Literature,Humor,Teen,Paranormal Romance,Nonfiction,Vampires,Crime,Realistic Fiction,Chick Lit,Womens Fiction,20th Century,British Literature,Young Adult Fantasy,War,Poetry,High Fantasy,MINMAX/norm Average Rating,MEAN/norm Average Rating
410,410,410,https://www.goodreads.com/book/show/4980.Breakfast_of_Champions,4980.0,Breakfast of Champions,Kurt Vonnegut Jr.,26880,339,4.07,7277,230030,303,1973.0,False,"Fiction, Classics, Science Fiction, Humor, Literature, Novels, Literature, American, Literary Fiction, Audiobook, Humor, Comedy",nan,0,United States of America,True,False,True,False,True,True,False,False,False,True,False,False,False,True,False,False,False,False,False,False,False,False,False,False,True,False,False,False,True,False,False,False,False,False,False,True,False,False,False,False,False,False,False,False,False,False,False,False,False,False,7.6195652173913055,5.469572488003493
411,411,411,https://www.goodreads.com/book/show/22463.The_Origin_of_Species,22463.0,The Origin of Species,Charles Darwin,26825,368,3.98,2566,104138,703,1859.0,False,"Science, Nonfiction, Classics, Science, Biology, Biology, Evolution, Philosophy, History, Environment, Nature, Anthropology, Science, Natural History",nan,0,nan,False,False,True,False,False,False,False,False,False,False,False,False,False,False,False,False,False,False,False,False,False,False,False,False,False,False,False,False,False,False,False,False,False,True,False,False,False,False,True,False,False,False,False,False,False,False,False,False,False,False,7.326086956521739,5.176094227133926
412,412,412,https://www.goodreads.com/book/show/51496.The_Strange_Case_of_Dr_Jekyll_and_Mr_Hyde,51496.0,The Strange Case of Dr. Jekyll and Mr. Hyde,Robert Louis Stevenson,26784,390,3.83,14302,414291,144,1886.0,False,"Classics, Fiction, Horror, Science Fiction, Mystery, Gothic, Fantasy, Literature, Literature, 19th Century, Academic, School",Independent Publisher Book Award (IPPY) for Audio Fiction - Abridged (1999),1,"London, England, England, United Kingdom",True,True,True,False,False,True,False,False,False,False,False,False,False,True,False,True,False,True,False,True,False,False,False,False,False,False,False,False,False,False,False,False,True,False,False,False,False,False,False,False,False,False,False,False,False,False,False,False,False,False,6.836956521739132,4.686963792351317
413,413,413,https://www.goodreads.com/book/show/10644930-11-22-63,10644930.0,11/22/63,Stephen King,26700,322,4.3,39445,444700,849,2011.0,False,"Fiction, Historical, Historical Fiction, Science Fiction, Science Fiction, Time Travel, Fantasy, Horror, Thriller, Audiobook, Historical, Mystery","Locus Award Nominee for Best SF Novel (2012), World Fantasy Award Nominee for Best Novel (2012), ITW Thriller Award for Best Hard Cover Novel (2012), Grand Prix de l'Imaginaire Nominee for Roman étranger (2014), British Fantasy Award Nominee for Best Novel (2012), このミステリーがすごい！ for Best Translated Mystery Novel of the Year in Japan (2014), 本屋大賞 Nominee for Translated Fiction (2014), Goodreads Choice Award for Science Fiction (2011) and Nominee for Best of the Best  (2018)",8,"Maine, Derry, Maine, Jodie, Texas",True,True,False,False,False,False,False,True,True,True,False,False,False,True,False,True,False,False,False,False,False,False,False,False,False,False,False,False,False,True,False,False,True,False,False,False,False,False,False,False,False,False,False,False,False,False,False,False,False,False,8.369565217391305,6.219572488003491
414,414,414,https://www.goodreads.com/book/show/5211.A_Fine_Balance,5211.0,A Fine Balance,Rohinton Mistry,26633,319,4.34,9364,134429,603,1995.0,False,"Fiction, Cultural, India, Historical, Historical Fiction, Asian Literature, Indian Literature, Cultural, Canada, Cultural, Asia, Literary Fiction, Novels, Historical, Literature","Booker Prize Nominee (1996), Winifred Holtby Memorial Prize (1996), Scotiabank Giller Prize (1995), Los Angeles Times Book Prize for Fiction (1996), Commonwealth Writers' Prize for Best Book Overall (1996), CBC Canada Reads Nominee (2002), International Dublin Literary Award Nominee for Shortlist (1997)",7,"India, Bombay",True,False,False,False,True,True,False,True,True,False,False,False,False,False,False,False,True,False,False,False,False,False,False,False,True,False,False,False,False,False,False,False,False,False,False,False,False,False,False,False,False,False,False,False,False,False,False,False,False,False,8.5,6.3500072706121875
415,415,415,https://www.goodreads.com/book/show/8490112-daughter-of-smoke-bone,8490112.0,Daughter of Smoke & Bone,Laini Taylor,26575,313,3.99,30084,332580,418,2011.0,True,"Fantasy, Young Adult, Romance, Fantasy, Paranormal, Paranormal, Angels, Fantasy, Urban Fantasy, Fiction, Fantasy, Magic, Young Adult, Young Adult Fantasy, Fantasy, Supernatural","Locus Award Nominee for Best Young Adult Novel (2012), Audie Award for Fantasy (2012), Rhode Island Teen Book Award Nominee (2013), Milwaukee County Teen Book Award Nominee (2013), Children's Choice Book Award Nominee for Teen Choice Book of the Year (2012), The Inky Awards Nominee for Silver Inky (2012), California Young Readers Medal Nominee for Young Adult (2015), Oregon Spirit Book Award for Young Adult (2011), Lincoln Award Nominee (2014), Andre Norton Award Nominee (2011), Goodreads Choice Award Nominee for Young Adult Fantasy & Science Fiction and for Favorite Book (2011), The Inky Awards Shortlist for Silver Inky (2012), Missouri Gateway Readers Award Nominee (2014), Premio El Templo de las Mil Puertas Nominee for Mejor novela extranjera perteneciente a saga (2012)",14,"Prague (Praha), Marrakech (Marrakesh), Eretz",True,True,False,True,False,False,True,False,False,False,True,False,False,False,False,False,False,False,True,False,False,False,True,False,False,True,False,False,False,False,True,False,False,False,False,False,False,False,False,False,False,False,False,False,False,False,True,False,False,False,7.358695652173914,5.208702922786101
416,416,416,https://www.goodreads.com/book/show/3975774-evermore,3975774.0,Evermore,Alyson Noel,26532,321,3.59,9861,274105,301,2009.0,True,"Young Adult, Fantasy, Fantasy, Paranormal, Romance, Romance, Paranormal Romance, Fantasy, Supernatural, Fiction, Fantasy, Urban Fantasy, Paranormal, Vampires, Fantasy, Magic","Lincoln Award Nominee (2011), Goodreads Choice Award Nominee for Favorite Book & Young Adult Series (2009)",2,"Laguna Beach, California",True,True,False,True,False,False,True,False,False,False,True,False,False,False,False,False,False,False,True,False,False,False,True,False,False,True,False,False,False,False,True,False,False,False,False,False,False,True,False,True,False,False,False,False,False,False,False,False,False,False,6.054347826086956,3.9043550966991427
417,417,417,https://www.goodreads.com/book/show/12898.Death_of_a_Salesman,12898.0,Death of a Salesman,Arthur  Miller,26202,407,3.54,5046,194501,117,1949.0,False,"Plays, Classics, Fiction, Drama, Academic, School, Plays, Theatre, Literature, Academic, Read For School, Young Adult, High School, Literature, American","Pulitzer Prize for Drama (1949), New York Drama Critics' Circle Award for Best American Play (1949)",2,"New York City, New York",True,False,True,True,False,True,False,False,False,False,True,False,False,False,False,False,False,True,False,True,False,False,False,False,False,False,True,False,True,False,False,False,False,False,False,False,False,False,False,False,False,False,False,False,False,False,False,False,False,False,5.891304347826088,3.741311618438274
418,418,418,https://www.goodreads.com/book/show/41637836-the-subtle-knife,41637836.0,The Subtle Knife,Philip Pullman,26177,352,4.13,10726,388718,370,1997.0,True,"Fantasy, Young Adult, Fiction, Childrens, Adventure, Science Fiction, Science Fiction Fantasy, Audiobook, Science Fiction, Steampunk, Childrens, Middle Grade","Audie Award for Children's Titles Ages 8-12 (2001), North East Teenage Book Award Nominee (1999)",2,nan,True,True,False,True,False,False,False,False,False,True,True,True,False,True,True,False,False,False,False,False,True,False,False,False,False,False,False,True,False,False,False,False,False,False,False,False,False,False,False,False,False,False,False,False,False,False,False,False,False,False,7.815217391304348,5.665224661916535
419,419,419,https://www.goodreads.com/book/show/1420.Hamlet,1420.0,Hamlet,William Shakespeare,26120,335,4.03,13760,764842,289,1603.0,False,"Classics, Plays, Fiction, Drama, Academic, School, Literature, Plays, Theatre, Academic, Read For School, Young Adult, High School, Poetry",Grammy Award Nominee for Best Spoken Word Album (2012),1,Denmark,True,False,True,True,False,True,False,False,False,False,True,False,False,False,False,False,False,True,False,True,False,False,False,False,False,False,True,False,False,False,False,False,False,False,False,False,False,False,False,False,False,False,False,False,False,False,False,False,True,False,7.489130434782609,5.339137705394797
420,420,420,https://www.goodreads.com/book/show/386187.Midnight_in_the_Garden_of_Good_and_Evil,386187.0,Midnight in the Garden of Good and Evil,John Berendt,25970,367,3.92,9321,235010,386,1994.0,False,"Nonfiction, Crime, True Crime, Mystery, Mystery, Crime, History, American, Southern, Classics, Travel, Audiobook, Autobiography, Memoir","Pulitzer Prize Nominee for General Nonfiction (1995), Exclusive Books Boeke Prize (1995), Ferro-Grumley Award for Gay Fiction (Non-Fiction) (1994), Lambda Literary Award for Gay Men's Mystery (1995)",4,"Savannah, Georgia",False,False,True,False,False,False,False,False,False,True,False,False,False,False,False,True,False,False,False,False,False,False,False,False,False,False,False,False,True,False,False,False,False,False,False,False,False,False,True,False,True,False,False,False,False,False,False,False,False,False,7.130434782608696,4.980442053220883
421,421,421,https://www.goodreads.com/book/show/18143977-all-the-light-we-cannot-see,18143977.0,All the Light We Cannot See,Anthony Doerr,25965,304,4.32,79270,1118214,531,2014.0,False,"Historical, Historical Fiction, Fiction, Historical, War, War, World War II, Audiobook, Adult, Cultural, France, Book Club, Adult Fiction","Pulitzer Prize for Fiction (2015), Audie Award for Fiction (2015), ALA Alex Award (2015), Dayton Literary Peace Prize Nominee for Fiction (2015), Ohioana Book Award for Fiction (2015), Australian Book Industry Award (ABIA) for International Book (2015), Andrew Carnegie Medal for Fiction (2015), Idaho Book of the Year Award (2014), National Book Award Finalist for Fiction (2014), Goodreads Choice Award for Historical Fiction (2014) and Nominee for Best of the Best  (2018), International Dublin Literary Award Nominee (2016)",11,"Paris, Zollverein, Evreux, Saint-Malo, Essen, Berlin, Schulpforte, Vienna, Épernay, Nuremberg",True,False,False,False,False,False,False,True,True,True,True,False,False,False,False,False,True,False,False,False,False,True,False,False,False,False,False,False,False,False,False,False,False,False,False,False,False,False,False,False,False,False,False,False,False,False,False,True,False,False,8.434782608695652,6.28478987930784
422,422,422,https://www.goodreads.com/book/show/11989.The_Plague,11989.0,The Plague,Albert Camus,25834,352,4.01,9349,188528,308,1947.0,False,"Fiction, Classics, Philosophy, Cultural, France, Literature, European Literature, French Literature, Novels, Literature, 20th Century, Literary Fiction, Cultural, Africa",Prix des Critiques (1947),1,"Oran, Algeria",True,False,True,False,True,True,False,False,False,False,False,False,False,False,False,False,True,False,False,False,False,False,False,True,True,False,False,False,False,False,False,False,False,True,False,False,False,False,False,False,False,False,False,False,True,False,False,False,False,False,7.423913043478261,5.273920314090447
423,423,423,https://www.goodreads.com/book/show/25036229-una-historia-de-ayer,25036229.0,Una Historia de Ayer,Sergio Cobo,25691,257,4.44,138,10657,75,2014.0,False,"Thriller, Mystery, European Literature, Spanish Literature, Suspense, Magical Realism, Mystery, Noir, Drama, Fiction, Mystery, Crime",nan,0,nan,True,False,False,False,False,True,False,False,False,False,False,False,False,False,False,True,False,False,False,False,False,False,True,True,False,False,True,False,False,True,False,False,False,False,False,False,False,False,False,False,True,False,False,False,False,False,False,False,False,False,8.826086956521742,6.676094227133928
424,424,424,https://www.goodreads.com/book/show/28862.The_Prince,28862.0,The Prince,Niccolò Machiavelli,25683,360,3.82,9005,274288,140,1532.0,False,"Classics, Philosophy, Nonfiction, Politics, History, Politics, Political Science, Literature, European Literature, Italian Literature, Cultural, Italy, Academic, School",National Book Award Finalist for Translation (1978),1,nan,False,False,True,False,False,True,False,False,False,False,False,False,False,False,False,False,True,True,False,True,False,False,False,True,False,False,False,False,False,False,False,False,False,True,False,False,False,False,True,False,False,False,False,False,False,False,False,False,False,False,6.804347826086956,4.654355096699144
425,425,425,https://www.goodreads.com/book/show/12220.A_Streetcar_Named_Desire,12220.0,A Streetcar Named Desire,Tennessee Williams,25639,392,3.98,4340,268602,107,1947.0,False,"Plays, Classics, Fiction, Drama, Academic, School, Plays, Theatre, Literature, American, Academic, Read For School, Literature, Young Adult, High School","Pulitzer Prize for Drama (1948), New York Drama Critics' Circle Award for Best American Play (1948)",2,"New Orleans, Louisiana",True,False,True,True,False,True,False,False,False,False,True,False,False,False,False,False,False,True,False,True,False,False,False,False,False,False,True,False,True,False,False,False,False,False,False,False,False,False,False,False,False,False,False,False,False,False,False,False,False,False,7.326086956521739,5.176094227133926
426,426,426,https://www.goodreads.com/book/show/28921.The_Remains_of_the_Day,28921.0,The Remains of the Day,Kazuo Ishiguro,25562,357,4.13,15429,214267,258,1989.0,False,"Fiction, Historical, Historical Fiction, Classics, Literature, Literary Fiction, Historical, Novels, European Literature, British Literature, Contemporary, Audiobook",Booker Prize (1989),1,"England, United Kingdom",True,False,True,False,True,True,False,True,True,True,False,False,True,False,False,False,False,False,False,False,False,False,False,True,True,False,False,False,False,False,False,False,False,False,False,False,False,False,False,False,False,False,False,False,False,True,False,False,False,False,7.815217391304348,5.665224661916535
427,427,427,https://www.goodreads.com/book/show/9460487-miss-peregrine-s-home-for-peculiar-children,9460487.0,Miss Peregrine's Home for Peculiar Children,Ransom Riggs,25531,317,3.91,62120,1035273,352,2011.0,True,"Fantasy, Young Adult, Fiction, Fantasy, Paranormal, Mystery, Horror, Science Fiction, Time Travel, Historical, Historical Fiction, Fantasy, Supernatural, Adventure","Grand Prix de l'Imaginaire for Roman jeunesse étranger (2015), Pennsylvania Young Readers' Choice Award for Young Adults (2014), California Young Readers Medal Nominee for Young Adult (2016), The Kitschies Nominee for Golden Tentacle (Debut) (2011), Goodreads Choice Award Nominee for Favorite Book and for Young Adult Fantasy & Science Fiction (2011)",5,"Englewood, Florida, Wales",True,True,False,True,False,False,False,True,True,False,True,True,False,True,False,True,False,False,True,False,False,False,False,False,False,False,False,False,False,False,True,False,True,False,False,False,False,False,False,False,False,False,False,False,False,False,False,False,False,False,7.097826086956523,4.94783335756871
428,428,428,https://www.goodreads.com/book/show/6759.Infinite_Jest,6759.0,Infinite Jest,David Foster Wallace,25440,278,4.27,9282,77868,1088,1996.0,False,"Fiction, Classics, Literature, Novels, Contemporary, Humor, Unfinished, Literary Fiction, Literature, American, Philosophy",LovelyBooks Leserpreis Nominee for Allgemeine Literatur (2009),1,"Massachusetts, Enfield Tennis Academy, Ennet House, Tucson, Arizona, Massachusetts Institute of Technology (MIT), Boston, Massachusetts",True,False,True,False,True,True,False,False,False,False,False,False,True,False,False,False,False,False,False,False,False,False,False,False,True,False,False,False,True,False,False,False,False,True,False,True,False,False,False,False,False,False,False,False,False,False,False,False,False,False,8.271739130434781,6.121746401046969
429,429,429,https://www.goodreads.com/book/show/13497.A_Feast_for_Crows,13497.0,A Feast for Crows,George R.R. Martin,25065,329,4.14,22088,648965,1061,2005.0,True,"Fantasy, Fiction, Fantasy, Epic Fantasy, Science Fiction Fantasy, Fantasy, High Fantasy, Adult, Adventure, Fantasy, Dragons, Audiobook, Epic","Hugo Award Nominee for Best Novel (2006), Locus Award Nominee for Best Fantasy Novel (2006)",2,nan,True,True,False,False,False,False,False,False,False,True,True,True,False,True,False,False,False,False,False,False,True,False,False,False,False,False,False,False,False,False,False,False,False,False,False,False,False,False,False,False,False,False,False,False,False,False,False,False,False,True,7.8478260869565215,5.697833357568708
430,430,430,https://www.goodreads.com/book/show/40873273-snow-flower-and-the-secret-fan,40873273.0,Snow Flower and the Secret Fan,Lisa See,25025,319,4.07,18105,348482,288,2005.0,False,"Historical, Historical Fiction, Fiction, Cultural, China, Historical, Cultural, Asia, Book Club, Adult, Literature, Asian Literature, Adult Fiction, Novels","California Book Award for Fiction (Silver) (2005), Lincoln Award Nominee (2008), Asian/Pacific American Award for Literature for Adult Fiction Honor (2005)",3,"Hunan, China",True,False,False,False,True,True,False,True,True,False,True,False,False,False,False,False,True,False,False,False,False,True,False,False,False,False,False,False,False,False,False,False,False,False,False,False,False,False,False,False,False,False,False,False,False,False,False,False,False,False,7.6195652173913055,5.469572488003493
431,431,431,https://www.goodreads.com/book/show/6936382-anna-and-the-french-kiss,6936382.0,Anna and the French Kiss,Stephanie Perkins,24965,288,4.0,30296,381930,372,2010.0,True,"Young Adult, Romance, Contemporary, Womens Fiction, Chick Lit, Fiction, Realistic Fiction, Young Adult, Young Adult Contemporary, Romance, Contemporary Romance, Young Adult, Young Adult Romance, Young Adult, Teen","Georgia Peach Book Award Nominee for Honor book (2012), Pennsylvania Young Readers' Choice Award Nominee for Young Adults (2013), Milwaukee County Teen Book Award Nominee (2012), The Inky Awards Nominee for Silver Inky (2011), Lincoln Award Nominee (2013), CYBILS Award Nominee for Young Adult Fiction (2011), Goodreads Choice Award Nominee for Goodreads Author, Young Adult Fiction  (2010)",8,"Paris, Atlanta, Georgia",True,False,False,True,False,False,True,False,False,False,True,False,True,False,False,False,False,False,False,False,False,False,False,False,False,False,False,False,False,False,False,False,False,False,False,False,True,False,False,False,False,True,True,True,False,False,False,False,False,False,7.391304347826088,5.241311618438274
432,432,432,https://www.goodreads.com/book/show/7735333-matched,7735333.0,Matched,Ally Condie,24902,311,3.65,33542,682568,369,2010.0,True,"Young Adult, Science Fiction, Dystopia, Romance, Science Fiction, Fiction, Fantasy, Young Adult, Teen, Audiobook, Futuristic, Apocalyptic, Post Apocalyptic","South Carolina Book Award for Young Adult (2013), Teen Buckeye Book Award (2012), Pennsylvania Young Readers' Choice Award for Young Adults (2012), Rhode Island Teen Book Award (2012), California Young Readers Medal for Young Adult (2013), Lincoln Award Nominee (2013), Literaturpreis der Jury der jungen Leser for Jugendbuch (2011), Carnegie Medal Nominee (2012), Missouri Gateway Readers Award Nominee (2013)",9,nan,True,True,False,True,False,False,True,False,False,True,True,False,False,True,False,False,False,False,False,False,False,False,False,False,False,False,False,False,False,False,False,True,False,False,False,False,True,False,False,False,False,False,False,False,False,False,False,False,False,False,6.25,4.100007270612187
433,433,433,https://www.goodreads.com/book/show/11324204-houdini-heart,11324204.0,Houdini Heart,Ki Longfellow,24819,257,3.8,227,5679,254,2011.0,False,"Horror, Fantasy, Fiction, Mystery, Magical Realism, Gothic, Literature, Thriller, Fantasy, Supernatural, Fantasy, Mythology",nan,0,nan,True,True,False,False,False,True,False,False,False,False,False,False,False,False,False,True,False,False,False,False,False,False,True,False,False,False,False,False,False,True,True,False,True,False,False,False,False,False,False,False,False,False,False,False,False,False,False,False,False,False,6.739130434782608,4.589137705394795
434,434,434,https://www.goodreads.com/book/show/14706.Faust_First_Part,14706.0,"Faust, First Part",Johann Wolfgang von Goethe,24804,332,3.92,1250,61027,327,1808.0,True,"Classics, Fiction, Plays, Poetry, European Literature, German Literature, Drama, Literature, Academic, School, Philosophy, Fantasy",nan,0,nan,True,True,True,False,False,True,False,False,False,False,False,False,False,False,False,False,False,True,False,True,False,False,False,True,False,False,True,False,False,False,False,False,False,True,False,False,False,False,False,False,False,False,False,False,False,False,False,False,True,False,7.130434782608696,4.980442053220883
435,435,435,https://www.goodreads.com/book/show/15717943-hopeless,15717943.0,Hopeless,Colleen Hoover,24684,276,4.28,22265,282945,410,2012.0,True,"Romance, New Adult, Young Adult, Contemporary, Romance, Contemporary Romance, Fiction, Sociology, Abuse, Young Adult, High School, Womens Fiction, Chick Lit, Drama",nan,0,nan,True,False,False,True,False,False,True,False,False,False,True,False,True,False,False,False,False,False,False,True,False,False,False,False,False,False,True,False,False,False,False,False,False,False,False,False,False,False,False,False,False,False,True,True,False,False,False,False,False,False,8.304347826086957,6.154355096699145
436,436,436,https://www.goodreads.com/book/show/13152.The_Angel_Experiment,13152.0,The Angel Experiment,James Patterson,24663,304,4.07,9441,212108,445,2005.0,True,"Young Adult, Fantasy, Science Fiction, Fiction, Adventure, Fantasy, Paranormal, Young Adult, Teen, Action, Mystery, Fantasy, Urban Fantasy","Lincoln Award Nominee (2008), Missouri Gateway Readers Award Nominee (2008)",2,"Denver, Colorado, California, New York State",True,True,False,True,False,False,False,False,False,False,True,True,False,True,False,True,False,False,True,False,False,False,False,False,False,True,False,False,False,False,False,False,False,False,False,False,True,False,False,False,False,False,False,False,False,False,False,False,False,False,7.6195652173913055,5.469572488003493
437,437,437,https://www.goodreads.com/book/show/43448.Flowers_in_the_Attic,43448.0,Flowers in the Attic,V.C. Andrews,24461,328,3.82,8778,169749,389,1979.0,True,"Fiction, Horror, Young Adult, Mystery, Classics, Romance, Gothic, Thriller, Drama, Adult",Books I Loved Best Yearly (BILBY) Awards for Secondary (1993),1,Virginia,True,False,True,True,False,False,True,False,False,False,True,False,False,False,False,True,False,False,False,False,False,False,False,False,False,False,True,False,False,True,False,False,True,False,False,False,False,False,False,False,False,False,False,False,False,False,False,False,False,False,6.804347826086956,4.654355096699144
438,438,438,https://www.goodreads.com/book/show/8664353-unbroken,8664353.0,"Unbroken: A World War II Story of Survival, Resilience and Redemption",Laura Hillenbrand,24421,293,4.36,46933,809195,492,2010.0,False,"Nonfiction, History, Biography, War, World War II, War, Historical, Audiobook, War, Military Fiction, Autobiography, Memoir, Biography Memoir","Los Angeles Times Book Prize for Biography (2010), Pennsylvania Young Readers' Choice Award Nominee for Young Adults (2014), Indies Choice Book Award for Nonfiction (2011), Dayton Literary Peace Prize Nominee for Nonfiction (2011), Lincoln Award Nominee (2015), Andrew Carnegie Medal Nominee for Nonfiction (2012), Goodreads Choice Award Nominee for History and Biography (2010)",7,nan,True,False,False,False,False,False,False,True,False,True,False,False,False,False,False,False,False,False,False,False,False,False,False,False,False,False,False,False,False,False,False,False,False,False,False,False,False,False,True,False,False,False,False,False,False,False,False,True,False,False,8.56521739130435,6.415224661916536
439,439,439,https://www.goodreads.com/book/show/136116.The_Scarlet_Pimpernel,136116.0,The Scarlet Pimpernel,Emmuska Orczy,24303,314,4.05,6561,127904,182,1905.0,True,"Classics, Historical, Historical Fiction, Fiction, Adventure, Romance, Historical, Mystery, Cultural, France, Literature, Classics, Classic Literature",nan,0,"England, France, London, England, Paris, Dover, Kent, England",True,False,True,False,False,True,True,True,True,False,False,True,False,False,False,True,True,False,False,False,False,False,False,False,False,False,False,False,False,False,False,False,False,False,True,False,False,False,False,False,False,False,False,False,False,False,False,False,False,False,7.554347826086957,5.404355096699143
