url,book_id,title,award_count,author,avg_rating,num_reviews,num_ratings,num_pages,original_publish_year,series,genres,awards,place
https://www.goodreads.com/book/show/12395.Journey_to_the_End_of_the_Night,12395,Journey to the End of the Night,2.0,Louis-Ferdinand Céline,4.22,33481,33481,453,1932.0,True,"Fiction, Classics, Cultural, France, European Literature, French Literature, Literature, Novels, Philosophy, Literature, 20th Century, War, Roman","Prix Renaudot (1932), Βραβείο Λογοτεχνικής Μετάφρασης ΕΚΕΜΕΛ Nominee for Γαλλόφωνη Λογοτεχνία (2008)","France, Africa, United States of America"
https://www.goodreads.com/book/show/17788401-ugly-love,17788401,Ugly Love,1.0,Colleen Hoover,4.25,194125,194125,337,,False,"Romance, New Adult, Contemporary, Romance, Contemporary Romance, Fiction, Adult, Womens Fiction, Chick Lit, Young Adult, Audiobook, Drama",Goodreads Choice Award Nominee for Romance (2014),"San Francisco, California"
https://www.goodreads.com/book/show/9566.Still_Life_with_Woodpecker,9566,Still Life with Woodpecker,,Tom Robbins,4.02,76259,76259,288,1980.0,False,"Fiction, Humor, Literature, Novels, Contemporary, Magical Realism, Classics, Literary Fiction, Literature, American, Fantasy",0,"Hawaii, Seattle, Washington"
https://www.goodreads.com/book/show/6567017-will-grayson-will-grayson,6567017,"Will Grayson, Will Grayson",9.0,John Green,3.76,348897,348897,310,,True,"Young Adult, Contemporary, LGBT, Fiction, Romance, Realistic Fiction, GLBT, Queer, Young Adult, Teen, Young Adult, Coming Of Age, Humor","Stonewall Book Award Nominee for Children’s and Young Adult Literature (2011), Romantic Times Reviewers' Choice Award (RT Award) Nominee for Best Young Adult Novel (2010), Odyssey Award Nominee (2011), Milwaukee County Teen Book Award (2011), Children's Choice Book Award for Teen Choice Book of the Year (2011), The Inky Awards Nominee for Silver Inky (2010), Lincoln Award Nominee (2013), Goodreads Choice Award Nominee for Young Adult Fiction (2010), The Inky Awards Shortlist for Silver Inky (2010)",Illinois
https://www.goodreads.com/book/show/321552.The_Agony_and_the_Ecstasy,321552,The Agony and the Ecstasy,1.0,Irving Stone,4.06,83002,83002,776,1958.0,False,"Historical, Historical Fiction, Fiction, Art, Classics, Cultural, Italy, Historical, Art, Art History, Literature, Biography Memoir, Novels",California Book Award for Fiction (Silver) (1961),"Italy, Florence, Rome"
https://www.goodreads.com/book/show/40496.How_Green_Was_My_Valley,40496,How Green Was My Valley,1.0,Richard Llewellyn,4.18,15068,15068,448,1939.0,False,"Classics, Fiction, Historical, Historical Fiction, Historical, Literature, European Literature, British Literature, Young Adult, Coming Of Age, Novels, Classics, Modern Classics, Literature, 20th Century",National Book Award for Fiction (1940),Wales
https://www.goodreads.com/book/show/9014.The_Long_Walk,9014,The Long Walk,,Richard Bachman,4.08,135514,135514,370,1979.0,False,"Horror, Fiction, Science Fiction, Dystopia, Thriller, Science Fiction, Fantasy, Suspense, Audiobook, Adult, Novels",0,Maine
https://www.goodreads.com/book/show/10916.The_Pact,10916,The Pact,,Jodi Picoult,4.01,279068,279068,512,1998.0,False,"Fiction, Romance, Contemporary, Womens Fiction, Chick Lit, Drama, Adult Fiction, Mystery, Adult, Young Adult, Realistic Fiction",0,
https://www.goodreads.com/book/show/44652.Fablehaven,44652,Fablehaven,2.0,Brandon Mull,4.09,141738,141738,351,,True,"Fantasy, Young Adult, Childrens, Middle Grade, Fiction, Childrens, Adventure, Fantasy, Magic, Childrens, Juvenile, Young Adult, Young Adult Fantasy, Science Fiction Fantasy","Utah Best of State for Literary Arts - Fiction (2010), Rebecca Caudill Young Readers' Book Award Nominee (2011)",Connecticut
https://www.goodreads.com/book/show/3099787-night-world-no-1,3099787,"Night World, No. 1",,L.J. Smith,4.05,61875,61875,729,,True,"Young Adult, Paranormal, Vampires, Fantasy, Fantasy, Paranormal, Romance, Fantasy, Supernatural, Paranormal, Witches, Romance, Paranormal Romance, Fiction, Fantasy, Magic",0,
https://www.goodreads.com/book/show/5168.Where_the_Heart_Is,5168,Where the Heart Is,1.0,Billie Letts,4.02,241506,241506,376,1995.0,False,"Fiction, Womens Fiction, Chick Lit, Romance, Contemporary, Adult Fiction, Adult, Drama, Realistic Fiction, Young Adult, Novels",Eliot Rosewater Indiana High School Book Award (2000),
https://www.goodreads.com/book/show/497199.Factotum,497199,Factotum,,Charles Bukowski,3.94,64063,64063,208,1975.0,False,"Fiction, Classics, Thriller, Mystery, Novels, Literature, Dark, Contemporary, Literature, American, Drama",0,"New Orleans, Louisiana, Los Angeles, California, New York City, New York, Philadelphia, Pennsylvania, St. Louis, Miami, Florida, Miami Beach, Florida"
https://www.goodreads.com/book/show/9791.A_Walk_in_the_Woods,9791,A Walk in the Woods: Rediscovering America on the Appalachian Trail,,Bill Bryson,4.06,357783,357783,397,1998.0,True,"Nonfiction, Travel, Humor, Autobiography, Memoir, Environment, Nature, Adventure, Audiobook, Biography, Nature, Outdoors, History",0,"United States of America, Appalachian Trail, North Carolina"
https://www.goodreads.com/book/show/27774758-an-ember-in-the-ashes,27774758,An Ember in the Ashes,13.0,Sabaa Tahir,4.26,206391,206391,446,2015.0,True,"Fantasy, Young Adult, Romance, Fiction, Young Adult, Young Adult Fantasy, Science Fiction, Dystopia, Fantasy, High Fantasy, Audiobook, Adventure, Fantasy, Magic","Pennsylvania Young Readers' Choice Award Nominee for Young Adults (2017), Rhode Island Teen Book Award Nominee (2017), Evergreen Teen Book Award Nominee (2018), Milwaukee County Teen Book Award Nominee (2016), Dioraphte Jongerenliteratuurprijs Nominee for Vertaald boek (2016), Lincoln Award Nominee (2018), David Gemmell Morningstar Award Nominee for Best Fantasy Newcomer (2016), Goodreads Choice Award Nominee for Debut Goodreads Author, and for Young Adult Fantasy & Science Fiction (2015), The Magnolia Award Nominee for 9-12 (2018), Prix Elbakin.net for Meilleur roman fantasy traduit Jeunesse (2016), Missouri Gateway Readers Award Nominee (2017), Premio El Templo de las Mil Puertas Nominee for Mejor novela extranjera perteneciente a saga (2015)",
https://www.goodreads.com/book/show/11918.Bitten,11918,Bitten,,Kelley Armstrong,4.01,96152,96152,436,2001.0,True,"Fantasy, Urban Fantasy, Fantasy, Fantasy, Paranormal, Romance, Shapeshifters, Werewolves, Romance, Paranormal Romance, Fiction, Fantasy, Supernatural, Adult, Paranormal, Shapeshifters",0,"Ontario, New York State"
https://www.goodreads.com/book/show/42038.Shakespeare_s_Sonnets,42038,Shakespeare's Sonnets,,William Shakespeare,4.24,88348,88348,488,1609.0,False,"Poetry, Classics, Fiction, Literature, Romance, Plays, Academic, School, European Literature, British Literature, Literature, English Literature, Classics, Classic Literature",0,
https://www.goodreads.com/book/show/3466.The_Wedding,3466,The Wedding,,Nicholas Sparks,3.98,143787,143787,276,2003.0,True,"Romance, Fiction, Womens Fiction, Chick Lit, Contemporary, Adult, Adult Fiction, Romance, Contemporary Romance, Love, Romance, Love Story, Drama",0,
https://www.goodreads.com/book/show/41424.Beauty,41424,Beauty: A Retelling of the Story of Beauty and the Beast,1.0,Robin McKinley,4.05,74886,74886,256,1978.0,False,"Fantasy, Young Adult, Romance, Fantasy, Fairy Tales, Fiction, Retellings, Fairy Tales, Beauty and The Beast, Fairy Tales, Fairy Tale Retellings, Fantasy, Magic, Young Adult, Young Adult Fantasy",Dorothy Canfield Fisher Children's Book Award Nominee (1980),
https://www.goodreads.com/book/show/1371.The_Iliad,1371,The Iliad,,Homer,3.88,367645,367645,683,-800.0,False,"Classics, Poetry, Fiction, Fantasy, Mythology, Literature, Fantasy, Historical, Historical Fiction, Academic, School, War, Epic",0,Troy
https://www.goodreads.com/book/show/13517535-thoughtless,13517535,Thoughtless,1.0,S.C. Stephens,4.1,135222,135222,530,2009.0,True,"Romance, New Adult, Contemporary, Romance, Contemporary Romance, Young Adult, Academic, College, Music, Adult, Womens Fiction, Chick Lit, Fiction",SKoW Award for Best M-Rated (2010),
https://www.goodreads.com/book/show/16056408-easy,16056408,Easy,2.0,Tammara Webber,4.08,220601,220601,336,2012.0,True,"Romance, New Adult, Contemporary, Young Adult, Romance, Contemporary Romance, Academic, College, Fiction, Womens Fiction, Chick Lit, Realistic Fiction, Sociology, Abuse","DABWAHA Romance Tournament for Best Young Adult (2013), Goodreads Choice Award Nominee for Young Adult Fiction and for Goodreads Author (2012)",
https://www.goodreads.com/book/show/9369720-passion,9369720,Passion,2.0,Lauren Kate,3.86,155202,155202,420,,True,"Young Adult, Fantasy, Paranormal, Angels, Fantasy, Paranormal, Romance, Paranormal Romance, Fantasy, Supernatural, Fiction, Fantasy, Urban Fantasy, Young Adult, Teen, Young Adult, Young Adult Fantasy","Children's Choice Book Award Nominee for Teen Choice Book of the Year (2012), Goodreads Choice Award Nominee for Young Adult Fantasy & Science Fiction and for Goodreads Author (2011)","Louisville, Kentucky, Moskow, Milan, Helston, Tahiti, Lhasa, Versailles, Paris, London, England, Central Greenland, Chichen Itza, Jerusalem, Yinchuan, Memphis, Heaven's Gate, Savannah, Georgia"
https://www.goodreads.com/book/show/4631.A_Moveable_Feast,4631,A Moveable Feast,,Ernest Hemingway,4.03,124380,124380,192,1964.0,False,"Classics, Nonfiction, Autobiography, Memoir, Biography, Cultural, France, Travel, Literature, Literature, American, Biography Memoir, Biography, Autobiography",0,Paris
https://www.goodreads.com/book/show/23878688-the-5-love-languages,23878688,The 5 Love Languages: The Secret to Love that Lasts,1.0,Gary Chapman,4.25,320809,320809,232,1990.0,False,"Nonfiction, Self Help, Relationships, Psychology, Marriage, Christian, Self Help, Personal Development, Audiobook, Love, Romance",Audie Award for Personal Development/Motivational (2006),
https://www.goodreads.com/book/show/38180.On_the_Beach,38180,On the Beach,,Nevil Shute,3.95,36456,36456,296,1957.0,False,"Fiction, Science Fiction, Apocalyptic, Post Apocalyptic, Classics, Science Fiction, Dystopia, Science Fiction, Apocalyptic, Cultural, Australia, War, Literature, Novels",0,"Australia, Melbourne, Victoria"
https://www.goodreads.com/book/show/297673.The_Brief_Wondrous_Life_of_Oscar_Wao,297673,The Brief Wondrous Life of Oscar Wao,10.0,Junot Díaz,3.89,238162,238162,335,,False,"Fiction, Contemporary, Magical Realism, Novels, Literary Fiction, Historical, Historical Fiction, Literature, Audiobook, Book Club, Adult","Pulitzer Prize for Fiction (2008), Anisfield-Wolf Book Award (2008), Massachusetts Book Award for Fiction (2008), Los Angeles Times Book Prize Nominee for Fiction (2007), Dayton Literary Peace Prize for Fiction (2008), National Book Critics Circle Award for Fiction (2007), Hurston/Wright Legacy Award for Fiction (2008), The Center for Fiction First Novel Prize (2007), International Dublin Literary Award Nominee (2009), The Rooster -- The Morning News Tournament of Books (2008)","Dominican Republic, Washington Heights, New York, Paterson, New Jersey, Rutgers University, New Brunswick, New Jersey (United States), Santo Domingo, Baní, Samaná, Santiago, Dominican Republic"
https://www.goodreads.com/book/show/4031.Lunar_Park,4031,Lunar Park,1.0,Bret Easton Ellis,3.64,32111,32111,404,2005.0,False,"Fiction, Thriller, Horror, Mystery, Suspense, Contemporary, Drama, Novels, Dark, Mystery, Crime",World Fantasy Award Nominee for Best Novel (2006),
https://www.goodreads.com/book/show/16729.Beach_Music,16729,Beach Music,,Pat Conroy,4.16,44215,44215,800,1995.0,False,"Fiction, American, Southern, Contemporary, Historical, Historical Fiction, Drama, Novels, Literature, Literary Fiction, Audiobook, Adult Fiction",0,"South Carolina, Italy"
https://www.goodreads.com/book/show/76171.We,76171,We,,Yevgeny Zamyatin,3.91,76658,76658,226,1920.0,False,"Fiction, Science Fiction, Science Fiction, Dystopia, Classics, Cultural, Russia, Literature, Russian Literature, Literature, Novels, Literature, 20th Century, Speculative Fiction",0,OneState
https://www.goodreads.com/book/show/529626.Sometimes_a_Great_Notion,529626,Sometimes a Great Notion,,Ken Kesey,4.18,21336,21336,640,1964.0,False,"Fiction, Classics, Literature, Novels, Thriller, Mystery, Literary Fiction, Drama, Literature, American, Suspense",0,"United States of America, Oregon"
https://www.goodreads.com/book/show/2702704-faefever,2702704,Faefever,,Karen Marie Moning,4.3,94573,94573,327,,True,"Fantasy, Urban Fantasy, Fantasy, Paranormal, Fantasy, Fairies, Fae, Romance, Paranormal Romance, Romance, Adult, Fantasy, Magic, Paranormal, Fairies, Fantasy, Supernatural",0,Dublin
https://www.goodreads.com/book/show/2233407.From_Dead_to_Worse,2233407,From Dead to Worse,,Charlaine Harris,4.0,179500,179500,359,2008.0,True,"Fantasy, Paranormal, Vampires, Fantasy, Paranormal, Fantasy, Urban Fantasy, Fiction, Romance, Mystery, Romance, Paranormal Romance, Fantasy, Supernatural, Adult",0,"Bon Temps, Louisiana"
https://www.goodreads.com/book/show/22205.This_Lullaby,22205,This Lullaby,4.0,Sarah Dessen,4.02,174053,174053,345,2002.0,False,"Young Adult, Romance, Contemporary, Fiction, Womens Fiction, Chick Lit, Realistic Fiction, Young Adult, Teen, Young Adult, Young Adult Contemporary, Music, Young Adult, Young Adult Romance","South Carolina Book Award Nominee for Young Adult Book Award (2005), Michigan Library Association Thumbs Up! Award Nominee (2003), Missouri Gateway Readers Award Nominee (2005), Margaret A. Edwards Award (2017)","Lakeview, North Carolina"
https://www.goodreads.com/book/show/5161066-dead-and-gone,5161066,Dead and Gone,1.0,Charlaine Harris,4.01,179314,179314,312,,True,"Fantasy, Paranormal, Vampires, Fantasy, Paranormal, Fantasy, Urban Fantasy, Fiction, Romance, Mystery, Romance, Paranormal Romance, Fantasy, Supernatural, Shapeshifters, Werewolves",Goodreads Choice Award for Fantasy (2009),Louisiana
https://www.goodreads.com/book/show/5886881-dark-places,5886881,Dark Places,2.0,Gillian Flynn,3.93,612559,612559,349,,False,"Mystery, Fiction, Thriller, Mystery, Crime, Thriller, Mystery Thriller, Suspense, Adult, Audiobook, Contemporary, Horror","Black Quill Award for Dark Genre Novel of the Year (2010), CWA Ian Fleming Steel Dagger Nominee (2010)","Kinnakee, Kansas, Kansas City, Missouri"
https://www.goodreads.com/book/show/140075.All_Together_Dead,140075,All Together Dead,,Charlaine Harris,4.04,191749,191749,323,,True,"Fantasy, Paranormal, Vampires, Fantasy, Paranormal, Fantasy, Urban Fantasy, Fiction, Romance, Mystery, Romance, Paranormal Romance, Fantasy, Supernatural, Adult",0,"Bon Temps, Louisiana, Northern Louisiana"
https://www.goodreads.com/book/show/310459.Roll_of_Thunder_Hear_My_Cry,310459,"Roll of Thunder, Hear My Cry",11.0,Mildred D. Taylor,3.85,115433,115433,288,1976.0,True,"Historical, Historical Fiction, Young Adult, Fiction, Classics, Childrens, Childrens, Middle Grade, Academic, School, Historical, Cultural, African American, Academic, Read For School","Newbery Medal (1977), Buxtehuder Bulle (1984), George C. Stone Center for Children's Books Recognition of Merit Award (1991), Jane Addams Children's Book Award Nominee (1977), Los Angeles Times Book Prize for Young Adult Fiction (2001), Dorothy Canfield Fisher Children's Book Award Nominee (1978), Coretta Scott King Book Award for Author Honor (1977), Pacific Northwest Library Association Young Reader's Choice Award (1979), Boston Globe-Horn Book Award Nominee for Fiction (1977), California Young Readers Medal Nominee for Middle School/Junior High (1980), National Book Award Finalist for Children's Literature (1977)",Mississippi
