url,book_id,title,award_count,author,avg_rating,num_reviews,num_ratings,num_pages,original_publish_year,series,genres,awards,place
https://www.goodreads.com/book/show/48328.Revolutionary_Road,48328,Revolutionary Road,1.0,Richard Yates,3.9,82166,82166,355,1961.0,False,"Fiction, Classics, Historical, Historical Fiction, Novels, Literature, American, Literature, Literary Fiction, Contemporary, Literature, 20th Century, Classics, Modern Classics",National Book Award Finalist for Fiction (1962),Connecticut
https://www.goodreads.com/book/show/21686.Shutter_Island,21686,Shutter Island,4.0,Dennis Lehane,4.07,173167,173167,369,2003.0,False,"Mystery, Fiction, Thriller, Suspense, Horror, Mystery, Crime, Thriller, Mystery Thriller, Novels, Thriller, Psychological Thriller, Drama","Barry Award Nominee for Best Novel (2004), Anthony Award Nominee for Best Novel (2004), Hammett Prize Nominee (2003), Grand Prix des lectrices de Elle for roman policier (2004)","Massachusetts, Shutter Island, Massachusetts"
https://www.goodreads.com/book/show/10569.On_Writing,10569,On Writing: A Memoir of the Craft,3.0,Stephen King,4.32,235154,235154,320,2000.0,False,"Nonfiction, Language, Writing, Autobiography, Memoir, Biography, Reference, Biography, Autobiography, Audiobook, Biography Memoir, Writing, Books About Books, Self Help","Bram Stoker Award for Best Non-Fiction (2000), Locus Award for Best Non-Fiction (2001), Puddly Award for Writing (2001)",
https://www.goodreads.com/book/show/22822858-a-little-life,22822858,A Little Life,11.0,Hanya Yanagihara,4.31,247729,247729,720,,False,"Fiction, Contemporary, LGBT, Literary Fiction, Adult, Novels, GLBT, Queer, Audiobook, Adult Fiction, Literature","Booker Prize Nominee (2015), Dayton Literary Peace Prize Nominee for Fiction (2016), Women's Prize for Fiction Nominee (2016), Andrew Carnegie Medal Nominee for Fiction (Shortlist) (2016), National Book Award Finalist for Fiction (2015), Kirkus Prize for Fiction (2015), Goodreads Choice Award Nominee for Fiction (2015), Waterstones Book of the Year Nominee (2015), Jarl Hellemann -palkinto (2017), International Dublin Literary Award Nominee for Shortlist (2017), Blogistanian Globalia (2017)","New York City, New York, SoHo, New York City, New York"
https://www.goodreads.com/book/show/42697.Exodus,42697,Exodus,1.0,Leon Uris,4.34,92873,92873,608,1958.0,False,"Historical, Historical Fiction, Fiction, Classics, Historical, Cultural, Israel, Literature, Jewish, War, Novels, World War II, Holocaust, Literature",National Jewish Book Award for Fiction (1959),"Israel, Cyprus"
https://www.goodreads.com/book/show/5246.Ethan_Frome,5246,Ethan Frome,,Edith Wharton,3.42,112648,112648,99,1911.0,False,"Classics, Fiction, Literature, Academic, School, Romance, Historical, Historical Fiction, Literature, American, Novels, Young Adult, High School, Classics, Classic Literature",0,"Starkfield, Massachusetts, New England, Massachusetts"
https://www.goodreads.com/book/show/40941582,40941582,گم شده ای در مه,,سید مرتضی مصطفوی,4.03,897,897,82,,False,"Fiction, Philosophy, Spirituality",0,
https://www.goodreads.com/book/show/36072.The_7_Habits_of_Highly_Effective_People,36072,The 7 Habits of Highly Effective People: Powerful Lessons in Personal Change,,Stephen R. Covey,4.13,565158,565158,372,1988.0,False,"Self Help, Nonfiction, Business, Self Help, Personal Development, Psychology, Leadership, Productivity, Business, Management, Audiobook, Philosophy",0,
https://www.goodreads.com/book/show/54479.Around_the_World_in_Eighty_Days,54479,Around the World in Eighty Days,1.0,Jules Verne,3.94,193766,193766,252,1872.0,False,"Classics, Fiction, Adventure, Science Fiction, Cultural, France, Travel, Fantasy, Literature, Historical, Historical Fiction, Novels",Audie Award for Classic (2006),"Suez Canal, Bombay, Calcutta, Hong Kong, Yokohama, San Francisco Bay, California, New York State, Liverpool, England, Singapore City, London, England"
https://www.goodreads.com/book/show/40389231-cold-sassy-tree,40389231,Cold Sassy Tree,,Olive Ann Burns,4.01,98825,98825,405,1984.0,False,"Fiction, Historical, Historical Fiction, Classics, American, Southern, Historical, Adult Fiction, Young Adult, Coming Of Age, Adult, Young Adult, Audiobook",0,Georgia
https://www.goodreads.com/book/show/334176.The_Sparrow,334176,The Sparrow,6.0,Mary Doria Russell,4.12,67284,67284,516,1996.0,True,"Science Fiction, Fiction, Fantasy, Religion, Science Fiction Fantasy, Speculative Fiction, Science Fiction, Aliens, Adult, Book Club, Novels","Arthur C. Clarke Award (1998), Kurd-Laßwitz-Preis for Foreign Novel (2001), British Science Fiction Association Award for Best Novel (1997), John W. Campbell Memorial Award Nominee for Best Science Fiction Novel (1997), James Tiptree Jr. Award (1996), Puddly Award for Science Fiction (2001)","Borgo Santo Spirito, Rome, Arecibo, Naples, San Juan, Rakhat"
https://www.goodreads.com/book/show/298275.Nausea,298275,Nausea,1.0,Jean-Paul Sartre,3.92,91697,91697,178,1938.0,False,"Philosophy, Fiction, Classics, Cultural, France, Literature, European Literature, French Literature, Novels, Literature, 20th Century, Nobel Prize, Unfinished",Grand Prix des meilleurs romans du demi-siècle Nominee (1950),
https://www.goodreads.com/book/show/83674.The_Bridges_of_Madison_County,83674,The Bridges of Madison County,2.0,Robert James Waller,3.63,84702,84702,224,1992.0,False,"Fiction, Romance, Classics, Womens Fiction, Chick Lit, Contemporary, Novels, Adult Fiction, Adult, Drama, Historical, Historical Fiction","American Booksellers Book Of The Year  Award for Adult Trade (1993), Audie Award for Romance (2015)","Madison County, Iowa"
https://www.goodreads.com/book/show/8695.The_Restaurant_at_the_End_of_the_Universe,8695,The Restaurant at the End of the Universe,,Douglas Adams,4.21,242282,242282,250,1980.0,True,"Science Fiction, Fiction, Humor, Fantasy, Humor, Comedy, Classics, Science Fiction Fantasy, Audiobook, Adventure, Novels",0,"Frogstar World B, Earth"
https://www.goodreads.com/book/show/18705209-the-blood-of-olympus,18705209,The Blood of Olympus,1.0,Rick Riordan,4.41,221631,221631,516,,True,"Fantasy, Fantasy, Mythology, Young Adult, Childrens, Middle Grade, Fiction, Adventure, Mythology, Greek Mythology, Childrens, Fantasy, Urban Fantasy, Romance",Goodreads Choice Award for Middle Grade & Children's (2014),"Ithaca, Pompeii, Olympus, Évora, Long Island, New York, Pylos, Sparta, San Juan, Buford, South Carolina, Delos, Cyclades, Athens"
https://www.goodreads.com/book/show/6050298-dreamfever,6050298,Dreamfever,,Karen Marie Moning,4.39,93555,93555,386,,True,"Fantasy, Urban Fantasy, Fantasy, Fantasy, Paranormal, Romance, Fairies, Fae, Romance, Paranormal Romance, Adult, Fiction, Fantasy, Magic, Fantasy, Supernatural",0,Dublin
https://www.goodreads.com/book/show/1848.Wild_Swans,1848,Wild Swans: Three Daughters of China,2.0,Jung Chang,4.24,97146,97146,562,1991.0,False,"Nonfiction, History, Cultural, China, Biography, Autobiography, Memoir, Cultural, Asia, Historical, Biography, Autobiography, Biography Memoir, Literature, Asian Literature","NCR Book Award (1992), British Book Award (1993)",China
https://www.goodreads.com/book/show/3407877-the-forgotten-garden,3407877,The Forgotten Garden,2.0,Kate Morton,4.13,198318,198318,648,,False,"Fiction, Historical, Historical Fiction, Mystery, Historical, Cultural, Australia, Romance, Adult Fiction, Adult, European Literature, British Literature, Book Club","Australian Book Industry Award (ABIA) for General Fiction (2009), 本屋大賞 Nominee for Translated Fiction (2012)","Australia, Cornwall, England, London, England"
https://www.goodreads.com/book/show/10140661-gabriel-s-inferno,10140661,Gabriel's Inferno,1.0,Sylvain Reynard,4.0,147167,147167,506,2011.0,True,"Romance, Romance, Contemporary Romance, Contemporary, Adult Fiction, Erotica, Adult, New Adult, Academic, College, Fiction, Romance, Erotic Romance, Womens Fiction, Chick Lit",Goodreads Choice Award Nominee for Romance and for Goodreads Author (2011),"Toronto, Ontario, Florence, Selinsgrove, Pennsylvania"
https://www.goodreads.com/book/show/24765.Specials,24765,Specials,,Scott Westerfeld,3.76,174420,174420,384,,True,"Young Adult, Science Fiction, Dystopia, Science Fiction, Fiction, Fantasy, Romance, Young Adult, Teen, Adventure, Apocalyptic, Post Apocalyptic, Futuristic",0,
https://www.goodreads.com/book/show/16151178-the-sea-of-tranquility,16151178,The Sea of Tranquility,2.0,Katja Millay,4.31,79132,79132,426,2012.0,False,"Young Adult, Romance, Contemporary, New Adult, Fiction, Romance, Contemporary Romance, Sociology, Abuse, Realistic Fiction, Young Adult, High School, Drama","ALA Alex Award (2014), Goodreads Choice Award Nominee for Young Adult Fiction (2012)",Florida
https://www.goodreads.com/book/show/8709523-the-golden-lily,8709523,The Golden Lily,1.0,Richelle Mead,4.29,112419,112419,418,,True,"Young Adult, Paranormal, Vampires, Fantasy, Fantasy, Paranormal, Romance, Fantasy, Urban Fantasy, Fantasy, Magic, Fantasy, Supernatural, Romance, Paranormal Romance, Fiction",Goodreads Choice Award Nominee for Young Adult Fantasy & Science Fiction and for Goodreads Author (2012),"Palm Springs, California"
https://www.goodreads.com/book/show/140079.Definitely_Dead,140079,Definitely Dead,,Charlaine Harris,4.0,197111,197111,324,2006.0,True,"Fantasy, Paranormal, Vampires, Fantasy, Paranormal, Fantasy, Urban Fantasy, Fiction, Romance, Mystery, Romance, Paranormal Romance, Fantasy, Supernatural, Adult",0,
https://www.goodreads.com/book/show/2595138-the-gargoyle,2595138,The Gargoyle,2.0,Andrew Davidson,3.94,46780,46780,468,,False,"Fiction, Fantasy, Historical, Historical Fiction, Romance, Historical, Contemporary, Gothic, Adult, Fantasy, Paranormal, Magical Realism","Sunburst Award for Canadian Novel (2009), LovelyBooks Leserpreis Nominee for Allgemeine Literatur (2009)","North America, Germany, Japan, England, Italy, Iceland"
https://www.goodreads.com/book/show/11768.The_Hotel_New_Hampshire,11768,The Hotel New Hampshire,1.0,John Irving,3.91,59467,59467,520,1981.0,False,"Fiction, Contemporary, Literature, Novels, Literary Fiction, Classics, Literature, American, Humor, The United States Of America, Adult Fiction",National Book Award Finalist for Fiction (Hardcover) (1982),"New Hampshire, Vienna, New York City, New York"
https://www.goodreads.com/book/show/5091.The_Dark_Tower,5091,The Dark Tower,1.0,Stephen King,4.24,154959,154959,1050,2004.0,True,"Fantasy, Fiction, Horror, Science Fiction, Adventure, Westerns, Science Fiction Fantasy, Audiobook, Young Adult, Epic",British Fantasy Award for Best Novel (2005),
https://www.goodreads.com/book/show/13928.Daughter_of_the_Forest,13928,Daughter of the Forest,3.0,Juliet Marillier,4.23,59808,59808,554,1999.0,True,"Fantasy, Romance, Fiction, Historical, Historical Fiction, Young Adult, Fantasy, Fairy Tales, Historical, Fantasy, Magic, Retellings, Adult","Locus Award Nominee for Best First Novel (2001), ALA Alex Award (2001), Aurealis Award Nominee for Fantasy Novel (1999)",
https://www.goodreads.com/book/show/29946.Illusions,29946,Illusions: The Adventures of a Reluctant Messiah,1.0,Richard Bach,4.14,58383,58383,144,1977.0,True,"Fiction, Philosophy, Spirituality, Fantasy, Classics, Religion, Inspirational, Novels, Literature, Self Help",National Book Award Finalist for Religion/Inspiration (Paperback) (1980),
https://www.goodreads.com/book/show/36336078-call-me-by-your-name,36336078,Call Me By Your Name,,André Aciman,4.21,251116,251116,248,2007.0,True,"Fiction, Romance, LGBT, Contemporary, GLBT, Queer, Audiobook, Adult, LGBT, Gay, Young Adult, Coming Of Age, Young Adult",0,"Italy, Italian Riviera, Liguria"
https://www.goodreads.com/book/show/21671.Mystic_River,21671,Mystic River,8.0,Dennis Lehane,4.15,135408,135408,416,2001.0,False,"Mystery, Fiction, Thriller, Mystery, Crime, Thriller, Mystery Thriller, Suspense, Drama, Novels, Contemporary, Adult","Barry Award for Best Novel (2002), Macavity Award Nominee for Best Mystery Novel (2002), Anthony Award for Best Novel (2002), Hammett Prize Nominee (2001), Dilys Award (2002), Massachusetts Book Award for Fiction (2002), Deutscher Krimi Preis for 3. Platz International (2003), Prix des libraires du Québec for Lauréats hors Québec (2003)","Boston, Massachusetts"
https://www.goodreads.com/book/show/13596809-reflected-in-you,13596809,Reflected in You,,Sylvia Day,4.32,317462,317462,338,2012.0,True,"Romance, Adult Fiction, Erotica, Contemporary, Romance, Contemporary Romance, Adult, Romance, Erotic Romance, Erotica, BDSM, Fiction, New Adult, Womens Fiction, Chick Lit",0,
https://www.goodreads.com/book/show/170210.Dead_as_a_Doornail,170210,Dead as a Doornail,,Charlaine Harris,3.99,212348,212348,295,2005.0,True,"Fantasy, Paranormal, Vampires, Fantasy, Paranormal, Fantasy, Urban Fantasy, Fiction, Romance, Mystery, Romance, Paranormal Romance, Fantasy, Supernatural, Adult",0,"Bon Temps, Louisiana"
https://www.goodreads.com/book/show/78983.Kane_and_Abel,78983,Kane and Abel,,Jeffrey Archer,4.32,103926,103926,592,1979.0,True,"Fiction, Historical, Historical Fiction, Thriller, Drama, Classics, Historical, Novels, Mystery, Contemporary, Thriller, Mystery Thriller",0,United States of America
https://www.goodreads.com/book/show/1241.A_Million_Little_Pieces,1241,A Million Little Pieces,,James Frey,3.65,231535,231535,515,2003.0,False,"Fiction, Contemporary, Psychology, Biography Memoir, Adult, Book Club, Novels, Health, Mental Health, Adult Fiction, Drama",0,
https://www.goodreads.com/book/show/2731276-the-story-of-edgar-sawtelle,2731276,The Story of Edgar Sawtelle,7.0,David Wroblewski,3.62,95719,95719,566,,False,"Fiction, Animals, Animals, Dogs, Adult Fiction, Contemporary, Young Adult, Coming Of Age, Book Club, Literary Fiction, Adult, Novels","John Sargent, Sr. First Novel Prize (2008), Colorado Book Award for Literary Fiction (2009), Sakura Medal Nominee for High School Book (2010), Indies Choice Book Award for Best Author Discovery (2009), Puddly Award for Fiction (2009), The Center for Fiction First Novel Prize Nominee (2008)","Mellen, Wisconsin, Pusan"
https://www.goodreads.com/book/show/373755.Absalom_Absalom_,373755,"Absalom, Absalom!",,William Faulkner,3.97,39570,39570,316,1936.0,False,"Classics, Fiction, Literature, Literature, American, Novels, Historical, Historical Fiction, American, Southern, Gothic, Southern Gothic, Literature, 20th Century, Literary Fiction",0,"United States of America, Mississippi, Yoknapatawpha County, Mississippi"
https://www.goodreads.com/book/show/7805.Pale_Fire,7805,Pale Fire,1.0,Vladimir Nabokov,4.1,45668,45668,246,1962.0,False,"Fiction, Classics, Poetry, Cultural, Russia, Literature, Novels, Literature, Russian Literature, Literature, 20th Century, Literary Fiction, Literature, American",National Book Award Finalist for Fiction (1963),"New Wye, Appalachia, Cedarn, Utana, Zembla"
https://www.goodreads.com/book/show/280111.Holy_Bible,280111,Holy Bible: New International Version,1.0,Anonymous,4.6,66186,66186,1248,1973.0,False,"Religion, Christian, Nonfiction, Classics, Religion, Christianity, Reference, Spirituality, History, Religion, Faith, Philosophy",ECPA Christian Book Award for Bibles (2007),
https://www.goodreads.com/book/show/6917952-burned,6917952,Burned,3.0,P.C. Cast,3.96,149201,149201,323,,True,"Young Adult, Paranormal, Vampires, Fantasy, Fantasy, Paranormal, Romance, Fantasy, Supernatural, Romance, Paranormal Romance, Fiction, Fantasy, Urban Fantasy, Fantasy, Magic","Children's Choice Book Award Nominee for Teen Choice Book of the Year (2011), Teen Read Award Nominee for Best Series (2010), Goodreads Choice Award Nominee for Young Adult Fantasy and for Favorite Book (2010)","Tulsa, Oklahoma"
https://www.goodreads.com/book/show/307791.The_City_of_Ember,307791,The City of Ember,14.0,Jeanne DuPrau,3.86,255606,255606,288,,True,"Young Adult, Science Fiction, Dystopia, Fantasy, Science Fiction, Fiction, Childrens, Middle Grade, Childrens, Adventure, Apocalyptic, Post Apocalyptic, Childrens, Juvenile","California Book Award for Young Adult (Silver) (2003), Maryland Black-Eyed Susan Book Award for Grade 6-9 (2006), Rhode Island Teen Book Award Nominee (2005), Dorothy Canfield Fisher Children's Book Award Nominee (2005), Child Magazine Best Book of the Year, Sunshine State Young Readers Award for Grades 3-5 and Grades 6-8 (2004), Charlie May Simon Children's Book Award Nominee (2006), New Mexico Land of Enchantment Award for Young Adult (2007), Judy Lopez Memorial Award for Children's Literature Nominee (2004), Chapman Award for Shared Reading Nominee for Fiction (2004), William Allen White Children's Book Award (2006), Washington State Sasquatch Award (2006), Bluestem Book Award Nominee (2019), Rebecca Caudill Young Readers' Book Award Nominee (2006)",
https://www.goodreads.com/book/show/7822895-the-millennium-trilogy,7822895,"The Millennium Trilogy (Millennium Trilogy, #1-3)",,Stieg Larsson,4.43,50317,50317,1531,2005.0,False,"Fiction, Mystery, Thriller, Mystery, Crime, Suspense, Contemporary, Novels, Thriller, Mystery Thriller, Adult, Literature",0,Stockholm
https://www.goodreads.com/book/show/24800.House_of_Leaves,24800,House of Leaves,7.0,Mark Z. Danielewski,4.05,142843,142843,710,,False,"Horror, Fiction, Fantasy, Mystery, Thriller, Novels, Contemporary, Adult, Literature, Fantasy, Paranormal","Bram Stoker Award Nominee for Best First Novel (2000), Locus Award Nominee for Best First Novel (2001), New York Public Library Young Lions Fiction Award (2001), Guardian First Book Award Nominee (2000), James Tait Black Memorial Prize Nominee for Fiction (2000), International Horror Guild Award Nominee for Best First Novel (2000), Premio Ignotus Nominee for Mejor novela extranjera (Best Foreign Novel) (2014)",
https://www.goodreads.com/book/show/2168860.One_Foot_in_the_Grave,2168860,One Foot in the Grave,,Jeaniene Frost,4.29,97214,97214,357,,True,"Fantasy, Paranormal, Paranormal, Vampires, Fantasy, Urban Fantasy, Romance, Paranormal Romance, Romance, Fantasy, Adult, Fantasy, Supernatural, Fiction, Audiobook",0,"Richmond, Virginia, Licking Falls, Ohio"
https://www.goodreads.com/book/show/17728.The_House_of_Mirth,17728,The House of Mirth,,Edith Wharton,3.95,87564,87564,351,1905.0,False,"Classics, Fiction, Historical, Historical Fiction, Literature, Literature, American, Novels, New York, Literature, 20th Century, Classics, Classic Literature, Historical",0,"New York City, New York"
https://www.goodreads.com/book/show/18839.Orlando,18839,Orlando,,Virginia Woolf,3.86,65990,65990,272,1928.0,False,"Classics, Fiction, Historical, Historical Fiction, LGBT, Fantasy, Feminism, GLBT, Queer, Literature, Novels, European Literature, British Literature",0,"England, Turkey"
https://www.goodreads.com/book/show/30281.Guilty_Pleasures,30281,Guilty Pleasures,,Laurell K. Hamilton,4.01,136830,136830,355,1993.0,True,"Fantasy, Urban Fantasy, Paranormal, Vampires, Fantasy, Fantasy, Paranormal, Romance, Horror, Fiction, Romance, Paranormal Romance, Fantasy, Supernatural, Mystery",0,"St. Louis, Missouri"
https://www.goodreads.com/book/show/7046495-lover-mine,7046495,Lover Mine,3.0,J.R. Ward,4.39,105576,105576,528,,True,"Fantasy, Paranormal, Romance, Paranormal Romance, Romance, Paranormal, Vampires, Fantasy, Fantasy, Urban Fantasy, Adult, Fiction, Adult Fiction, Erotica, Fantasy, Supernatural","All About Romance (AAR) Annual Reader Poll for Guiltiest Pleasure Romance & Honorable Mention for Best Paranormal Romance (2011), Romantic Times Reviewers' Choice Award (RT Award) Nominee for Vampire Romance (2010), Goodreads Choice Award for Romance (2010)","Caldwell, New York"
https://www.goodreads.com/book/show/26157586-toe-to-toe,26157586,Toe to Toe,,Deborah Leblanc,4.29,12441,12441,304,2015.0,False,"Contemporary, Novels, Fiction, Drama, Epic",0,
https://www.goodreads.com/book/show/270730.Crank,270730,Crank,6.0,Ellen Hopkins,4.15,129692,129692,537,,True,"Young Adult, Poetry, Fiction, Contemporary, Realistic Fiction, Young Adult, Teen, Health, Mental Health, Romance, Young Adult, High School, Drama","Soaring Eagle Book Award (2008), Deutscher Jugendliteraturpreis Nominee for Jugendbuch (2011), Lincoln Award (2009), Goldener Lufti (2012), Green Mountain Book Award (2009), Missouri Gateway Readers Award (2007)","United States of America, Albuquerque, New Mexico, Reno, Nevada"
https://www.goodreads.com/book/show/16328.The_Murder_of_Roger_Ackroyd,16328,The Murder of Roger Ackroyd,2.0,Agatha Christie,4.24,170352,170352,288,1926.0,True,"Mystery, Fiction, Classics, Mystery, Crime, Thriller, Mystery Thriller, Mystery, Detective, Thriller, Audiobook, European Literature, British Literature, Mystery, Murder Mystery","Anthony Award Nominee for Best Novel of the Century (2000), CWA Best Ever for Crime Novel (2013)","King's Abbot, England"
https://www.goodreads.com/book/show/334123.The_Amulet_of_Samarkand,334123,The Amulet of Samarkand,2.0,Jonathan Stroud,4.0,121421,121421,462,,True,"Fantasy, Young Adult, Fiction, Fantasy, Magic, Childrens, Middle Grade, Childrens, Adventure, Fantasy, Urban Fantasy, Young Adult, Young Adult Fantasy, Audiobook","Mythopoeic Fantasy Award for Children's Literature (2006), Deutscher Jugendliteraturpreis Nominee for Jugendbuch (2005)","London, England"
https://www.goodreads.com/book/show/46945.Requiem_for_a_Dream,46945,Requiem for a Dream,,Hubert Selby Jr.,4.09,58064,58064,279,1978.0,False,"Fiction, Thriller, Mystery, Classics, Contemporary, Drama, Novels, Mystery, Crime, Suspense, Dark",0,"Coney Island, New York"
https://www.goodreads.com/book/show/18045891-sharp-objects,18045891,Sharp Objects,4.0,Gillian Flynn,3.98,735097,735097,254,,False,"Mystery, Fiction, Thriller, Mystery, Crime, Thriller, Mystery Thriller, Suspense, Adult, Contemporary, Audiobook, Adult Fiction","Barry Award Nominee for Best First Novel (2007), CWA New Blood Dagger (2007), Edgar Award Nominee for Best First Novel (2007), CWA Ian Fleming Steel Dagger (2007)","Wind Gap, Missouri, Chicago, Illinois, Missouri"
https://www.goodreads.com/book/show/35879889-christy,35879889,Christy,,Catherine Marshall,4.24,50190,50190,512,1967.0,False,"Historical, Historical Fiction, Fiction, Classics, Christian Fiction, Christian, Romance, Historical, Young Adult, Adult, Inspirational",0,"North Carolina, Tennessee"
https://www.goodreads.com/book/show/19691.The_Hunt_for_Red_October,19691,The Hunt for Red October,,Tom Clancy,4.08,344401,344401,432,1984.0,True,"Fiction, Thriller, Mystery, Suspense, War, Military Fiction, Adventure, Spy Thriller, Espionage, Action, Thriller, Mystery Thriller, War",0,"London, England, Washington, D.C., Atlantic Ocean, Moscow"
https://www.goodreads.com/book/show/9593911-pandemonium,9593911,Pandemonium,1.0,Lauren Oliver,4.04,222835,222835,375,,True,"Young Adult, Science Fiction, Dystopia, Romance, Science Fiction, Fiction, Fantasy, Young Adult, Teen, Adventure, Audiobook, Love",Goodreads Choice Award Nominee for Young Adult Fantasy & Science Fiction and for Goodreads Author (2012),"New York City, New York"
https://www.goodreads.com/book/show/3063499-the-lucky-one,3063499,The Lucky One,,Nicholas Sparks,4.12,333934,333934,326,2007.0,False,"Romance, Fiction, Womens Fiction, Chick Lit, Contemporary, Adult, Romance, Contemporary Romance, Adult Fiction, Love, Drama, Romance, Love Story",0,"Hampton, North Carolina"
https://www.goodreads.com/book/show/7437.Naked_Lunch,7437,Naked Lunch,,William S. Burroughs,3.46,87169,87169,289,1959.0,False,"Fiction, Classics, Literature, Novels, Literature, American, Contemporary, Thriller, Literature, Banned Books, Literature, 20th Century, Science Fiction",0,
https://www.goodreads.com/book/show/13362536-opal,13362536,Opal,1.0,Jennifer L. Armentrout,4.27,131849,131849,394,,True,"Young Adult, Fantasy, Paranormal, Romance, Fantasy, Science Fiction, Aliens, Science Fiction, Romance, Paranormal Romance, Fantasy, Supernatural, Fantasy, Urban Fantasy, Fiction",Goodreads Choice Award Nominee for Young Adult Fantasy & Science Fiction (2013),West Virginia
https://www.goodreads.com/book/show/2666.The_Bonfire_of_the_Vanities,2666,The Bonfire of the Vanities,2.0,Tom Wolfe,3.86,74461,74461,690,1987.0,False,"Fiction, Classics, Novels, Literature, Contemporary, Literary Fiction, New York, Literature, American, Literature, 20th Century, Humor","Ambassador Book Award for Fiction (1988), National Book Critics Circle Award Nominee for Fiction (1987)","New York City, New York, New York State"
https://www.goodreads.com/book/show/11991.The_Fall,11991,The Fall,,Albert Camus,4.02,79137,79137,147,1956.0,False,"Fiction, Philosophy, Classics, Cultural, France, Literature, European Literature, French Literature, Novels, Literature, 20th Century, Literary Fiction, Nobel Prize",0,"Amsterdam, Paris"
https://www.goodreads.com/book/show/162898.A_Connecticut_Yankee_in_King_Arthur_s_Court,162898,A Connecticut Yankee in King Arthur's Court,,Mark Twain,3.77,98117,98117,480,1889.0,False,"Classics, Fiction, Fantasy, Historical, Historical Fiction, Humor, Science Fiction, Time Travel, Literature, Adventure, Science Fiction, Mythology, Arthurian",0,"United Kingdom, Hartford, Connecticut, Connecticut, England"
https://www.goodreads.com/book/show/368916.84_Charing_Cross_Road,368916,"84, Charing Cross Road",,Helene Hanff,4.14,53343,53343,97,1970.0,False,"Nonfiction, Writing, Books About Books, Autobiography, Memoir, Classics, Biography, European Literature, British Literature, Biography Memoir, History, Adult, Historical",0,
