url,book_id,title,author,avg_rating,num_reviews,num_ratings,num_pages,original_publish_year,series,genres,awards,place
https://www.goodreads.com/book/show/3591262-cutting-for-stone,,Cutting for Stone,Abraham   Verghese,4.29,345293,345293,541.0,2009.0,False,"Fiction, Historical, Historical Fiction, Cultural, Africa, Book Club, Health, Medicine, Eastern Africa, Ethiopia, Medical, Novels, Literary Fiction, Contemporary","(6, 'PEN/Hemingway Foundation Award Nominee (2010), Exclusive Books Boeke Prize Nominee (2011), Indies Choice Book Award for Adult Fiction (2010), Dayton Literary Peace Prize Nominee for Fiction (2010), Wellcome Book Prize Nominee for Shortlist (2009), Goodreads Choice Award Nominee for Fiction (2009)')","Addis Ababa, Madras, Kochi, Aden, Djibouti, Asmara, Khartoum, Nairobi, New York City, New York, Boston, Massachusetts, Rome"
https://www.goodreads.com/book/show/140077.Dead_to_the_World,,Dead to the World,Charlaine Harris,4.11,252693,252693,291.0,2004.0,True,"Fantasy, Paranormal, Vampires, Fantasy, Paranormal, Fantasy, Urban Fantasy, Romance, Fiction, Mystery, Romance, Paranormal Romance, Fantasy, Supernatural, Adult","(0, nan)","Bon Temps, Louisiana"
https://www.goodreads.com/book/show/17675462-the-raven-boys,,The Raven Boys,Maggie Stiefvater,4.04,293027,293027,409.0,,True,"Fantasy, Young Adult, Fantasy, Paranormal, Romance, Fiction, Fantasy, Urban Fantasy, Fantasy, Magic, Audiobook, Young Adult, Young Adult Fantasy, Fantasy, Supernatural","(10, 'Bram Stoker Award Nominee for Best Young Adult Novel (2012), Mythopoeic Fantasy Award Nominee for Adult Literature (2017), Rhode Island Teen Book Award Nominee (2015), Milwaukee County Teen Book Award Nominee (2014), The Inky Awards for Silver Inky (2013), Lincoln Award Nominee (2015), Goodreads Choice Award Nominee for Young Adult Fantasy & Science Fiction (2012), Carnegie Medal Nominee (2014), The Inky Awards Shortlist for Silver Inky (2013), Premio El Templo de las Mil Puertas Nominee for Mejor novela extranjera perteneciente a saga (2013)')","Henrietta, Virginia"
https://www.goodreads.com/book/show/84119.The_Horse_and_His_Boy,,The Horse and His Boy,C.S. Lewis,3.91,291025,291025,224.0,1954.0,True,"Fantasy, Classics, Fiction, Young Adult, Childrens, Adventure, Christian, Childrens, Middle Grade, Christian Fiction, Science Fiction Fantasy","(0, nan)",Narnia
https://www.goodreads.com/book/show/77767.Little_House_on_the_Prairie,,Little House on the Prairie,Laura Ingalls Wilder,4.19,263350,263350,335.0,1935.0,True,"Classics, Historical, Historical Fiction, Childrens, Fiction, Young Adult, Historical, Childrens, Middle Grade, Childrens, Juvenile, Family, Adventure","(0, nan)","Kansas, Wisconsin"
https://www.goodreads.com/book/show/518848.Sabriel,,Sabriel,Garth Nix,4.14,194308,194308,491.0,1995.0,True,"Fantasy, Young Adult, Fiction, Fantasy, Magic, Adventure, Young Adult, Young Adult Fantasy, Fantasy, High Fantasy, Science Fiction Fantasy, Audiobook, Young Adult, Teen","(4, 'برنده جایزه آریلیس, Ditmar Award Nominee for Short Fiction (1996), Aurealis Award for Fantasy Novel and Young Adult Novel (1995), Lincoln Award Nominee (2005)')","Old Kingdom, Ancelstierre"
https://www.goodreads.com/book/show/13188676-ignite-me,,Ignite Me,Tahereh Mafi,4.39,151787,151787,421.0,,True,"Young Adult, Science Fiction, Dystopia, Fantasy, Romance, Science Fiction, Fantasy, Paranormal, Fiction, New Adult, Young Adult, Young Adult Fantasy, Apocalyptic, Post Apocalyptic","(1, 'Goodreads Choice Award Nominee for Young Adult Fantasy & Science Fiction (2014)')",
https://www.goodreads.com/book/show/56728.You_Are_Special,,You Are Special,Max Lucado,4.44,50344,50344,32.0,1997.0,True,"Childrens, Picture Books, Childrens, Christian, Fiction, Religion, Inspirational, Christian Fiction, Religion, Christianity, Fantasy, Kids","(0, nan)",
https://www.goodreads.com/book/show/10576365-the-darkest-minds,,The Darkest Minds,Alexandra Bracken,4.17,159407,159407,488.0,,True,"Young Adult, Science Fiction, Dystopia, Fantasy, Science Fiction, Romance, Fiction, Fantasy, Paranormal, Adventure, Young Adult, Young Adult Fantasy, Fantasy, Supernatural","(2, 'Lincoln Award Nominee (2016), Goodreads Choice Award Nominee for Young Adult Fantasy & Science Fiction (2013)')",
https://www.goodreads.com/book/show/11408650-the-unbecoming-of-mara-dyer,,The Unbecoming of Mara Dyer,Michelle Hodkin,4.03,159474,159474,456.0,,True,"Young Adult, Fantasy, Paranormal, Fantasy, Romance, Mystery, Fiction, Fantasy, Supernatural, Horror, Contemporary, Romance, Paranormal Romance","(0, nan)","Miami, Florida"
https://www.goodreads.com/book/show/5326.A_Christmas_Carol,,A Christmas Carol,Charles Dickens,4.07,643799,643799,104.0,1843.0,False,"Classics, Fiction, Holiday, Christmas, Fantasy, Literature, Audiobook, Historical, Historical Fiction, Holiday, Literature, 19th Century, Classics, Classic Literature","(1, 'Audie Award for Classic (2005)')","London, England"
https://www.goodreads.com/book/show/31122.I_Capture_the_Castle,,I Capture the Castle,Dodie Smith,4.0,88007,88007,408.0,1948.0,False,"Classics, Fiction, Young Adult, Historical, Historical Fiction, Romance, Young Adult, Coming Of Age, Historical, European Literature, British Literature, Novels, Adult Fiction","(0, nan)","Suffolk, England, Godsend Castle, Suffolk, England"
https://www.goodreads.com/book/show/41014505-the-bronze-horseman,,The Bronze Horseman,Paullina Simons,4.3,69495,69495,912.0,2000.0,True,"Historical, Historical Fiction, Romance, Historical, Romance, Historical Romance, Fiction, War, Cultural, Russia, Adult, War, World War II, Adult Fiction","(0, nan)","Leningrad, USSR, Russia"
https://www.goodreads.com/book/show/17333223-the-goldfinch,,The Goldfinch,Donna Tartt,3.92,756944,756944,771.0,2013.0,False,"Fiction, Contemporary, Literary Fiction, Audiobook, Art, Adult, Novels, Adult Fiction, Mystery, Literature","(7, ""Pulitzer Prize for Fiction (2014), Audie Award for Literary Fiction (2014), National Book Critics Circle Award Nominee for Fiction (2013), Australian Book Industry Award (ABIA) Nominee for International Book (2014), Women's Prize for Fiction Nominee (2014), Andrew Carnegie Medal for Fiction (2014), Goodreads Choice Award Nominee for Fiction (2013)"")","Amsterdam, Las Vegas, Nevada, New York City, New York, New York City's Upper East Side"
https://www.goodreads.com/book/show/92307.Being_and_Time,,Being and Time,Martin Heidegger,4.03,20887,20887,589.0,1927.0,False,"Philosophy, Nonfiction, Classics, European Literature, German Literature, Psychology, Science, Philosophy, Theory, Academic, Cultural, Germany, Literature, 20th Century","(0, nan)",
https://www.goodreads.com/book/show/179064.The_Goose_Girl,,The Goose Girl,Shannon Hale,4.1,140008,140008,383.0,2003.0,True,"Fantasy, Young Adult, Fantasy, Fairy Tales, Romance, Fiction, Retellings, Childrens, Middle Grade, Adventure, Childrens, Young Adult, Young Adult Fantasy","(4, ""Mythopoeic Fantasy Award Nominee for Children's Literature (2010), Utah Book Award for Children/Young Adults (2003), Josette Frank Award (2004), Waterstones Children's Book Prize Nominee (2005)"")",
https://www.goodreads.com/book/show/29908754-the-zombie-room,,The Zombie Room,R.D. Ronald,4.17,76126,76126,241.0,2012.0,False,"Thriller, Fiction, Mystery, Mystery, Crime, Drama, Suspense, Novels, Dark, Contemporary, Adult Fiction","(0, nan)",
https://www.goodreads.com/book/show/77566.Hyperion,,Hyperion,Dan Simmons,4.23,198847,198847,482.0,1989.0,True,"Science Fiction, Fiction, Fantasy, Space, Space Opera, Science Fiction Fantasy, Audiobook, Science Fiction, Time Travel, Horror, Space, Novels","(10, 'Hugo Award for Best Novel (1990), Locus Award for Best Science Fiction Novel (1990), Arthur C. Clarke Award Nominee (1992), British Science Fiction Association Award Nominee for Best Novel (1992), Premio Ignotus for Novela (1991), SF Chronicle Award Nominee for Best Novel (1990), Tähtivaeltaja Award (1998), Chesley Award Nominee for Hardback cover (2013), Prix Cosmos 2000 (1992), Seiun Award 星雲賞 for Best Foreign Novel (1995)')",
https://www.goodreads.com/book/show/1625.Twelfth_Night,,Twelfth Night,William Shakespeare,3.98,159339,159339,272.0,1601.0,False,"Classics, Plays, Drama, Fiction, Academic, School, Romance, Plays, Theatre, Literature, Poetry, Academic, Read For School","(0, nan)",Illyria
https://www.goodreads.com/book/show/40909452-drums-of-autumn,,Drums of Autumn,Diana Gabaldon,4.32,216842,216842,928.0,1996.0,True,"Historical, Historical Fiction, Romance, Fantasy, Fiction, Science Fiction, Time Travel, Historical, Romance, Historical Romance, Audiobook, Adult, Adventure","(1, 'All About Romance (AAR) Annual Reader Poll for Favorite ""Other"" Romance & Honorable Mention for Favorite Couple (1998)')","Boston, Massachusetts, Charleston, South Carolina, Fraser's Ridge, North Carolina, Cross Creek, North Carolina, Oxford, England, Inverness, Scotland, Scottish Highlands"
https://www.goodreads.com/book/show/40611510-the-last-lecture,,The Last Lecture,Randy Pausch,4.25,314441,314441,217.0,2008.0,False,"Nonfiction, Autobiography, Memoir, Biography, Self Help, Inspirational, Philosophy, Biography, Autobiography, Biography Memoir, Audiobook, Adult","(1, 'Audie Award for Biography/Memoir (2009)')",
https://www.goodreads.com/book/show/78411.The_Bad_Beginning,,The Bad Beginning,Lemony Snicket,3.95,423909,423909,176.0,,True,"Fiction, Young Adult, Childrens, Fantasy, Childrens, Middle Grade, Mystery, Adventure, Audiobook, Humor, Childrens, Juvenile","(3, ""Book Sense Book of the Year Award Nominee for Children's Literature (2001), Nene Award (2003), Silberner Lufti (2000)"")",
https://www.goodreads.com/book/show/5064.World_Without_End,,World Without End,Ken Follett,4.26,211622,211622,1014.0,,True,"Historical, Historical Fiction, Fiction, Historical, Historical, Medieval, European Literature, British Literature, Audiobook, Novels, Romance, Fantasy, Adult","(0, nan)","Kingsbridge, England"
https://www.goodreads.com/book/show/36236125-invisible-monsters,,Invisible Monsters,Chuck Palahniuk,3.98,131604,131604,304.0,1999.0,False,"Fiction, Contemporary, Thriller, Mystery, Novels, Dark, Adult, Humor, Drama, Adult Fiction","(0, nan)",
https://www.goodreads.com/book/show/11899.The_Hours,,The Hours,Michael Cunningham,3.94,127429,127429,230.0,1998.0,False,"Fiction, Historical, Historical Fiction, Contemporary, LGBT, Literary Fiction, Novels, Literature, Classics, Historical, GLBT, Queer","(7, 'Pulitzer Prize for Fiction (1999), Stonewall Book Award for Literature (1999), PEN/Faulkner Award for Fiction (1999), Ferro-Grumley Award for Gay Fiction (1999), National Book Critics Circle Award Nominee for Fiction (1998), Premio Grinzane Cavour for Narrativa Straniera (2000), International Dublin Literary Award Nominee for Shortlist (2000)')","London, England, New York City, New York, Los Angeles, California"
https://www.goodreads.com/book/show/29127.The_Last_Unicorn,,The Last Unicorn,Peter S. Beagle,4.14,101408,101408,294.0,1968.0,True,"Fantasy, Fiction, Classics, Young Adult, Childrens, Adventure, Science Fiction Fantasy, Fantasy, Magic, Fantasy, Unicorns, Fantasy, Fairy Tales","(1, 'Национални фантастични награди for Любим превод за 2015 г. – първо място (2016)')",
https://www.goodreads.com/book/show/8337.Little_House_in_the_Big_Woods,,Little House in the Big Woods,Laura Ingalls Wilder,4.18,240605,240605,198.0,1932.0,True,"Classics, Historical, Historical Fiction, Childrens, Fiction, Young Adult, Historical, Childrens, Middle Grade, Childrens, Juvenile, Audiobook, Family","(1, 'Lewis Carroll Shelf Award (1958)')","Pepin, Wisconsin, Wisconsin"
https://www.goodreads.com/book/show/366522.P_S_I_Love_You,,P.S. I Love You,Cecelia Ahern,4.02,347695,347695,501.0,2004.0,True,"Romance, Womens Fiction, Chick Lit, Fiction, Contemporary, Adult, Romance, Contemporary Romance, Love, Adult Fiction, Drama, Cultural, Ireland","(0, nan)",Dublin
https://www.goodreads.com/book/show/92517.The_Glass_Menagerie,,The Glass Menagerie,Tennessee Williams,3.71,114950,114950,104.0,1945.0,False,"Plays, Classics, Drama, Fiction, Academic, School, Plays, Theatre, Literature, Academic, Read For School, Young Adult, High School, Literature, American","(1, ""New York Drama Critics' Circle Award for Best American Play (1945)"")","United States of America, St. Louis, Missouri"
https://www.goodreads.com/book/show/305234.Wicked_Lovely,,Wicked Lovely,Melissa Marr,3.69,162168,162168,328.0,,True,"Fantasy, Young Adult, Romance, Fantasy, Paranormal, Fantasy, Urban Fantasy, Paranormal, Fairies, Fairies, Fae, Fiction, Romance, Paranormal Romance, Fantasy, Magic","(3, 'RITA Award by Romance Writers of America for Best Young Adult Romance (2008), DABWAHA Romance Tournament for Best Young Adult (2008), Missouri Gateway Readers Award Nominee (2010)')","Huntsdale, Pennsylvania"
https://www.goodreads.com/book/show/4134071-hunted,,Hunted,P.C. Cast,3.91,170318,170318,323.0,,True,"Young Adult, Paranormal, Vampires, Fantasy, Fantasy, Paranormal, Romance, Fiction, Fantasy, Supernatural, Fantasy, Urban Fantasy, Romance, Paranormal Romance, Fantasy, Magic","(1, 'Goodreads Choice Award Nominee for Favorite Book & Young Adult Series (2009)')","Tulsa, Oklahoma"
https://www.goodreads.com/book/show/7090447-the-red-pyramid,,The Red Pyramid,Rick Riordan,4.08,339831,339831,516.0,,True,"Fantasy, Young Adult, Fantasy, Mythology, Childrens, Middle Grade, Adventure, Fiction, Childrens, Fantasy, Magic, Fantasy, Urban Fantasy, Science Fiction Fantasy","(5, ""Pennsylvania Young Readers' Choice Award for Grades 6-8 (2012), New Mexico Land of Enchantment Award for Young Adult (2012), Goodreads Choice Award Nominee for Favorite Book and for Young Adult Fantasy (2010), Carnegie Medal Nominee (2011), Premio El Templo de las Mil Puertas for Mejor novela extranjera perteneciente a saga (2011)"")","London, England, Cairo, Phoenix, Arizona, Duat"
https://www.goodreads.com/book/show/22299763-crooked-kingdom,,Crooked Kingdom,Leigh Bardugo,4.58,251478,251478,561.0,,True,"Fantasy, Young Adult, Fiction, Young Adult, Young Adult Fantasy, LGBT, Romance, Fantasy, Magic, Adventure, Fantasy, High Fantasy, Audiobook","(1, 'Goodreads Choice Award Nominee for Young Adult Fantasy & Science Fiction (2016)')",Ketterdam
https://www.goodreads.com/book/show/7967.Speaker_for_the_Dead,,Speaker for the Dead,Orson Scott Card,4.07,232171,232171,382.0,1986.0,True,"Science Fiction, Fiction, Fantasy, Science Fiction Fantasy, Young Adult, Audiobook, Space, Science Fiction, Aliens, Novels, Space, Space Opera","(7, 'Hugo Award for Best Novel (1987), Nebula Award for Best Novel (1986), Locus Award for Best Science Fiction Novel (1987), Kurd-Laßwitz-Preis for Foreign Novel (1989), John W. Campbell Memorial Award Nominee for Best Science Fiction Novel (1987), SF Chronicle Award for Best Novel (1987), Prix Cosmos 2000 (1988)')",
https://www.goodreads.com/book/show/12497.No_Country_for_Old_Men,,No Country for Old Men,Cormac McCarthy,4.11,158026,158026,309.0,2005.0,False,"Fiction, Thriller, Mystery, Crime, Westerns, Mystery, Literature, Novels, Classics, Contemporary, Literature, American","(5, 'Hammett Prize Nominee (2005), Audie Award for Audiobook Adaptation (2011), Exclusive Books Boeke Prize Nominee (2007), Falcon Award (2008), International Dublin Literary Award Nominee for Shortlist (2007)')","United States of America, Terrell County, Texas"
https://www.goodreads.com/book/show/30333938-slammed,,Slammed,Colleen Hoover,4.25,216927,216927,354.0,2012.0,True,"Romance, New Adult, Young Adult, Contemporary, Romance, Contemporary Romance, Fiction, Womens Fiction, Chick Lit, Young Adult, High School, Realistic Fiction, Poetry","(1, 'Goodreads Choice Award Nominee for Young Adult Fiction and for Goodreads Author (2012)')","Ypsilanti, Michigan"
https://www.goodreads.com/book/show/24128.The_Merchant_of_Venice,,The Merchant of Venice,William Shakespeare,3.8,162485,162485,337.0,1596.0,False,"Classics, Plays, Fiction, Drama, Academic, School, Literature, Plays, Theatre, Academic, Read For School, Poetry, Classics, Classic Literature","(0, nan)","Republic of Venice, Venice"
https://www.goodreads.com/book/show/13006.Julius_Caesar,,Julius Caesar,William Shakespeare,3.69,175323,175323,128.0,1599.0,False,"Classics, Plays, Fiction, Drama, Academic, School, Historical, Historical Fiction, Literature, Academic, Read For School, Plays, Theatre, Young Adult, High School","(0, nan)","Rome, Italy, Philippi"
https://www.goodreads.com/book/show/30868.The_Bean_Trees,,The Bean Trees,Barbara Kingsolver,3.98,137571,137571,232.0,1988.0,True,"Fiction, Contemporary, Novels, Literary Fiction, Adult Fiction, Adult, Classics, Academic, School, Literature, Realistic Fiction","(0, nan)","Tucson, Arizona"
https://www.goodreads.com/book/show/15638.Cyrano_de_Bergerac,,Cyrano de Bergerac,Edmond Rostand,4.07,73469,73469,240.0,1897.0,False,"Classics, Plays, Fiction, Drama, Cultural, France, Romance, Plays, Theatre, Academic, School, Literature, Historical, Historical Fiction","(0, nan)","France, Arras, Paris"
https://www.goodreads.com/book/show/5439.Interpreter_of_Maladies,,Interpreter of Maladies,Jhumpa Lahiri,4.16,164818,164818,198.0,1999.0,False,"Short Stories, Fiction, Cultural, India, Contemporary, Literary Fiction, Literature, Asian Literature, Indian Literature, Cultural, Asia, Adult Fiction, Adult","(3, 'Pulitzer Prize for Fiction (2000), PEN/Hemingway Foundation Award (2000), Puddly Award for Short Stories (2001)')","Boston, Massachusetts, Kolkata, Odisha, Connecticut"
https://www.goodreads.com/book/show/902.The_Westing_Game,,The Westing Game,Ellen Raskin,4.01,177147,177147,182.0,1978.0,False,"Mystery, Young Adult, Fiction, Childrens, Middle Grade, Childrens, Classics, Thriller, Mystery Thriller, Academic, School, Childrens, Juvenile, Realistic Fiction","(6, ""Newbery Medal (1979), Banta Award, Dorothy Canfield Fisher Children's Book Award Nominee (1980), Boston Globe-Horn Book Award for Fiction (1978), National Book Award Finalist for Children's Book, Fiction (Paperback) (1981), Virginia Reader's Choice"")","Westingtown, Milwaukee, Wisconsin"
https://www.goodreads.com/book/show/77390.Anne_of_Avonlea,,Anne of Avonlea,L.M. Montgomery,4.19,155647,155647,304.0,1909.0,True,"Classics, Fiction, Young Adult, Historical, Historical Fiction, Childrens, Historical, Romance, Cultural, Canada, Audiobook, Childrens, Middle Grade","(0, nan)",Prince Edward Island
https://www.goodreads.com/book/show/7723542-a-dog-s-purpose,,A Dog's Purpose,W. Bruce Cameron,4.34,117923,117923,319.0,,True,"Fiction, Animals, Animals, Dogs, Contemporary, Adult, Fantasy, Audiobook, Adult Fiction, Humor, Young Adult","(2, 'Goodreads Choice Award Nominee for Fiction (2010), Missouri Gateway Readers Award Nominee (2013)')",
https://www.goodreads.com/book/show/35729.Lover_Eternal,,Lover Eternal,J.R. Ward,4.33,177249,177249,441.0,,True,"Romance, Fantasy, Paranormal, Romance, Paranormal Romance, Paranormal, Vampires, Fantasy, Fantasy, Urban Fantasy, Adult, Fiction, Adult Fiction, Erotica, Fantasy, Supernatural","(0, nan)","Caldwell, New York"
https://www.goodreads.com/book/show/227571.Peace_Like_a_River,,Peace Like a River,Leif Enger,3.98,84404,84404,312.0,2001.0,False,"Fiction, Historical, Historical Fiction, Book Club, Adult Fiction, Novels, Literary Fiction, Adult, Contemporary, Young Adult, Coming Of Age, Family","(4, 'Book Sense Book of the Year Award for Adult Fiction (2002), Independent Publisher Book Award (IPPY) for Fiction - General (2002), ALA Alex Award (2002), International Dublin Literary Award Nominee (2003)')","United States of America, North Dakota"
https://www.goodreads.com/book/show/15241.The_Two_Towers,,The Two Towers,J.R.R. Tolkien,4.45,757279,757279,322.0,1954.0,True,"Fantasy, Fiction, Classics, Adventure, Science Fiction Fantasy, Fantasy, High Fantasy, Fantasy, Epic Fantasy, Novels, Literature, Young Adult","(0, nan)",Middle-earth
https://www.goodreads.com/book/show/5527.All_the_King_s_Men,,All the King's Men,Robert Penn Warren,4.06,60309,60309,439.0,1946.0,False,"Fiction, Classics, Historical, Historical Fiction, Politics, Literature, Novels, Literature, American, Literary Fiction, American, Southern, Historical","(3, 'Pulitzer Prize for Fiction (1947), Prix du Meilleur Livre Étranger for Roman (1953), Mikael Agricola -palkinto (1977)')",Southern Region
https://www.goodreads.com/book/show/25480342-a-monster-calls,,A Monster Calls,Patrick Ness,4.33,223246,223246,237.0,2011.0,False,"Fantasy, Young Adult, Fiction, Horror, Childrens, Middle Grade, Contemporary, Magical Realism, Childrens, Fantasy, Paranormal, Death","(22, ""Bram Stoker Award Nominee for Best Young Adult Novel (2011), Kate Greenaway Medal (2012), Galaxy British Book Awards for Children's Book of the Year (2011), Grand Prix de l'Imaginaire for Jeunesse (2013), Los Angeles Times Book Prize Nominee for Young Adult Literature (2011), Red House Children's Book Award (2012), Rhode Island Teen Book Award Nominee (2014), Deutscher Jugendliteraturpreis for Preis der Jugendjury & Nominierung Kategorie Kinderbuch (2012), Tähtifantasia Award Nominee (2017), The Inky Awards Nominee for Silver Inky (2012), Gouden Lijst for vertaald boek (2014), Lincoln Award Nominee (2015), Galaxy National Book Award for Children’s Book of the Year (2011), Grampian Children’s Book Award Nominee (2013), The Kitschies for Red Tentacle (Novel) (2011), Goodreads Choice Award Nominee for Middle Grade & Children's (2011), Carnegie Medal (2012), The Inky Awards Shortlist for Silver Inky (2012), Prix Elbakin.net for Meilleur roman fantasy traduit Jeunesse (2012), Europese Literatuurprijs Nominee (2014), Rebecca Caudill Young Readers' Book Award Nominee (2016), Premi Protagonista Jove for Categoria 13-14 anys (2017)"")","England, United Kingdom"
https://www.goodreads.com/book/show/65641.The_Silver_Chair,,The Silver Chair,C.S. Lewis,3.95,252487,252487,243.0,1953.0,True,"Fantasy, Fiction, Classics, Young Adult, Childrens, Christian, Adventure, Childrens, Middle Grade, Christian Fiction, Science Fiction Fantasy","(0, nan)",
https://www.goodreads.com/book/show/14935.Sense_and_Sensibility,,Sense and Sensibility,Jane Austen,4.08,986221,986221,409.0,1811.0,False,"Classics, Fiction, Romance, Historical, Historical Fiction, Literature, Historical, Classics, Classic Literature, Literature, 19th Century, Novels, European Literature, British Literature","(0, nan)","England, United Kingdom, Devonshire, England"
https://www.goodreads.com/book/show/567678.The_Wasp_Factory,,The Wasp Factory,Iain Banks,3.81,87973,87973,192.0,1984.0,False,"Fiction, Horror, Thriller, Mystery, Contemporary, Dark, Drama, Suspense, Novels, Classics","(1, 'Kurd-Laßwitz-Preis for Foreign Novel (1992)')",Scotland
https://www.goodreads.com/book/show/40593473-finding-hope-in-the-darkness-of-grief,,"Finding Hope in the Darkness of Grief: Spiritual Insights Expressed Through Art, Poetry and Prose",Diamante Lavendar,4.33,5252,5252,74.0,,False,"Contemporary, Fiction, Novels, Drama, Book Club, Epic, Adult, Poetry, New Adult, Young Adult","(1, 'Feathered Quill Book Award for Religious/Spiritual (1st) and for Inspirational (2nd) (2019)')",
https://www.goodreads.com/book/show/80660.We_Need_to_Talk_About_Kevin,,We Need to Talk About Kevin,Lionel Shriver,4.05,176206,176206,400.0,2003.0,False,"Fiction, Contemporary, Thriller, Horror, Mystery, Crime, Drama, Psychology, Adult, Literary Fiction, Book Club","(1, 'Orange Prize for Fiction (2005)')",
https://www.goodreads.com/book/show/43758.The_Queen_of_the_Damned,,The Queen of the Damned,Anne Rice,3.88,141333,141333,448.0,1988.0,True,"Horror, Fantasy, Paranormal, Vampires, Fiction, Fantasy, Paranormal, Fantasy, Supernatural, Fantasy, Urban Fantasy, Gothic, Adult, Science Fiction Fantasy","(2, 'Bram Stoker Award Nominee for Best Novel (1988), Locus Award Nominee for Best Horror Novel (1989)')",
https://www.goodreads.com/book/show/10534.The_Art_of_War,,The Art of War,Sun Tzu,3.97,355777,355777,273.0,-500.0,False,"Nonfiction, Classics, Philosophy, History, War, Business, Politics, War, Military Fiction, Cultural, China, Leadership","(1, 'Independent Publisher Book Award (IPPY) for Multicultural Non-Fiction (2003)')",
https://www.goodreads.com/book/show/7631105-the-scorch-trials,,The Scorch Trials,James Dashner,3.91,472703,472703,362.0,,True,"Young Adult, Science Fiction, Dystopia, Science Fiction, Fiction, Fantasy, Adventure, Apocalyptic, Post Apocalyptic, Young Adult, Teen, Audiobook, Mystery","(0, nan)",
https://www.goodreads.com/book/show/60510.Poison_Study,,Poison Study,Maria V. Snyder,4.09,152899,152899,427.0,2005.0,True,"Fantasy, Young Adult, Romance, Fantasy, Magic, Fiction, Fantasy, Paranormal, Fantasy, High Fantasy, Young Adult, Young Adult Fantasy, Adventure, New Adult","(3, 'Locus Award Nominee for Best First Novel (2006), RITA Award by Romance Writers of America Nominee for First Book (2006), Compton Crook Award (2006)')",Ixia
https://www.goodreads.com/book/show/52529.The_Secret,,The Secret,Rhonda Byrne,3.69,372555,372555,199.0,,True,"Self Help, Nonfiction, Spirituality, Psychology, Philosophy, Self Help, Personal Development, Inspirational, Audiobook, Spirituality, New Age, Business","(0, nan)",
https://www.goodreads.com/book/show/23522.Mythology,,Mythology,Edith Hamilton,4.01,46555,46555,497.0,1942.0,False,"Fantasy, Mythology, Classics, Nonfiction, History, Reference, Religion, Academic, School, Mythology, Greek Mythology, Literature, Short Stories","(0, nan)",
