url,book_id,title,author,good_read_score,good_read_votes,avg_rating,num_reviews,num_ratings,num_pages,original_publish_year,series,genres,awards,award_count,place
https://www.goodreads.com/book/show/7244.The_Poisonwood_Bible,7244,The Poisonwood Bible,Barbara Kingsolver,273752,3005,4.07,23762,672795,546,1998,False,"Fiction, Historical, Historical Fiction, Cultural, Africa, Classics, Historical, Literary Fiction, Novels, Literature, Religion, Adult Fiction","Pulitzer Prize Nominee for Fiction (1999), Orange Prize Nominee for Fiction Shortlist (1999), Book Sense Book of the Year Award for Adult (2000), PEN/Faulkner Award for Fiction Nominee (1999), Independent Publisher Book Award (IPPY) for Audio Fiction - Unabridged (1999), Exclusive Books Boeke Prize (2000), Puddly Award for Novel (2001), International Dublin Literary Award Nominee (2000)",8,"Bethlehem, Georgia, Kilanga, Sanderling Island, Georgia, Leopoldville"
https://www.goodreads.com/book/show/119322.The_Golden_Compass,119322,The Golden Compass,Philip Pullman,266992,2986,3.99,23532,1336947,399,1995,True,"Fantasy, Young Adult, Fiction, Childrens, Adventure, Science Fiction, Childrens, Middle Grade, Science Fiction Fantasy, Science Fiction, Steampunk, Classics","Guardian Children's Fiction Prize (1996), Audie Award for Children's Titles (2000), Lincoln Award Nominee (2005), Carnegie Medal (1995)",4,"Oxford, England, Svalbard, Spitsbergen"
https://www.goodreads.com/book/show/3263607-the-fellowship-of-the-ring,3263607,The Fellowship of the Ring,J.R.R. Tolkien,261363,2867,4.37,24830,2441907,527,1954,True,"Fantasy, Classics, Fiction, Adventure, Science Fiction Fantasy, Fantasy, High Fantasy, Fantasy, Epic Fantasy, Young Adult, Novels, Fantasy, Magic",Publieksprijs voor het Nederlandse Boek Nominee (2002),1,Middle-earth
https://www.goodreads.com/book/show/3836.Don_Quixote,3836,Don Quixote,Miguel de Cervantes Saavedra,259190,2953,3.88,8666,221389,1023,1605,False,"Classics, Fiction, Literature, European Literature, Spanish Literature, Adventure, Novels, Historical, Historical Fiction, Cultural, Spain, Humor, Classics, Classic Literature","Will Eisner Comic Industry Awards Nominee for Best Adaptation from Another Medium & Best Humor Publication (2014), Βραβείο Λογοτεχνικής Μετάφρασης ΕΚΕΜΕΛ for Ισπανόφωνη Λογοτεχνία (2010), Premio de traducción literaria Valle Inclán for John Rutherford (2002)",3,"La Mancha, Barcelona, Catalonia, Spain"
https://www.goodreads.com/book/show/662.Atlas_Shrugged,662,Atlas Shrugged,Ayn Rand,250615,2754,3.69,17832,361830,1078,1957,False,"Fiction, Classics, Philosophy, Literature, Politics, Science Fiction, Novels, Science Fiction, Dystopia, Economics, Business","Prometheus Hall of Fame Award (1983), National Book Award Finalist for Fiction (1958)",2,
https://www.goodreads.com/book/show/2165.The_Old_Man_and_the_Sea,2165,The Old Man and the Sea,Ernest Hemingway,241956,2799,3.79,26890,879409,96,1952,False,"Classics, Fiction, Literature, Novels, Literature, American, Academic, School, Adventure, Classics, Classic Literature, Literary Fiction, Literature, 20th Century","Pulitzer Prize for Fiction (1953), Premio Bancarella (1953), National Book Award Finalist for Fiction (1953)",3,Cuba
https://www.goodreads.com/book/show/33648131-the-notebook,33648131,The Notebook,Nicholas Sparks,233055,2630,4.11,20554,1386098,227,1996,True,"Romance, Fiction, Womens Fiction, Chick Lit, Contemporary, Adult, Adult Fiction, Romance, Contemporary Romance, Love, Classics, Drama",,0,"New Bern, North Carolina, North Carolina"
https://www.goodreads.com/book/show/99107.Winnie_the_Pooh,99107,Winnie-the-Pooh,A.A. Milne,226710,2665,4.31,5096,287358,145,1926,True,"Classics, Childrens, Fiction, Fantasy, Animals, Childrens, Picture Books, Young Adult, Audiobook, Childrens, Middle Grade, Childrens, Juvenile",,0,Hundred Acre Wood
https://www.goodreads.com/book/show/23919.The_Complete_Stories_and_Poems,23919,The Complete Stories and Poems,Edgar Allan Poe,225168,2608,4.37,2265,230583,821,1849,False,"Classics, Poetry, Horror, Fiction, Short Stories, Mystery, Gothic, Literature, Fantasy, Classics, Classic Literature",,0,United States of America
https://www.goodreads.com/book/show/14.The_Hitchhiker_s_Guide_to_the_Galaxy,14,The Hitchhiker's Guide to the Galaxy,Douglas Adams,217290,2264,4.22,32043,1511949,215,1979,True,"Science Fiction, Fiction, Humor, Fantasy, Classics, Humor, Comedy, Science Fiction Fantasy, Audiobook, Adventure, Novels",,0,
https://www.goodreads.com/book/show/43763.Interview_with_the_Vampire,43763,Interview with the Vampire,Anne Rice,212969,2441,4.0,10756,504007,342,1976,True,"Horror, Fantasy, Fiction, Paranormal, Vampires, Fantasy, Paranormal, Classics, Fantasy, Supernatural, Gothic, Fantasy, Urban Fantasy, Historical, Historical Fiction",British Fantasy Award Nominee for Best Novel (1977),1,"New Orleans, Louisiana, Paris"
