url,book_id,title,author,good_read_score,good_read_votes,avg_rating,num_reviews,num_ratings,num_pages,original_publish_year,series,genres,awards,award_count,place
https://www.goodreads.com/book/show/7329.Unfinished_Tales_of_N_menor_and_Middle_Earth,7329,Unfinished Tales of Númenor and Middle-Earth,J.R.R. Tolkien,455,7,3.93,807.0,35682.0,452.0,1980.0,False,"Fantasy, Fiction, Classics, Young Adult, Fantasy, High Fantasy, Childrens, Adventure, Fantasy, Epic Fantasy, Short Stories, Science Fiction Fantasy","Locus Award Nominee for Best Single Author Collection (1981), Mythopoeic Fantasy Award (1981), Balrog Award for Best Collection/Anthology (1981)",3,Middle-earth
https://www.goodreads.com/book/show/59146.Marie_Antoinette,59146,Marie Antoinette: The Portrait of an Average Woman,Stefan Zweig,455,5,4.31,401.0,4904.0,476.0,1932.0,False,"History, Biography, Nonfiction, Cultural, France, Historical, Classics, European History, French Revolution, European Literature, German Literature, Literature, 20th Century, Biography Memoir",,0,
https://www.goodreads.com/book/show/243685.A_History_of_Western_Philosophy,243685,A History of Western Philosophy,Bertrand Russell,455,5,4.1,1111.0,33261.0,906.0,1945.0,False,"Philosophy, History, Nonfiction, Classics, Reference, Politics, Religion, Historical, Unfinished, Science",,0,
https://www.goodreads.com/book/show/7248435-the-chaos,7248435,The Chaos,Rachel Ward,455,5,3.82,624.0,7486.0,345.0,2010.0,True,"Young Adult, Fantasy, Science Fiction, Science Fiction, Dystopia, Fantasy, Paranormal, Fiction, Romance, Thriller, Mathematics, Number, Young Adult, Teen",,0,"London, England"
https://www.goodreads.com/book/show/12891107-king-of-thorns,12891107,King of Thorns,Mark  Lawrence,455,5,4.2,2732.0,57179.0,449.0,2012.0,True,"Fantasy, Fiction, Fantasy, Dark Fantasy, Fantasy, Epic Fantasy, Fantasy, High Fantasy, Science Fiction, Apocalyptic, Post Apocalyptic, Fantasy, Magic, Dark, Adult","David Gemmell Legend Award Nominee for Best Fantasy Novel (2013), Goodreads Choice Award Nominee for Fantasy (2012)",2,
https://www.goodreads.com/book/show/34311452-year-one,34311452,Year One,Nora Roberts,455,5,4.01,7118.0,72529.0,419.0,2017.0,True,"Fantasy, Fiction, Science Fiction, Dystopia, Fantasy, Paranormal, Romance, Fantasy, Urban Fantasy, Apocalyptic, Post Apocalyptic, Fantasy, Magic, Science Fiction, Audiobook",Goodreads Choice Award Nominee for Fantasy (2018),1,"New York City, New York"
https://www.goodreads.com/book/show/79109.Snow_in_August,79109,Snow in August,Pete Hamill,454,6,3.93,688.0,5911.0,384.0,1997.0,False,"Fiction, Historical, Historical Fiction, Fantasy, New York, Literature, Jewish, Historical, Magical Realism, Novels, Young Adult, Coming Of Age, Adult","ALA Alex Award (1998), Long Island Reads (2004)",2,"Brooklyn, New York City, New York, Park Slope, Brooklyn, New York"
https://www.goodreads.com/book/show/19001.A_Perfect_Spy,19001,A Perfect Spy,John le Carré,454,5,3.99,822.0,17094.0,608.0,1986.0,False,"Fiction, Spy Thriller, Espionage, Thriller, Mystery, Thriller, Spy Thriller, Mystery, Crime, Thriller, Mystery Thriller, Suspense, Novels, Audiobook","Martin Beck Award (1986), Los Angeles Times Book Prize Nominee for Fiction (1986), Deutscher Krimi Preis for 3. Platz International (1987)",3,
https://www.goodreads.com/book/show/3026017-my-bonny-light-horseman,3026017,"My Bonny Light Horseman: Being an Account of the Further Adventures of Jacky Faber, in Love and War",L.A. Meyer,454,5,4.25,437.0,7110.0,436.0,2008.0,True,"Historical, Historical Fiction, Young Adult, Adventure, Historical, Fiction, Adventure, Pirates, Young Adult, Teen, Audiobook, Romance, War",,0,
https://www.goodreads.com/book/show/9454.Hegel_s_Phenomenology_of_Spirit,9454,Hegel's Phenomenology of Spirit,Georg Wilhelm Friedrich Hegel,454,6,3.95,380.0,15753.0,640.0,1807.0,False,"Philosophy, Nonfiction, Classics, European Literature, German Literature, Philosophy, Theory, History, Philosophy, Metaphysics, Literature, 19th Century, Religion, Cultural, Germany",,0,
https://www.goodreads.com/book/show/7124925-the-forgotten-warrior,7124925,The Forgotten Warrior,Erin Hunter,454,6,4.46,291.0,10019.0,368.0,2011.0,True,"Fantasy, Animals, Childrens, Middle Grade, Fiction, Childrens, Young Adult, Animals, Cats, Adventure, Animals, Animal Fiction, Animals, Anthropomorphic",,0,
https://www.goodreads.com/book/show/112751.Spell_of_the_Highlander,112751,Spell of the Highlander,Karen Marie Moning,454,7,4.27,985.0,25593.0,394.0,2005.0,True,"Romance, Romance, Paranormal Romance, Fantasy, Paranormal, Science Fiction, Time Travel, Fantasy, Romance, Historical Romance, Historical, Fairies, Fae, Fiction, Fantasy, Magic",,0,"Chicago, Illinois, Scottish Highlands"
https://www.goodreads.com/book/show/12439061-mystic,12439061,Mystic,Alyson Noel,454,6,4.01,263.0,4683.0,320.0,2013.0,True,"Fantasy, Young Adult, Fantasy, Paranormal, Romance, Fantasy, Magic, Fiction, Fantasy, Supernatural, Romance, Paranormal Romance, Fantasy, Urban Fantasy, Young Adult, Teen",,0,
https://www.goodreads.com/book/show/33585392-dear-ijeawele-or-a-feminist-manifesto-in-fifteen-suggestions,33585392,"Dear Ijeawele, or a Feminist Manifesto in Fifteen Suggestions",Chimamanda Ngozi Adichie,454,5,4.51,7974.0,62799.0,63.0,2017.0,False,"Nonfiction, Feminism, Writing, Essays, Audiobook, Womens, Parenting, Adult, Cultural, Africa, Social Movements, Social Justice, Gender",,0,
https://www.goodreads.com/book/show/40670312-the-one,40670312,The One,John Marrs,454,6,4.13,8489.0,62478.0,416.0,2016.0,False,"Thriller, Fiction, Science Fiction, Thriller, Mystery Thriller, Mystery, Romance, Audiobook, Adult, Suspense, Contemporary",,0,
https://www.goodreads.com/book/show/52862.Varjak_Paw,52862,Varjak Paw,S.F. Said,453,5,4.13,434.0,5118.0,256.0,2003.0,True,"Fantasy, Animals, Fiction, Animals, Cats, Childrens, Adventure, Childrens, Middle Grade, Young Adult, Animals, Animal Fiction, Novels",Nestlé Smarties Book Prize for 6–8 years (2003),1,
https://www.goodreads.com/book/show/30125.The_Missing_Piece_Meets_the_Big_O,30125,The Missing Piece Meets the Big O,Shel Silverstein,453,6,4.35,610.0,12432.0,104.0,1981.0,True,"Childrens, Poetry, Childrens, Picture Books, Fiction, Classics, Inspirational, Humor, Young Adult, Sequential Art, Graphic Novels, Sequential Art, Comics",,0,
https://www.goodreads.com/book/show/11378.Elmer_Gantry,11378,Elmer Gantry,Sinclair Lewis,453,7,4.0,493.0,5057.0,352.0,1927.0,False,"Fiction, Classics, Religion, Literature, Literature, American, Historical, Historical Fiction, Novels, Literature, 20th Century, Nobel Prize, Literary Fiction",Audie Award for Literary Fiction (2009),1,Missouri
https://www.goodreads.com/book/show/658.The_Kingdom_of_God_Is_Within_You,658,The Kingdom of God Is Within You,Leo Tolstoy,453,5,4.11,339.0,3703.0,352.0,1893.0,False,"Philosophy, Religion, Nonfiction, Classics, Religion, Theology, Religion, Christianity, Spirituality, Cultural, Russia, Christian, Politics",,0,
https://www.goodreads.com/book/show/723801.Demons_of_the_Ocean,723801,Demons of the Ocean,Justin Somper,453,5,3.84,728.0,8959.0,352.0,2005.0,True,"Fantasy, Paranormal, Vampires, Young Adult, Adventure, Pirates, Adventure, Fiction, Fantasy, Paranormal, Childrens, Middle Grade, Horror, Fantasy, Supernatural",Manchester Book Award  Nominee for Longlist (2006),1,
https://www.goodreads.com/book/show/1427030.Cuore,1427030,Cuore,Edmondo de Amicis,453,5,3.84,664.0,11669.0,362.0,1886.0,False,"Classics, Fiction, Childrens, European Literature, Italian Literature, Cultural, Italy, Literature, Novels, Young Adult, Literature, 19th Century, Historical, Historical Fiction",,0,Turin
https://www.goodreads.com/book/show/186669.Brilliance_of_the_Moon,186669,Brilliance of the Moon,Lian Hearn,453,5,4.06,495.0,19252.0,346.0,2004.0,True,"Fantasy, Fiction, Historical, Historical Fiction, Cultural, Japan, Young Adult, Historical, Romance, Historical Fiction, Historical Fantasy, Cultural, Asia, Adventure",Aurealis Award Nominee for Best Fantasy Novel (2004),1,
https://www.goodreads.com/book/show/20348781-loving-mr-daniels,20348781,Loving Mr. Daniels,Brittainy C. Cherry,453,6,4.24,4031.0,30751.0,310.0,2014.0,False,"Romance, New Adult, Contemporary, Romance, Contemporary Romance, Young Adult, Young Adult, High School, Fiction, Drama, Love, Academic, Teachers",,0,
https://www.goodreads.com/book/show/20983362-passenger,20983362,Passenger,Alexandra Bracken,453,5,3.75,6296.0,39019.0,496.0,2016.0,True,"Fantasy, Young Adult, Science Fiction, Time Travel, Historical, Historical Fiction, Romance, Science Fiction, Historical, Fiction, Young Adult, Young Adult Fantasy, Adventure",,0,
https://www.goodreads.com/book/show/9490.The_Book_of_Embraces,9490,The Book of Embraces,Eduardo Galeano,452,5,4.33,770.0,6948.0,288.0,1989.0,False,"Fiction, Poetry, Short Stories, Literature, Cultural, Latin American, European Literature, Spanish Literature, Writing, Essays, Literature, Latin American Literature, Philosophy, Adult",,0,
https://www.goodreads.com/book/show/152662.What_s_Eating_Gilbert_Grape,152662,What's Eating Gilbert Grape,Peter Hedges,452,6,4.1,606.0,14953.0,319.0,1991.0,False,"Fiction, Classics, Contemporary, Young Adult, Media Tie In, Young Adult, Coming Of Age, Family, Drama, Novels, Literature",,0,Iowa
https://www.goodreads.com/book/show/214856.Leven_Thumps_and_the_Gateway_to_Foo,214856,Leven Thumps and the Gateway to Foo,Obert Skye,452,5,3.74,1640.0,20119.0,368.0,2005.0,True,"Fantasy, Young Adult, Fiction, Childrens, Middle Grade, Adventure, Fantasy, Magic, Childrens, Young Adult, Young Adult Fantasy, Childrens, Juvenile, Young Adult, Teen",,0,
https://www.goodreads.com/book/show/92717.The_Darkangel,92717,The Darkangel,Meredith Ann Pierce,452,6,3.9,603.0,8939.0,281.0,1982.0,True,"Young Adult, Fantasy, Romance, Fantasy, Paranormal, Fiction, Young Adult, Young Adult Fantasy, Paranormal, Angels, Paranormal, Vampires, Fantasy, Supernatural, Science Fiction","IRA Children’s and Young Adult’s Book Award (1983), California Young Readers Medal for Young Adult (1986)",2,
https://www.goodreads.com/book/show/2712967-the-darkest-pleasure,2712967,The Darkest Pleasure,Gena Showalter,452,7,4.26,1311.0,46027.0,368.0,2008.0,True,"Romance, Paranormal Romance, Fantasy, Paranormal, Romance, Paranormal, Demons, Fantasy, Fantasy, Mythology, Adult, Fantasy, Urban Fantasy, Fantasy, Supernatural, Fiction",,0,Budapest
https://www.goodreads.com/book/show/13565914-knight,13565914,Knight,Kristen Ashley,452,6,3.93,3782.0,51968.0,285.0,2012.0,True,"Romance, Romance, Contemporary Romance, Adult Fiction, Erotica, Contemporary, Erotica, BDSM, Adult, Romance, Erotic Romance, Dark, Womens Fiction, Chick Lit, New Adult",,0,Colorado
https://www.goodreads.com/book/show/13645358-let-the-storm-break,13645358,Let the Storm Break,Shannon Messenger,452,5,4.15,446.0,5012.0,400.0,2014.0,True,"Fantasy, Young Adult, Romance, Fantasy, Paranormal, Fiction, Young Adult, Young Adult Fantasy, Fantasy, Supernatural, Fantasy, Mythology, Fantasy, Urban Fantasy, Adventure",,0,
https://www.goodreads.com/book/show/80081.The_Golden_Ass,,,,452,7,,,,,,False,,,0,
https://www.goodreads.com/book/show/889284.The_Postman,889284,The Postman,David Brin,452,5,3.9,1345.0,32416.0,321.0,1985.0,False,"Science Fiction, Fiction, Apocalyptic, Post Apocalyptic, Science Fiction, Dystopia, Science Fiction, Apocalyptic, Fantasy, Science Fiction Fantasy, Speculative Fiction, Adventure, War","Hugo Award Nominee for Best Novel (1986), Nebula Award Nominee for Best Novel (1985), Locus Award for Best Science Fiction Novel (1986), John W. Campbell Memorial Award for Best Science Fiction Novel (1986), SF Chronicle Award Nominee for Novel (1986)",5,Pacific Northwest
https://www.goodreads.com/book/show/141077.The_Kreutzer_Sonata,141077,The Kreutzer Sonata,Leo Tolstoy,452,6,3.89,1346.0,20764.0,128.0,1889.0,False,"Classics, Fiction, Cultural, Russia, Literature, Russian Literature, Literature, Short Stories, Literature, 19th Century, Novels, Novella, Music",,0,
https://www.goodreads.com/book/show/31842429-patria,31842429,Patria,Fernando Aramburu,452,5,4.37,2730.0,24361.0,889.0,2016.0,False,"Fiction, Historical, Historical Fiction, European Literature, Spanish Literature, Cultural, Spain, Drama, Contemporary, Novels, Historical, Literature, 21st Century, Literature","Premio de la Crítica de narrativa castellana (2016), Europese Literatuurprijs Nominee (2019), Premio Strega Europeo (2018), Premio Francisco Umbral al libro del año (2016), Prémio Literário Giuseppe Tomasi di Lampedusa International (2018), Premio Nacional de Narrativa (2017)",6,
https://www.goodreads.com/book/show/294861.Tisha,294861,Tisha: The Wonderful True Love Story of a Young Teacher in the Alaskan Wilderness,Robert Specht,451,5,4.3,857.0,6815.0,342.0,1976.0,False,"Historical, Historical Fiction, Fiction, Historical, Adventure, Romance, Young Adult, Biography Memoir, Travel, Native Americans, Teaching",,0,Alaska
https://www.goodreads.com/book/show/1624.West_with_the_Night,1624,West with the Night,Beryl Markham,451,5,4.12,3214.0,33138.0,294.0,1942.0,False,"Nonfiction, Autobiography, Memoir, Biography, Cultural, Africa, Travel, History, Adventure, Biography Memoir, Biography, Autobiography, Aviation",,0,Kenya
https://www.goodreads.com/book/show/53044.Hiroshima_Mon_Amour,53044,Hiroshima Mon Amour,Marguerite Duras,451,6,3.9,241.0,4305.0,160.0,1959.0,False,"Fiction, Cultural, France, Classics, Plays, European Literature, French Literature, Culture, Film, Romance, Drama, Literature, Cultural, Japan",,0,Japan
https://www.goodreads.com/book/show/29.The_Mother_Tongue,29,The Mother Tongue: English and How It Got That Way,Bill Bryson,451,6,3.91,2781.0,37227.0,270.0,1990.0,False,"Nonfiction, History, Humanities, Language, Humanities, Linguistics, Humor, Audiobook, Language, Writing, Travel, Reference, Science",,0,
https://www.goodreads.com/book/show/47626.Shade_s_Children,47626,Shade's Children,Garth Nix,451,5,3.9,590.0,12068.0,345.0,1997.0,False,"Young Adult, Science Fiction, Fantasy, Fiction, Science Fiction, Dystopia, Apocalyptic, Post Apocalyptic, Horror, Young Adult, Teen, Science Fiction Fantasy, Childrens",Golden Duck Award Nominee for Young Adult (Hal Clement Award) (1998),1,
https://www.goodreads.com/book/show/7602367-skull-full-of-kisses,7602367,Skull Full of Kisses,Michael  West,451,5,4.19,11.0,67.0,212.0,2009.0,False,"Horror, Short Stories, Anthologies, Anthologies, Collections",,0,"Colonial Bay, New Hampshire, Harmony, Indiana, Outer Space, Tibet, Japan"
https://www.goodreads.com/book/show/17524166,17524166,نادي السيارات,Alaa Al Aswany,451,5,3.46,1972.0,13355.0,644.0,2013.0,False,"Fiction, Novels, Historical, Historical Fiction, Northern Africa, Egypt, Cultural, Africa, Literature, African Literature, Egyptian Literature, Historical, Literature, African Literature, Romance",Saif Ghobash Banipal Prize Nominee for Russell Harris (2016),1,
https://www.goodreads.com/book/show/34840184-the-perfect-couple,34840184,The Perfect Couple,Elin Hilderbrand,451,5,3.95,5718.0,72361.0,480.0,2018.0,True,"Fiction, Mystery, Womens Fiction, Chick Lit, Audiobook, Romance, Contemporary, Thriller, Mystery Thriller, Adult Fiction, Thriller, Adult",,0,"Nantucket, Massachusetts"
https://www.goodreads.com/book/show/10718.Something_Happened,10718,Something Happened,Joseph Heller,450,5,3.53,560.0,7293.0,576.0,1974.0,False,"Fiction, Classics, Literature, American, Humor, Novels, Literature, Contemporary, Literary Fiction, The United States Of America, Literature, 20th Century",National Book Award Finalist for Fiction (1975),1,
https://www.goodreads.com/book/show/8646.Crow_Lake,8646,Crow Lake,Mary Lawson,450,7,3.9,1925.0,17482.0,324.0,2002.0,False,"Fiction, Cultural, Canada, Contemporary, Family, Book Club, Adult Fiction, Literary Fiction, Young Adult, Coming Of Age, Adult, Novels","McKitterick Prize (2003), ALA Alex Award (2003), Amazon.ca First Novel Award (2002), OLA Evergreen Award (2005)",4,"Ontario, Canada"
https://www.goodreads.com/book/show/7197913-the-wide-awake-princess,7197913,The Wide-Awake Princess,E.D. Baker,450,5,4.11,1031.0,12540.0,261.0,2010.0,True,"Fantasy, Fantasy, Fairy Tales, Childrens, Middle Grade, Young Adult, Romance, Retellings, Childrens, Adventure, Fiction, Fantasy, Magic",,0,
https://www.goodreads.com/book/show/777824.Parade_s_End,777824,Parade's End,Ford Madox Ford,450,6,3.91,498.0,5689.0,836.0,1928.0,True,"Fiction, Classics, Historical, Historical Fiction, War, War, World War I, European Literature, British Literature, Literature, 20th Century, Literature, Historical, Novels",,0,
https://www.goodreads.com/book/show/499437.Shadows_in_Paradise,499437,Shadows in Paradise,Erich Maria Remarque,450,5,4.15,107.0,3831.0,400.0,1971.0,False,"Fiction, Classics, European Literature, German Literature, War, Historical, Historical Fiction, Literature, 20th Century, Novels, Audiobook, Historical, Cultural, Germany",,0,
https://www.goodreads.com/book/show/1001312.Parnassus_on_Wheels,1001312,Parnassus on Wheels,Christopher  Morley,450,5,4.03,1187.0,5966.0,152.0,1917.0,True,"Fiction, Writing, Books About Books, Classics, Humor, Adventure, Historical, Historical Fiction, Novella, Romance, Literature, Audiobook",,0,New York State
https://www.goodreads.com/book/show/79876.Does_My_Head_Look_Big_in_This_,79876,Does My Head Look Big in This?,Randa Abdel-Fattah,450,5,3.66,1603.0,10858.0,360.0,2007.0,False,"Young Adult, Fiction, Contemporary, Religion, Realistic Fiction, Young Adult, Teen, Religion, Islam, Cultural, Australia, Cultural, Young Adult, Coming Of Age","Lincoln Award Nominee (2010), Australian Book Industry Award (ABIA) for Older Children (ages 8-14) (2006)",2,"Melbourne, Victoria"
https://www.goodreads.com/book/show/6870.Enduring_Love,6870,Enduring Love,Ian McEwan,450,6,3.64,2201.0,38881.0,245.0,1997.0,False,"Fiction, Contemporary, Literary Fiction, European Literature, British Literature, Literature, Novels, Literature, 20th Century, Romance, Adult, Adult Fiction","James Tait Black Memorial Prize Nominee for Fiction (1997), International Dublin Literary Award Nominee for Shortlist (1999)",2,"London, England, England"
https://www.goodreads.com/book/show/38895679-in-my-hands,38895679,In My Hands: Compelling Stories from a Surgeon and His Patients Fighting Cancer,Steven A. Curley,450,5,4.35,13.0,490.0,305.0,2018.0,False,"Nonfiction, Adult, Contemporary, Biography, True Story, New Adult, Medical, Health, Medicine, Health, Illness, Young Adult, Teen",,0,
https://www.goodreads.com/book/show/10400575-witch-song,10400575,Witch Song,Amber Argyle,449,5,3.68,700.0,5324.0,305.0,2011.0,True,"Fantasy, Young Adult, Paranormal, Witches, Fantasy, Paranormal, Fantasy, Magic, Romance, Fiction, Fantasy, Supernatural, Adventure, Young Adult, Young Adult Fantasy",,0,
https://www.goodreads.com/book/show/2149385.Girl_Missing,2149385,"Girl, Missing",Sophie McKenzie,449,5,3.94,697.0,10763.0,283.0,2006.0,True,"Young Adult, Mystery, Fiction, Thriller, Contemporary, Mystery, Crime, Adventure, Young Adult, Teen, Childrens, Thriller, Mystery Thriller","Manchester Book Award  (2008), Sakura Medal for Middle School Book (2008), Bolton Children's Book Award (2007), Carnegie Medal Nominee (2008)",4,
https://www.goodreads.com/book/show/59149.Beware_of_Pity,59149,Beware of Pity,Stefan Zweig,449,6,4.22,1093.0,10626.0,353.0,1939.0,False,"Fiction, Classics, European Literature, German Literature, Literature, Novels, Historical, Historical Fiction, Literature, 20th Century, Romance, Literary Fiction, Classics, Modern Classics",,0,Vienna
https://www.goodreads.com/book/show/26214355-high-couch-of-silistra,26214355,High Couch of Silistra,Janet E. Morris,449,5,3.66,57.0,372.0,265.0,1977.0,True,"Fantasy, Science Fiction, Fiction, Apocalyptic, Post Apocalyptic, Adult Fiction, Erotica, Fantasy, High Fantasy, Science Fiction Fantasy, Romance, Science Fiction, Dystopia, Science Fiction, Aliens",,0,
https://www.goodreads.com/book/show/25944798-the-beauty-of-darkness,25944798,The Beauty of Darkness,Mary E. Pearson,449,5,4.23,4454.0,34983.0,684.0,2016.0,True,"Fantasy, Young Adult, Romance, Young Adult, Young Adult Fantasy, Fantasy, High Fantasy, Fiction, Fantasy, Magic, Audiobook, Science Fiction, Dystopia, Adventure",,0,
https://www.goodreads.com/book/show/35068432-i-ll-be-gone-in-the-dark,35068432,I'll Be Gone in the Dark: One Woman's Obsessive Search for the Golden State Killer,Michelle McNamara,449,5,4.1,16045.0,178870.0,352.0,2018.0,False,"Nonfiction, Crime, True Crime, Mystery, Crime, Audiobook, Mystery, History, Autobiography, Memoir, Adult, Thriller, Thriller, Mystery Thriller","Anthony Award for Best Critical / Non-Fiction Work (2019), Audie Award Nominee for Audiobook of the Year (2019), Edgar Award Nominee for Best Fact Crime (2019), Goodreads Choice Award for Nonfiction (2018)",4,
https://www.goodreads.com/book/show/34042261-undercover-princess,34042261,Undercover Princess,Connie Glynn,449,5,4.02,786.0,4588.0,441.0,2017.0,True,"Fantasy, Young Adult, Childrens, Middle Grade, Fiction, Contemporary, Romance, LGBT, Childrens, Fantasy, Fairy Tales, Audiobook",,0,
https://www.goodreads.com/book/show/238125.Holiday_in_Death,238125,Holiday in Death,J.D. Robb,448,8,4.31,1177.0,37196.0,308.0,1998.0,True,"Mystery, Romance, Mystery, Crime, Romance, Romantic Suspense, Fiction, Futuristic, Suspense, Science Fiction, Thriller, Mystery Thriller, Thriller","All About Romance (AAR) Annual Reader Poll for Favorite Couple (1999), RITA Award by Romance Writers of America Nominee for Romantic Suspense (1999), Romantic Times Reviewers' Choice Award (RT Award) for Futuristic Romance (1998), Romance Readers Anonymous (RRA) Award for Best Alternative Realities or Time Travel Romance (1998)",4,"New York City, New York"
https://www.goodreads.com/book/show/368468.Bud_Not_Buddy,368468,"Bud, Not Buddy",Christopher Paul Curtis,448,6,3.93,5364.0,100489.0,243.0,1999.0,False,"Historical, Historical Fiction, Young Adult, Fiction, Childrens, Middle Grade, Childrens, Historical, Academic, School, Realistic Fiction, Cultural, African American, Classics","Newbery Medal (2000), Book Sense Book of the Year Award Nominee for Children (2000), Grand Canyon Reader Award for Teen Book (2002), Nene Award (2002), Pennsylvania Young Readers' Choice Award for Grades 6-8 (2001), Dorothy Canfield Fisher Children's Book Award (2001), Coretta Scott King Book Award for Author (2000), Pacific Northwest Library Association Young Reader's Choice Award for Junior (2002), IRA Children’s and Young Adult’s Book Award for Older Reader Category (2000), New Mexico Land of Enchantment Award for Young Adult (2003), William Allen White Children's Book Award (2002)",11,"Flint, Michigan, Michigan"
https://www.goodreads.com/book/show/1303564.Maximum_Security,1303564,Maximum Security,Robert Muchamore,448,5,4.26,563.0,20489.0,277.0,2005.0,True,"Young Adult, Fiction, Action, Adventure, Spy Thriller, Espionage, Childrens, Thriller, Young Adult, Teen, Mystery, Crime, Mystery",,0,
https://www.goodreads.com/book/show/14565.Dangerous_Angels,14565,Dangerous Angels,Francesca Lia Block,448,5,4.24,596.0,8752.0,478.0,1998.0,True,"Young Adult, Fantasy, Fiction, Magical Realism, Fantasy, Urban Fantasy, Romance, LGBT, GLBT, Queer, Fantasy, Magic, Young Adult, Teen",,0,United States of America
https://www.goodreads.com/book/show/19400.The_Decline_and_Fall_of_the_Roman_Empire,19400,The Decline and Fall of the Roman Empire,Edward Gibbon,448,6,3.98,529.0,12321.0,1312.0,1776.0,False,"History, Nonfiction, Classics, History, Ancient History, Historical, Politics, Literature, Ancient, History, World History, Literature, 18th Century, Roman",,0,Roman Empire
https://www.goodreads.com/book/show/9935444-torrent,9935444,Torrent,Lisa Tawn Bergren,448,5,4.3,872.0,9131.0,388.0,2011.0,True,"Science Fiction, Time Travel, Historical, Historical Fiction, Young Adult, Fantasy, Romance, Christian Fiction, Historical, Christian, Fiction, Adventure",,0,
https://www.goodreads.com/book/show/590272.The_Nightingale_and_the_Rose,590272,The Nightingale and the Rose,Oscar Wilde,448,5,4.31,630.0,7417.0,12.0,1888.0,False,"Classics, Short Stories, Fiction, Fantasy, Romance, Literature, European Literature, Irish Literature, Fantasy, Fairy Tales, Literature, 19th Century, Childrens",,0,
https://www.goodreads.com/book/show/125523.The_Half_Brother,125523,The Half Brother,Lars Saabye Christensen,448,6,4.1,198.0,3222.0,696.0,2001.0,False,"Fiction, European Literature, Scandinavian Literature, Novels, Contemporary, Literature, Roman, Literary Fiction, Unfinished, Historical, Historical Fiction, Cultural, International","Nordisk Raads Litteraturpris (Nordic Council Literature Prize) (2002), Brageprisen for Fiction (2001), Bokhandlerprisen (2001), P2-lytternes romanpris Nominee (2001)",4,Oslo
https://www.goodreads.com/book/show/6117055-the-greatest-show-on-earth,6117055,The Greatest Show on Earth: The Evidence for Evolution,Richard Dawkins,448,6,4.15,1942.0,49788.0,470.0,2009.0,False,"Science, Nonfiction, Science, Biology, Biology, Evolution, Religion, Religion, Atheism, Science, Popular Science, Philosophy, History, Environment, Nature",Prismas Casa de las Ciencias a la Divulgación for Libro editado (2010),1,
https://www.goodreads.com/book/show/10637748-the-pledge,10637748,The Pledge,Kimberly Derting,448,6,3.79,2513.0,28468.0,323.0,2011.0,True,"Young Adult, Science Fiction, Dystopia, Fantasy, Romance, Fantasy, Paranormal, Fantasy, Magic, Science Fiction, Fiction, Young Adult, Teen, Fantasy, Supernatural",,0,Ludania
