url,book_id,title,author,good_read_score,good_read_votes,avg_rating,num_reviews,num_ratings,num_pages,original_publish_year,series,genres,awards,award_count,place
https://www.goodreads.com/book/show/29780253-born-a-crime,29780253,Born a Crime: Stories From a South African Childhood,Trevor Noah,1870,22,4.46,40469,452083,289.0,2016,False,"Nonfiction, Autobiography, Memoir, Biography, Audiobook, Humor, Cultural, Africa, Biography, Autobiography, Biography Memoir, Race, Southern Africa, South Africa","Evergreen Teen Book Award Nominee (2019), Lincoln Award Nominee (2019), NAACP Image Award for Debut Author and for Biography / Auto-biography (2017), Thurber Prize for American Humor (2017)",4,Johannesburg
https://www.goodreads.com/book/show/7094569-feed,7094569,Feed,Mira Grant,1868,22,3.86,6379,53907,599.0,2010,True,"Horror, Horror, Zombies, Science Fiction, Fiction, Science Fiction, Dystopia, Apocalyptic, Post Apocalyptic, Young Adult, Fantasy, Thriller, Audiobook","Hugo Award Nominee for Best Novel (2011), Locus Award Nominee for Best SF Novel (2011), Shirley Jackson Award Nominee for Novel (Finalist) (2010), Goodreads Choice Award for Science Fiction (2010)",4,
https://www.goodreads.com/book/show/7714.Pygmalion,7714,Pygmalion,George Bernard Shaw,1864,28,3.9,2488,89657,82.0,1913,False,"Classics, Plays, Fiction, Drama, Plays, Theatre, Academic, School, Literature, Romance, European Literature, British Literature, Academic, Read For School",,0,"London, England, England, United Kingdom"
https://www.goodreads.com/book/show/14058818-life-love-kumbh,14058818,Life... Love... Kumbh...,Aporva Kala,1862,19,3.49,46,2858,290.0,2011,False,"Romance, Love, Fantasy, Mythology, Philosophy, Cultural, India, Humor, Literature, Spirituality, Contemporary, Inspirational",,0,
https://www.goodreads.com/book/show/294459.Miss_Lonelyhearts_The_Day_of_the_Locust,294459,Miss Lonelyhearts / The Day of the Locust,Nathanael West,1859,25,3.91,551,9422,185.0,1939,False,"Fiction, Classics, Literature, Novels, Literature, American, Short Stories, Literature, 20th Century, Literary Fiction, Novella, Academic, College",,0,
https://www.goodreads.com/book/show/8635145-embrace,8635145,Embrace,Jessica Shirvington,1856,25,4.01,2093,25612,382.0,2010,True,"Young Adult, Paranormal, Angels, Fantasy, Fantasy, Paranormal, Romance, Romance, Paranormal Romance, Fantasy, Supernatural, Fantasy, Urban Fantasy, Fiction, Fantasy, Magic",,0,
https://www.goodreads.com/book/show/1675216.Found,1675216,Found,Margaret Peterson Haddix,1855,25,3.98,3840,37589,320.0,2008,True,"Science Fiction, Young Adult, Mystery, Science Fiction, Time Travel, Fantasy, Fiction, Childrens, Middle Grade, Adventure, Childrens, Historical, Historical Fiction","Nene Award (2010), Massachusetts Children's Book Award (2010), Pennsylvania Young Readers' Choice Award for Grades 6-8 (2010), Dorothy Canfield Fisher Children's Book Award Nominee (2010), Sunshine State Young Readers Award for Grades 3-5 (2009), Iowa Children's Choice Award Nominee (2011), Washington State Sasquatch Award (2011), Rebecca Caudill Young Readers' Book Award Nominee (2011)",8,"Liston, Ohio"
https://www.goodreads.com/book/show/153784.First_Test,153784,First Test,Tamora Pierce,1852,26,4.18,1523,60442,240.0,1999,True,"Fantasy, Young Adult, Fiction, Young Adult, Young Adult Fantasy, Adventure, Fantasy, Magic, Childrens, Middle Grade, Childrens, Fantasy, High Fantasy, Young Adult, Teen",Margaret A. Edwards Award (2013),1,Tortall
https://www.goodreads.com/book/show/421129.Undead_and_Unwed,421129,Undead and Unwed,MaryJanice Davidson,1848,23,3.81,2776,54688,255.0,2004,True,"Paranormal, Vampires, Fantasy, Paranormal, Romance, Fantasy, Romance, Paranormal Romance, Fantasy, Urban Fantasy, Womens Fiction, Chick Lit, Humor, Fiction, Fantasy, Supernatural",All About Romance (AAR) Annual Reader Poll for Best Alternate Reality Romance & Honorable Mention for Favorite Funny (2005),1,"Minneapolis, Minnesota, Minnesota"
https://www.goodreads.com/book/show/17200687-rule,17200687,Rule,Jay Crownover,1847,26,4.13,5899,94428,369.0,2012,True,"Romance, New Adult, Contemporary, Romance, Contemporary Romance, Academic, College, Young Adult, Adult, Adult Fiction, Erotica, Womens Fiction, Chick Lit, Fiction",,0,"Denver, Colorado, Colorado"
https://www.goodreads.com/book/show/68520.The_Winter_King,68520,The Winter King,Bernard Cornwell,1847,24,4.26,1805,38910,433.0,1995,True,"Historical, Historical Fiction, Fantasy, Fiction, Historical, Mythology, Arthurian, Fantasy, Mythology, Historical, Medieval, Adventure, War, Historical Fiction, Historical Fantasy",,0,Britain
https://www.goodreads.com/book/show/815309.On_Chesil_Beach,815309,On Chesil Beach,Ian McEwan,1846,28,3.59,7292,82382,166.0,2007,False,"Fiction, Historical, Historical Fiction, Contemporary, Literary Fiction, European Literature, British Literature, Romance, Novels, Literature, Adult Fiction, Adult","Booker Prize Nominee (2007), British Book Award (2008), Prix Littéraire Européen - Madeleine Zepter (2008), International Dublin Literary Award Nominee (2009)",4,"Chesil Beach, Dorset, England"
https://www.goodreads.com/book/show/34051011-pachinko,34051011,Pachinko,Min Jin Lee,1845,22,4.28,23905,242446,496.0,2017,False,"Historical, Historical Fiction, Fiction, Historical, Cultural, Japan, Cultural, Asia, Literary Fiction, Adult, Audiobook, Novels, Literature, Asian Literature","Dayton Literary Peace Prize Nominee for Fiction (2018), National Book Award Finalist for Fiction (2017), Goodreads Choice Award Nominee for Historical Fiction (2017), Reading Women Award for Fiction (2017), Litsy Award for Historical Fiction (2017), International Dublin Literary Award Nominee (2019)",6,"Osaka, Busan, Nagano, Yokohama"
https://www.goodreads.com/book/show/69091.The_Clown,69091,The Clown,Heinrich Böll,1843,22,3.99,1468,22875,272.0,1963,False,"Fiction, European Literature, German Literature, Novels, Classics, Cultural, Germany, Literature, Literature, 20th Century, Nobel Prize, Literary Fiction, Unfinished",,0,"Bonn, Germany"
https://www.goodreads.com/book/show/13545075-unwholly,13545075,UnWholly,Neal Shusterman,1842,22,4.25,4562,49957,416.0,2012,True,"Young Adult, Science Fiction, Dystopia, Science Fiction, Fiction, Fantasy, Young Adult, Teen, Horror, Thriller, Romance, Adventure, Survival",Premio El Templo de las Mil Puertas for Mejor novela extranjera perteneciente a saga (2013),1,
https://www.goodreads.com/book/show/944076.Last_Argument_of_Kings,944076,Last Argument of Kings,Joe Abercrombie,1842,21,4.28,5000,116738,536.0,2008,True,"Fantasy, Fiction, Fantasy, Epic Fantasy, Fantasy, Dark Fantasy, Adventure, Fantasy, High Fantasy, Audiobook, Young Adult, Childrens, Science Fiction Fantasy",David Gemmell Legend Award Nominee for Best Fantasy Novel (2009),1,
https://www.goodreads.com/book/show/42080479-the-school-for-good-and-evil,42080479,The School for Good and Evil,Soman Chainani,1842,23,4.02,7899,70466,544.0,2013,True,"Fantasy, Childrens, Middle Grade, Young Adult, Fantasy, Magic, Fantasy, Fairy Tales, Fiction, Romance, Childrens, Adventure, Audiobook","Waterstones Children's Book Prize Nominee (2014), Goodreads Choice Award Nominee for Middle Grade & Children's (2013)",2,
https://www.goodreads.com/book/show/5941233-thirst-no-1,5941233,"Thirst No. 1: The Last Vampire, Black Blood, and Red Dice",Christopher Pike,1838,26,3.84,1681,33505,594.0,1998,True,"Fantasy, Young Adult, Paranormal, Vampires, Fantasy, Paranormal, Fiction, Romance, Thriller, Fantasy, Supernatural, Mystery, Young Adult, Young Adult Fantasy",,0,
https://www.goodreads.com/book/show/147843.Green_Rider,147843,Green Rider,Kristen Britain,1838,23,4.03,1809,36947,471.0,1998,True,"Fantasy, Young Adult, Fiction, Adventure, Fantasy, Magic, Fantasy, High Fantasy, Fantasy, Epic Fantasy, Science Fiction Fantasy, Childrens, Childrens, Middle Grade",,0,
https://www.goodreads.com/book/show/6164358-the-mysterious-benedict-society-and-the-prisoner-s-dilemma,6164358,The Mysterious Benedict Society and the Prisoner's Dilemma,Trenton Lee Stewart,1838,24,4.3,1611,34409,11.0,2009,True,"Mystery, Fiction, Young Adult, Childrens, Middle Grade, Adventure, Fantasy, Childrens, Realistic Fiction, Science Fiction, Audiobook",,0,
https://www.goodreads.com/book/show/13623150-destroy-me,13623150,Destroy Me,Tahereh Mafi,1836,21,4.2,7536,75841,111.0,2012,True,"Young Adult, Science Fiction, Dystopia, Fantasy, Romance, Novella, Short Stories, Fantasy, Paranormal, Science Fiction, Fiction, Young Adult, Young Adult Fantasy",,0,
https://www.goodreads.com/book/show/1362.The_Histories,1362,The Histories,Herodotus,1836,25,3.95,1250,44982,716.0,-450,False,"History, Classics, Nonfiction, History, Ancient History, Cultural, Greece, Literature, Ancient, Historical, Literature, Philosophy, Fantasy, Mythology",,0,"Cappadocia, Lydia, Halys River, Corynth, Sparta, Sardis (now: Sart), Ecbatana, Delphi, Ascalon (now: Ashkelon), Cytherea, Babylon, Athens, Marathon, Salamis (Greece)"
https://www.goodreads.com/book/show/82970.Lucky,82970,Lucky,Alice Sebold,1835,27,3.78,4307,95791,243.0,1999,False,"Nonfiction, Autobiography, Memoir, Biography, Crime, True Crime, Biography Memoir, Biography, Autobiography, Adult, Mystery, Crime, Contemporary, Drama",,0,
https://www.goodreads.com/book/show/253058.Temple_of_the_Winds,253058,Temple of the Winds,Terry Goodkind,1833,26,4.01,1007,79476,822.0,1998,True,"Fantasy, Fiction, Fantasy, Epic Fantasy, Science Fiction Fantasy, Fantasy, High Fantasy, Fantasy, Magic, Young Adult, Adventure, Childrens, Epic",,0,
https://www.goodreads.com/book/show/18500665-end-of-days,18500665,End of Days,Susan Ee,1832,22,4.06,7013,61951,344.0,2015,True,"Fantasy, Young Adult, Paranormal, Angels, Science Fiction, Dystopia, Fantasy, Paranormal, Romance, Apocalyptic, Post Apocalyptic, Fantasy, Urban Fantasy, Fiction, Paranormal, Demons",Goodreads Choice Award Nominee for Young Adult Fantasy & Science Fiction (2015),1,"Palo Alto, California"
https://www.goodreads.com/book/show/460635.The_Bone_People,460635,The Bone People,Keri Hulme,1831,23,4.05,1822,20067,450.0,1984,False,"Fiction, Magical Realism, Literary Fiction, Contemporary, Novels, Literature, Historical, Historical Fiction, Fantasy, Literature, 20th Century, Book Club","Booker Prize (1985), Pegasus Prize for Literature (1985), Ockham New Zealand Book Awards for Fiction (NZ Book Awards) (1984)",3,New Zealand
https://www.goodreads.com/book/show/74406.Fifth_Business,74406,Fifth Business,Robertson Davies,1831,27,4.06,1129,17170,252.0,1970,True,"Fiction, Cultural, Canada, Classics, Historical, Historical Fiction, Literature, Literary Fiction, Novels, Literature, Canadian Literature, Academic, School, Historical",Premi Llibreter de narrativa (2006),1,
https://www.goodreads.com/book/show/25365.Out,25365,Out,Natsuo Kirino,1829,21,3.94,2825,30029,400.0,1997,False,"Fiction, Cultural, Japan, Thriller, Mystery, Asian Literature, Japanese Literature, Mystery, Crime, Horror, Thriller, Mystery Thriller, Cultural, Asia, Contemporary","Naoki Prize 直木三十五賞 Nominee (1997), Edgar Award Nominee for Best Novel (2004), 日本推理作家協会賞 for Best Novel (1998), このミステリーがすごい！ for Best Japanese Mystery Novel of the Year (1998)",4,"Japan, Tokyo"
https://www.goodreads.com/book/show/18149927-beneath-this-man,18149927,Beneath This Man,Jodi Ellen Malpas,1829,22,4.28,4136,85488,452.0,2013,True,"Romance, Adult Fiction, Erotica, Erotica, BDSM, Romance, Contemporary Romance, Contemporary, Romance, Erotic Romance, Adult, New Adult, Love, Fiction",Goodreads Choice Award Nominee for Romance (2013),1,
https://www.goodreads.com/book/show/6315602-my-soul-to-take,6315602,My Soul to Take,Rachel Vincent,1828,25,3.87,2683,42205,279.0,2009,True,"Young Adult, Fantasy, Paranormal, Fantasy, Romance, Fantasy, Urban Fantasy, Romance, Paranormal Romance, Fantasy, Supernatural, Mystery, Fiction, Paranormal, Ghosts",,0,Texas
https://www.goodreads.com/book/show/30324.Blood_and_Chocolate,30324,Blood and Chocolate,Annette Curtis Klause,1825,27,3.78,2274,40340,264.0,1997,False,"Young Adult, Fantasy, Romance, Fantasy, Paranormal, Shapeshifters, Werewolves, Fantasy, Urban Fantasy, Fiction, Fantasy, Supernatural, Romance, Paranormal Romance, Young Adult, Teen",South Carolina Book Award for Young Adult Book Award (2000),1,"United States of America, Maryland"
https://www.goodreads.com/book/show/1297123.The_Black_Obelisk,1297123,The Black Obelisk,Erich Maria Remarque,1823,22,4.38,305,10790,448.0,1956,False,"Classics, Fiction, European Literature, German Literature, Historical, Historical Fiction, War, Cultural, Germany, Novels, Literature, 20th Century, Historical, Drama",,0,Werdenbrück
https://www.goodreads.com/book/show/6948436-little-bee,6948436,Little Bee,Chris Cleave,1823,25,3.71,21410,228952,275.0,2008,False,"Fiction, Cultural, Africa, Historical, Historical Fiction, Book Club, Contemporary, Adult Fiction, Western Africa, Nigeria, Adult, Literary Fiction, Audiobook","Costa Book Award Nominee for Novel (2008), Goodreads Choice Award Nominee for Fiction (2009)",2,"Kingston-upon-Thames, London, England"
https://www.goodreads.com/book/show/530848.Eighth_Grade_Bites,530848,Eighth Grade Bites,Heather Brewer,1822,24,3.93,2755,34685,182.0,2007,True,"Young Adult, Paranormal, Vampires, Fantasy, Fantasy, Paranormal, Fantasy, Supernatural, Fiction, Horror, Young Adult, Teen, Fantasy, Urban Fantasy, Childrens, Middle Grade",Missouri Truman Readers Award (2010),1,Bathory
https://www.goodreads.com/book/show/301736.Guess_How_Much_I_Love_You,301736,Guess How Much I Love You,Sam McBratney,1822,30,4.36,1812,129718,20.0,1988,False,"Childrens, Picture Books, Childrens, Fiction, Animals, Family, Classics, Love, Kids, Childrens, Storytime, Animals, Rabbits","Zilveren Griffel (1995), American Booksellers Book Of The Year  Award for Children (1996)",2,
https://www.goodreads.com/book/show/15704307-saga-vol-1,15704307,"Saga, Vol. 1",Brian K. Vaughan,1820,23,4.18,13749,269462,176.0,2012,True,"Sequential Art, Graphic Novels, Sequential Art, Comics, Fantasy, Science Fiction, Fiction, Graphic Novels Comics, Adult, Romance, Comics, Comic Book, Adventure","Hugo Award for Best Graphic Story (2013), Harvey Awards for Best Continuing or Limited Series, Best New Series, Best Single Issue or Story (Saga #1), Best Writer (for Brian K. Vaughan), Best Artist (for Fiona Staples), Best Colorist (for Fiona Staples) AND nominated for Best Cover Artist (for Fiona Staples) (2013), British Fantasy Award for Best Comic/Graphic Novel (2013), Will Eisner Comic Industry Awards for Best New Series, Best Continuing Series, Best Writer (for Brian K. Vaughan) (2013), Goodreads Choice Award Nominee for Best Graphic Novels & Comics (2012)",12,
https://www.goodreads.com/book/show/43877.The_Monk_Who_Sold_His_Ferrari,43877,The Monk Who Sold His Ferrari: A Fable About Fulfilling Your Dreams and Reaching Your Destiny,Robin S. Sharma,1820,20,3.86,6989,117479,208.0,1996,False,"Self Help, Nonfiction, Philosophy, Spirituality, Self Help, Personal Development, Inspirational, Psychology, Business, Audiobook, Unfinished",,0,
https://www.goodreads.com/book/show/8204005-love-unscripted,8204005,Love Unscripted,Tina Reber,1819,23,4.02,3476,67318,668.0,2010,True,"Romance, Contemporary, Romance, Contemporary Romance, New Adult, Adult, Womens Fiction, Chick Lit, Love, Adult Fiction, Erotica, Fiction, Young Adult",,0,Rhode Island
https://www.goodreads.com/book/show/68527.The_Last_Kingdom,68527,The Last Kingdom,Bernard Cornwell,1818,24,4.24,4388,78979,351.0,2004,True,"Historical, Historical Fiction, Fiction, Historical, Fantasy, Historical, Medieval, Adventure, War, Audiobook, European Literature, British Literature, Adult",,0,England
https://www.goodreads.com/book/show/3392089-the-winter-sea,3392089,The Winter Sea,Susanna Kearsley,1817,21,4.08,6705,59683,527.0,2008,True,"Historical, Historical Fiction, Romance, Fiction, Historical, Science Fiction, Time Travel, Cultural, Scotland, Romance, Historical Romance, Fantasy, Contemporary, Adult","RITA Award by Romance Writers of America Nominee for Novel with Strong Romantic Elements (2009), Romantic Times Reviewers' Choice Award (RT Award) for Historical Fiction (2010), Audie Award for Solo Narration - Female (2012)",3,"Aberdeenshire, Scotland"
https://www.goodreads.com/book/show/17235026-the-girl-with-all-the-gifts,17235026,The Girl with All the Gifts,M.R. Carey,1816,21,3.94,20391,197281,461.0,2014,True,"Horror, Fiction, Science Fiction, Horror, Zombies, Science Fiction, Dystopia, Apocalyptic, Post Apocalyptic, Fantasy, Audiobook, Thriller, Adult","Arthur C. Clarke Award Nominee (2015), Audie Award for Paranormal (2015), British Fantasy Award Nominee for August Derleth Award (best horror novel) (2015), Tähtivaeltaja Award Nominee (2017), Goodreads Choice Award Nominee for Horror (2014), James Herbert Award Nominee (2015)",6,"London, England"
https://www.goodreads.com/book/show/32885178-a-merciful-truth,32885178,A Merciful Truth,Kendra Elliot,1816,19,4.27,760,25508,322.0,2017,True,"Mystery, Romance, Romantic Suspense, Thriller, Mystery, Crime, Fiction, Romance, Suspense, Contemporary, Thriller, Mystery Thriller, Audiobook",,0,Oregon
https://www.goodreads.com/book/show/1519.The_Oresteia,1519,"The Oresteia: Agamemnon, The Libation Bearers, The Eumenides",Aeschylus,1814,27,4.02,1137,35853,335.0,-458,True,"Classics, Plays, Drama, Fiction, Fantasy, Mythology, Poetry, Literature, Plays, Theatre, Academic, School, Literature, Ancient",National Book Award Finalist for Translation (1977),1,"Greece, Argos"
https://www.goodreads.com/book/show/38822883-alexander-crowley---a-new-king-in-town,38822883,Alexander Crowley - A New King in Town,Don Barr,1814,20,4.41,18,1587,182.0,2018,False,"Contemporary, Novels, Fiction, Book Club, Drama, Epic, Adventure, Adult, Fantasy, New Adult",,0,
https://www.goodreads.com/book/show/31371230-house-of-spies,31371230,House of Spies,Daniel Silva,1814,19,4.3,1739,30208,576.0,2017,True,"Fiction, Thriller, Mystery, Spy Thriller, Espionage, Thriller, Mystery Thriller, Suspense, Thriller, Spy Thriller, Novels, Audiobook, Adult",,0,"Casablanca, Morocco, London, England, Israel, Côte d'Azur, Paris, Tel Aviv, Corsica, Washington DC, France"
https://www.goodreads.com/book/show/359410.Elsewhere,359410,Elsewhere,Gabrielle Zevin,1812,25,3.9,5286,52970,277.0,2005,False,"Young Adult, Fantasy, Fiction, Romance, Death, Young Adult, Teen, Fantasy, Paranormal, Contemporary, Fantasy, Supernatural, Audiobook","Georgia Peach Book Award Nominee for Honor book (2006), Borders Original Voices Award for YA or Independent Reader (2005), Sakura Medal for High School Book (2007), California Young Readers Medal Nominee for Young Adult (2008), Lincoln Award Nominee (2011), Bronzener Lufti (2006), Ulmer Unke (2005)",7,
https://www.goodreads.com/book/show/30735.The_Complete_Essays,30735,The Complete Essays,Michel de Montaigne,1806,22,4.24,376,11922,1344.0,1588,False,"Philosophy, Writing, Essays, Classics, Nonfiction, Cultural, France, History, European Literature, French Literature, Literature, Biography, Literature, 16th Century",,0,
https://www.goodreads.com/book/show/33290383-let-it-snow,33290383,Let it Snow,John Green,1804,22,3.74,11211,121475,353.0,2008,False,"Young Adult, Romance, Contemporary, Holiday, Christmas, Fiction, Short Stories, Holiday, Realistic Fiction, Young Adult, Young Adult Contemporary, Anthologies",Silberner Lufti (2011),1,North Carolina
https://www.goodreads.com/book/show/43326.Tell_Me_Your_Dreams,43326,Tell Me Your Dreams,Sidney Sheldon,1797,21,3.97,1904,49436,384.0,1998,False,"Fiction, Thriller, Mystery, Suspense, Thriller, Mystery Thriller, Mystery, Crime, Novels, Drama, Romance, Contemporary",,0,"San Jose, California"
https://www.goodreads.com/book/show/102030.Musashi,102030,Musashi,Eiji Yoshikawa,1796,20,4.47,1118,15941,970.0,1935,True,"Fiction, Historical, Historical Fiction, Cultural, Japan, Classics, Historical, Asian Literature, Japanese Literature, Novels, Literature, Adventure, Cultural, Asia",,0,Japan
https://www.goodreads.com/book/show/343881.Cloudstreet,343881,Cloudstreet,Tim Winton,1796,20,4.0,1531,21021,426.0,1991,False,"Fiction, Cultural, Australia, Historical, Historical Fiction, Classics, Literature, Literary Fiction, Contemporary, Historical, Novels, Family","Miles Franklin Literary Award (1992), National Book Council Banjo Award for Fiction (1991)",2,"Perth, Western Australia, Australia"
https://www.goodreads.com/book/show/20388847-the-book-of-occult,20388847,The Book of Occult,Simon W. Clark,1793,18,3.54,95,3199,336.0,2013,False,"Horror, Fiction, Occult, Thriller, Mystery, Fantasy, Novels, Drama, Fantasy, Magic, Fantasy, Supernatural",,0,
https://www.goodreads.com/book/show/23966.Filth,23966,Filth,Irvine Welsh,1791,20,3.74,913,26914,393.0,1998,False,"Fiction, Contemporary, Mystery, Crime, Mystery, Novels, Thriller, Dark, Drama, European Literature, British Literature, Cultural, Scotland",,0,"Edinburgh, Scotland"
https://www.goodreads.com/book/show/3758.Casino_Royale,3758,Casino Royale,Ian Fleming,1790,24,3.74,4549,75111,192.0,1953,True,"Fiction, Thriller, Mystery, Classics, Spy Thriller, Espionage, Mystery, Crime, Adventure, Novels, Audiobook, Thriller, Mystery Thriller",,0,"Royale-Les-Eaux, London, England"
https://www.goodreads.com/book/show/6690.Danny_the_Champion_of_the_World,6690,Danny the Champion of the World,Roald Dahl,1789,24,4.08,2661,59638,224.0,1975,False,"Childrens, Fiction, Classics, Young Adult, Fantasy, Childrens, Middle Grade, Adventure, Humor, Novels, European Literature, British Literature","Zilveren Griffel (1977), Deutscher Jugendliteraturpreis Nominee for Kinderbuch (1978), California Young Readers Medal for Intermediate (1979)",3,
https://www.goodreads.com/book/show/65119.The_Miserable_Mill,65119,The Miserable Mill,Lemony Snicket,1789,29,3.85,4225,146854,194.0,2000,True,"Fiction, Young Adult, Childrens, Fantasy, Childrens, Middle Grade, Mystery, Adventure, Audiobook, Humor, Childrens, Juvenile",,0,"Lucky Smells Lumbermill, Paltryville"
https://www.goodreads.com/book/show/17673620-vampire-origins---project-ichorous,17673620,Vampire Origins - Project Ichorous,Riley Banks,1789,19,3.9,61,147,377.0,2013,True,"Fantasy, Paranormal, Vampires, Young Adult, Horror, Romance, Fantasy, Supernatural, Fantasy, Magic, Romance, Paranormal Romance, Fantasy, Paranormal",,0,
https://www.goodreads.com/book/show/17683.Dead_Beat,17683,Dead Beat,Jim Butcher,1788,22,4.39,3692,114294,517.0,2005,True,"Fantasy, Fantasy, Urban Fantasy, Fiction, Mystery, Fantasy, Paranormal, Fantasy, Magic, Audiobook, Fantasy, Supernatural, Paranormal, Vampires, Science Fiction Fantasy",,0,"Chicago, Illinois"
https://www.goodreads.com/book/show/18132276-spellbound-in-his-arms,18132276,Spellbound in His Arms,Angel Sefer,1788,19,3.9,71,350,194.0,2013,True,"Mystery, Romance, Romance, Romantic Suspense, Thriller, Mystery Thriller, Thriller, Suspense, Romance, Contemporary Romance, Fiction, Action, Adventure",,0,
https://www.goodreads.com/book/show/18776097-forsaken,18776097,Forsaken,Lisa Renee Jones,1788,18,4.09,306,2177,384.0,2015,True,"Romance, Suspense, Romance, Contemporary Romance, Contemporary, Romance, Romantic Suspense, Adult Fiction, Erotica, Mystery, New Adult, Adult, Womens Fiction, Chick Lit",,0,
https://www.goodreads.com/book/show/24937499-her-final-breath,24937499,Her Final Breath,Robert Dugoni,1788,19,4.3,2074,49153,426.0,2015,True,"Mystery, Fiction, Thriller, Mystery, Crime, Thriller, Mystery Thriller, Suspense, Audiobook, Contemporary, Adult, Mystery, Detective",,0,
https://www.goodreads.com/book/show/41044147-library-of-souls,41044147,Library of Souls,Ransom Riggs,1788,22,4.12,10995,129073,465.0,2015,True,"Fantasy, Young Adult, Fiction, Fantasy, Paranormal, Adventure, Historical, Historical Fiction, Audiobook, Horror, Science Fiction, Time Travel, Fantasy, Supernatural",Goodreads Choice Award Nominee for Young Adult Fantasy & Science Fiction (2015),1,
https://www.goodreads.com/book/show/1524173.The_Sorcerer_of_the_North,1524173,The Sorcerer of the North,John Flanagan,1786,25,4.27,1736,60359,304.0,2006,True,"Fantasy, Young Adult, Adventure, Fiction, Childrens, Middle Grade, Action, Young Adult, Young Adult Fantasy, Historical, Medieval, Childrens, Young Adult, Teen",,0,
https://www.goodreads.com/book/show/29986740-a-merciful-death,29986740,A Merciful Death,Kendra Elliot,1786,19,4.13,1752,48370,353.0,2017,True,"Mystery, Fiction, Romance, Romantic Suspense, Thriller, Romance, Suspense, Mystery, Crime, Thriller, Mystery Thriller, Contemporary, Audiobook",,0,Oregon
https://www.goodreads.com/book/show/6351885-the-120-days-of-sodom,6351885,The 120 Days of Sodom,Marquis de Sade,1784,21,3.11,873,10778,376.0,1785,False,"Classics, Fiction, Adult Fiction, Erotica, Horror, Cultural, France, European Literature, French Literature, Philosophy, Literature, Novels, Dark",,0,
https://www.goodreads.com/book/show/12476820-partials,12476820,Partials,Dan Wells,1783,23,3.92,4701,57126,468.0,2012,True,"Young Adult, Science Fiction, Dystopia, Science Fiction, Apocalyptic, Post Apocalyptic, Fiction, Fantasy, Romance, Adventure, Young Adult, Teen, Audiobook",,0,"Long Island, New York"
https://www.goodreads.com/book/show/10567.Cell,10567,Cell,Stephen King,1782,29,3.66,6229,200087,449.0,2006,False,"Horror, Fiction, Horror, Zombies, Thriller, Science Fiction, Apocalyptic, Post Apocalyptic, Fantasy, Science Fiction, Apocalyptic, Suspense, Science Fiction, Dystopia",,0,"United States of America, Maine, Massachusetts"
https://www.goodreads.com/book/show/8716.Lincoln,8716,Lincoln,Gore Vidal,1782,23,4.22,543,8491,672.0,1984,True,"Historical, Historical Fiction, Fiction, Military History, Civil War, Historical, Politics, North American Hi..., American History, Literature, Politics, Presidents, Literature, American, Novels",Benjamin Barondess Award (1985),1,"Washington, D.C."
