url,book_id,title,author,good_read_score,good_read_votes,avg_rating,num_reviews,num_ratings,num_pages,original_publish_year,series,genres,awards,award_count,place
https://www.goodreads.com/book/show/21726.The_Ruins,21726,The Ruins,Scott        Smith,461,7,3.59,3913.0,33987.0,319.0,2006.0,False,"Horror, Fiction, Thriller, Mystery, Suspense, Adventure, Audiobook, Adult, Fantasy, Supernatural, Novels",,0,"Cancún, Mexico"
https://www.goodreads.com/book/show/11324290-par-s,11324290,París,Florencia Bonelli,461,5,4.31,331.0,3639.0,560.0,2010.0,True,"Romance, Romance, Contemporary Romance, Contemporary, Cultural, France, Adult, Historical, Historical Fiction, Drama, Action, Medical, European Literature, Spanish Literature",,0,
https://www.goodreads.com/book/show/261689.The_Grand_Sophy,261689,The Grand Sophy,Georgette Heyer,461,7,4.15,3309.0,27628.0,328.0,1950.0,False,"Romance, Historical, Historical Fiction, Romance, Historical Romance, Historical, Fiction, Historical, Regency, Classics, Historical Romance, Regency Romance, Humor, European Literature, British Literature",,0,"London, England"
https://www.goodreads.com/book/show/6604887,6604887,أنت لي,منى المرشود,461,5,3.92,2811.0,22524.0,1607.0,2007.0,True,"Novels, Romance, Fiction, Unfinished, Romantic, Literature, Love, Realistic Fiction, Drama",,0,
https://www.goodreads.com/book/show/15811405-the-iron-traitor,15811405,The Iron Traitor,Julie Kagawa,461,6,4.11,1573.0,13719.0,304.0,2013.0,True,"Fantasy, Young Adult, Romance, Fantasy, Paranormal, Fairies, Fae, Paranormal, Fairies, Fantasy, Magic, Fiction, Fantasy, Urban Fantasy, Adventure",,0,
https://www.goodreads.com/book/show/50146.Goodbye_Tsugumi,50146,Goodbye Tsugumi,Banana Yoshimoto,461,5,3.72,740.0,9180.0,186.0,1989.0,False,"Fiction, Cultural, Japan, Asian Literature, Japanese Literature, Contemporary, Cultural, Asia, Novels, Literature, Asian Literature, Literature, Young Adult, Literary Fiction",山本周五郎賞 Yamamoto Shūgorō Prize (1989),1,Japan
https://www.goodreads.com/book/show/20640755-the-book-of-ivy,20640755,The Book of Ivy,Amy Engel,461,6,4.15,2652.0,18632.0,282.0,2014.0,True,"Young Adult, Science Fiction, Dystopia, Romance, Science Fiction, Fantasy, Fiction, Apocalyptic, Post Apocalyptic, Science Fiction, Apocalyptic, Audiobook, Young Adult, Teen","Georgia Peach Book Award (2016), Colorado Romance Writers Award of Excellence Nominee for Young Adult Fiction (2015), Missouri Gateway Readers Award (2017)",3,
https://www.goodreads.com/book/show/28116714-perfect,28116714,Perfect,Cecelia Ahern,461,5,4.21,1634.0,15551.0,341.0,2017.0,True,"Young Adult, Science Fiction, Dystopia, Fantasy, Romance, Fiction, Science Fiction, Audiobook, Young Adult, Teen, Novels, Drama",,0,
https://www.goodreads.com/book/show/34506912-the-prince-and-the-dressmaker,34506912,The Prince and the Dressmaker,Jen Wang,461,5,4.39,10779.0,57651.0,277.0,2018.0,False,"Sequential Art, Graphic Novels, Young Adult, LGBT, Historical, Historical Fiction, Romance, Sequential Art, Comics, Fiction, GLBT, Queer, Historical, Childrens, Middle Grade","Harvey Awards for Best Children or Young Adult Book AND nominated for Book of the Year (2018), Rhode Island Teen Book Award Nominee (2020), Prix du Festival d'Angoulême for Prix jeunesse (2019), Goodreads Choice Award Nominee for Graphic Novels & Comics (2018), Rebecca Caudill Young Readers' Book Award Nominee (2020)",5,Paris
https://www.goodreads.com/book/show/51061.The_Griffin_Sabine_Trilogy,51061,The Griffin & Sabine Trilogy,Nick Bantock,460,6,4.37,271.0,2846.0,142.0,1993.0,True,"Fiction, Fantasy, Art, Romance, Sequential Art, Graphic Novels, Novels, Mystery, Poetry, Young Adult, Modern",,0,
https://www.goodreads.com/book/show/138134.The_Complete_Poems,138134,The Complete Poems,John Keats,460,6,4.24,276.0,21863.0,416.0,1820.0,False,"Poetry, Classics, Literature, Medievalism, Romanticism, Fiction, Literature, 19th Century, European Literature, British Literature, Literature, English Literature, Romance, Classics, Classic Literature",,0,
https://www.goodreads.com/book/show/7124095-gone,7124095,Gone,Lisa McMann,460,5,3.69,1981.0,30901.0,214.0,2010.0,True,"Young Adult, Fantasy, Paranormal, Fantasy, Romance, Fiction, Fantasy, Supernatural, Mystery, Young Adult, Teen, Fantasy, Urban Fantasy, Young Adult, Young Adult Fantasy",Goodreads Choice Award Nominee for Goodreads Author (2010),1,
https://www.goodreads.com/book/show/9648.Keep_the_Aspidistra_Flying,9648,Keep the Aspidistra Flying,George Orwell,460,6,3.89,1225.0,16757.0,277.0,1936.0,False,"Fiction, Classics, European Literature, British Literature, Literature, Literature, 20th Century, Novels, Literature, English Literature, Literary Fiction, Classics, Modern Classics, Politics",,0,"London, England"
https://www.goodreads.com/book/show/13615701-elegy,13615701,Elegy,Amanda Hocking,460,5,4.01,603.0,7553.0,542.0,2013.0,True,"Fantasy, Young Adult, Mythology, Mermaids, Fantasy, Paranormal, Fantasy, Mythology, Romance, Fiction, Fantasy, Supernatural, Fantasy, Magic, Romance, Paranormal Romance",,0,
https://www.goodreads.com/book/show/6178065-tenth-grade-bleeds,6178065,Tenth Grade Bleeds,Heather Brewer,459,6,4.24,743.0,20195.0,292.0,2009.0,True,"Paranormal, Vampires, Young Adult, Fantasy, Fantasy, Paranormal, Fiction, Fantasy, Supernatural, Fantasy, Urban Fantasy, Horror, Young Adult, Teen, Romance",,0,
https://www.goodreads.com/book/show/101086.Stonehenge,101086,Stonehenge,Bernard Cornwell,459,6,3.66,645.0,10503.0,578.0,1999.0,False,"Historical, Historical Fiction, Fiction, Historical, Fantasy, European Literature, British Literature, Adventure, Historical Fiction, Historical Fantasy, Historical Fiction, Prehistoric, History, Prehistory, Romance",,0,Britain
https://www.goodreads.com/book/show/7939759-this-isn-t-what-it-looks-like,7939759,This Isn't What It Looks Like,Pseudonymous Bosch,459,6,4.3,513.0,13982.0,423.0,2010.0,True,"Mystery, Fantasy, Childrens, Middle Grade, Fiction, Adventure, Childrens, Young Adult, Humor, Fantasy, Magic, Thriller, Mystery Thriller",,0,
https://www.goodreads.com/book/show/137975.The_Season_of_Passage,137975,The Season of Passage,Christopher Pike,459,5,4.16,243.0,3137.0,448.0,1992.0,False,"Horror, Fiction, Science Fiction, Young Adult, Paranormal, Vampires, Fantasy, Fantasy, Paranormal, Thriller, Suspense, Science Fiction, Aliens",,0,
https://www.goodreads.com/book/show/2549004.The_Return,2549004,The Return,Victoria Hislop,459,5,3.85,794.0,10468.0,432.0,2008.0,False,"Historical, Historical Fiction, Fiction, Cultural, Spain, Historical, Romance, War, Civil War, Spanish Civil War, Novels, Contemporary, Drama",,0,
https://www.goodreads.com/book/show/11737311-the-treachery-of-beautiful-things,11737311,The Treachery of Beautiful Things,Ruth Frances Long,459,5,3.81,688.0,5536.0,366.0,2012.0,False,"Fantasy, Young Adult, Romance, Fantasy, Paranormal, Paranormal, Fairies, Fantasy, Magic, Fairies, Fae, Fantasy, Fairy Tales, Fiction, Fantasy, Urban Fantasy",,0,
https://www.goodreads.com/book/show/13517444-stung,13517444,Stung,Bethany Wiggins,459,5,4.01,1430.0,10502.0,304.0,2013.0,True,"Young Adult, Science Fiction, Dystopia, Science Fiction, Romance, Fantasy, Horror, Zombies, Apocalyptic, Post Apocalyptic, Horror, Fiction, Adventure, Survival",,0,
https://www.goodreads.com/book/show/12842134-just-one-year,12842134,Just One Year,Gayle Forman,459,7,3.89,4142.0,40923.0,336.0,2013.0,True,"Young Adult, Romance, Contemporary, New Adult, Fiction, Realistic Fiction, Travel, Young Adult, Young Adult Contemporary, Womens Fiction, Chick Lit, Young Adult, Teen",,0,"Paris, Amsterdam, Utrecht, Deauville, Cancún, Valladolid, Mexico, Mumbai, Jaisalmer, Merida (Mérida)"
https://www.goodreads.com/book/show/4653511,4653511,رجال في الشمس,غسان كنفاني,459,5,4.18,2717.0,17675.0,93.0,1963.0,False,"Novels, Fiction, Short Stories, Literature, Classics, Politics, Historical, Historical Fiction, Literature, 20th Century, Academic, School, Adult",,0,
https://www.goodreads.com/book/show/34050917-the-girl-in-the-tower,34050917,The Girl in the Tower,Katherine Arden,459,6,4.31,7522.0,66831.0,360.0,2018.0,True,"Fantasy, Historical, Historical Fiction, Fiction, Young Adult, Historical, Fantasy, Fairy Tales, Cultural, Russia, Fantasy, Magic, Adult, Fantasy, Mythology",Goodreads Choice Award Nominee for Fantasy (2018),1,Russia
https://www.goodreads.com/book/show/52140091-book-of-leo,52140091,Book of Leo: Prequel to Mystical Trash,Mary Ramsey,459,5,4.32,8.0,568.0,83.0,2019.0,False,"Epic, Novels, Suspense, Thriller, Drama, Contemporary, Fiction",,0,
https://www.goodreads.com/book/show/28390369-swing-time,28390369,Swing Time,Zadie Smith,459,5,3.57,5616.0,63531.0,453.0,2016.0,False,"Fiction, Contemporary, Literary Fiction, Novels, Audiobook, Cultural, Africa, European Literature, British Literature, Race, Adult Fiction, Adult","Booker Prize Nominee for Longlist (2017), Los Angeles Times Book Prize Nominee for Fiction (2016), National Book Critics Circle Award Nominee for Fiction (2016), Hurston/Wright Legacy Award Nominee for Fiction (2017), Andrew Carnegie Medal Nominee for Fiction (Shortlist) (2017), Europese Literatuurprijs Nominee (2017)",6,Northwest London  to West Africa
https://www.goodreads.com/book/show/28006109-the-tyrant-s-tomb,28006109,The Tyrant’s Tomb,Rick Riordan,459,6,4.33,3040.0,33719.0,439.0,2019.0,True,"Fantasy, Fantasy, Mythology, Young Adult, Childrens, Middle Grade, Fiction, Adventure, LGBT, Audiobook, Fantasy, Urban Fantasy, Mythology, Greek Mythology",Goodreads Choice Award for Middle Grade & Children's (2019),1,
https://www.goodreads.com/book/show/826584.If_You_Give_a_Moose_a_Muffin,826584,If You Give a Moose a Muffin,Laura Joffe Numeroff,458,8,4.18,1087.0,59968.0,32.0,1991.0,False,"Childrens, Picture Books, Childrens, Animals, Fiction, Humor, Food and Drink, Food, Childrens, Storytime, Kids, Fantasy, Classics",,0,
https://www.goodreads.com/book/show/59952.300,59952,300,Frank Miller,458,6,3.96,939.0,45843.0,88.0,1999.0,True,"Sequential Art, Graphic Novels, Sequential Art, Comics, Historical, Historical Fiction, Fiction, Graphic Novels Comics, Comics, Comic Book, Fantasy, War, Historical, Sequential Art, Comix","Harvey Awards for Best Continuing or Limited Series & Best Colorist (for Lynn Varley) (1999), Will Eisner Comic Industry Awards for Best Publication Design (in 2000 awards), Best Limited Series, Best Writer/Artist (for Frank Miller), Best Coloring (for Lynn Varley) (1999)",5,
https://www.goodreads.com/book/show/2296567.Say_You_re_One_of_Them,2296567,Say You're One of Them,Uwem Akpan,458,7,3.53,2396.0,14653.0,358.0,2008.0,False,"Fiction, Short Stories, Cultural, Africa, Historical, Historical Fiction, Western Africa, Nigeria, War, Literature, African Literature, Contemporary, Eastern Africa, Rwanda, Eastern Africa, Kenya","Guardian First Book Award Nominee for Longlist (2008), Dayton Literary Peace Prize Nominee for Fiction (2009), PEN Open Book Award (2009), Paris Book Festival for Compilation/Anthology (2010), Hurston/Wright Legacy Award for Fiction (2009), Commonwealth Writers' Prize for Best First Book in Africa (2009)",6,"Benin, Kenya, Ethiopia, Rwanda, Nigeria, Africa"
https://www.goodreads.com/book/show/72659.Never_Cry_Wolf,72659,Never Cry Wolf: The Amazing True Story of Life Among Arctic Wolves,Farley Mowat,458,8,4.2,1137.0,22392.0,246.0,1963.0,False,"Nonfiction, Animals, Environment, Nature, Science, Autobiography, Memoir, Cultural, Canada, Biography, Animals, Wolves, Classics, Adventure",,0,"Canadian Arctic, Canada"
https://www.goodreads.com/book/show/24271.Skellig,24271,Skellig,David Almond,458,5,3.81,2549.0,23243.0,208.0,1998.0,True,"Fantasy, Young Adult, Fiction, Childrens, Novels, Childrens, Middle Grade, Magical Realism, Academic, School, Paranormal, Angels, Family","Whitbread Award for Children's Book of the Year (1998), Mythopoeic Fantasy Award Nominee for Children's Literature (2000), Zilveren Griffel (2000), Michael L. Printz Award Nominee (2000), North East Teenage Book Award Nominee (1999), Carnegie Medal (1998)",6,
https://www.goodreads.com/book/show/23355220-the-leopard,23355220,The Leopard,Jo Nesbø,458,5,4.09,3124.0,52003.0,634.0,2009.0,True,"Mystery, Crime, Mystery, Fiction, Thriller, European Literature, Scandinavian Literature, Thriller, Mystery Thriller, Scandinavian Lite..., Nordic Noir, Mystery, Detective, Audiobook, Suspense","Bokhandlerprisen Nominee (2009), Corine Internationaler Buchpreis for Hörbuch (2010)",2,"Oslo, Ustaoset, Hong Kong, Congo"
https://www.goodreads.com/book/show/40940157-swamplandia,40940157,Swamplandia!,Karen Russell,458,5,3.28,7818.0,55291.0,418.0,2011.0,False,"Fiction, Magical Realism, Fantasy, Contemporary, Literary Fiction, Novels, Adult Fiction, Young Adult, Coming Of Age, Book Club, Adult","Pulitzer Prize Nominee for Fiction (2012), New York Public Library Young Lions Fiction Award (2012), Orange Prize Nominee for Fiction Longlist (2011), Orion Book Award Nominee (2012), Andrew Carnegie Medal Nominee for Fiction (Shortlist) (2012), Goodreads Choice Award Nominee for Fiction (2011), International Dublin Literary Award Nominee for Shortlist (2013)",7,"Everglades, Florida"
https://www.goodreads.com/book/show/14759334-lullaby,14759334,Lullaby,Amanda Hocking,458,5,3.85,928.0,12700.0,290.0,2012.0,True,"Fantasy, Young Adult, Mythology, Mermaids, Fantasy, Paranormal, Fantasy, Mythology, Romance, Fiction, Fantasy, Supernatural, Romance, Paranormal Romance, Young Adult, Teen",,0,"Capri, Maryland"
https://www.goodreads.com/book/show/9722217,9722217,رغم الفراق,نور عبدالمجيد,458,5,3.95,1305.0,8919.0,360.0,2012.0,False,"Novels, Romance, Romantic, Fiction, Drama, Social, Literature, Adult, Love",,0,
https://www.goodreads.com/book/show/16059396-the-girl-who-was-supposed-to-die,16059396,The Girl Who Was Supposed to Die,April Henry,458,5,4.05,1406.0,9831.0,213.0,2013.0,False,"Young Adult, Thriller, Suspense, Fiction, Mystery, Contemporary, Thriller, Mystery Thriller, Adventure, Audiobook, Young Adult, Teen","Oregon Spirit Book Award Nominee for Young Adult (2013), Missouri Truman Readers Award Nominee (2016)",2,Oregon
https://www.goodreads.com/book/show/6480781-open,6480781,Open,Andre Agassi,458,6,4.25,6752.0,88006.0,388.0,2009.0,False,"Biography, Nonfiction, Sports, Sports, Autobiography, Memoir, Biography, Autobiography, Biography Memoir, Audiobook, Adult, Book Club, Literature, American",,0,
https://www.goodreads.com/book/show/18178211-the-dionysus-connection,18178211,The Dionysus Connection,Liz  Cowan,458,5,4.14,5.0,95.0,360.0,2012.0,True,"Modern, Suspense, Novels, Fiction, Drama, Young Adult, Mystery, Adult, Young Adult, Teen",,0,
https://www.goodreads.com/book/show/37242713-without,37242713,Without,Brian Dennis Hartford,458,5,4.23,9.0,159.0,318.0,2017.0,False,"Young Adult, Fantasy, Fiction, Mystery, Adult, Young Adult, Teen, Novels, Romance, Love Story, Adventure, New Adult",,0,
https://www.goodreads.com/book/show/29939148-never-let-you-go,29939148,Never Let You Go,Chevy Stevens,458,5,3.98,2896.0,26854.0,406.0,2017.0,False,"Thriller, Mystery, Fiction, Suspense, Thriller, Mystery Thriller, Audiobook, Mystery, Crime, Thriller, Psychological Thriller, Contemporary, Drama",Goodreads Choice Award Nominee for Mystery & Thriller (2017),1,
https://www.goodreads.com/book/show/29386918-wildcard,29386918,Wildcard,Marie Lu,458,5,4.0,5744.0,36826.0,352.0,2018.0,True,"Young Adult, Science Fiction, Fantasy, Science Fiction, Dystopia, Romance, Fiction, Audiobook, Adventure, Young Adult, Teen, Young Adult, Young Adult Fantasy",Goodreads Choice Award Nominee for Young Adult Fantasy & Science Fiction (2018),1,Tokyo
https://www.goodreads.com/book/show/44582454-regretting-you,44582454,Regretting You,Colleen Hoover,458,5,4.24,9150.0,83232.0,363.0,2019.0,False,"Romance, Contemporary, Fiction, Young Adult, New Adult, Romance, Contemporary Romance, Adult, Audiobook, Womens Fiction, Chick Lit, Adult Fiction",Goodreads Choice Award Nominee for Romance (2020),1,Texas
https://www.goodreads.com/book/show/79378.Roses_Are_Red,79378,Roses Are Red,James Patterson,457,7,4.04,1467.0,62978.0,416.0,2000.0,True,"Mystery, Fiction, Thriller, Mystery, Crime, Suspense, Thriller, Mystery Thriller, Mystery, Detective, Mystery, Murder Mystery, Adult, Audiobook",,0,"Washington, D.C., Virginia, Maryland"
https://www.goodreads.com/book/show/820956.Dawn_on_a_Distant_Shore,820956,Dawn on a Distant Shore,Sara Donati,457,5,4.21,638.0,16426.0,647.0,2000.0,True,"Historical, Historical Fiction, Romance, Historical, Fiction, Romance, Historical Romance, Adventure, Cultural, Scotland, Audiobook, Adult, Outdoors, Wilderness",,0,
https://www.goodreads.com/book/show/6002005-the-last-thing-i-remember,6002005,The Last Thing I Remember,Andrew Klavan,457,5,4.01,871.0,6641.0,336.0,2009.0,True,"Young Adult, Mystery, Fiction, Adventure, Thriller, Action, Christian, Christian Fiction, Suspense, Contemporary","Florida Teens Read Nominee (2010), Missouri Truman Readers Award Nominee (2012)",2,
https://www.goodreads.com/book/show/30071.The_Walking_Dead_Book_One,30071,"The Walking Dead, Book One",Robert Kirkman,457,5,4.35,1392.0,35894.0,304.0,2004.0,True,"Sequential Art, Graphic Novels, Sequential Art, Comics, Horror, Horror, Zombies, Fiction, Graphic Novels Comics, Apocalyptic, Post Apocalyptic, Comics, Comic Book, Science Fiction, Dystopia, Science Fiction",,0,
https://www.goodreads.com/book/show/542712.Soul_Surfer,542712,"Soul Surfer: A True Story of Faith, Family, and Fighting to Get Back on the Board",Bethany Hamilton,457,6,4.07,1677.0,11901.0,222.0,2004.0,False,"Nonfiction, Biography, Christian, Autobiography, Memoir, Sports, Sports, Biography, Autobiography, Audiobook, Biography Memoir, Inspirational, Religion, Faith",,0,"Kauai, Hawaii"
https://www.goodreads.com/book/show/11690.Istanbul,11690,Istanbul: Memories and the City,Orhan Pamuk,457,5,3.8,1627.0,16748.0,356.0,2003.0,False,"Nonfiction, Travel, Autobiography, Memoir, Biography, History, Cultural, Turkish, Asian Literature, Turkish Literature, Biography, Autobiography, Literature, Nobel Prize","National Book Critics Circle Award Nominee for Autobiography/Memoir (2005), Samuel Johnson Prize for Non-Fiction Nominee (2005), Metų verstinė knyga (2009)",3,Istanbul
https://www.goodreads.com/book/show/7882883-rise-of-the-huntress,7882883,Rise of the Huntress,Joseph Delaney,457,6,4.18,393.0,12533.0,436.0,2010.0,True,"Fantasy, Young Adult, Horror, Fiction, Fantasy, Magic, Fantasy, Paranormal, Paranormal, Witches, Adventure, Childrens, Middle Grade, Fantasy, Supernatural",,0,Mona Island
https://www.goodreads.com/book/show/25686470-shadow-team-gb,25686470,Shadow Team GB,J.M. Johnson,457,5,4.8,12.0,83.0,390.0,2015.0,True,,,0,
https://www.goodreads.com/book/show/22749539-echo,22749539,Echo,Pam Muñoz Ryan,457,5,4.35,6442.0,33895.0,592.0,2015.0,False,"Historical, Historical Fiction, Childrens, Middle Grade, Fantasy, Young Adult, Fiction, Audiobook, Magical Realism, Historical, Childrens, Music","Newbery Medal Nominee (2016), Odyssey Award Nominee (2016), Texas Bluebonnet Award Nominee (2017), Audie Award for Middle Grade (2016), Dorothy Canfield Fisher Children's Book Award Nominee (2017), Américas Award (2016), Children's Literature Council of Southern California Award for Outstanding Work of Fiction (2016), Kirkus Prize for Young Readers' Literature (2015), Goodreads Choice Award Nominee for Middle Grade & Children's (2015), Rebecca Caudill Young Readers' Book Award Nominee (2017)",10,
https://www.goodreads.com/book/show/24763621-wintersong,24763621,Wintersong,S. Jae-Jones,457,5,3.55,5294.0,27148.0,436.0,2017.0,True,"Fantasy, Young Adult, Romance, Retellings, Fiction, New Adult, Young Adult, Young Adult Fantasy, Fantasy, Magic, Fantasy, Fairy Tales, Fantasy, Paranormal",Goodreads Choice Award Nominee for Young Adult Fantasy & Science Fiction (2017),1,
https://www.goodreads.com/book/show/484192.Eagle_in_the_Snow,484192,Eagle in the Snow: A Novel of General Maximus and Rome's Last Stand,Wallace Breem,456,5,4.12,164.0,2393.0,400.0,1970.0,False,"Historical, Historical Fiction, Fiction, Historical, Roman, War, War, Military Fiction, Literature, Ancient, Fantasy, Cultural, Germany, History, Ancient History",,0,
https://www.goodreads.com/book/show/5933646-dragon-spear,5933646,Dragon Spear,Jessica Day George,456,7,4.19,737.0,14304.0,248.0,2009.0,True,"Fantasy, Fantasy, Dragons, Young Adult, Childrens, Middle Grade, Adventure, Romance, Childrens, Fiction, Young Adult, Young Adult Fantasy, Fantasy, Magic",Utah Book Award Nominee for Children (2009),1,
https://www.goodreads.com/book/show/395058.The_Recognitions,395058,The Recognitions,William Gaddis,456,5,4.19,563.0,4761.0,976.0,1955.0,False,"Fiction, Classics, Literature, Novels, Literature, American, Literature, 20th Century, Art, Literary Fiction, The United States Of America, Classics, Modern Classics",,0,
https://www.goodreads.com/book/show/11737700-fade,11737700,Fade,Ais,456,5,4.57,372.0,2770.0,1214.0,2011.0,True,"Romance, M M Romance, Science Fiction, Dystopia, Romance, Dark, Science Fiction, LGBT, War, Military Fiction, Sociology, Abuse, Action, Adult Fiction, Erotica",,0,
https://www.goodreads.com/book/show/18465566-this-one-summer,18465566,This One Summer,Mariko Tamaki,456,5,3.69,6103.0,62385.0,320.0,2014.0,False,"Sequential Art, Graphic Novels, Young Adult, Sequential Art, Comics, Fiction, Contemporary, Realistic Fiction, Graphic Novels Comics, Young Adult, Coming Of Age, Young Adult, Teen, Family","Caldecott Medal Nominee (2015), Harvey Awards Nominee for Best Graphic Album Original, Best Artist (for Jillian Tamaki) (2015), Michael L. Printz Award Nominee (2015), Governor General's Literary Awards / Prix littéraires du Gouverneur général for Children's Literature — Illustration (2014), Will Eisner Comic Industry Awards for Best Graphic Album-New (2015), Goodreads Choice Award Nominee for Graphic Novels & Comics (2014)",7,"Ontario, Awago Beach"
https://www.goodreads.com/book/show/22514020-neurotribes,22514020,NeuroTribes: The Legacy of Autism and the Future of Neurodiversity,Steve Silberman,456,5,4.3,1394.0,9876.0,477.0,2015.0,False,"Nonfiction, Psychology, Science, History, Audiobook, Disability, Biology, Neuroscience, Health, Education, Health, Medicine","California Book Award for Nonfiction (Silver) (2015), Wellcome Book Prize Nominee (2016), Samuel Johnson Prize for Non-Fiction (2015), Goodreads Choice Award Nominee for Science & Technology (2015), Openbook好書獎 for 年度好書．翻譯書 (2017)",5,
https://www.goodreads.com/book/show/41726841-slow-burn,41726841,Slow Burn,Autumn Jones Lake,456,5,3.97,800.0,8472.0,242.0,2014.0,True,"Romance, Romance, Contemporary Romance, Contemporary, Adult, Adult Fiction, Erotica, Transport, Motorcycle, Business, Amazon, Fiction, New Adult, Audiobook",,0,
https://www.goodreads.com/book/show/50071950-the-importance-of-being-wild,50071950,The Importance of Being Wild,J.J. Sorel,456,5,4.17,12.0,155.0,398.0,2018.0,False,"Romance, Contemporary, Romance, Love Story, Fiction, Adult, Novels, Adult Fiction, Erotica, New Adult",,0,
https://www.goodreads.com/book/show/38503833-a-curve-in-the-road,38503833,A Curve in the Road,Julianne MacLean,456,5,3.76,1735.0,28147.0,266.0,2018.0,False,"Fiction, Contemporary, Womens Fiction, Chick Lit, Romance, Audiobook, Drama, Cultural, Canada, Mystery, Suspense, Adult Fiction",,0,"Lunenburg, Nova Scotia, Halifax, Nova Scotia, Nova Scotia"
https://www.goodreads.com/book/show/20417.Have_Space_Suit_Will_Travel,20417,Have Space Suit—Will Travel,Robert A. Heinlein,455,6,3.92,966.0,28121.0,276.0,1958.0,False,"Science Fiction, Fiction, Young Adult, Science Fiction Fantasy, Classics, Audiobook, Adventure, Space, Space, Space Opera, Fantasy","Hugo Award Nominee for Best Novel (1959), Locus Award Nominee for All-Time Best SF Novel before 1990 (1998), British Science Fiction Association Award Nominee for Best Novel of 1958 (2007), Oklahoma Sequoyah Award (1961)",4,Space
https://www.goodreads.com/book/show/2075382.El_llano_en_llamas,2075382,El llano en llamas,Juan Rulfo,455,5,4.2,945.0,15232.0,210.0,1953.0,False,"Short Stories, Fiction, European Literature, Spanish Literature, Classics, Cultural, Latin American, Literature, Literature, Latin American Literature, Novels, Magical Realism, Literature, 20th Century",Republic of Consciousness Prize Nominee for Longlist (2020),1,Mexico
https://www.goodreads.com/book/show/6176.The_Drowned_and_the_Saved,6176,The Drowned and the Saved,Primo Levi,455,5,4.43,407.0,6471.0,170.0,1986.0,True,"Nonfiction, History, World War II, Holocaust, Autobiography, Memoir, War, World War II, War, Philosophy, Biography, European Literature, Italian Literature, Writing, Essays",,0,
https://www.goodreads.com/book/show/80534.Me_Emma,80534,Me & Emma,Elizabeth Flock,455,6,3.91,1966.0,20871.0,296.0,2005.0,False,"Fiction, Contemporary, Womens Fiction, Chick Lit, Sociology, Abuse, Family, Drama, Adult Fiction, Adult, Psychology, Book Club",,0,
https://www.goodreads.com/book/show/79155.The_Journeyer,79155,The Journeyer,Gary Jennings,455,5,4.31,234.0,3446.0,1024.0,1984.0,False,"Historical, Historical Fiction, Fiction, Historical, Adventure, Travel, Cultural, Asia, Fantasy, Cultural, China, Historical, Medieval, Novels",,0,Venice
https://www.goodreads.com/book/show/85392.Term_Limits,85392,Term Limits,Vince Flynn,455,6,4.31,1304.0,32921.0,612.0,1997.0,False,"Fiction, Thriller, Mystery, Action, Suspense, Politics, Thriller, Mystery Thriller, Thriller, Spy Thriller, Adventure, Mystery, Crime",,0,
